Sheet: Setup
B4: STEP 1 | E4: Variants
B5: Select Expansion(s) | E5: The destiny deck will be created with 3 cards from each skill deck instead of 2. When it is 1/3 full (5 cards in base, 6 in Pegasus), it will be refilled and reshuffled. | F5: Handling for Psychological Warfare: Use the Manipulate Destiny tab to discard all of Destiny, then deal 6 Treachery into Destiny and shuffle it. Just before you would deal the last two Treachery from Destiny into a skill check, deal one card from each deck into it (bringing it up to 7-8 cards), but do not shuffle. Then deal Destiny into the check, which will cause it to rebuild itself correctly.
B6: Select Number of Players
E7: Destiny is created without Treachery. Whenever a Human Player discards Treachery, it is shuffled into the Destiny deck*. | F7: *Destiny will be rebuilt when it reaches either 0 or 1 card. If combined with Complex Destiny, it will instead be rebuilt when it reaches either 5 or 6 cards. It is highly recommended that Sabotage be changed when using this variant.
B8: STEP 2 | C8: STEP 3 | E8: Use Custom Loyalty Cards
B9: Enter Names for Players | C9: Select Characters
E10: The Loyalty Deck will be created according to the usual rules, but no Loyalty cards will be dealt automatically.
E11: A Mashup between a Personal Goal and a Cylon Leader's Agenda. Each Human player is dealt a Flaw at the beginning of the game. If he can keep it hidden until Distance 6, he can choose to Reveal it for a special ability. If he is forced to Reveal it early, he gains a permanent drawback.
B14: STEP 4
B15: Select Final Objective
B17: Select Sympathizer Type
B18: Quorum Hand Limit
B19: Expansion Options
E20: If you are going to be using the automatic GIMP image creation, Locate the GIMP executable:
B21: 0
B23: Initialization Tasks | C23: Completed
C24: Initialize
C25: Game State
C26: Loyalty Cards
C27: Ships | E27: Default / tan = 163 134 125
C28: Skill Cards & Destiny | E28: Olive = 77 101 60
C29: Crisis Cards
C30: Super Crisis Cards
C31: Quorum Cards
C32: Destination Cards
C33: Game Log

Sheet: Board Status
E2: Destiny | F2: of:="Damaged Vipers" & IF(['Game State'.$M$40]<>"";": (MkII/MVII)";"") -> Damaged Vipers | G2: of:="Viper Reserves" & IF(['Game State'.$M$40]<>"";": (MkII/MVII)";"") -> Viper Reserves | H2: Raptor Reserves | J2: Fuel | K2: Food | L2: Morale | M2: Population
E3: of:=['Skill Cards'.D26] -> 4 | F3: of:=[Ships.$F$13] & IF(['Game State'.$M$40]<>"";"/" & [Ships.$F$21];"") -> 7 | G3: of:=[Ships.$C$13] & IF(['Game State'.$M$40]<>"";"/" & [Ships.$C$21];"") -> 0 | H3: of:=[Ships.C46] -> 1 | J3: of:=['Game State'.$Q$19] -> 2 | K3: of:=['Game State'.$R$19] -> 5 | L3: of:=['Game State'.$S$19] -> 3 | M3: of:=['Game State'.$T$19] -> 2 | P3: Title | Q3: Quorum | R3: Nukes
C4: Distance | D4: of:=['Destination Cards'.D6] -> 8 | N4: of:="1: " & ['Game State'.$E$3] -> 1: Gaius | O4: of:=['Skill Cards'.B19] -> 4 | Q4: of:=IF(ISNUMBER(FIND("Pres";[.P4]));['Quorum Cards'.$G$4];"") ->  | R4: of:=IF(ISNUMBER(FIND("Adm";[.P4]));['Game State'.$C$20];"") -> 
C5: Civilians | D5: of:=[Ships.D37] -> 6 | F5: JUMP TRACK | N5: of:="2: " & ['Game State'.$E$4] -> 2: Athena | O5: of:=['Skill Cards'.B20] -> 8 | P5: CYLON | Q5: of:=IF(ISNUMBER(FIND("Pres";[.P5]));['Quorum Cards'.$G$4];"") ->  | R5: of:=IF(ISNUMBER(FIND("Adm";[.P5]));['Game State'.$C$20];"") -> 
C6: Crisis Deck | D6: of:=['Crisis Cards'.C171] -> 69 | F6: START | G6: 1 | H6: 2 | I6: -3 Pop | J6: -1 Pop | K6: Auto-Jump | N6: of:="3: " & ['Game State'.$E$5] -> 3: Lee | O6: of:=['Skill Cards'.B21] -> 7 | P6: President | Q6: of:=IF(ISNUMBER(FIND("Pres";[.P6]));['Quorum Cards'.$G$4];"") -> 5 | R6: of:=IF(ISNUMBER(FIND("Adm";[.P6]));['Game State'.$C$20];"") -> 
C7: Caprica Deck | D7: of:=['Crisis Cards'.C197] -> 0 | N7: of:="4: " & ['Game State'.$E$6] -> 4: Tom | O7: of:=['Skill Cards'.B22] -> 5 | P7: CYLON | Q7: of:=IF(ISNUMBER(FIND("Pres";[.P7]));['Quorum Cards'.$G$4];"") ->  | R7: of:=IF(ISNUMBER(FIND("Adm";[.P7]));['Game State'.$C$20];"") -> 
C8: Super C Deck | D8: of:=['Crisis Cards'.C214] -> 0 | G8: BOARDING PARTY | N8: of:="5: " & ['Game State'.$E$7] -> 5: Karl | O8: of:=['Skill Cards'.B23] -> 5 | P8: Admiral | Q8: of:=IF(ISNUMBER(FIND("Pres";[.P8]));['Quorum Cards'.$G$4];"") ->  | R8: of:=IF(ISNUMBER(FIND("Adm";[.P8]));['Game State'.$C$20];"") -> 0
C9: Quorum Deck | D9: of:=['Quorum Cards'.G3] -> 9 | G9: of:=IF([Ships.O15]>0;[Ships.O15];"") -> 3 | H9: of:=IF([Ships.P15]>0;[Ships.P15];"") ->  | I9: of:=IF([Ships.Q15]>0;[Ships.Q15];"") ->  | J9: of:=IF([Ships.R15]>0;[Ships.R15];"") ->  | N9: of:="6: " & ['Game State'.$E$8] -> 6: Cottle | O9: of:=['Skill Cards'.B24] -> 6 | Q9: of:=IF(ISNUMBER(FIND("Pres";[.P9]));['Quorum Cards'.$G$4];"") ->  | R9: of:=IF(ISNUMBER(FIND("Adm";[.P9]));['Game State'.$C$20];"") -> 
C10: BSG Damage | D10: of:=['Game State'.$W$13]+['Game State'.AB9] -> 2 | N10: of:="7: " & ['Game State'.$E$9] -> 7:  | O10: of:=['Skill Cards'.B25] ->  | Q10: of:=IF(ISNUMBER(FIND("Pres";[.P10]));['Quorum Cards'.$G$4];"") ->  | R10: of:=IF(ISNUMBER(FIND("Adm";[.P10]));['Game State'.$C$20];"") -> 
E12: Sector 2 | J12: Sector 3 | O12: Special Assignments
E13: Basestars: | F13: of:=IF([Ships.P9]>0; [Ships.P9];"") ->  | G13: Civilians | J13: Basestars: | K13: of:=IF([Ships.Q9]>0; [Ships.Q9];"") ->  | L13: Civilians
E14: Raiders: | F14: of:=IF([Ships.P10]>0; [Ships.P10];"") -> 3 | J14: Raiders: | K14: of:=IF([Ships.Q10]>0; [Ships.Q10];"") -> 
E15: Heavies: | F15: of:=IF([Ships.P11]>0; [Ships.P11];"") ->  | J15: Heavies: | K15: of:=IF([Ships.Q11]>0; [Ships.Q11];"") -> 
E16: Vipers: | J16: Vipers:
A17: Colonial One | B17: 0 | O17: Cylon Locations
A18: Press Room | B18: Pres. Office | C18: Admin | O18: Caprica | P18: Cylon Fleet | Q18: Human Fleet | R18: Rez Ship | S18: Basestar
O19: Gaius
O20: Tom
F21: GALACTICA
F22: Weapons Ctrl | H22: Communications | J22: Research Lab | L22: Sick Bay
H23: Cottle
A24: Sector 1 | B24: 0 | N24: Sector 4
A25: Basestars: | B25: of:=IF([Ships.O9]>0; [Ships.O9];"") -> 1 | C25: Civilians | N25: Basestars: | O25: of:=IF([Ships.R9]>0;[Ships.R9];"") ->  | P25: Civilians
A26: Raiders: | B26: of:=IF([Ships.O10]>0; [Ships.O10];"") ->  | G26: FTL Control | K26: Armory | N26: Raiders: | O26: of:=IF([Ships.R10]>0;[Ships.R10];"") ->  | P26: Civilian D
A27: Heavies: | B27: of:=IF([Ships.O11]>0; [Ships.O11];"") ->  | G27: Lee | N27: Heavies: | O27: of:=IF([Ships.R11]>0;[Ships.R11];"") ->  | P27: Civilian E
A28: Vipers: | G28: Karl | N28: Vipers: | P28: Civilian F
F30: Command | H30: Admiral's Quarters | J30: Hangar Deck | L30: Brig
F31: Athena
E35: Sector 6 | H35: Apollo | J35: Sector 5 | L35: Apollo | O35: Pegasus
A36: The Graveyard | E36: Basestars: | F36: of:=IF([Ships.T9]>0;[Ships.T9];"") ->  | G36: Civilians | H36: Helo | J36: Basestars: | K36: of:=IF([Ships.S9]>0;[Ships.S9];"") ->  | L36: Civilians | O36: Pegasus CIC | P36: Airlock | Q36: Main Batteries | R36: Engine Room
E37: Raiders: | F37: of:=IF([Ships.T10]>0;[Ships.T10];"") ->  | J37: Raiders: | K37: of:=IF([Ships.S10]>0;[Ships.S10];"") -> 
E38: Heavies: | F38: of:=IF([Ships.T11]>0;[Ships.T11];"") ->  | J38: Heavies: | K38: of:=IF([Ships.S11]>0;[Ships.S11];"") -> 
E39: Vipers: | J39: Vipers: | K39: Karl (V)
O42: New Caprica
O43: Medical Center | Q43: Resistance HQ | V43: Unlocked
V44: of:=[Ships.$G$38] -> 0
C45: of:=['Skill Cards'.D19] -> 15 | E45: of:=['Skill Cards'.D20] -> 4 | G45: of:=['Skill Cards'.D21] -> 6 | I45: of:=['Skill Cards'.D22] -> 2 | K45: of:=['Skill Cards'.D23] -> 6 | M45: of:=['Skill Cards'.D24] -> 14
C46: Politics | E46: Leadership | G46: Tactics | I46: Piloting | K46: Engineering | M46: Treachery
S47: Breeder's Canyon | U47: Shipyard
G50: CYLON FLEET
F51: Sector 2 | I51: Sector 3 | O51: Detention | Q51: Occupation Authority | V51: Locked
F52: Basestars: | G52: of:=IF([Ships.P12]>0; [Ships.P12];"") ->  | I52: Basestars: | J52: of:=IF([Ships.Q12]>0; [Ships.Q12];"") ->  | V52: of:=[Ships.$G$39] -> 0
F53: Raiders: | G53: of:=IF([Ships.P13]>0; [Ships.P13];"") ->  | I53: Raiders: | J53: of:=IF([Ships.Q13]>0; [Ships.Q13];"") -> 
F54: Heavies: | G54: of:=IF([Ships.P14]>0; [Ships.P14];"") ->  | I54: Heavies: | J54: of:=IF([Ships.Q14]>0; [Ships.Q14];"") -> 
C56: Sector 1 | L56: Sector 4 | Q56: OCCUPATION FORCES
C57: Basestars: | D57: of:=IF([Ships.O12]>0; [Ships.O12];"") ->  | F57: PURSUIT TRACK | L57: Basestars: | M57: of:=IF([Ships.R12]>0; [Ships.R12];"") ->  | Q57: of:=IF([Ships.O16]>0;[Ships.O16];"") ->  | S57: of:=IF([Ships.P16]>0;[Ships.P16];"") ->  | U57: of:=IF([Ships.Q16]>0;[Ships.Q16];"") -> 
C58: Raiders: | D58: of:=IF([Ships.O13]>0; [Ships.O13];"") ->  | F58: Start | G58: 1 (1 Civ) | H58: 2 | I58: 3 (2 Civs) | J58: Attack! | L58: Raiders: | M58: of:=IF([Ships.R13]>0; [Ships.R13];"") -> 
C59: Heavies: | D59: of:=IF([Ships.O14]>0; [Ships.O14];"") ->  | L59: Heavies: | M59: of:=IF([Ships.R14]>0; [Ships.R14];"") -> 
F61: Sector 6 | I61: Sector 5
F62: Basestars: | G62: of:=IF([Ships.T12]>0; [Ships.T12];"") ->  | I62: Basestars: | J62: of:=IF([Ships.S12]>0; [Ships.S12];"") -> 
F63: Raiders: | G63: of:=IF([Ships.T13]>0; [Ships.T13];"") ->  | I63: Raiders: | J63: of:=IF([Ships.S13]>0; [Ships.S13];"") -> 
F64: Heavies: | G64: of:=IF([Ships.T14]>0; [Ships.T14];"") ->  | I64: Heavies: | J64: of:=IF([Ships.S14]>0; [Ships.S14];"") -> 

Sheet: Game State
B1: GAME NAME: | C1: 1 | H1: TURN: | L1: 7 | M1: 3 | P1: RESOURCES | W1: Galactica Damage | AB1: Pegasus Damage
B2: Players | D2: Infiltrator | E2: Characters | F2: Loyalty | G2: President | H2: Admiral | I2: CAG | K2: OPG | L2: Revealed Cylon | M2: Super Crises | N2: Location | Q2: Fuel | R2: Food | S2: Morale | T2: Population | W2: Damage Type | X2: Damaged | Y2: Removed | AB2: Damage Type | AC2: Damaged | AD2: Removed
B3: Shadowed | C3: 1 | E3: Gaius | F3: C | K3: 0 | L3: X | M3: 1 | N3: Caprica | P3: 15 | Q3: of:=IF([.$P3]=[.Q$19];"X";"") ->  | R3: of:=IF([.$P3]=[.R$19];"X";"") ->  | S3: of:=IF([.$P3]=[.S$19];"X";"") ->  | T3: of:=IF([.$P3]=[.T$19];"X";"") ->  | W3: Armory | AB3: Airlock
B4: Karantor | C4: 2 | D4: X | E4: Athena | F4: L | K4: 0 | L4: X | M4: 0 | N4: Command | P4: 14 | Q4: of:=IF([.$P4]=[.Q$19];"X";"") ->  | R4: of:=IF([.$P4]=[.R$19];"X";"") ->  | S4: of:=IF([.$P4]=[.S$19];"X";"") ->  | T4: of:=IF([.$P4]=[.T$19];"X";"") ->  | W4: Food - Resource | AB4: Engine Room
B5: Zoronos | C5: 3 | E5: Lee | F5: H | G5: X | K5: 1 | M5: 0 | N5: FTL Control | P5: 13 | Q5: of:=IF([.$P5]=[.Q$19];"X";"") ->  | R5: of:=IF([.$P5]=[.R$19];"X";"") ->  | S5: of:=IF([.$P5]=[.S$19];"X";"") ->  | T5: of:=IF([.$P5]=[.T$19];"X";"") ->  | W5: Hangar Deck | AB5: Pegasus CIC
B6: Tymber | C6: of:=IF([.E6]<>"";4;"") -> 4 | E6: Tom | F6: C | K6: 0 | L6: X | M6: 0 | N6: Caprica | P6: 12 | Q6: of:=IF([.$P6]=[.Q$19];"X";"") ->  | R6: of:=IF([.$P6]=[.R$19];"X";"") ->  | S6: of:=IF([.$P6]=[.S$19];"X";"") ->  | T6: of:=IF([.$P6]=[.T$19];"X";"") ->  | W6: Weapons Control | AB6: Main Batteries
B7: Simmons | C7: of:=IF([.E7]<>"";5;"") -> 5 | E7: Karl | F7: H | H7: X | K7: 1 | M7: 0 | N7: FTL Control | P7: 11 | Q7: of:=IF([.$P7]=[.Q$19];"X";"") ->  | R7: of:=IF([.$P7]=[.R$19];"X";"") ->  | S7: of:=IF([.$P7]=[.S$19];"X";"") ->  | T7: of:=IF([.$P7]=[.T$19];"X";"") ->  | W7: FTL Control
B8: Masnie | C8: of:=IF([.E8]<>"";6;"") -> 6 | E8: Cottle | F8: H | K8: 1 | M8: 0 | N8: Communications | P8: 10 | Q8: of:=IF([.$P8]=[.Q$19];"X";"") ->  | R8: of:=IF([.$P8]=[.R$19];"X";"") ->  | S8: of:=IF([.$P8]=[.S$19];"X";"") ->  | T8: of:=IF([.$P8]=[.T$19];"X";"") ->  | W8: Command | X8: X
C9: of:=IF([.E9]<>"";7;"") ->  | M9: 0 | P9: 9 | Q9: of:=IF([.$P9]=[.Q$19];"X";"") ->  | R9: of:=IF([.$P9]=[.R$19];"X";"") ->  | S9: of:=IF([.$P9]=[.S$19];"X";"") ->  | T9: of:=IF([.$P9]=[.T$19];"X";"") ->  | W9: Admiral's Quarters | X9: X | AB9: of:=COUNTIF([.AC3:.AC6];"X") -> 0
P10: 8 | Q10: of:=IF([.$P10]=[.Q$19];"X";"") ->  | R10: of:=IF([.$P10]=[.R$19];"X";"") ->  | S10: of:=IF([.$P10]=[.S$19];"X";"") ->  | T10: of:=IF([.$P10]=[.T$19];"X";"") ->  | W10: Fuel - Resource | Y10: X
P11: 7 | Q11: of:=IF([.$P11]=[.Q$19];"X";"") ->  | R11: of:=IF([.$P11]=[.R$19];"X";"") ->  | S11: of:=IF([.$P11]=[.S$19];"X";"") ->  | T11: of:=IF([.$P11]=[.T$19];"X";"") -> 
P12: 6 | Q12: of:=IF([.$P12]=[.Q$19];"X";"") ->  | R12: of:=IF([.$P12]=[.R$19];"X";"") ->  | S12: of:=IF([.$P12]=[.S$19];"X";"") ->  | T12: of:=IF([.$P12]=[.T$19];"X";"") -> 
P13: 5 | Q13: of:=IF([.$P13]=[.Q$19];"X";"") ->  | R13: of:=IF([.$P13]=[.R$19];"X";"") -> X | S13: of:=IF([.$P13]=[.S$19];"X";"") ->  | T13: of:=IF([.$P13]=[.T$19];"X";"") ->  | W13: of:=COUNTIF([.X3:.X10];"X") -> 2
M14: Hangar Deck | P14: 4 | Q14: of:=IF([.$P14]=[.Q$19];"X";"") ->  | R14: of:=IF([.$P14]=[.R$19];"X";"") ->  | S14: of:=IF([.$P14]=[.S$19];"X";"") ->  | T14: of:=IF([.$P14]=[.T$19];"X";"") -> 
P15: 3 | Q15: of:=IF([.$P15]=[.Q$19];"X";"") ->  | R15: of:=IF([.$P15]=[.R$19];"X";"") ->  | S15: of:=IF([.$P15]=[.S$19];"X";"") -> X | T15: of:=IF([.$P15]=[.T$19];"X";"") -> 
P16: 2 | Q16: of:=IF([.$P16]=[.Q$19];"X";"") -> X | R16: of:=IF([.$P16]=[.R$19];"X";"") ->  | S16: of:=IF([.$P16]=[.S$19];"X";"") ->  | T16: of:=IF([.$P16]=[.T$19];"X";"") -> X
P17: 1 | Q17: of:=IF([.$P17]=[.Q$19];"X";"") ->  | R17: of:=IF([.$P17]=[.R$19];"X";"") ->  | S17: of:=IF([.$P17]=[.S$19];"X";"") ->  | T17: of:=IF([.$P17]=[.T$19];"X";"") -> 
P18: 0 | Q18: of:=IF([.$P18]=[.Q$19];"X";"") ->  | R18: of:=IF([.$P18]=[.R$19];"X";"") ->  | S18: of:=IF([.$P18]=[.S$19];"X";"") ->  | T18: of:=IF([.$P18]=[.T$19];"X";"") -> 
Q19: 2 | R19: 5 | S19: 3 | T19: 2
B20: Remaining Nukes | C20: 0
L21: 8 | Q21: 2 | R21: 5 | S21: 3 | T21: 2
H24: 39
N26: GAME PHASE | P26: Jump Preparation
N27: IN SPACE | P27: Start | Q27: Red 1 | R27: Red 2 | S27: Blue -3 | T27: Blue -1 | U27: Jump
S28: x | W28: JPG
N29: OBJECTIVE
N30: Kobol | R30: 3 | S30: 1
N32: PURSUIT | W32: OutlineCounters
N33: Standard
P34: Pursuit Track
M35: MODULES | P35: Start | Q35: 1 Civ | R35: Rest | S35: 2 Civs | T35: Attack
N36: Pegasus | P36: x
N37: Exodus
N38: Personal Goals | R38: 0
N39: Final Five
N40: Cylon Fleet
M41: X | N41: Daybreak
N42: Revelations
N43: Cylon Civil War

Sheet: Skill Cards
H1: CURRENT SKILL CHECK | I1: Y | J1: G | K1: P | L1: R | M1: B | N1: O | O1: F | P1: Target | Q1: Partial | R1: Cons
G2: DESTINY
G3: [color=purple]4 - Strategic Planning[/color]
G4: [color=#a52a2a]3 - A Better Machine[/color]
G5: [color=#a52a2a]5 - Exploit Weakness[/color]
G6: [color=red]1 - Evasive Maneuvers[/color]
A18: HAND COUNTS | C18: Deck Counts | E18: Discard
A19: of:=[.$A$30] -> Gaius | B19: of:=22-COUNTBLANK([.$A$33:.$A$54]) -> 4 | C19: Politics | D19: of:=COUNTIF([.A58:.A97];"<>") -> 15 | E19: of:=COUNTIF([.A101:.A140];"<>") -> 6
A20: of:=[.$B$30] -> Athena | B20: of:=22-COUNTBLANK([.$B$33:.$B$54]) -> 8 | C20: Leadership | D20: of:=COUNTIF([.B58:.B97];"<>") -> 4 | E20: of:=COUNTIF([.B101:.B140];"<>") -> 16
A21: of:=[.$C$30] -> Lee | B21: of:=22-COUNTBLANK([.$C$33:.$C$54]) -> 7 | C21: Tactics | D21: of:=COUNTIF([.C58:.C97];"<>") -> 6 | E21: of:=COUNTIF([.C101:.C140];"<>") -> 16
A22: of:=[.$D$30] -> Tom | B22: of:=IF([.A22]="";"";22-COUNTBLANK([.$D$33:.$D$54])) -> 5 | C22: Piloting | D22: of:=COUNTIF([.D58:.D97];"<>") -> 2 | E22: of:=COUNTIF([.D101:.D140];"<>") -> 16
A23: of:=[.$E$30] -> Karl | B23: of:=IF([.A23]="";"";22-COUNTBLANK([.$E$33:.$E$54])) -> 5 | C23: Engineering | D23: of:=COUNTIF([.E58:.E97];"<>") -> 6 | E23: of:=COUNTIF([.E101:.E140];"<>") -> 16
A24: of:=[.$F$30] -> Cottle | B24: of:=IF([.A24]="";"";22-COUNTBLANK([.$F$33:.$F$54])) -> 6 | C24: Treachery | D24: of:=COUNTIF([.F58:.F97];"<>") -> 14 | E24: of:=COUNTIF([.F101:.F140];"<>") -> 0 | H24: Totals | I24: of:=IF([.I2]="B";0;SUM([.I3:.I23])) -> 0 | J24: of:=IF([.J2]="B";0;SUM([.J3:.J23])) -> 0 | K24: of:=IF([.K2]="B";0;SUM([.K3:.K23])) -> 0 | L24: of:=IF([.L2]="B";0;SUM([.L3:.L23])) -> 0 | M24: of:=IF([.M2]="B";0;SUM([.M3:.M23])) -> 0 | N24: of:=IF([.N2]="B";0;SUM([.N3:.N23])) -> 0 | O24: of:=IF([.O2]="B";0;SUM([.O3:.O23])) -> 0 | P24: of:=SUM([.I24:.O24]) -> 0
A25: of:=[.$G$30] -> 0 | B25: of:=IF([.A25]="";"";22-COUNTBLANK([.$G$33:.$G$54])) ->  | C25: Faith | D25: of:=COUNTIF([.G58:.G97];"<>") -> 0 | E25: of:=COUNTIF([.G101:.G140];"<>") -> 0 | P25: of:=IF(ISBLANK([.$P$2]);"";IF([.$P$24]>=[.$P$2];"PASS";IF(AND(NOT(OR(ISBLANK([.$Q$2]);[.$Q$2]=0));[.$P$24]>=[.$Q$2]);"PARTIAL";"FAIL"))) -> 
C26: Destiny | D26: of:=COUNTIF([.G3:.G27];"<>") -> 4
A27: of:=IF([Loyalty.B3] <> "";[Loyalty.B3];"") ->  | B27: of:=IF([Loyalty.C3] <> "";[Loyalty.C3];"") ->  | C27: of:=IF([Loyalty.D3] <> "";[Loyalty.D3];"") ->  | D27: of:=IF([Loyalty.E3] <> "";[Loyalty.E3];"") ->  | E27: of:=IF([Loyalty.F3] <> "";[Loyalty.F3];"") ->  | F27: of:=IF([Loyalty.G3] <> "";[Loyalty.G3];"") ->  | G27: of:=IF([Loyalty.H3] <> "";[Loyalty.H3];"") -> 
A30: of:=['Game State'.E3] -> Gaius | B30: of:=['Game State'.E4] -> Athena | C30: of:=['Game State'.E5] -> Lee | D30: of:=['Game State'.E6] -> Tom | E30: of:=['Game State'.E7] -> Karl | F30: of:=['Game State'.E8] -> Cottle | G30: of:=['Game State'.E9] -> 0 | H30: Conditional Orders
A31: *** 2 CARDS *** | B31: 1 Pi / 2 L - 1 Pi - 2 E | C31: 1 T / 2 Pi / 2 Po - 2 L | D31: *** 2 CARDS *** | E31: 2 L / 2 T / 1 Pi | F31: 1 Po / 2 T / 2 E
A32: of:=['Game State'.B3] -> Shadowed | B32: of:=['Game State'.B4] -> Karantor | C32: of:=['Game State'.B5] -> Zoronos | D32: of:=['Game State'.B6] -> Tymber | E32: of:=['Game State'.B7] -> Simmons | F32: of:=['Game State'.B8] -> Masnie | G32: of:=['Game State'.B9] -> 0
A33: [color=red]1 - Evasive Maneuvers[/color] | B33: [color=green]1 - Executive Order[/color] | C33: [color=orange]0 - Force Their Hand[/color] | D33: [color=orange]3 - Investigative Committee[/color] | E33: [color=green]0 - All Hands On Deck[/color] | F33: [color=orange]1 - Consolidate Power[/color]
A34: [color=red]2 - Evasive Maneuvers[/color] | B34: [color=green]3 - Declare Emergency[/color] | C34: [color=orange]2 - Consolidate Power[/color] | D34: [color=red]2 - Evasive Maneuvers[/color] | E34: [color=red]0 - Dogfight[/color] | F34: [color=orange]2 - Consolidate Power[/color]
A35: [color=blue]4 - Scientific Research[/color] | B35: [color=green]3 - Declare Emergency[/color] | C35: [color=green]1 - Executive Order[/color] | D35: [color=#a52a2a]0 - Dradis Contact[/color] | E35: [color=#a52a2a]3 - A Better Machine[/color] | F35: [color=purple]1 - Launch Scout[/color]
A36: [color=#a52a2a]5 - Exploit Weakness[/color] | B36: [color=red]3 - Combat Veteran[/color] | C36: [color=green]4 - Declare Emergency[/color] | D36: [color=#a52a2a]0 - Dradis Contact[/color] | E36: [color=#a52a2a]4 - Violent Outbursts[/color] | F36: [color=purple]2 - Launch Scout[/color]
B37: [color=blue]2 - Repair[/color] | C37: [color=purple]1 - Launch Scout[/color] | D37: [color=#a52a2a]3 - Personal Vices[/color] | E37: [color=#a52a2a]4 - Violent Outbursts[/color] | F37: [color=blue]1 - Repair[/color]
B38: [color=#a52a2a]0 - Dradis Contact[/color] | C38: [color=red]1 - Evasive Maneuvers[/color] | F38: [color=blue]4 - Scientific Research[/color]
B39: [color=#a52a2a]3 - Personal Vices[/color] | C39: [color=red]1 - Evasive Maneuvers[/color]
B40: [color=#a52a2a]5 - Exploit Weakness[/color]
I43: .
A56: SKILL CARD DECKS
A57: Politics | B57: Leadership | C57: Tactics | D57: Piloting | E57: Engineering | F57: Treachery | G57: Faith
A58: [color=orange]0 - Force Their Hand[/color] | B58: [color=green]2 - Executive Order[/color] | C58: [color=purple]1 - Launch Scout[/color] | D58: [color=red]2 - Evasive Maneuvers[/color] | E58: [color=blue]2 - Repair[/color] | F58: [color=#a52a2a]4 - Violent Outbursts[/color]
A59: [color=orange]1 - Consolidate Power[/color] | B59: [color=green]2 - Executive Order[/color] | C59: [color=purple]2 - Launch Scout[/color] | D59: [color=red]3 - Maximum Firepower[/color] | E59: [color=blue]2 - Repair[/color] | F59: [color=#a52a2a]0 - Bait[/color]
A60: [color=orange]2 - Consolidate Power[/color] | B60: [color=green]1 - Executive Order[/color] | C60: [color=purple]4 - Unorthodox Plan[/color] | E60: [color=blue]3 - Scientific Research[/color] | F60: [color=#a52a2a]0 - Dradis Contact[/color]
A61: [color=orange]1 - Consolidate Power[/color] | B61: [color=green]2 - Executive Order[/color] | C61: [color=purple]1 - Launch Scout[/color] | E61: [color=blue]4 - Raptor Specialist[/color] | F61: [color=#a52a2a]0 - Bait[/color]
A62: [color=orange]2 - Consolidate Power[/color] | C62: [color=purple]3 - Strategic Planning[/color] | E62: [color=blue]0 - Install Upgrades[/color] | F62: [color=#a52a2a]0 - Bait[/color]
A63: [color=orange]2 - Consolidate Power[/color] | C63: [color=purple]5 - Strategic Planning[/color] | E63: [color=blue]0 - Install Upgrades[/color] | F63: [color=#a52a2a]3 - Personal Vices[/color]
A64: [color=orange]3 - Investigative Committee[/color] | F64: [color=#a52a2a]3 - Personal Vices[/color]
A65: [color=orange]1 - Consolidate Power[/color] | F65: [color=#a52a2a]0 - Bait[/color]
A66: [color=orange]2 - Consolidate Power[/color] | F66: [color=#a52a2a]0 - Dradis Contact[/color]
A67: [color=orange]3 - Popular Influence[/color] | F67: [color=#a52a2a]3 - A Better Machine[/color]
A68: [color=orange]1 - Consolidate Power[/color] | F68: [color=#a52a2a]0 - Dradis Contact[/color]
A69: [color=orange]1 - Consolidate Power[/color] | F69: [color=#a52a2a]0 - Bait[/color]
A70: [color=orange]4 - Popular Influence[/color] | F70: [color=#a52a2a]3 - A Better Machine[/color]
A71: [color=orange]1 - Consolidate Power[/color] | F71: [color=#a52a2a]0 - Bait[/color]
A72: [color=orange]1 - Consolidate Power[/color]
A99: SKILL CARD DISCARDS
A100: Politics | B100: Leadership | C100: Tactics | D100: Piloting | E100: Engineering | F100: Treachery | G100: Faith
A101: [color=orange]3 - Investigative Committee[/color] | B101: [color=green]1 - Executive Order[/color] | C101: [color=purple]2 - Launch Scout[/color] | D101: [color=red]0 - Dogfight[/color] | E101: [color=blue]1 - Repair[/color]
A102: [color=orange]4 - Investigative Committee[/color] | B102: [color=green]3 - Restore Order[/color] | C102: [color=purple]2 - Launch Scout[/color] | D102: [color=red]2 - Evasive Maneuvers[/color] | E102: [color=blue]1 - Repair[/color]
A103: [color=orange]4 - Investigative Committee[/color] | B103: [color=green]4 - Restore Order[/color] | C103: [color=purple]5 - A Second Chance[/color] | D103: [color=red]2 - Evasive Maneuvers[/color] | E103: [color=blue]2 - Repair[/color]
A104: [color=orange]5 - Investigative Committee[/color] | B104: [color=green]3 - Declare Emergency[/color] | C104: [color=purple]1 - Launch Scout[/color] | D104: [color=red]3 - Maximum Firepower[/color] | E104: [color=blue]1 - Repair[/color]
A105: [color=orange]3 - Investigative Committee[/color] | B105: [color=green]3 - Declare Emergency[/color] | C105: [color=purple]1 - Launch Scout[/color] | D105: [color=red]4 - Combat Veteran[/color] | E105: [color=blue]1 - Repair[/color]
A106: [color=orange]5 - Negotiation[/color] | B106: [color=green]5 - Change of Plans[/color] | C106: [color=purple]2 - Launch Scout[/color] | D106: [color=red]4 - Maximum Firepower[/color] | E106: [color=blue]1 - Repair[/color]
B107: [color=green]5 - Declare Emergency[/color] | C107: [color=purple]3 - Strategic Planning[/color] | D107: [color=red]5 - Launch Reserves[/color] | E107: [color=blue]3 - Scientific Research[/color]
B108: [color=green]0 - All Hands On Deck[/color] | C108: [color=purple]3 - Unorthodox Plan[/color] | D108: [color=red]5 - Maximum Firepower[/color] | E108: [color=blue]2 - Repair[/color]
B109: [color=green]2 - Executive Order[/color] | C109: [color=purple]4 - Strategic Planning[/color] | D109: [color=red]1 - Evasive Maneuvers[/color] | E109: [color=blue]3 - Raptor Specialist[/color]
B110: [color=green]1 - Executive Order[/color] | C110: [color=purple]1 - Launch Scout[/color] | D110: [color=red]1 - Evasive Maneuvers[/color] | E110: [color=blue]5 - Scientific Research[/color]
B111: [color=green]1 - Executive Order[/color] | C111: [color=purple]3 - Strategic Planning[/color] | D111: [color=red]1 - Evasive Maneuvers[/color] | E111: [color=blue]2 - Repair[/color]
B112: [color=green]1 - Executive Order[/color] | C112: [color=purple]3 - Strategic Planning[/color] | D112: [color=red]2 - Evasive Maneuvers[/color] | E112: [color=blue]1 - Repair[/color]
B113: [color=green]2 - Executive Order[/color] | C113: [color=purple]0 - Quick Thinking[/color] | D113: [color=red]1 - Evasive Maneuvers[/color] | E113: [color=blue]1 - Repair[/color]
B114: [color=green]4 - Declare Emergency[/color] | C114: [color=purple]0 - Quick Thinking[/color] | D114: [color=red]3 - Maximum Firepower[/color] | E114: [color=blue]5 - Test the Limits[/color]
B115: [color=green]2 - Executive Order[/color] | C115: [color=purple]2 - Launch Scout[/color] | D115: [color=red]3 - Maximum Firepower[/color] | E115: [color=blue]3 - Scientific Research[/color]
B116: [color=green]1 - Executive Order[/color] | C116: [color=purple]1 - Launch Scout[/color] | D116: [color=red]4 - Maximum Firepower[/color] | E116: [color=blue]3 - Scientific Research[/color]
A143: SKILL CARD COLOR TAGS
A144: [color=orange] | B144: [color=green] | C144: [color=purple] | D144: [color=red] | E144: [color=blue] | F144: [color=#a52a2a] | G144: [color=gray]
A148: PREVIOUSLY DRAWN
A149: X | B149: X | C149: X | D149: X | E149: X | F149: X | H149: Y
A150: X | B150: X | C150: X | D150: X | E150: X | F150: X | H150: G
B151: X | C151: X | D151: X | E151: X | F151: X | H151: P
A152: X | B152: X | C152: X | D152: X | E152: X | F152: X | H152: R
A153: X | B153: X | C153: X | D153: X | E153: X | F153: X | H153: B
A154: X | B154: X | C154: X | D154: X | E154: X | F154: X | H154: T
B155: X | C155: X | D155: X | E155: X | F155: X | H155: F
A156: of:=IF(OR([.I25]="";AND(['Game State'.M36]<>"";[.N25]=""));"X";"") -> X | B156: of:=IF(AND(['Game State'.M36]<>"";[.N25]="");"X";"") ->  | C156: of:=IF(AND(['Game State'.M36]<>"";[.N25]="");"X";"") ->  | E156: of:=IF(OR([.M2]="";AND(['Game State'.M36]<>"";[.N25]=""));"X";"") -> X | G156: of:=IF(['Game State'.M42]<>"";"X";"") ->  | H156: Skill Check Needs
H157: Die Roll Needs
A159: of:=['Posting Templates'.E3]&"("&[.B19]&") - "&IF(AND(['Game State'.L3]<>"";['Game State'.D3]="");"CYLON";IF([.B19]=0;"PASS: No cards";IF(AND(OR([.A156]="";[.A149]="");OR([.B156]="";[.A150]=""));"PASS: No Draws";""))) -> Gaius(4) - CYLON | B159: of:=['Posting Templates'.F3] & "(" & [.B20] & ") - " -> Athena(8) -  | C159: of:=['Posting Templates'.G3] & "(" & [.B21] & ") - " -> Lee(7) -  | D159: of:=['Posting Templates'.H3] & "(" & [.B22] & ") - " -> Tom(5) -  | E159: of:=['Posting Templates'.I3] & "(" & [.B23] & ") - " -> Karl(5) -  | F159: of:=['Posting Templates'.J3] & "(" & [.G19] & ") - " -> Cottle() -  | G159: of:=['Posting Templates'.K3] & "(" & [.H19] & ") - " -> 0() -  | H159: Skill Check Interrupt
A160: of:=['Posting Templates'.E3] & "(" & [.B19] & ") - " & IF([.B19]=0;"PASS: No cards";IF(OR(['Game State'.D3]<>"";['Game State'.N3]="Detention");"(2 max)";IF(OR(['Game State'.L3]<>"";['Game State'.N3]="Brig");"(1 max)";IF(['Posting Templates'.E3]="Gaeta";"(3 max)";IF(AND(['Posting Templates'.E3]="Cally";[.B19]=1);"PASS: Impulsive";""))))) -> Gaius(4) - (1 max) | B160: of:=['Posting Templates'.F3] & "(" & [.B20] & ") - " -> Athena(8) -  | C160: of:=['Posting Templates'.G3] & "(" & [.B21] & ") - " -> Lee(7) -  | D160: of:=['Posting Templates'.H3] & "(" & [.B22] & ") - " -> Tom(5) -  | E160: of:=['Posting Templates'.I3] & "(" & [.B23] & ") - " -> Karl(5) -  | F160: of:=['Posting Templates'.J3] & "(" & [.G19] & ") - " -> Cottle() -  | G160: of:=['Posting Templates'.K3] & "(" & [.H19] & ") - " -> 0() -  | H160: Skill Check Token
A161: of:=['Posting Templates'.E3]&"("&[.B19]&") - "&IF(AND(['Game State'.L3]<>"";['Game State'.D3]="");"CYLON";IF([.B19]=0;"PASS: No cards";"Test")) -> Gaius(4) - CYLON | B161: of:=['Posting Templates'.F3] & "(" & [.B20] & ") - " -> Athena(8) -  | C161: of:=['Posting Templates'.G3] & "(" & [.B21] & ") - " -> Lee(7) -  | D161: of:=['Posting Templates'.H3] & "(" & [.B22] & ") - " -> Tom(5) -  | E161: of:=['Posting Templates'.I3] & "(" & [.B23] & ") - " -> Karl(5) -  | F161: of:=['Posting Templates'.J3] & "(" & [.G19] & ") - " -> Cottle() -  | G161: of:=['Posting Templates'.K3] & "(" & [.H19] & ") - " -> 0() -  | H161: Die Roll Interrupt

Sheet: Crisis Cards
A1: 100 | B1: 5 | S1: 5 | T1: 0 | U1: 0
C2: Who Chooses? | H2: Skill Check | P2: Activation | Q2: Jump Track | S2: Cylon Attack Deployment ( # x sector)
A3: Crisis Cards | B3: Cards Played | C3: Current Player | D3: President | E3: Admiral | F3: CAG | G3: Cylon Attack | H3: Politics | I3: Leadership | J3: Tactics | K3: Piloting | L3: Engineering | M3: Difficulty | N3: Partial | O3: Consequence | R3: Description | S3: Basestars | T3: Heavy Raiders | U3: Raiders | V3: Vipers | W3: Civilians | X3: Module
B4: Unexpected Reunion | H4: X | I4: X | J4: X | M4: 8 | P4: R | R4: Pass: No Effect; Fail: -1 Morale, and the Current Player discards his hand of Skill Cards. | X4: B
B5: Cylon Tracking Device | J5: X | K5: X | L5: X | M5: 10 | P5: R | R5: Pass: No Effect; Fail: Destroy 1 Raptor and place a Basestar in front of Galactica and 2 Civilian ships behind it. | X5: B
B6: Colonial Day | C6: X | H6: X | J6: X | M6: 10 | P6: B | Q6: X | R6: Current Player Chooses: Pass: +1 Morale; Fail: -2 Morale. OR -1 Morale. | X6: B
B7: Bomb Threat | C7: X | H7: X | I7: X | J7: X | M7: 13 | P7: R | Q7: X | R7: Current Player Chooses: Pass: No Effect; Fail: -1 Morale and draw a Civilian ship and destroy it. OR Roll a die. If 4 or lower, trigger the "Fail" effect of this card. | X7: B
B8: Earth in Ruins | C8: X | H8: X | I8: X | J8: X | M8: 9 | P8: R | Q8: X | R8: Current Player Chooses: Pass: -1 Morale; Fail: -2 Morale OR -1 Food and the current player draws 1 Mutiny Card | X8: D
B9: Forced Water Mining | C9: X | H9: X | I9: X | J9: X | L9: X | M9: 17 | P9: R | Q9: X | R9: Current Player Chooses: Pass: +1 Food; Fail: -1 Population, -1 Morale. OR +1 Food, -1 Morale, and each player discards 1 random Skill Card. | X9: B
B10: Legendary Discovery | J10: X | K10: X | M10: 14 | P10: L | R10: Pass: Place this card next to the Kobol Objective card. It counts as 1 Distance; Fail: -1 Food and destroy 1 Raptor. | X10: B
B11: Question Procedure | D11: X | P11: B | Q11: X | R11: President Chooses: -1 Morale. OR Damage Galactica, and the President discards 3 skill cards. | X11: D
B12: Domestic Dispute | H12: X | J12: X | M12: 9 | P12: R | R12: Pass: No Effect; Fail: -1 Morale and the Current Player is sent to Sickbay. | X12: D
B13: Rescue Mission (B) | E13: X | P13: R | Q13: X | R13: Admiral Chooses: -1 Morale, Current Player is sent to "Sickbay." OR -1 Fuel and destroy 1 Raptor. | X13: B
B14: Rescue Mission (A) | E14: X | P14: B | Q14: X | R14: Admiral Chooses: -1 Morale, Current Player is sent to "Sickbay." OR -1 Fuel and destroy 1 Raptor. | X14: B
B15: Jammed Assault | G15: X | P15: R | R15: Communications Jamming: Keep this card in play until the Fleet Jumps. Players may not activate the "Communications" location. | S15: 1x3 | T15: 2x3 | U15: 4x2 | V15: 1x[5,6] | W15: 1x[1,4,5,6] | X15: B
B16: Send Survey Team | C16: X | J16: X | K16: X | L16: X | M16: 15 | P16: R | Q16: X | R16: Current Player Chooses: Pass: No Effect; Fail: The Current Player is sent to "Sickbay" and destroy 1 Raptor. OR Roll a die. If 5 or less, -1 Fuel. | X16: B
B17: Water Shortage (A) | D17: X | P17: B | Q17: X | R17: President Chooses: -1 Food. OR The President discards 2 Skill Cards, then the Current Player discards 3 Skill Cards. | X17: B
B18: Lockdown | G18: X | P18: H | R18: Concerted Attack: Keep this card in play until the fleet jumps or a basestar is destroyed. Players cannot activate the Armory location. | S18: 1x2 | T18: 2x[1,2] | V18: 1x4 | W18: 1x[4,5] | X18: D
B19: Food Shortage | D19: X | P19: R | Q19: X | R19: President Chooses: -2 Food. OR -1 Food. The President discards 2 Skill Cards and the Current Player discards 3 Skill Cards. | X19: B
B20: Guilt by Collusion | I20: X | J20: X | M20: 9 | P20: R | Q20: X | R20: Pass: The Current Player may choose a character to move to the "Brig."; Fail: -1 Morale. | X20: B
B21: Water Shortage ( C) | D21: X | P21: B | R21: President Chooses: -1 Food. OR The President discards 2 Skill Cards, then the Current Player discards 3 Skill Cards. | X21: B
B22: One Last Cocktail | C22: X | J22: X | L22: X | M22: 7 | P22: B | Q22: X | R22: Current Player Chooses: Pass: No Effect; Fail: -1 Food, -1 Morale OR Roll a die. On a 6 or lower, -1 morale and the President is sent to the Brig. | X22: D
B23: Dishonest Tactics | D23: X | P23: R | Q23: X | R23: President Chooses: -1 Morale and the President may choose 1 Player to move from the Brig to Command. OR -1 Fuel and the President draws 2 Quorum Cards. | X23: D
B24: Secret Meetings | C24: X | H24: X | J24: X | L24: X | M24: 9 | P24: R | Q24: X | R24: Current Player Chooses: Pass: No Effect; Fail: -1 Morale OR The current player draws 1 Mutiny Card. Then he chooses a player to draw 1 Mutiny Card. | X24: D
B25: Elections Loom | H25: X | I25: X | M25: 8 | N25: 5 | P25: H | Q25: X | R25: Pass: No Effect; 5+: -1 Morale; Fail: -1 Morale, and the President discards 4 Skill Cards. | X25: B
B26: Raiding Party | G26: X | P26: R | R26: FTL Failure: Move the Fleet token 1 space towards the start of the Jump Prep track. | S26: 1x3 | T26: 2x4 | U26: 3x3,2x4 | V26: 2x6 | W26: 1x5,2x6 | X26: B
B27: Blindsided | G27: X | P27: R | R27: Pluck Out Their Eyes: Destroy 1 Raptor. | S27: 1x[1,4] | T27: 1x[1,4] | U27: 3x2 | V27: 1x6 | W27: 2x6,1,5 | X27: D
B28: Water Shortage (A) | D28: X | P28: B | Q28: X | R28: President Chooses: -1 Food. OR The President discards 2 Skill Cards, then the Current Player discards 3 Skill Cards. | X28: B
B29: Build Cylon Detector | E29: X | P29: H | R29: Admiral Chooses: Discard 1 Nuke Token. If you do not have any Nuke tokens, you may not choose this option. OR -1 Morale, and the Admiral discards 2 Skill Cards. | X29: B
B30: Tactical Strike | G30: X | P30: R | R30: Hangar Assault: Damage 2 Vipers in the reserves. | S30: 1x6 | T30: 1x1 | U30: 5x6 | V30: 2x5 | W30: 1x[3,4,5] | X30: B
B31: Unidentified Ship | J31: X | K31: X | M31: 10 | P31: L | R31: Pass: No Effect; Fail: -1 Population. | X31: B
B32: Abandon Galactica | E32: X | P32: B | Q32: X | R32: Admiral Chooses: Discard 1 nuke token. If you do not have any nuke tokens, you cannot choose this option. OR -1 Food and the Admiral draws 2 Treachery cards. | X32: D
B33: Dangerous Plots | D33: X | P33: B | Q33: X | R33: President Chooses: The Admiral and the President both draw 1 Mutiny Card. OR -1 Morale and the current player discards 3 Skill Cards. | X33: D
B34: Rescue the Fleet | E34: X | P34: R | Q34: X | R34: Admiral Chooses: -2 Population. OR -1 Morale, place 1 Basestar and 3 Raiders in front of Galactica, and 3 Civilian ships behind Galactica. | X34: B
A35: Sleep Deprivation | E35: X | P35: B | Q35: X | R35: Admiral Chooses: Return all undamaged Vipers on the game board to the "Reserves." Current Player is sent to "Sickbay." OR -1 Morale. | X35: B
A36: A Traitor Accused | C36: X | H36: X | I36: X | M36: 8 | P36: R | Q36: X | R36: Current Player Chooses: Pass: No Effect; Fail: the Current Player chooses a character to send to the "Brig." OR The Current Player discards 5 Skill Cards. | X36: B
A37: Trial by Fire | G37: X | P37: R | R37: Cavalry's Here: The human fleet gains an Assault Raptor. The current player places it in a space area with a viper launch icon and may immediately activate it. | S37: 1x4 | T37: 2x1 | U37: 3x1 | V37: 1x2 | W37: 1x6 | X37: D
A38: Religious Turmoil | C38: X | H38: X | J38: X | M38: 7 | P38: R | Q38: X | R38: Current Player Chooses: Pass: No Effect; Fail: -1 Morale and each player discards 1 Skill Card OR Roll a die. On a 4 or lower, -1 Food and -1 Population. | X38: D
A39: Scouting for Fuel | C39: X | J39: X | K39: X | M39: 12 | P39: R | Q39: X | R39: Current Player Chooses: Pass: +1 Fuel; Fail: -1 Fuel and destroy 1 Raptor. OR Roll a die. If 4 or lower, -1 Fuel. | X39: B
A40: Riots(B) | E40: X | P40: L | R40: Admiral Chooses: -1 Food, -1 Morale. OR -1 Population, -1 Fuel. | X40: B
A41: Insubordinate Crew | I41: X | J41: X | M41: 12 | P41: R | R41: Pass: No Effect; Fail: -1 Morale and each player that does not have a Mutiny Card draws 1 Mutiny Card. | X41: D
A42: Cylon Screenings | C42: X | H42: X | I42: X | M42: 9 | P42: R | R42: Current Player Chooses: Pass: No Effect; Fail: -1 Morale, and the Current Player looks at 1 random Loyalty Card belonging to the President or Admiral. OR Each player discards 2 Skill Cards. | X42: B
A43: Prison Labor | H43: X | I43: X | J43: X | M43: 10 | P43: R | R43: Pass: No Effect; Fail: -1 Morale, -1 Food. | X43: B
A44: Rebuild Trust | H44: X | I44: X | M44: 9 | P44: R | R44: Pass: Each character in the Brig may move to any location on Galactica; Fail: -2 Morale | X44: D
A45: Rallying Support | H45: X | J45: X | M45: 8 | P45: R | Q45: X | R45: Pass: No Effect; Fail: -1 Population and the current player draws 1 Mutiny Card and 1 Treachery Card. | X45: D
A46: Fulfiller of Prophecy | C46: X | H46: X | I46: X | M46: 6 | P46: B | R46: Current Player Chooses: Pass: The Current Player draws 1 Politics Skill Card; Fail: -1 Population. OR Current Player discards 1 Skill Card. After the Activate Cylon Ships step, return to the Resolve Crisis step (Draw a new Crisis Card and resolve it). | X46: B
A47: Hybrid in Panic | J47: X | L47: X | M47: 12 | N47: 8 | P47: H | Q47: X | R47: Pass: Increase the Jump Preparation track by 1; 8+: The current player discards 2 skill cards; Fail: -1 Fuel | X47: D
A48: Crash Landing | J48: X | K48: X | M48: 6 | P48: H | R48: Pass: No Effect; Fail: The Admiral may spend 1 fuel. If he does not, -1 Morale, and the Current Player is sent to "Sickbay." | X48: B
A49: Terrorist Investigations | H49: X | I49: X | M49: 12 | N49: 6 | P49: H | Q49: X | R49: Pass: Current Player looks at 1 random Loyalty Card belonging to any player; 6+: No effect; Fail: -1 Morale. | X49: B
A50: Hangar Accident | J50: X | K50: X | L50: X | M50: 10 | N50: 7 | P50: H | Q50: X | R50: Pass: No Effect; 7+: -1 Population; Fail: -1 Population and damage 2 Vipers in the "Reserves." | X50: B
A51: Food Shortage | D51: X | P51: R | Q51: X | R51: President Chooses: -2 Food. OR -1 Food. The President discards 2 Skill Cards and the Current Player discards 3 Skill Cards. | X51: B
A52: Detector Sabotage | I52: X | J52: X | M52: 8 | P52: H | Q52: X | R52: Pass: No Effect; Fail: All characters in the "Research Lab" location are sent to "Sickbay." Keep this card in play. Players may not look at other players' Loyalty Cards. | X52: B
A53: Declare Martial Law | E53: X | P53: B | R53: Admiral Chooses: -1 Morale and the Admiral receives the President Title. OR -1 Population and the Admiral discards 2 Skill Cards | X53: B
A54: Low Supplies | H54: X | I54: X | M54: 7 | P54: R | R54: Pass: No Effect; Fail: -1 Morale. If Food is less than 6, -1 additional Morale. | X54: B
A55: Consult the Hybrid | H55: X | I55: X | M55: 10 | P55: H | Q55: X | R55: Pass: The current player draws a Mutiny Card and 2 Skill Cards (they may be from outside his skill set); Fail: -1 Food and shuffle 2 Treachery into the Destiny Deck | X55: D
A56: Cylon Virus | J56: X | L56: X | M56: 13 | P56: L | R56: Pass: No Effect; Fail: All characters in the "FTL Control" location are sent to "Sickbay." Then place 1 Centurion marker at the start of the Boarding Party track. | X56: B
A57: Reprisal | G57: X | P57: R | R57: Opportunity for Treason: Shuffle 2 Treachery Cards into the Destiny Deck. Then the Current Player draws a Mutiny Card. | S57: 1x6 | T57: 1x4 | U57: 2x1,3x4 | V57: 1x[2,3] | W57: 1x[1,5] | X57: D
A58: A Desperate Pact | C58: X | H58: X | I58: X | K58: X | M58: 15 | P58: R | R58: Current Player Chooses: Pass: No Effect; Fail: -1 Morale and give the President title to the player (aside from the current President) highest on the line of succession OR The President discards 3 skill cards, then the Current Player draws 1 Mutiny Card. | X58: D
A59: Galactica Falling Apart | C59: X | I59: X | K59: X | L59: X | M59: 8 | P59: R | Q59: X | R59: Current Player Chooses: Pass: No Effect; Fail: -1 Morale and damage Galactica OR Roll a die. On a 6 or lower, -1 Food. | X59: D
A60: Food Shortage | D60: X | P60: R | Q60: X | R60: President Chooses: -2 Food. OR -1 Food. The President discards 2 Skill Cards and the Current Player discards 3 Skill Cards. | X60: B
A61: Weapon Malfunction | J61: X | K61: X | L61: X | M61: 11 | P61: L | R61: Pass: No Effect; Fail: Damage 2 Vipers in space areas. All characters in the "Weapons Control" location are sent to "Sickbay." | X61: B
A62: Thirty-Three | G62: X | P62: R | R62: Relentless Pursuit: Keep in play until a Civilian ship or Basestar is destroyed. If this card is in play when the Fleet Jumps, shuffle it back into the Crisis deck. | S62: 1x1 | V62: 1x[5,6] | W62: 1x[3,4,5,6] | X62: B
A63: Loss of a Friend | H63: X | I63: X | M63: 9 | N63: 7 | P63: H | Q63: X | R63: Pass: No Effect; 7+: The Current Player discards 2 Skill Cards; Fail: -1 Morale, and the Current Player discards 2 Skill Cards. | X63: B
A64: Riots(A) | E64: X | P64: B | Q64: X | R64: Admiral Chooses: -1 Food, -1 Morale. OR -1 Population, -1 Fuel. | X64: B
A65: Scouting for Water | C65: X | J65: X | K65: X | M65: 9 | P65: R | Q65: X | R65: Current Player Chooses: Pass: +1 Food; Fail: -1 Fuel and destroy 1 Raptor. OR -1 Food. | X65: B
A66: Missing G4 Explosives | I66: X | J66: X | M66: 7 | P66: R | R66: Pass: No Effect; Fail: -1 Food, and all characters in the "Armory" location are sent to the "Brig." | X66: B
A67: Crippled Raider | C67: X | J67: X | L67: X | M67: 10 | P67: R | Q67: X | R67: Current Player Chooses: Pass: Increase the Jump Prep track by 1; Fail: -1 population. OR Roll a die. If 4 or lower, place 3 Raiders in front of Galactica and 1 Civilian ship behind it. | X67: B
A68: Admiral Grilled | C68: X | H68: X | I68: X | M68: 9 | P68: R | Q68: X | R68: Current Player Chooses: Pass: No Effect; Fail: -1 Morale, and the Admiral discards 2 Skill Cards. OR -1 Morale. | X68: B
A69: Enemy of my Enemy | C69: X | H69: X | I69: X | K69: X | M69: 13 | P69: R | Q69: X | R69: Current Player Chooses: Pass: -1 Morale; Fail: -2 Morale and damage Galactica OR Damage Galactica twice. | X69: D
A70: Hornet's Nest | G70: X | P70: R | R70: Suppressive Fire: Keep this card in play until the fleet jumps or a basestar is destroyed. Players cannot use actions on Piloting Cards. | S70: 1x3 | U70: 3x[1,4] | V70: 1x[1,5] | W70: 1x1,2x6 | X70: D
A71: Starvation in Dogsville | D71: X | P71: R | Q71: X | R71: President Chooses: Roll a die. On a 4 or less, -1 population and -1 food OR Roll a die, One a 4 or less, -2 food. | X71: D
A72: Requisition for Demetrius | E72: X | P72: B | R72: Admiral Chooses: -1 Food then roll a die. On a 6 or lower, shuffle 2 Treachery cards into the Destiny deck. OR The Admiral draws 1 Mutiny Card and 2 Treachery Cards. | X72: D
A73: Prisoner Revolt | H73: X | I73: X | J73: X | M73: 11 | N73: 6 | P73: H | Q73: X | R73: Pass: No Effect; 6+: -1 Population; Fail: -1 Population, and the President chooses another player to receive the President title. | X73: B
A74: Rescue Caprica Survivors | D74: X | P74: R | Q74: X | R74: President Chooses:-1 Fuel, -1 Food, +1 Population. OR -1 Morale. | X74: B
A75: Jump Computer Failure | J75: X | L75: X | M75: 7 | P75: L | R75: Pass: No Effect; Fail: -1 Population and move the Fleet token 1 space towards the start of the Jump Prep track. | X75: B
A76: Analyze Enemy Fighter | C76: X | J76: X | L76: X | M76: 7 | P76: R | Q76: X | R76: Current Player Chooses: Pass: Repair 1 destroyed Raptor; Fail: -1 population. OR Roll a die. If 4 or lower, -1 population and the current player discards 2 Skill Cards. | X76: B
A77: Reactor Critical | J77: X | K77: X | L77: X | M77: 7 | P77: L | R77: Pass: The current player draws 2 Treachery Cards; Fail: -1 Fuel | X77: D
A78: Network Computers | C78: X | H78: X | J78: X | L78: X | M78: 11 | P78: R | Q78: X | R78: Current Player Chooses: Pass: Increase the Jump Prep track by 1; Fail: -1 Population and place 1 Centurion marker at the start of the Boarding Party track. OR -1 Population and decrease the Jump Prep track by 1. | X78: B
A79: Water Sabotaged | C79: X | H79: X | I79: X | J79: X | M79: 13 | P79: R | Q79: X | R79: Current Player Chooses: Pass: No Effect; Fail: -2 Food. OR - 1 Food. | X79: B
A80: The Olympic Carrier | H80: X | I80: X | K80: X | M80: 11 | N80: 8 | P80: H | Q80: X | R80: Pass: No Effect; 8+: -1 Population; Fail: -1 Morale, -1 Population. | X80: B
A81: Water Shortage (A) | D81: X | P81: B | Q81: X | R81: President Chooses: -1 Food. OR The President discards 2 Skill Cards, then the Current Player discards 3 Skill Cards. | X81: B
A82: Incitement to Mutiny | H82: X | I82: X | J82: X | M82: 13 | N82: 7 | P82: H | Q82: X | R82: Pass: No Effect; 7+: Shuffle 2 Treachery Cards into the Destiny Deck; Fail: Shuffle 4 Treachery Cards into the Destiny Deck | X82: D
A83: Requested Resignation | E83: X | P83: B | R83: Admiral Chooses: The President and Admiral both discard 2 Skill Cards. OR The President may choose to give the President title to the Admiral, or move to the "Brig" location. | X83: B
A84: Security Breach | I84: X | J84: X | M84: 6 | P84: L | R84: Pass: No Effect; Fail: -1 Morale, and all characters in the "Command" location are sent to "Sickbay." | X84: B
A85: Cylon Accusation | H85: X | I85: X | J85: X | M85: 10 | P85: R | R85: Pass: No Effect; Fail: The Current Player is placed in the "Brig" location. | X85: B
A86: Event Horizon | G86: X | P86: R | R86: Gravity Well: Keep this card in play until the fleet jumps. No player can activate a viper unless he first discards a Skill Card. | S86: 1x[2,4] | U86: 2x[1,4] | V86: 1x[1,5,6] | X86: D
A87: Besieged | G87: X | P87: R | R87: Heavy Casualties: The 4 Raiders that were just setup are immediately activated. | S87: 1x5 | T87: 1x4 | U87: 4x6 | V87: 2x6 | W87: 1x[1,2,6] | X87: B
A88: Mandatory Testing | H88: X | I88: X | M88: 13 | N88: 9 | P88: H | Q88: X | R88: Pass: The President looks at 1 random Loyalty card of the Current Player; 9+: No Effect; Fail: -1 Morale. | X88: B
A89: Witch Hunt | H89: X | I89: X | M89: 10 | N89: 6 | P89: H | Q89: X | R89: Pass: No Effect; 6+: -1 Morale; Fail: -1 Morale. Current Player chooses a character and moves him to "Sickbay." | X89: B
A90: Keep Tabs on Visitor | C90: X | H90: X | I90: X | J90: X | M90: 12 | P90: R | Q90: X | R90: Current Player Chooses: Pass: No Effect; Fail: Roll a die. If 4 or lower, -2 Population. OR The Current Player discards 4 random Skill Cards. | X90: B
A91: Informing the Public | C91: X | H91: X | I91: X | M91: 7 | P91: R | Q91: X | R91: Current Player Chooses: Pass: Current Player looks at 1 random Loyalty Card belonging to any player; Fail: -2 Morale. OR Roll a die. On a 4 or lower, -1 Morale and -1 Population. | X91: B
A92: Terrorist Bomber | I92: X | J92: X | M92: 9 | P92: H | Q92: X | R92: Pass: No Effect; Fail: -1 Morale, and the Current Player is sent to "Sickbay." | X92: B
A93: Boarding Parties | G93: X | P93: H | R93: Surprise Assault: There are no Vipers in this setup. | S93: 1x2 | T93: 2x[1,3] | U93: 4x2 | W93: 1x4,2x5 | X93: B
A94: Surrounded | G94: X | P94: B | R94: Panic: The Current Player must discard 3 Skill Cards. | S94: 1x2 | T94: 1x3 | U94: 4x1,3x3 | V94: 1x[5,6] | W94: 1x[4,5,6] | X94: B
A95: Food Shortage | D95: X | P95: R | Q95: X | R95: President Chooses: -2 Food. OR -1 Food. The President discards 2 Skill Cards and the Current Player discards 3 Skill Cards. | X95: B
A96: Give In To Despair | H96: X | I96: X | M96: 14 | N96: 9 | P96: H | Q96: X | R96: Pass: No Effect; 9+: -1 Food and the current player draws 3 Treachery Cards; Fail: -2 Morale | X96: D
A97: Ambush | G97: X | P97: B | R97: Training New Pilots: Keep this card in play until the Fleet Jumps. Each Unmanned Viper suffers a -2 penalty to its attack rolls. | S97: 1x4 | U97: 4x[1,4] | V97: 2x5 | W97: 1x[3,5,6] | X97: B
A98: Heavy Assault | G98: X | P98: R | R98: Heavy Bombardment: Each Basestar immediately attacks Galactica. | S98: 1x[1,2] | V98: 1x6 | W98: 1x[4,5,6] | X98: B
A99: Cylon Swarm | G99: X | P99: B | R99: Massive Deployment: Keep this card in play until the Fleet Jumps. Each time a Basestar launches Raiders or Heavy Raiders, it launches 1 additional ship of the same type. | S99: 1x1 | T99: 1x2 | U99: 5x1 | V99: 1x[5,6] | W99: 1x[4,5,6] | X99: B
A100: Quorum in Uproar | H100: X | J100: X | M100: 8 | P100: L | R100: Pass: No Effect; Fail: The President discards 2 random Quorum Cards and 2 random skill cards. | X100: D
A101: Resistance | H101: X | I101: X | J101: X | M101: 12 | N101: 9 | P101: H | Q101: X | R101: Pass: No Effect; 9+: -1 Food; Fail: -1 Food, -1 Fuel. | X101: B
A102: Water Shortage (B) | D102: X | P102: R | Q102: X | R102: President Chooses: -1 Food. OR The President discards 2 Skill Cards, then the Current Player discards 3 Skill Cards. | X102: B
A103: An Ambitious Operation | E103: X | P103: R | Q103: X | R103: Admiral Chooses: -1 Fuel. The Admiral chooses another player to gain 1 Miracle Token. OR Roll a die. On a 4 or less, -1 Fuel. | X103: D
A104: Unwelcome Faces | E104: X | P104: R | Q104: X | R104: Admiral Chooses: The Admiral must discard all of his Skill Cards and then choose a character to send to the Brig. OR -1 Morale and Damage Galactica once. | X104: E
A105: Divisive Behavior | H105: X | I105: X | J105: X | M105: 10 | O105: X | P105: H | Q105: X | R105: Pass: No effect; Fail -1 Morale; Consequence: The Current Player chooses another player to send to Sickbay. | X105: E
A106: Threat of a Super Nova | I106: X | K106: X | L106: X | M106: 10 | O106: X | P106: H | Q106: X | R106: Pass: No Effect; Fail: -1 Population and damage Galactica; Consequence: Activate Basestars. | X106: E
A107: Centurion Assault | J107: X | K107: X | M107: 9 | P107: L | R107: Pass: No Effect; Fail: Destroy 1 Raptor and the current player is sent to Sickbay. | X107: E
A108: Confrontation at Gunpoint | H108: X | I108: X | M108: 13 | P108: H | R108: Pass: The Current Player looks at the top 3 cards of the Crisis deck and places each on the top or bottom in any order; Fail: The President may choose to discard his hand of Quorum cards, or the President is Executed; Prove Faith 2: The President may move another player from the Brig to any Location on Galactica. | X108: R
A109: In the Ring | H109: X | I109: X | J109: X | M109: 12 | O109: X | P109: H | Q109: X | R109: Pass: +1 Morale; Fail: -1 Morale and the Current Player is sent to Sickbay; Consequence: The Current Player chooses another player to send to Sickbay. | X109: E
A110: Mysterious Message | C110: X | H110: X | L110: X | M110: 9 | P110: R | Q110: X | R110: Current Player Chooses: Pass: The Current Player may search the Destiny deck and choose 2 cards to discard. He then reshuffles the Destiny deck; Fail: Launch Raiders, Activate Basestars. OR Activate Basestars. | X110: E
A111: Joe's Bar | H111: X | I111: X | L111: X | M111: 12 | P111: R | Q111: X | R111: Pass: +1 Morale; Fail: -1 Morale and the Current Player is sent to the Brig. | X111: E
A112: Cylon Genocide | C112: X | H112: X | I112: X | J112: X | L112: X | M112: 21 | P112: R | Q112: X | R112: Current Player Chooses: Pass: Destroy all Cylon ships currently on the main game board; Fail: -1 Morale, then Activate Basestars, Launch Raiders, Activate Heavy Raiders. OR Roll a die. If 4 or lower, the Current Player is sent to the Brig. | X112: E
A113: Unexplained Deaths | I113: X | J113: X | M113: 8 | P113: R | Q113: X | R113: Pass: No Effect; Fail: -1 Morale, -1 Population. | X113: E
A114: Temple of the Five | J114: X | L114: X | M114: 9 | P114: L | R114: Pass: The Current Player may draw 2 Skill Cards; Fail: Decrease the Jump Preparation track by 1. | X114: E
A115: Interrogation | E115: X | P115: B | R115: Admiral Chooses: The Admiral chooses another player to send to Sickbay. The Admiral may then look at 1 of that character's Loyalty Cards at random. OR The Admiral discards 2 Skill Cards, then the Current Player discards 3 Skill Cards. | X115: E
A116: Raptor Malfunction | C116: X | J116: X | K116: X | L116: X | M116: 12 | P116: R | Q116: X | R116: Current Player Chooses: Pass: No Effect; Fail: Damage Galactica once and destroy 1 Raptor. OR The Current Player is sent to Sickbay. | X116: E
A117: Appoint Head of Security | E117: X | P117: L | R117: Admiral Chooses: Return all undamaged Vipers on the game board to the Reserves. Then the Admiral must discard 2 random Skill Cards. OR -1 Morale and damage Galactica once. | X117: E
A118: Mysterious Guide | C118: X | H118: X | I118: X | M118: 11 | P118: R | R118: Current Player Chooses: Pass: Increase the Jump Preparation track by 1; Fail: -1 Fuel and the Current Player discards all of his Skill Cards. OR -1 Morale. | X118: E
A119: Controversial Manuscript | D119: X | P119: R | Q119: X | R119: President Chooses: -1 Morale. OR +1 Morale and damage Galactica twice. | X119: E
A120: Hidden Explosives | E120: X | P120: R | Q120: X | R120: Admiral Chooses: Destroy 1 Raptor and the Current Player is sent to Sickbay. OR -1 Morale. | X120: E
A121: Not to be Human | I121: X | L121: X | M121: 11 | P121: H | Q121: X | R121: Pass: The Current Player may choose a revealed Cylon to discard all his Skill Cards; Fail: Launch Raider, Activate Raiders; Prove Faith: The Current Player may activate 1 unmanned Viper for each PF card in this Skill Check (limit 3). | X121: R
A122: Set a Trap | C122: X | I122: X | J122: X | M122: 10 | P122: R | R122: Current Player Chooses: Pass: Destroy a Centurion on the Boarding Party track; Fail: Place a Centurion at the start of the Boarding Party track. The Current Player is sent to Sickbay. OR Roll a die. If 4 or lower, place a Centurion at the start of the Boarding Party track. | X122: E
A123: The Circle | D123: X | P123: R | Q123: X | R123: President Chooses: You must choose another player to receive the President title or the Current Player is Executed. OR The President discards 2 Skill Cards, then the Current Player discards 3 Skill Cards. | X123: E
A124: Truth and Reconciliation | D124: X | P124: B | Q124: X | R124: President Chooses: -1 Morale and the President must choose a character to send to the "Brig." OR The President discards 2 Skill Cards, then the Current Player discards 3 Skill Cards. | X124: E
A125: Harsh Reality | I125: X | J125: X | M125: 10 | P125: B | Q125: X | R125: Pass: No Effect; Fail: -1 Morale, -1 Food; Prove Faith: Every Human player may draw 2 Faith Skill Cards. | X125: R
A126: Ambushed by the Press | D126: X | P126: R | Q126: X | R126: President Chooses: -1 Morale. OR The President must discard all of his Skill Cards. | X126: E
A127: Guilty Conscience | H127: X | I127: X | M127: 7 | P127: H | Q127: X | R127: Pass: No Effect; Fail: The Current Player discards 3 random Skill Cards. | X127: E
A128: Consult the Prisoner | C128: X | H128: X | J128: X | L128: X | M128: 13 | P128: B | Q128: X | R128: Current Player Chooses: Pass: Increase the Jump Preparation track by 1; Fail: Each player discards 1 Skill Card and the Current Player is sent to the Brig. OR The Admiral discards 2 Skill Cards and the Current Player discards 3 Skill Cards. | X128: E
A129: Rookie Mistake | I129: X | K129: X | M129: 9 | P129: L | R129: Pass: Current Player may activate an unmanned Viper; Fail: Current Player must destroy one piloted Viper. If there are no piloted Vipers, Current Player is sent to Sickbay; Prove Faith: Current Player may look at 1 Civilian, then move it to an adjacent space sector. | X129: R
A130: The Road Less Traveled | H130: X | I130: X | J130: X | M130: 18 | P130: L | R130: Pass: Place this card next to the Kobol Objective card. It counts as 1 Distance; Fail: -1 Fuel, and the Current Player is sent to the Brig. | X130: R
A131: Visions of Your Own Death | H131: X | I131: X | M131: 7 | P131: R | Q131: X | R131: Pass: No Effect; Fail: The President discards 2 Skill Cards and moves to the 'Sickbay' location; Prove Faith: The President and the Current Player may each draw 1 Skill Card for each PF card in the check (limit 3). | X131: R
A132: Hidden Identity | H132: X | I132: X | J132: X | M132: 12 | P132: L | R132: Pass: No Effect; Fail: -1 Morale. Current player is sent to the Brig. | X132: E
A133: Deciphering the Music | H133: X | J133: X | L133: X | M133: 11 | P133: R | Q133: X | R133: Pass: The Current Player looks at the top 3 cards of the Destination deck and places one on the bottom and two on top in any order; Fail: The Current Player discards all of his Skill Cards; Prove Faith 3: Increas the Jump Preparation track by 1. | X133: R
A134: Power Failure | I134: X | J134: X | L134: X | M134: 14 | O134: X | P134: H | R134: Pass: No Effect; Fail: Reduce the Jump Preparation track by 1; Consequence: Damage Galactica once. | X134: E
A135: Medal of Distinction | E135: X | P135: B | Q135: X | R135: Admiral Chooses: +1 Morale, place 2 Civilian ships on the game board and then activate Raiders. OR -1 Morale. | X135: E
A136: Labor Dispute | D136: X | P136: B | R136: -2 Morale. OR -1 Fuel and decrease Jump Prep track by 1. | X136: E
A137: Haunted by the Past | H137: X | I137: X | M137: 12 | O137: X | P137: H | Q137: X | R137: Pass: No Effect; Fail: Each player must discard 1 random Skill Card; Consequence: The current player gives any Title Cards he has to the player (aside from himself) highest on the Line of Succession. | X137: E
A138: Strange Beacon | J138: X | K138: X | L138: X | M138: 13 | P138: R | R138: Pass: Current Player chooses 1 space area on the main game board and removes all Cylon ships in that area; Fail: Decrease the Jump Preparation track by 1. | X138: E
A139: Familiar Face | C139: X | H139: X | I139: X | J139: X | M139: 12 | P139: R | Q139: X | R139: Current Player Chooses: Pass: The Admiral may choose a character to send to the Brig; Fail: -1 Morale and the Admiral must discard all of his Skill Cards. OR -1 Morale. | X139: E
A140: Airlock Leak | J140: X | L140: X | M140: 6 | P140: H | R140: Pass: No Effect; Fail: Damage Galactica and the Current Player is sent to Sickbay. | X140: E
A141: The Passage | C141: X | J141: X | K141: X | L141: X | M141: 14 | P141: R | Q141: X | R141: Current Player Chooses: Pass: Increase the Jump Preparation track by 1; Fail: Destroy 2 Civilian ships. OR Roll a die. If 6 or lower, the Current Player is sent to Sickbay. | X141: E
A142: Widespread Starvation | D142: X | P142: R | Q142: X | R142: President Chooses: -2 Food. OR -1 Food, -1 Population. | X142: E
A143: Hera Rescued | C143: X | H143: X | I143: X | M143: 10 | P143: R | Q143: X | R143: Current Player Chooses: Pass: No Effect; Fail: -2 Morale and destroy 1 Raptor. OR -1 Morale. | X143: E
A144: Unfair Bias | H144: X | I144: X | J144: X | M144: 12 | P144: R | Q144: X | R144: Pass: No Effect; Fail: Damage Galactica and the Current Player discards his hand of Skill Cards. | X144: E
A145: Dogfight | G145: X | P145: R | R145: Constant Barrage: Keep this card in play until the Fleet Jumps or no Raiders remain on the board. Each time Raiders are activated, launch two Raiders from each Basestar (do not activate the new Raiders). | S145: 1x3 | U145: 2x[3,4] | V145: 1x[5,6] | W145: 1x6 | X145: P
A146: Training Snafu | I146: X | K146: X | M146: 8 | P146: B | Q146: X | R146: Pass: No Effect; Fail: Damage 3 Vipers in space areas or in the Reserves. | X146: P
A147: The Black Market | C147: X | H147: X | I147: X | J147: X | M147: 13 | P147: R | Q147: X | R147: Current Player Chooses: Pass: +1 Food; Fail: -2 Food, -1 Morale. OR -1 Food and each player discards 1 Skill Card and draws 1 Treachery Card. | X147: P
A148: Detente | F148: X | P148: L | R148: CAG Chooses: All Vipers in space areas are returned to the Reserves. All characters who were piloting vipers are placed in the Hangar Deck. Increase the Pursuit Track by 1. OR Activate Basestars, Activate Raiders, Activate Heavy Raiders. | X148: E
A149: Food Hoarding in the Fleet | D149: X | P149: R | Q149: X | R149: President Chooses: -1 Morale and roll a die. If 3 or less, draw and destroy 1 Civilian ship. OR -2 Food. | X149: P
A150: Return to Duty | F150: X | P150: R | R150: CAG Chooses: Any character on Galactica with piloting in his skill set may immediately launch himself in a Viper. Then Launch Raiders. OR Activate Basestars. | X150: E
A151: Standoff with Pegasus | H151: X | I151: X | J151: X | K151: X | M151: 22 | P151: L | R151: Pass: Current Player may move 1 character from the Brig to any other Galactica location; Fail: -1 Population, -1 Morale, and damage 1 Viper in a space area (if able). | X151: P
A152: Unsettling Stories | C152: X | H152: X | I152: X | M152: 9 | P152: R | Q152: X | R152: Current Player Chooses: Pass: No Effect; Fail -1 Morale, and each player discards 1 Skill Card and draws 1 Treachery Card. OR -1 Morale. | X152: P
A153: Medical Breakthrough | H153: X | I153: X | L153: X | M153: 12 | N153: 6 | P153: H | R153: Pass: Each Human player draws 1 Skill Card; 6+ No Effect; Fail: -1 Morale and each player discards 1 Skill Card and draws 1 Treachery Card. | X153: P
A154: Suspicious Election Results | E154: X | P154: R | R154: Give the President title to the character (aside from the current President) highest in the line of succession. OR The Admiral discards 1 random Skill Card and draws 1 Treachery Card. | X154: P
A155: Review Camera Footage | F155: X | P155: B | R155: CAG Chooses: Damage 2 Vipers in the Reserves (if able) and increase the Pursuit track by 1. The CAG may then activate 1 Unmanned Viper. OR The CAG discards 2 Skill Cards, then the Current Player discards 3 Skill Cards. | X155: E
A156: Pressure the Supply Ships | E156: X | P156: R | Q156: X | R156: Admiral Chooses: +1 Food and -1 Morale. The Admiral discards 2 Skill Cards and draws 2 Treachery Cards. OR -2 Food. | X156: P
A157: The Guardians | G157: X | P157: B | R157: Raptor Crew Captured: Keep this card in play until the Fleet Jumps. When a Basestar is destroyed, lose 1 Morale and destroy 1 Raptor. | S157: 1x1 | T157: 1x3 | U157: 2x[2,6] | V157: 1x[5,6] | W157: 1x4 | X157: P
A158: Sabotage Investigated | J158: X | L158: X | M158: 9 | P158: H | Q158: X | R158: Pass: -1 Food; Fail: -1 Morale, -1 Fuel, -1 Food. | X158: P
A159: Defending a Prisoner | H159: X | I159: X | M159: 11 | P159: H | Q159: X | R159: Pass: No Effect; Fail: -1 Morale and roll a die. If 4 or lower, the Current Player is Executed. | X159: P
A160: Raiders Inbound | F160: X | P160: H | R160: CAG Chooses: -1 Population and damage Galactica once. OR The CAG and the Admiral must each discard 3 Skill Cards. | X160: E
A161: Assassination Plot | D161: X | P161: B | Q161: X | R161: President Chooses: The Admiral and the Current Player must both discard 3 Skill Cards and draw 3 Treachery Cards. OR Admiral is Executed. | X161: P
A162: Reunite the Fleet | C162: X | H162: X | I162: X | M162: 10 | P162: R | R162: Current Player Chooses: Pass: +1 Population; Fail: -1 Morale and each player discards 1 Skill Card and draws 1 Treachery Card. OR Current Player discards 2 random Skill Cards and draws 2 Treachery Cards. | X162: P
A163: Scar | G163: X | P163: R | R163: Personal Vendetta: Keep this card in play until the Fleet Jumps or Scar is destroyed. Whenever Raiders are activated, activate the Scar Raider twice. Scar may only be destroyed by a roll of 7 or 8. Scar deploys in Sector 2. | V163: 1x[5,6] | W163: 2x4 | X163: P
A164: An Offer of Peace | H164: X | I164: X | M164: 12 | N164: 6 | P164: L | R164: Pass: No Effect; 6+: Shuffle 2 Treachery Cards into the Destiny deck; Fail: -1 Morale and shuffle 2 Treachery Cards into the Destiny deck. | X164: P
A165: A Verdict of Guilty | E165: X | P165: B | Q165: X | R165: Admiral Chooses: Current Player is Executed and the Admiral discards 3 Skill Cards. OR Damage Galactica twice. | X165: P
A166: Training a Rookie | F166: X | P166: L | R166: CAG Chooses: Activate one Unmanned Viper. Then Activate Raiders. OR The CAG chooses 2 Vipers that are not currently damaged or destroyed and moves them to the Damaged Viper box. | X166: E
A167: Civilian Ship Nuked | D167: X | P167: R | Q167: X | R167: President Chooses: Draw 1 Civilian ship and destroy it. Then each player discards 1 Skill Card and draws 1 Treachery Card. OR Draw and destroy 2 Civilian ships. | X167: P
A168: Code Blue | C168: X | H168: X | I168: X | J168: X | M168: 13 | P168: H | Q168: X | R168: Current Player Chooses: Pass: The Current Player looks at 1 random Loyalty Card of any player; Fail: -1 Morale and the Current Player is sent to the Brig. OR Each player discards 2 Skill Cards and draws 2 Treachery Cards. | X168: P
A169: Review Galactica's Log | H169: X | I169: X | J169: X | M169: 14 | N169: 6 | P169: R | Q169: X | R169: Pass: No Effect; 6+: The Admiral must discard 3 Skill Cards; Fail: -1 Morale and the Admiral must discard 5 Skill Cards. | X169: P
A170: Tracked by Radiation | F170: X | P170: B | R170: CAG Chooses: Place a Basestar and 3 Raiders in front of Galactica and 2 Civilian ships behind Galactica. OR -1 Fuel. | X170: E
B171: Crisis Deck Size | C171: of:=[.A1]-COUNTBLANK([.A4:.A170]) -> 69
A173: New Caprica Deck | B173: New Caprica Deck
A174: Labor Union Strike | H174: X | J174: X | M174: 13 | N174: 10 | P174: R/O | Q174: X | R174: Pass: +1 Morale; 10+: No Effect; Fail: -1 Food and if the Current Player is on New Caprica, he is sent to Detention.
A175: Held for Questioning | C175: X | H175: X | I175: X | J175: X | M175: 10 | P175: H/O | Q175: X | R175: Current Player Chooses: Pass: No Effect; Fail: -1 Morale and the Current Player is sent to Detention if on New Caprica. OR Current Player must discard 3 random Skill Cards.
A176: Attack on the Power Plant | D176: X | P176: L | Q176: X | R176: President Chooses: -1 Morale and each Human player draws 2 Skill Cards. OR -1 Population and +1 Morale.
A177: Betrayed From Within | H177: X | I177: X | M177: 9 | N177: 6 | P177: R | Q177: X | R177: Pass: No Effect; 6+: Current Player discards 2 random Skill Cards and draws 2 Treachery Cards. Fail: Current Player is Executed.
A178: A Cylon Ally | E178: X | P178: R/O | Q178: X | R178: Admiral Chooses: Prepare or Evacuate 1 Civilian ship and roll a die. If the result is 5 or less, the Current Player is sent to Detention. If the Current Player is not on New Caprica you may not choose this option. OR Admiral discards 2 Skill Cards and Current Player discards 3 Skill Cards.
A179: NCP Recruitment | C179: X | H179: X | I179: X | M179: 8 | P179: R | R179: Current Player Chooses: Pass: No Effect; Fail: -1 Morale. OR Each player discards 2 Skill Cards and draws 2 Treachery Cards.
A180: Arrests at Night | C180: X | I180: X | J180: X | M180: 10 | P180: L | Q180: X | R180: Current Player Chooses: Pass: No Effect; Fail: -1 Morale and Current Player is sent to Detention if on New Caprica. OR Each player discards 2 Skill Cards and draws 2 Treachery Cards.
A181: Contact Raptor | H181: X | L181: X | M181: 7 | P181: R | Q181: X | R181: Pass: No Effect; Fail: -1 Morale and the Current Player discards 2 Skill Cards.
A182: Prepare for a Fight | C182: X | I182: X | J182: X | L182: X | M182: 8 | P182: R/O | Q182: X | R182: Current Player Chooses: Pass: Destroy 1 Occupation force; Fail: -1 Morale and Current Player is sent to Detention if on New Caprica. OR Current Player chooses a Human player on New Caprica to send to Medical Center.
A183: Organize the Pilots | H183: X | K183: X | M183: 9 | P183: B | R183: Pass: Prepare or Evacuate 1 Civilian ship; Fail: Destroy the top ship of the Locked Civilian Stack, or Prepared if Locked is empty.
A184: Intra-Atmos Entry | I184: X | J184: X | K184: X | L184: X | M184: 15 | N184: 9 | P184: H | Q184: X | R184: Pass: Prepare or Evacuate 1 Civilian ship. Then increase the Jump Prep track by 1; 9+: No Effect; Fail: -1 Fuel. Then damage Galactica if it is in orbit of New Caprica.
A185: Centurion Ambush | J185: X | K185: X | M185: 7 | P185: R | Q185: X | R185: Pass: No Effect; Fail: -1 Population and the Current Player is sent to Medical Center if on New Caprica.
A186: Rescue Detainees | C186: X | I186: X | J186: X | M186: 9 | P186: H/O | Q186: X | R186: Current Player Chooses: Pass: Current Player may move a character from Detention to any other New Caprica location; Fail: -1 Morale. OR Roll a die. If 4 or lower, the Current Player chooses a Human player on New Caprica to send to Detention.
A187: Execution List | D187: X | P187: H/O | Q187: X | R187: President Chooses: Roll a die. If 5 or less, the President is Executed. OR -1 Population.
A188: Dissent Among Cylons | H188: X | I188: X | M188: 12 | N188: 7 | P188: L | Q188: X | R188: Pass: Each Human player may draw 2 Skill Cards; 7+: No Effect; Fail: -1 Morale.
A189: Brutal Treatment | C189: X | H189: X | J189: X | M189: 9 | P189: B/O | Q189: X | R189: Current Player Chooses: Pass: No Effect; Fail: -1 Morale and the Current Player is sent to Medical Center if on New Caprica. OR Current Player chooses a Human player on New Caprica to send to Detention.
A190: Marine Reinforcements | E190: X | P190: R | R190: Admiral Chooses: Destroy 1 Occupation force. Admiral discards 2 Skill Cards and Current Player discards 3 Skill Cards. OR Admiral chooses a Human player on New Caprica to send to Detention.
A191: Keeping Hera Hidden | D191: X | P191: R/O | Q191: X | R191: President Chooses: Shuffle 2 Treachery Cards into the Destiny deck. OR President chooses a Human player on NC to send to Detention.
A192: Resistance Bombing | I192: X | J192: X | L192: X | M192: 12 | N192: 7 | P192: B/O | R192: Pass: Admiral may choose to lose 1 Morale to Execute a Revealed Cylon or destroy 2 Occupation forces; 7+: No Effect; Fail: -1 Morale, -1 Population.
A193: Second Thoughts | H193: X | I193: X | M193: 9 | P193: B/O | Q193: X | R193: Pass: Current Player may move a character from Detention to any other New Caprica location; Fail: -1 Morale.
A194: Decode Cylon Maps | J194: X | L194: X | M194: 8 | P194: H/O | R194: Pass: Prepare or Evacuate 1 Civilian ship; Fail: -1 Morale and place 1 Occupation force on Occupation Authority.
A195: Establish Sanitation | D195: X | P195: R | Q195: X | R195: President Chooses: Skip the Prepare for Jump step of this turn. OR -1 Morale.
A196: Contact Informant | C196: X | H196: X | J196: X | M196: 9 | P196: R/O | Q196: X | R196: Current Player Chooses: Pass: No Effect; Fail: -1 Morale and -1 Population. OR -1 Population.
A197: Prepare the Civilians | H197: X | I197: X | M197: 9 | P197: R | Q197: X | R197: Pass: No Effect; Fail: -1 Food and place 1 Occupation force at Occupation Authority.
A198: Recover Launch Keys | I198: X | J198: X | L198: X | M198: 10 | P198: B | R198: Pass: Prepare or Evacuate 1 Civilian ship; Fail: -1 Population. If the current player is on New Caprica, he is sent to Detention.
A199: Hiding Underground | C199: X | I199: X | J199: X | M199: 9 | P199: R/O | Q199: X | R199: Current Player Chooses: Pass: No Effect; Fail: -1 Food. OR Current Player chooses a Human player on New Caprica to send to Detention.
A200: Meet Liaison Officer | H200: X | J200: X | M200: 10 | P200: R | Q200: X | R200: Pass: No Effect; Fail: -1 Fuel and destroy 1 Raptor.
A201: NCP Graduation | E201: X | P201: H | Q201: X | R201: Admiral Chooses: -1 Morale. OR -1 Population.
A202: Demanded Surrender | D202: X | P202: B/O | R202: President Chooses: President chooses a Human player on New Caprica to send to Detention. OR -1 Morale.
A203: Playing with Emotions | C203: X | H203: X | J203: X | M203: 7 | P203: L | Q203: X | R203: Current Player Chooses: Pass: No Effect; Fail: -1 Morale. OR Current Player must discard 2 random Skill Cards and draw 2 Treachery Cards.
B204: New Caprica Crisis Deck Size | C204: of:=30-COUNTBLANK([.A174:.A203]) -> 30
A206: Battle of the Colony Deck | B206: New Caprica Deck
A207: Helped by the Enemy | C207: X | H207: X | I207: X | J207: X | M207: 12 | P207: P | R207: Current Player Chooses: Pass: Move Hera one position to the left; Fail: Activate All Defenders, then place a Centurion on the Boarding Party track. OR -1 Population.
A208: Fighting Alongside Centurions | H208: X | J208: X | M208: 9 | P208: P | R208: Pass: Current Player chooses a Defender to destroy; Fail: -1 Food, then: Sneak Attack, Sneak Attack.
A209: Using Cylon Technology | C209: X | H209: X | I209: X | L209: X | M209: 10 | P209: H/D | Q209: X | R209: Pass: Current Player choose 2 Galactica Locations to repair; Fail: -1 Morale and damage Galactica. OR Damage Galactica, and all characters in Weapons Control are sent to Sickbay.
A210: Close to a Black Hole | E210: X | P210: R/D | R210: Admiral Chooses: Destroy one Viper (in space if able) and one Raptor, increase Hand of Fate counter by 2. OR Decrease Hand of Fate counter by 2, then: Activate Raiders, Activate Defenders, Activate Heavy Raiders.
A211: Interim President | H211: X | I211: X | M211: 7 | P211: R/D | R211: Pass: The Admiral may choose a player and give them the President title; Fail: -1 Population. If Population is now 5 or less, -1 Morale.
A212: One Act of Bravery | C212: X | H212: X | I212: X | J212: X | M212: 10 | P212: R/H | R212: Current Player Chooses: Pass: Decrease Hand of Fate counter by 1; Fail: Current Player must discard all of his Skill Cards or move to the Brig. OR Current Player must send a Human from the Assault Track to Sickbay. You cannot choose this option if there are no Humans on the Assault Track.
A213: Treating the Wounded | H213: X | I213: X | M213: 7 | N213: 4 | P213: P | Q213: X | R213: Pass: No Effect; 4+: Current Player must send another Human player to Sickbay; Fail: -2 Food, and Current Player is sent to Sickbay.
A214: Crossing the Line | H214: X | I214: X | J214: X | K214: X | M214: 20 | N214: 16 | P214: R/D | Q214: X | R214: Pass: +1 Morale, and all Humans on the Assault Track may move to an adjacent position; 16+: +1 Morale; Fail: -1 Morale, -1 Population, -1 Food.
A215: Messengers from God | I215: X | M215: 8 | P215: R/D | Q215: X | R215: Pass: +1 Morale; Fail: -1 Morale; Prove Faith: Decrease the Difficulty of this Skill Check by the number of PF cards in the check.
A216: Casualties of Battle | H216: X | I216: X | J216: X | M216: 12 | N216: 8 | P216: R/D | R216: Pass: Current Player may choose to Execute a Cylon player; 8+: No Effect; Fail: Current Player is Executed.
A217: Secret of the Opera House | D217: X | P217: R/D | Q217: X | R217: President Chooses: Damage Galactica and move Hera one position to the left. OR Sneak Attack, Activate Defenders.
A218: Gun Barrage | I218: X | J218: X | L218: X | M218: 10 | P218: A | Q218: X | R218: Pass: Current Player can either damage Colony or destroy a Defender; Fail: Damage Galactica.
A219: Crazy Raptor Assault | I219: X | J219: X | K219: X | M219: 12 | P219: R/D | Q219: X | R219: Pass: Current Player may move any one human to position 3 on the Assault Track; Fail: -1 Fuel, destroy a Raptor.
A220: Sending the Fleet Away | E220: X | P220: H/S | R220: Admiral Chooses: The Admiral must discard 4 Skill Cards, then pass the Admiral title to the next character in the line of succession. OR -2 Population.
A221: Spatial Distortions | C221: X | J221: X | K221: X | L221: X | M221: 7 | P221: A | Q221: X | R221: Current Player Chooses: Pass: No Effect; Fail: Damage Galactica. OR -1 Fuel.
A222: Centurion Counterattack | I222: X | J222: X | M222: 10 | N222: 6 | P222: A | R222: Pass: No Effect; 6+: Place one Centurion on the start of the Boarding Party track; Fail: Place one Centurion on the start of the Boarding Party track and Damage Galactica.
A223: Experiments on Hera | H223: X | I223: X | J223: X | M223: 10 | N223: 6 | P223: R/D | R223: Pass: No Effect; 6+: -1 Morale; Fail: -1 Morale, and place Hera on Position 6 of the Assault Track.
A224: Galactica's Hybrid | H224: X | L224: X | M224: 9 | P224: H/D | Q224: X | R224: Pass: Current Player chooses one Galactica Location to repair; Fail: -1 Fuel, -1 Morale.
A225: Haunted by Lives Past | D225: X | P225: R/H | R225: President Chooses: +1 Morale, then: Activate All Defenders, Place Defenders. OR -2 Morale.
A226: Secrets Revealed | F226: X | P226: R/D | R226: CAG Chooses: -1 Morale and land one Viper from space (if able). OR CAG discards 3 random skill cards.
A227: Civilians Left Behind | H227: X | I227: X | J227: X | M227: 13 | N227: 8 | P227: R/D | Q227: X | R227: Pass: No Effect; 8+: Destroy a Raptor; Fail: Destroy a Raptor, then the Admiral draws three Civilian ships and chooses two of them to destroy.
A228: Dealing with Past Decisions | H228: X | I228: X | M228: 8 | P228: P | Q228: X | R228: Pass: No Effect; Fail: -1 Morale and the Current Player is sent to Sickbay.
A229: Old Enmities | D229: X | P229: R/H | R229: President Chooses: +1 Morale, damage Galactica, and increase the Hand of Fate counter by 1. OR -1 Food, the Current Player is sent to the Brig, decrease the Hand of Fate counter by 1.
A230: Nukes Fired | J230: X | K230: X | M230: 12 | P230: R/D | Q230: X | R230: Pass: Damage Colony twice; Fail: Damage Galactica twice.
A231: Destiny's Hand | I231: X | J231: X | K231: X | M231: 12 | P231: A | R231: Pass: Each player who participated in this Skill Check may draw 2 Faith Skill Cards; Fail: Increase Hand of Fate counter by 2.
A232: Rage | H232: X | I232: X | L232: X | M232: 12 | N232: 7 | P232: H/S | Q232: X | R232: Pass: No Effect; 7+: Activate Raiders; Fail: Activate Raiders, then Current Player must choose another Human player to Execute.
A233: Perfection | H233: X | I233: X | K233: X | M233: 14 | O233: X | P233: A | Q233: X | R233: Pass: All Humans on the Assault Track may move to an adjacent position; Fail: The rightmost Human on the Assault Track is sent to Sickbay; Consequence: Damage Galactica.
A234: Prepare to Abandon Ship | H234: X | I234: X | J234: X | M234: 11 | P234: P | Q234: X | R234: Pass: +1 Morale; Fail: -1 Morale and damage Galactica.
A235: Recall the Fighters | J235: X | K235: X | M235: 10 | P235: R/D | Q235: X | R235: Pass: Remove one Raider from each space area (where able) and decrease the Hand of Fate counter by 1; Fail: Damage a Viper (in space if able) and the Admiral must discard 2 random Skill Cards.
A236: Ready to Battle | E236: X | P236: H/S | R236: Admiral Chooses: Every Human Player may draw 2 Tactics Skill Cards, then decreases the Hand of Fate counter by 1, then: Place Defenders. OR Admiral may lose 1 Fuel to repair one Galactica Location or 2 damaged Vipers, then: Activate Defenders.
B237: Colony Crisis Deck Size | C237: of:=30-COUNTBLANK([.A207:.A236]) -> 30
A239: Super Crisis Cards
A240: Super Crisis Cards | B240: In Hand | C240: Discard | H240: Politics | I240: Leadership | J240: Tactics | K240: Piloting | L240: Engineering | M240: Difficulty | N240: Partial | O240: Consequence | P240: Activation | Q240: Jump Track | R240: Description | S240: Basestars | T240: Heavy Raiders | U240: Raiders | V240: Vipers | W240: Civilians
C241: Bomb on Colonial One | J241: X | K241: X | L241: X | M241: 15 | R241: Pass: No Effect; Fail : -2 Morale, and all characters on Colonial One are sent to 'Sickbay'. Keep this card in play. Characters may not move to Colonial One for the rest of the game. | X241: B
A242: Inbound Nukes | B242: Gaius | I242: X | J242: X | M242: 15 | R242: Pass: No Effect; Fail: -1 Fuel, -1 Food, and -1 Population. | X242: B
A243: Cylon Intruders | I243: X | J243: X | M243: 18 | N243: 14 | R243: Pass: No Effect; 14+: Place 1 Centurion marker at the start of the Boarding Party track; Fail: Damage Galactica and place 2 Centurion markers at the start of the Boarding Party Track. | X243: B
A244: Massive Assault | P244: H/B | R244: 1) Activate Heavy Raiders, Activate Basestars. 2) Setup Ships. 3) Power Failure: Move the Fleet token 2 spaces towards the start of the Jump Preparation track. | S244: 1x[2,3] | T244: 1x3 | U244: 4x2,2x3 | V244: 1x[5,6] | W244: 2x[5,6] | X244: B
A245: Fleet Mobilization | I245: X | J245: X | K245: X | L245: X | M245: 24 | R245: Pass: Activate Basestars, Launch Raiders; Fail : -1 Morale, and Activate Basestars, Activate Raiders, Activate Heavy Raiders, Launch Raiders. | X245: B
A246: Lured into a Trap | P246: R | R246: 1) Activate Raiders. 2) Setup Ships. 3) Dangerous Repairs are Necessary: Keep this card in play until after the Fleet Jumps. Any character in either Engine Room or FTL Control when the fleet jumps is Executed. | S246: 1x[2,3] | T246: 1x4 | U246: 3x[2,3] | V246: 1x[5,6] | W246: 1x[5,6] | X246: P
A247: Psychological Warfare | R247: President Chooses: -1 Morale, each player discards 2 Skill Cards and draws 2 Treachery. OR Each Revealed Cylon draws 2 Treachery, then discard the Destiny deck and build a new one of 6 Treachery Cards. | X247: P
A248: Footage Transmitted | H248: X | I248: X | J248: X | M248: 17 | N248: 12 | R248: Pass: Each player draws 1 Treachery; 12+: Each Revealed Cylon player draws 2 Treachery; Fail: Each Revealed Cylon player draws 2 Treachery and 1 Super Crisis Card. | X248: P
A249: The Farm | J249: X | L249: X | M249: 15 | N249: 8 | R249: Pass: No Effect; 8+: -1 Food; Fail: -1 Food, -1 Population. Keep this card in play. Human players may not use their once-per-game abilities. | X249: P
A250: Demand Peace' Manifesto | R250: Admiral Chooses: -1 Morale and damage Galactica twice. OR The President and Admiral each discard their hand of Skill Cards. | X250: P
A251: Human Prisoner | I251: X | J251: X | M251: 18 | R251: Pass: No Effect; Fail: The Cylon player who played this card chooses one Human player and takes all of his Skill Cards. That human player's character is then sent to Sickbay. | X251: E
A252: Fighting Blind | R252: CAG Chooses: Place 2 Centurions at the start of the Boarding Party track. OR The CAG is Executed. | X252: E
A253: Frak Earth | H253: X | I253: X | M253: 13 | R253: Pass: No Effect; Fail: -1 Population and place this card next to the Kobol Objective card. It counts as -1 Distance. Prove Faith: All revealed Cylons may draw 2 Faith Skill Cards | X253: R
A254: Facing the Impossible | M254: 10 | R254: Pass: No Effect; Fail: -1 Food, -1 Morale, -1 Population | X254: R
A255: Fire All Missles | J255: X | K255: X | M255: 22 | O255: X | R255: Pass: No Effect; Fail: Draw 2 Civilian Ships to destroy; Consequences: Damage Galactica twice. | X255: E
B256: Super Crisis Deck Size | C256: of:=[.B1]-COUNTBLANK([.A241:.A255]) - COUNTIF([.B241:.B255];"<>") -> 3
A258: End-Game Battles | C258: Discard | H258: Politics | I258: Leadership | J258: Tactics | K258: Piloting | L258: Engineering | M258: Value | N258: Partial | O258: Consequence | P258: Activation | Q258: Jump Track | R258: Description | S258: Basestars | T258: Heavy Raiders | U258: Raiders | V258: Vipers | W258: Civilians
A259: Battle of New Caprica | S259: 1x[2,3] | U259: 4x[2,3] | V259: 2x[5,6] | X259: P
A260: Battle of the Ionian Nebula | S260: 1x[2,3] | U260: 4x[2,3] | V260: 2x[5,6] | X260: E
A261: Battle of the Colony | U261: 2x[1,4] | X261: R

Sheet: Quorum Cards
F3: Quorum Deck | G3: of:=[.$B$5]-COUNTBLANK([.$B$16:.$B$47]) -> 9
F4: President's Hand | G4: of:=COUNTIF([.$C$16:.$C$47];"<>") -> 5
B5: 17 | F5: Quorum Discard | G5: of:=COUNTIF([.$F$16:.$F$47];"<>") -> 2
F8: Card Types | H8: `
F9: Discard after playing | G9: D
F10: Assign to a player | G10: A
F11: Assign to game | G11: S
F12: Remove after success | G12: R
A15: Type | B15: Quorum Card | C15: President's Hand | D15: In Play | E15: Assigned to | F15: Discard Pile | G15: Removed | H15: Description | I15: Module
A16: D | C16: Presidential Pardon | H16: Move any other character from the Brig to any other location on Galactica. | I16: B
A17: D | C17: Encourage Mutiny | H17: Pick non-Admiral player. Target: Roll 1-2 -1 morale; 3-8 become Admiral | I17: B
A18: A | C18: Assign Arbitrator | H18: Draw 2 politics (yellow) and pick any other player. When anyone activates Admiral's Quarters, Arbitrator can discard this card to move difficulty +/-3, then discard this card. | I18: B
A19: D | C19: Release Cylon Mugshots | H19: Pick player and view 1 random Loyalty card. Roll 1-3 -1 morale. | I19: B
A20: A | C20: Assign Vice President | H20: Draw 2 politics (yellow) and name VP. Only VP can become President via Administration. | I20: B
A21: R | B21: Inspirational Speech | H21: Roll 6-8 +1 Morale | I21: B
A22: S | B22: Accept Prophecy | H22: Draw 1 card (any color). Next time a player activates Administration or chooses the President with the Admiral's Quarters, difficulty +2, then discard this card. | I22: B
A23: R | B23: Inspirational Speech | H23: Roll 6-8 +1 Morale | I23: B
A24: R | B24: Food Rationing | H24: Roll 6-8 +1 Food | I24: B
A25: D | B25: Authorization of Brutal Force | H25: Destroy 3 Raiders, 1 Heavy, or 1 Centurion. Roll 1-2 -1 Population | I25: B
A26: R | B26: Food Rationing | H26: Roll 6-8 +1 Food | I26: B
A27: D | B27: Arrest Order | H27: Send a character to the Brig. | I27: B
A28: D | B28: Authorization of Brutal Force | H28: Destroy 3 Raiders, 1 Heavy, or 1 Centurion. Roll 1-2 -1 Population | I28: B
A29: R | B29: Inspirational Speech | H29: Roll 6-8 +1 Morale | I29: B
A30: A | F30: Assign Mission Specialist | H30: Draw 2 politics (yellow) and assign Specialist. On next Jump, Specialist chooses 3 destination cards and picks 1, instead of Admiral, then discard this card. | I30: B
A31: D | F31: Arrest Order | H31: Send a character to the Brig. | I31: B
A32: R | G32: Inspirational Speech | H32: Roll 6-8 +1 Morale | I32: B
A33: A | B33: Probation | H33: Give to any player. After he plays cards into a Skill check, President may discard to look at the cards he played | I33: P
A34: D | B34: Civilian Self Defense | H34: Destroy 3 raiders or 1 heavy raider in the same space area as a civilian ship. Then roll: 2 or less destroys the civilian. | I34: P
A35: D | B35: Eulogy | H35: If at least 1 morale has been lost by execution, +1 morale | I35: P
A36: D | B36: Consult the Oracle | H36: Look at bottom card of any 1 deck. Then look at all Destiny and discard 2 of them. Then shuffle Destiny | I36: P
A37: A | B37: Assign Chief of Staff | H37: Draw 2 Politics and assign to any other player. Before cards are added to a Skill check, this player may discard to make all Politics Cards in the check count as positive | I37: P
A38: D | B38: Enact Production Quotas | H38: +1 food then -1 morale | I38: P
A39: D | B39: Resources for Galactica | H39: Repair up to 1 location and 2 damaged vipers. | I39: P
A40: D | B40: Execute Prisoner | H40: Choose a character in the Brig. The character is executed | I40: P
A41: D | B41: Unsavory Connections | H41: Discard 2 random Skill Cards and draw 2 Treachery. Then either +1 food or +1 fuel | I41: P
A42: A | B42: Endorse Religious Leader | H42: Draw 2 Faith and give this card to any other player. Keep this card in play. While this card is in play, the Religious Leader may draw 2 Faith cards (instead of one) during their Movement step. Discard this card if the Religious Leader is executed or Reveals as a Cylon. | I42: R
A43: D | B43: Establish Dogville | H43: Gain 1 Population and lose 1 Morale. | I43: E
A44: D | B44: Presidential Order | H44: Choose any player, give him either the Admiral or the CAG title. | I44: E
A45: D | B45: Resignation | H45: Discard any number of Quorum Cards from your hand and then draw an equal number of new Quorum Cards. Then choose another character, give him the President title. | I45: E
A46: R | B46: Reevaluate Rights | H46: Draw 1 Leadership and 1 Treachery. Then gain 1 Population and lose 1 Morale, or gain 1 Morale and lose 1 Population. Then remove this card from the game. | I46: R
A47: D | B47: Master Your Own Fate | H47: Draw 6 Skill Cards from any skill type, in any combination (they may come from outside your Skill Set. Put 2 of those cards in your hand and shuffle the rest into the Destiny deck. | I47: R

Sheet: Destination Cards
B3: X
C6: Total Distance ==> | D6: 8 | E6: 5 | F6: <==Cards Buried
A8: Module | B8: Destination Card | C8: Jumped | D8: Distance | E8: Fuel | F8: Other | G8: Special Action
A9: B | C9: Tylium Planet | D9: 1 | E9: -1 | G9: Admiral may risk 1 Raptor: Roll 1-2 lose Raptor; 3-8 +2 fuel.
A10: B | C10: Cylon Ambush | D10: 3 | E10: -1 | F10: Deploy: B(1), R(3x1), Civ(3x4)
A11: B | C11: Asteroid Field | D11: 3 | E11: -2 | F11: Civilian -1
A12: B | C12: Tylium Planet | D12: 1 | E12: -1 | G12: Admiral may risk 1 Raptor: Roll 1-2 lose Raptor; 3-8 +2 fuel.
A13: B | B13: Tylium Planet | D13: 1 | E13: -1 | G13: Admiral may risk 1 Raptor: Roll 1-2 lose Raptor; 3-8 +2 fuel.
A14: B | B14: Barren Planet | D14: 2 | E14: -2
A15: B | B15: Desolate Moon | D15: 3 | E15: -3
A16: B | B16: Barren Planet | D16: 2 | E16: -2
A17: B | B17: Barren Planet | D17: 2 | E17: -2
A18: B | B18: Ragnar Anchorage | D18: 1 | E18: 0 | G18: Admiral may repair up to 3 Vipers and 1 Raptor (damaged or destroyed ships).
A19: B | B19: Remote Planet | D19: 2 | E19: -1 | F19: Raptor -1
A20: B | B20: Deep Space | D20: 2 | E20: -1 | F20: Morale -1
A21: B | B21: Tylium Planet | D21: 1 | E21: -1 | G21: Admiral may risk 1 Raptor: Roll 1-2 lose Raptor; 3-8 +2 fuel.
A22: B | B22: Asteroid Field | D22: 3 | E22: -2 | F22: Civilian -1
A23: B | B23: Deep Space | D23: 2 | E23: -1 | F23: Morale -1
A24: B | B24: Cylon Refinery | D24: 2 | E24: -1 | G24: Admiral may risk 2 Vipers: Roll 1-5 damage 2 Vipers; 6-8 +2 fuel.
A25: B | B25: Remote Planet | D25: 2 | E25: -1 | F25: Raptor -1
A26: B | B26: Barren Planet | D26: 2 | E26: -2
A27: B | B27: Deep Space | D27: 2 | E27: -1 | F27: Morale -1
A28: B | B28: Icy Moon | D28: 1 | E28: -1 | G28: Admiral may risk 1 Raptor: Roll 1-2 lose Raptor; 3-8 +1 Food
A29: B | B29: Icy Moon | D29: 1 | E29: -1 | G29: Admiral may risk 1 Raptor: Roll 1-2 lose Raptor; 3-8 +1 Food
A30: B | B30: Remote Planet | D30: 2 | E30: -1 | F30: Raptor -1
A31: BX | B31: Legendary Discovery | D31: 1 | G31: Pass the Skill Check to increase Distance by 1.
A32: P | B32: Misjump | D32: 0 | E32: 0 | F32: Civilian -1 | G32: Then discard this dest and draw a new one to resolve
A33: P | B33: Mining Asteroid | D33: 2 | E33: -1 | F33: Vipers +2 | G33: Search for and immediately resolve "Scar" card. Shuffle Crisis deck
A34: P | B34: Gas Cloud | D34: 1 | E34: 0 | G34: Admiral looks at top 3 Crisis Cards, then places them on the top or bottom in any order
A35: P | B35: A Civilian Convoy | D35: 3 | E35: -3 | F35: Population +1 | G35: Admiral may lose 1 morale for +1 fuel
A36: P | B36: Binary Star | D36: 2 | E36: -1 | F36: Deploy: Civ (1), Civ (4)
A37: R | B37: The Hub | D37: 1 | E37: -1 | G37: Destroy 1 Viper. For the remainder of the game, Cylons may not play Skill Cards into Skill Checks on Super Crisis cards.
A38: R | B38: Stay And Fight | D38: 0 | E38: 0 | G38: CAG may Activate up to 4 unmanned Vipers and escort up to 2 Civilians. Move all Cylon Ships from the Cylon Fleet Board to the Main Game Board and reset the Pursuit Track. Set the Jump Prep track to the first Blue space. Gain 1 Morale.
A39: E | B39: Lion's Head Nebula | D39: 3 | E39: -4 | G39: After the Reset Jump Preparation Track step of this jump, advance the Jump Prep Track by 2.
A40: E | B40: Derelict Basestar | D40: 2 | E40: -1 | F40: Deploy: B(1), Civ(2x4) | G40: Damage the basestar once.
A41: E | B41: Algae Planet | D41: 1 | E41: -1 | F41: Food +1
A42: E | B42: Cylon Raiders | D42: 3 | E42: -2 | F42: Deploy: R(3x4)
A43: RX | B43: Frak Earth | D43: -1 | G43: Fail the Skill Check to decrease Distance by 1.
A44: RX | B44: The Road Less Traveled | D44: 1 | G44: Pass the Skill Check to increase Distance by 1.
A45: E | B45: Gas Giant | D45: 1 | E45: 0 | G45: Admiral may destroy 1 Viper to gain 1 Fuel
A46: R | B46: Comet at a Gas Giant | D46: 2 | E46: -2 | G46: All players (including revealed Cylons) must shuffle a card from their hand into the Destiny deck.
A47: E | B47: Radioactive Cloud | D47: 2 | E47: -1 | F47: Population -1
A48: E | B48: Dying Star | D48: 2 | E48: -1 | G48: Damage Galactica once.
A49: R | B49: Home of the Thirteenth | D49: 3 | E49: -2 | F49: Morale -1 | G49: Lose 1 Food. Every player draws 2 Faith Skill cards.
A50: R | B50: Site of a Battle | D50: 1 | E50: -1 | F50: Raptor -1 | G50: Gain 1 Morale.

Sheet: Ships
B3: VIPERS Mark II | I3: RAIDERS | N3: SHIPS BY SECTOR
A4: 15 | C4: Reserves | D4: Sector | E4: Pilot | F4: Damaged | G4: Destroyed | J4: Off Board | K4: Sector | L4: Cylon Fleet | O4: 1 | P4: 2 | Q4: 3 | R4: 4 | S4: 5 | T4: 6
B5: Viper 1 | F5: X | I5: Raider 1 | K5: 2 | N5: Vipers | O5: of:=COUNTIF([.$D$5:.$D$12];[.O4]) -> 0 | P5: of:=COUNTIF([.$D$5:.$D$12];[.P4]) -> 0 | Q5: of:=COUNTIF([.$D$5:.$D$12];[.Q4]) -> 0 | R5: of:=COUNTIF([.$D$5:.$D$12];[.R4]) -> 0 | S5: of:=COUNTIF([.$D$5:.$D$12];[.S4]) -> 0 | T5: of:=COUNTIF([.$D$5:.$D$12];[.T4]) -> 0
B6: Viper 2 | F6: X | I6: Raider 2 | K6: 2 | N6: Vipers MkVII | O6: of:=COUNTIF([.$D$17:.$D$20];[.O4]) -> 0 | P6: of:=COUNTIF([.$D$17:.$D$20];[.P4]) -> 0 | Q6: of:=COUNTIF([.$D$17:.$D$20];[.Q4]) -> 0 | R6: of:=COUNTIF([.$D$17:.$D$20];[.R4]) -> 0 | S6: of:=COUNTIF([.$D$17:.$D$20];[.S4]) -> 0 | T6: of:=COUNTIF([.$D$17:.$D$20];[.T4]) -> 0
B7: Viper 3 | F7: X | I7: Raider 3 | K7: 2 | N7: Assault Raptors | O7: of:=COUNTIF([.$D$51:.$D$54];[.O4]) -> 0 | P7: of:=COUNTIF([.$D$51:.$D$54];[.P4]) -> 0 | Q7: of:=COUNTIF([.$D$51:.$D$54];[.Q4]) -> 0 | R7: of:=COUNTIF([.$D$51:.$D$54];[.R4]) -> 0 | S7: of:=COUNTIF([.$D$51:.$D$54];[.S4]) -> 0 | T7: of:=COUNTIF([.$D$51:.$D$54];[.T4]) -> 0
B8: Viper 4 | F8: X | I8: Raider 4 | J8: X | N8: Civilians | O8: of:=COUNTIF([.$E$25:.$E$36];[.O4]) -> 0 | P8: of:=COUNTIF([.$E$25:.$E$36];[.P4]) -> 0 | Q8: of:=COUNTIF([.$E$25:.$E$36];[.Q4]) -> 0 | R8: of:=COUNTIF([.$E$25:.$E$36];[.R4]) -> 3 | S8: of:=COUNTIF([.$E$25:.$E$36];[.S4]) -> 0 | T8: of:=COUNTIF([.$E$25:.$E$36];[.T4]) -> 0
B9: Viper 5 | F9: X | I9: Raider 5 | J9: X | N9: Basestars | O9: of:=COUNTIF([.$K$37:.$K$38];[.O$4]) -> 1 | P9: of:=COUNTIF([.$K$37:.$K$38];[.P4]) -> 0 | Q9: of:=COUNTIF([.$K$37:.$K$38];[.Q4]) -> 0 | R9: of:=COUNTIF([.$K$37:.$K$38];[.R4]) -> 0 | S9: of:=COUNTIF([.$K$37:.$K$38];[.S4]) -> 0 | T9: of:=COUNTIF([.$K$37:.$K$38];[.T4]) -> 0
B10: Viper 6 | F10: X | I10: Raider 6 | J10: X | N10: Raiders | O10: of:=COUNTIF([.$K$5:.$K$24];[.O4]) -> 0 | P10: of:=COUNTIF([.$K$5:.$K$24];[.P4]) -> 3 | Q10: of:=COUNTIF([.$K$5:.$K$24];[.Q4]) -> 0 | R10: of:=COUNTIF([.$K$5:.$K$24];[.R4]) -> 0 | S10: of:=COUNTIF([.$K$5:.$K$24];[.S4]) -> 0 | T10: of:=COUNTIF([.$K$5:.$K$24];[.T4]) -> 0
B11: Viper 7 | F11: X | I11: Raider 7 | J11: X | N11: Heavy Raiders | O11: of:=COUNTIF([.$K$29:.$K$32];[.O$4]) -> 0 | P11: of:=COUNTIF([.$K$29:.$K$32];[.P4]) -> 0 | Q11: of:=COUNTIF([.$K$29:.$K$32];[.Q4]) -> 0 | R11: of:=COUNTIF([.$K$29:.$K$32];[.R4]) -> 0 | S11: of:=COUNTIF([.$K$29:.$K$32];[.S4]) -> 0 | T11: of:=COUNTIF([.$K$29:.$K$32];[.T4]) -> 0
B12: Viper 8 | G12: X | I12: Raider 8 | J12: X | N12: Basestars (Fleet) | O12: of:=COUNTIF([.$L$37:.$L$38];[.O$4]) -> 0 | P12: of:=COUNTIF([.$L$37:.$L$38];[.P$4]) -> 0 | Q12: of:=COUNTIF([.$L$37:.$L$38];[.Q$4]) -> 0 | R12: of:=COUNTIF([.$L$37:.$L$38];[.R$4]) -> 0 | S12: of:=COUNTIF([.$L$37:.$L$38];[.S$4]) -> 0 | T12: of:=COUNTIF([.$L$37:.$L$38];[.T$4]) -> 0
C13: of:=COUNTIF([.C5:.C12];"X") -> 0 | D13: of:=COUNTIF([.D5:.D12];">0") -> 0 | F13: of:=COUNTIF([.F5:.F12];"X") -> 7 | G13: of:=COUNTIF([.G5:.G12];"X") -> 1 | I13: Raider 9 | J13: X | N13: Raiders (Fleet) | O13: of:=COUNTIF([.$L$5:.$L$24];[.O$4]) -> 0 | P13: of:=COUNTIF([.$L$5:.$L$24];[.P$4]) -> 0 | Q13: of:=COUNTIF([.$L$5:.$L$24];[.Q$4]) -> 0 | R13: of:=COUNTIF([.$L$5:.$L$24];[.R$4]) -> 0 | S13: of:=COUNTIF([.$L$5:.$L$24];[.S$4]) -> 0 | T13: of:=COUNTIF([.$L$5:.$L$24];[.T$4]) -> 0
I14: Raider 10 | J14: X | N14: Heavies (Fleet) | O14: of:=COUNTIF([.$L$29:.$L$32];[.O$4]) -> 0 | P14: of:=COUNTIF([.$L$29:.$L$32];[.P$4]) -> 0 | Q14: of:=COUNTIF([.$L$29:.$L$32];[.Q$4]) -> 0 | R14: of:=COUNTIF([.$L$29:.$L$32];[.R$4]) -> 0 | S14: of:=COUNTIF([.$L$29:.$L$32];[.S$4]) -> 0 | T14: of:=COUNTIF([.$L$29:.$L$32];[.T$4]) -> 0
B15: VIPERS Mark VII | I15: Raider 11 | J15: X | N15: Centurions | O15: of:=COUNTIF([.$R$29:.$R$32];[.O4]) -> 3 | P15: of:=COUNTIF([.$R$29:.$R$32];[.P4]) -> 0 | Q15: of:=COUNTIF([.$R$29:.$R$32];[.Q4]) -> 0 | R15: of:=COUNTIF([.$R$29:.$R$32];[.R4]) -> 0
C16: Reserves | D16: Sector | E16: Pilot | F16: Damaged | G16: Destroyed | I16: Raider 12 | J16: X | N16: Occ Forces | O16: of:=COUNTIF([.$R$22:.$R$25];[.O4]) -> 0 | P16: of:=COUNTIF([.$R$22:.$R$25];[.P4]) -> 0 | Q16: of:=COUNTIF([.$R$22:.$R$25];[.Q4]) -> 0
B17: Viper Mark VII 1 | I17: Raider 13 | J17: X
A18: Locked | B18: Viper Mark VII 2 | I18: Raider 14 | J18: X | N18: SCAR | O18: 0
A19: Locked | B19: Viper Mark VII 3 | I19: Raider 15 | J19: X
A20: Locked | B20: Viper Mark VII 4 | I20: Raider 16 | J20: X | N20: Occupation Forces
A21: Locked | C21: of:=COUNTIF([.C17:.C20];"X") -> 0 | D21: of:=COUNTIF([.D17:.D20];">0") -> 0 | F21: of:=COUNTIF([.F17:.F20];"X") -> 0 | G21: of:=COUNTIF([.G17:.G20];"X") -> 0 | I21: Raider 17 | O21: Off Board | R21: Track
A22: Locked | I22: Raider 18 | N22: Occ Force 1
A23: Locked | B23: CIVILIANS | I23: Raider 19 | N23: Occ Force 2
A24: Locked | C24: Resource | D24: Off Board | E24: Sector | F24: Destroyed | G24: On NC | I24: Raider 20 | N24: Occ Force 3
A25: Locked | B25: Civilian A | C25: 08 - 1 Pop | F25: X | J25: of:=COUNTIF([.J5:.J24];"X") -> 13 | K25: of:=COUNTIF([.K5:.K24];"X") -> 0 | L25: of:=COUNTIF([.L5:.L24];"X") -> 0 | N25: Occ Force 4
A26: Locked | B26: Civilian B | C26: 09 - 2 Pop | F26: X
A27: Locked | B27: Civilian C | C27: 04 - 1 Pop | F27: X | I27: HEAVY RAIDERS | N27: CENTURIONS
A28: Locked | B28: Civilian D | C28: 03 - 1 Pop | E28: 4 | J28: Off Board | K28: Sector | L28: Cylon Fleet | O28: Off Board | R28: Track
A29: 2 | B29: Civilian E | C29: 05 - 1 Pop | E29: 4 | I29: Heavy 1 | J29: X | N29: Centurion 1 | R29: 1
B30: Civilian F | C30: 10 - 2 Pop | E30: 4 | I30: Heavy 2 | J30: X | N30: Centurion 2 | R30: 1
B31: Civilian G | C31: 11 - Pop/Fuel | D31: X | I31: Heavy 3 | J31: X | N31: Centurion 3 | R31: 1
B32: Civilian H | C32: 12 - Pop/Mor | D32: X | I32: Heavy 4 | J32: X | N32: Centurion 4 | O32: X
B33: Civilian I | C33: 01 Decoy | D33: X | J33: of:=COUNTIF([.J29:.J32];"X") -> 4 | K33: of:=COUNTIF([.K29:.K32];"X") -> 0 | L33: of:=COUNTIF([.L29:.L32];"X") -> 0
B34: Civilian J | C34: 02 Decoy | D34: X
B35: Civilian K | C35: 07 - 1 Pop | D35: X | I35: BASESTARS
B36: Civilian L | C36: 06 - 1 Pop | D36: X | J36: Off Board | K36: Sector | L36: Cylon Fleet | M36: Damage
D37: of:=12-COUNTBLANK([.D25:.D36]) -> 6 | E37: of:=COUNTIF([.E$25:.E$36];">0") -> 3 | F37: of:=COUNTIF([.F$25:.F$36];">0") -> 0 | G37: of:=COUNTIF([.G$25:.G$36];">0") -> 0 | I37: Basestar 1 | K37: 1
G38: of:=COUNTIF([Ships.G25:.G36];"Prepped") -> 0 | I38: Basestar 2 | J38: X
G39: of:=COUNTIF([Ships.G25:.G36];"Locked") -> 0
B40: RAPTORS | I40: BASESTAR DAMAGE | J40: X
C41: Reserves | D41: Destroyed | I41: Type
B42: Raptor 1 | D42: X | I42: Structural Damage
B43: Raptor 2 | D43: X | I43: Weapons Disabled
B44: Raptor 3 | D44: X | I44: Hangar Disabled
B45: Raptor 4 | C45: X | I45: Critical Hit - 2
C46: of:=COUNTIF([.C42:.C45];"X") -> 1 | I46: Damage to Personnel
I47: Collateral Damage
B49: ASSAULT RAPTORS
C50: Reserves | D50: Sector | E50: Pilot | F50: Destroyed
B51: Assault Raptor 1 | F51: X
B52: Assault Raptor 2 | F52: X
B53: Assault Raptor 3 | F53: X
B54: Assault Raptor 4 | F54: X
C55: of:=COUNTIF([.C51:.C54];"<>") -> 0 | D55: of:=COUNTIF([.D51:.D54];"<>") -> 0 | E55: of:=COUNTIF([.E51:.E54];"<>") -> 0 | F55: of:=COUNTIF([.F51:.F54];"<>") -> 4

Sheet: Ionian Nebula
A1: Player | B1: Benevolent | C1: Antagonistic
A2: of:=['Game State'.E3] -> Gaius | B2: 0 | C2: 0 | D2: Player | E2: Target
A3: of:=['Game State'.E4] -> Athena | B3: 0 | C3: 0
A4: of:=['Game State'.E5] -> Lee | B4: 0 | C4: 0
A5: of:=['Game State'.E6] -> Tom | B5: 0 | C5: 0
A6: of:=['Game State'.E7] -> Karl | B6: 0 | C6: 0
A7: of:=['Game State'.E8] -> Cottle | B7: 0 | C7: 0
A8: of:=['Game State'.E9] -> 0 | B8: 0 | C8: 0
A10: Disaster | B10: Benevolent | C10: Antagonistic
A11: LOCATIONS | B11: Benevolent | C11: Antagonistic
B12: X | D12: <---Brig
C13: X | D13: <---Sickbay
A15: TRAUMA TOKEN POOL
A16: of:=COUNTIF([.$G$20:.$G$57]; "=Disaster") -> 2 | B16: of:=COUNTIF([.$G$20:.$G$57]; "=Benevolent") -> 18 | C16: of:=COUNTIF([.$G$20:.$G$57]; "=Antagonistic") -> 18
A18: ALLIES | G18: TRAUMA POOL
A19: Name | B19: Location | C19: In The Box | D19: Benevolent | E19: Antagonistic
A20: William Adama | B20: Admiral's Quarters | D20: Veteran Commander: Draw 3 Leadership Skill Cards. | E20: No Man Left Behind: Decrease the Jump Preparation track by 1. | G20: Antagonistic
A21: Lee Apollo Adama | B21: Hangar Deck | D21: Inspirational Pilot: Each unmanned viper may destroy a raider in its current space area. | E21: Under Too Much Pressure: Activate: Basestars launch. | G21: Antagonistic
A22: Karl Helo Agathon | B22: Weapons Control | D22: Devoted Officer: Draw 3 Tactics Skill Cards. | E22: Unpopular Decisions: Roll a die. On a 4 or lower, lose 1 morale. | G22: Antagonistic
A23: Gaius Baltar | B23: Research Lab | D23: Brilliant Scientist: You may look at 1 random Loyalty Card belonging to any player. | E23: Odd Behavior: If distance is 7 or less, shuffle 1 "You Are Not a Cylon" card into the Loyalty deck. Then draw 1 Loyalty Card. Otherwise, no effect. | G23: Benevolent
A24: Diana Hardball Seelix | B24: Armory | D24: Avionics Specialist: Move 3 vipers from the "Damaged Vipers" box to the "Reserves". | E24: Unforgiving: You are sent to "Sickbay". | G24: Benevolent
A25: Kendra Shaw | B25: Weapons Control | D25: Razor: You may lose 1 morale to gain either 1 fuel or 1 food. | E25: Went Too Far: Draw a civilian ship to destroy. | G25: Benevolent
A26: Callandra Cally Tyrol | B26: Hangar Deck | D26: Gifted Deckhand: Draw 3 Engineering Skill Cards | E26: Mood Swings: Roll a die. On a 4 or lower, lose 1 morale. | G26: Disaster
A27: Simon O'Neill | B27: Sickbay | D27: Cylon Medic: Draw 2 Skill Cards of any type (they may be from outside your skill set). Then move to any location. | E27: Experimental Procedures: Draw 2 trauma tokens. Then move to any location. | G27: Benevolent
A28: Helena Cain | B28: Command | D28: Uncompromising: You may choose another character to be executed. | E28: No Room for Mistakes: The Admiral is sent to the "Brig". | G28: Benevolent
A29: Samuel T. Anders | B29: Armory | D29: Athlete: Move all centurion tokens on the boarding party track one space towards the "Start" space. | E29: Rookie Pilot: Choose two unmanned vipers in space areas to move to the "Damaged Vipers" box. | G29: Antagonistic
A30: Felix Gaeta | B30: FTL Control | D30: Tactical Officer: Advance the Jump Preparation track by 1. | E30: Consumed with Bitterness: Draw 2 trauma tokens or discard 3 Skill Cards. | G30: Antagonistic
A31: Louanne Kat Katraine | B31: Hangar Deck | D31: Hotshot Pilot: Draw 3 Piloting Skill Cards. | E31: Stim Addiction: Discard 3 Skill Cards. | G31: Benevolent
A32: Tory Foster | B32: Press Room | D32: Political Strategist: Draw 3 Politics Skill Cards. | E32: Questionable Ethics: Discard 2 random Skill Cards. | G32: Antagonistic
A33: Sharon Boomer Valerii | B33: Armory | D33: Talented Raptor Pilot: Gain 1 food. | E33: Botched Landings: Damage Galactica. | G33: Antagonistic
A34: Laura Roslin | B34: President's Office | D34: Gifted Leader: Discard 2 trauma tokens. | E34: Debilitating Illness: Draw 2 trauma tokens. | G34: Antagonistic
A35: Louis Hoshi | B35: Communications | D35: Communications Officer: Choose 1 civilian ship in a space area to shuffle back into the pile of unused civilian ships. | E35: Emotionally Compromised: Activate: Basestars fire | G35: Antagonistic
A36: Brother Cavil | B36: Research Lab | D36: Unconventional Counselor: Choose 1 trauma token to discard. Then choose a second trauma token at random to discard. | E36: Primary Cylon: Place a Basestar and 3 raiders in front of Galactica. Place 1 civilian ship behind Galactica. | G36: Benevolent
A37: Saul Tigh | B37: Command | D37: Executive Officer You may choose another character to send to the "Brig". | E37: Heavy-handed: You are sent to the "Brig". | G37: Benevolent
A38: Dr. Sherman Cottle | B38: Sickbay | D38: Expert Surgeon: Discard 3 of your trauma tokens and then move to any location. | E38: Chain Smoker: Discard 3 Skill Cards, then move to any location. | G38: Benevolent
A39: Ellen Tigh | B39: Admiral's Quarters | D39: Savvy Manipulator: You may choose any human player to receive either the President or the Admiral title. | E39: Bad Influence: You are sent to the "Brig". | G39: Benevolent
A40: Priestess Elosha | B40: President's Office | D40: Religious Leader: Look at the top card of the Crisis deck, and place it on the top or bottom of the deck. | E40: Crisis of Faith: Draw 2 trauma tokens. | G40: Antagonistic
A41: Alex Crashdown Quartararo | B41: Armory | D41: Loyal ECO: Look at the top card of the Destination deck, and place it on the top or bottom of the deck. | E41: Inexperienced Leader: Roll a die. On a 4 or lower, lose 1 population. | G41: Benevolent
A42: Anastasia Dee Dualla | B42: Communications | D42: CIC Officer: Look at every civilian ship on the game board and then may move any number of them to adjacent areas. | E42: Despondent: Draw 2 trauma tokens. | G42: Benevolent
A43: Billy Keikeya | B43: Administration | D43: Populist Politician: Gain 1 morale. | E43: Jealous Nature: Draw 1 trauma token and discard 1 random Skill Card. | G43: Benevolent
A44: Brendan Hot Dog Costanza | B44: Weapons Control | D44: Fearless Pilot: Choose 1 space area on the main game board and destroy 2 raiders in that area. | E44: Troublemaker: Roll a die. On a 4 or less, lose 1 morale. | G44: Disaster
A45: Margaret Racetrack Edmondson | B45: Weapons Control | D45: Gifted Raptor Pilot: Gain 1 fuel. | E45: Kill Them All: Draw 1 trauma token and discard 1 random Skill Card. | G45: Antagonistic
A46: Caprica Six | B46: Brig | D46: Cooperative Cylon Prisoner: Advance the Jump Preparation track by 1. | E46: Delusional: Discard 3 random Skill Cards and then draw the top 2 cards of the Destiny deck and add them to your hand of Skill Cards. | G46: Antagonistic
A47: Chief Galen Tyrol | B47: Hangar Deck | D47: Senior Chief Petty Officer: Repair up to 2 locations on Galactica or up to 4 unmanned vipers. | E47: Depression and Anger: You are sent to "Sickbay". | G47: Antagonistic
A48: Aaron Kelly | B48: Command | D48: Landing Signal Officer: Activate up to 4 unmanned vipers. | E48: Extreme Measures: Damage Galactica. | G48: Antagonistic
A49: Leoben Conoy | B49: Communications | D49: Tuned In: Choose 1 space area on the main game board and destroy all Cylon ships from that area. | E49: Unstable Cylon: Draw 2 trauma tokens. | G49: Benevolent
A50: Aaron Doral | B50: Administration | D50: Bureaucrat: Draw 3 Quorum Cards, choose 1 to resolve and place the rest on the bottom of the deck (even if you are not President). | E50: Calculating Cylon: Damage Galactica. | G50: Benevolent
A51: Romo Lampkin | B51: Brig | D51: Clever Lawyer: Move out of the "Brig" to any location. | E51: Kleptomaniac: Discard all of your skill cards. | G51: Antagonistic
A52: D'Anna Biers | B52: Press Room | D52: Investigative Journalist: Gain 1 morale. | E52: Opportunistic Cylon: Draw 2 trauma tokens or discard 3 Skill Cards. | G52: Antagonistic
A53: Tom Zarek | B53: Administration | D53: Resourceful: You may lose 1 population to gain 1 of any other resource type. | E53: Dubious Associations: You are sent to the "Brig". | G53: Benevolent
A54: Kara Starbuck Thrace | B54: Hangar Deck | D54: Skilled Pilot: Choose 1 unmanned viper to activate 4 times. | E54: Risky Maneuvers: Activate: Raiders | G54: Antagonistic
A55: of:=COUNTIF([.C20:.C54];"<>") -> 0 | G55: Benevolent
G56: Antagonistic
A57: CROSSROADS | G57: Benevolent
A58: Card | B58: Player | C58: Token | D58: Benevolent | E58: Antagonistic | G58: of:=COUNTIF([.$G$20:.$G$57]; "<>") -> 38
A59: Perjury | D59: Gain Sympathy: You must discard 2 random Skill Cards and may then discard 2 trauma tokens. | E59: Cast Aspersions: You must draw 2 trauma tokens and may then draw 2 Skill Cards
A60: Scanned | D60: Order a Retreat: Remove 4 raiders of your choosing from the main game board. Lose 1 morale. | E60: Order an Attack: Activate all raiders on the main game board and increase the Jump Preparation track by 1.
A61: Strange Music | D61: Nothing But Static: You must choose a player and look at all of his Loyalty Cards. Then discard 1 trauma token. | E61: I Hear It: Shuffle 1 You Are Not a Cylon" card into the Loyalty deck. Then choose a human player to draw 1 Loyalty Card. Each Cylon player draws a trauma token.
A62: Testimony | D62: Forgiven: Choose another player. That player discards 2 random Skill Cards and may discard 2 trauma tokens. | E62: Scapegoat: Choose another player. That player draws 2 Skill Cards and must draw 2 trauma tokens.
A63: The Opera House | D63: The Opera House Revealed: Draw 3 trauma tokens. Then choose another player to also draw 3 trauma tokens. | E63: The Door is Shut: There is no effect.
A64: Disturbing Vision | D64: It Wasn't Real: Discard 2 trauma tokens and 2 random Skill Cards. | E64: What Have You Done?: Each Cylon player draws 2 trauma tokens. Then the Admiral is immediately Executed.
A65: Miraculous Return | D65: I Believe: +1 morale. If any vipers have been destroyed, move 1 destroyed viper to the Reserves". Then activate raiders twice. | E65: It's a Trick: -1 morale. Draw a civilian ship to destroy. Then choose one basestar on the main game board and damage it.

Sheet: Mutiny
B2: Select a Player | D2: Select a Mutiny Card
B3: of:=COUNTIF([.$C$13:.$C$34];"="&['Game State'.$E3]) -> 0
B4: of:=COUNTIF([.$C$13:.$C$34];"="&['Game State'.$E4]) -> 0
B5: of:=COUNTIF([.$C$13:.$C$34];"="&['Game State'.$E5]) -> 0
B6: of:=COUNTIF([.$C$13:.$C$34];"="&['Game State'.$E6]) -> 0
B7: of:=COUNTIF([.$C$13:.$C$34];"="&['Game State'.$E7]) -> 0 | E7: 7
B8: of:=COUNTIF([.$C$13:.$C$34];"="&['Game State'.$E8]) -> 0
B9: of:=COUNTIF([.$C$13:.$C$34];"="&['Game State'.$E9]) -> 0
A11: Type | B11: Deck | C11: In Hand | D11: Discard | E11: Removed | F11: Description
B12: of:=COUNTIF([.B13:.B34];"<>") - COUNTIF([.C13:.C34];"<>") -> 15 | D12: of:=COUNTIF([.D13:.D34];"<>") -> 5 | E12: of:=COUNTIF([.E13:.E34];"<>") -> 2
A13: D | B13: Clipped Wings | F13: Action: Return all Vipers in Space Areas to the Reserves and repair all damaged Vipers. Then, draw 2 Treachery cards and discard this card. You cannot play this card unless there is at least 1 Viper in a Space Area.
A14: D | B14: Scavenging for Parts | F14: Action: Damage Galactica and, if possible, choose 1 Civilian ship in a Space Area. Shuffle that ship into the pile of unused Civilian ships. Then, discard this card.
A15: D | B15: Weapons Armed | F15: Action: Destroy a Raptor to gain an Assault Raptor. Then, launch 2 Raiders from each Basestar and discard this card. You cannot play this card if there are no Raptors in the Reserves.
A16: D | B16: Armed Resistance | F16: Action: Send the Admiral to "Sickbay" and look at the top card of the Crisis Deck. Place that card on the top or bottom of the deck, and discard this card.
A17: D | B17: Peaceful Resistance | F17: Action: Move to "Sickbay" and roll a die. On a result of 4 or less, send the Admiral to the Brig. Then, discard this card.
A18: D | B18: Violent Protest | F18: Action: Draw 2 Politics Cards and send the President to "Sickbay". Then, discard this card.
A19: D | B19: Impeachment | F19: Action: Discard 5 Skill Cards to take the President Title. Then, discard this card. You cannot play this card if you do not have 5 or more Skill Cards or you already hold the President Title.
A20: D | B20: Make a Deal | F20: Action: Choose a character in the Brig and move him to any Location on Galactica. Then, discard this card and choose a player to draw a Mutiny card.
A21: R | B21: Unauthorized Usage | F21: Action: Launch 1 Nuke at a Basestar. Then remove this card and all nuke tokens from the game. You cannot play this card if the Admiral has no nuke tokens.
A22: R | B22: Feed the People | F22: Action: Decrease the Jump Preparation track by 2 and gain 1 Food. Then, remove this card from the game.
A23: D | B23: Assume Command | F23: Action: Discard 5 Skill Cards to take the Admiral Title. Then, discard this card. You cannot play this card if you do not have 5 or more Skill Cards, you already hold the Admiral Title, or you are in the Brig.
A24: D | B24: Panic | F24: Action: Place 1 Civilian Ship behind Galactica. Then, Activate 1 Unmanned Viper, if possible, and discard this card.
A25: D | B25: Selfish Act | F25: Action: Draw 2 Skill Cards. Discard this card and then draw another Mutiny Card.
A26: R | B26: Controversial Speech | F26: Action: Roll a die. If the result is 6 or higher, gain 1 Morale and remove this card from the game. Otherwise, discard this card and each player, including Cylon Players, draws 1 Treachery Skill Card.
A27: D | B27: Betrayal of Trust | F27: Action: Draw 2 Treachery Cards. Then, look at the top card of the Destination Deck and place it on the top or bottom of the deck. Finally, discard this card.
A28: D | D28: Ruined Reputation | F28: Action: Choose one Human Player to draw 2 Skill Cards (they may be from outside his Skill Set). Then, roll a die. On a result of 4 or less, send that Player to the "Brig." Then, discard this card.
A29: D | D29: Set the Agenda | F29: Action: The President draws 2 Quorum Cards. Look at his Quorum cards and choose two cards. Place them on the bottom of the Quorum deck in any order. Then, discard this card. You cannot play this card if you are the President.
A30: D | D30: Bait and Switch | F30: Action: Draw 2 Skill Cards (they may be from outside your Skill Set). Then, shuffle 2 Treachery cards into the Destiny deck and discard this card.
A31: D | D31: Send a Message | F31: Action: Damage Galactica and, if possible, attack a Centurion on the Boarding Party Track, adding 2 to the die result. Then, discard this card.
A32: D | D32: Blackmail | F32: Action: Take 3 random Skill Cards from the President. Then, discard this card. You cannot play this card if you are the President or if the President has 2 or fewer Skill Cards.
A33: R | E33: The Strong Survive | F33: Action: Draw a Civilian Ship to destroy. Then, increase the Jump Preparation track by 1 and remove this card from the game.
A34: R | E34: Necessary Risk | F34: Action: Increase Food by 1. Then, choose a Space Area and place 1 Basestar and 3 Raiders in that area. Finally, remove this card from the game.

Sheet: Loyalty
B1: of:=['Game State'.B3] -> Shadowed | C1: of:=['Game State'.B4] -> Karantor | D1: of:=['Game State'.B5] -> Zoronos | E1: of:=['Game State'.B6] -> Tymber | F1: of:=['Game State'.B7] -> Simmons | G1: of:=['Game State'.B8] -> Masnie | H1: of:=['Game State'.B9] -> 0
B2: of:=['Game State'.E3] -> Gaius | C2: of:=['Game State'.E4] -> Athena | D2: of:=['Game State'.E5] -> Lee | E2: of:=['Game State'.E6] -> Tom | F2: of:=['Game State'.E7] -> Karl | G2: of:=['Game State'.E8] -> Cottle | H2: of:=['Game State'.E9] -> 0
A3: Agenda
A4: Start of Game | B4: You are a Cylon Can Send a Character to the Brig | C4: Human Allegiance: End the Chase | D4: You are NOT a Cylon | E4: You are a Cylon Can Damage Galactica | F4: You are NOT a Cylon | G4: You are NOT a Cylon
C5: Human Allegiance: Remove the Threat
A6: Sleeper Phase | C6: Cylon Allegiance: A False Sense of Security | D6: You are NOT a Cylon | F6: You are NOT a Cylon | G6: You are NOT a Cylon
C7: Human Allegiance: Keep them Docile
A8: Other | F8: You are NOT a Cylon
F9: You are NOT a Cylon
A14: Card Count | B14: 0 | C14: 3 | D14: 2 | E14: 0 | F14: 4 | G14: 2 | H14: 0
B15: Background Color Key | C15: White: In Hand or Will Be | D15: Grey: Discarded | E15: Blue Gray: Placeholder
B17: Loyalty Deck | C17: Exodus: You are NOT a Cylon Deck
E18: 0

Sheet: Game Log
A1: Turn | B1: Action | C1: Turn | D1: Index | F1: BURIED CARDS
A2: 1.1 | B2: ************************************ | C2: 1.1 | D2: 1 | F2: Destination | H2: Crisis
A3: 1.1 | B3: Game Commences: Turn 1.1 | C3: 1.2 | D3: 38 | F3: Turn | G3: Name | H3: Turn | I3: Name
A4: 1.1 | B4: Athena receives [color=green]4 - Declare Emergency[/color] | C4: 1.3 | D4: 60 | F4: 2.2 | G4: Barren Planet | H4: 3.3 | I4: Cylon Swarm
A5: 1.1 | B5: Athena receives [color=green]2 - Executive Order[/color] | C5: 1.4 | D5: 86 | F5: 3.6 | G5: Deep Space | H5: 5.1 | I5: Quorum in Uproar
A6: 1.1 | B6: Athena receives [color=red]1 - Evasive Maneuvers[/color] | C6: 1.5 | D6: 127 | F6: 3.6 | G6: Icy Moon | H6: 5.6 | I6: Resistance
A7: 1.1 | B7: Lee receives [color=green]1 - Executive Order[/color] | C7: 1.6 | D7: 148 | F7: 5.2 | G7: Icy Moon | H7: 7.1 | I7: Water Shortage (B)
A8: 1.1 | B8: Lee receives [color=green]4 - Restore Order[/color] | C8: 2.1 | D8: 184 | F8: 6.6 | G8: Remote Planet | H8: 7.2 | I8: An Ambitious Operation
A9: 1.1 | B9: Lee receives [color=purple]3 - Strategic Planning[/color] | C9: 2.2 | D9: 199
A10: 1.1 | B10: Tom receives [color=orange]2 - Consolidate Power[/color] | C10: 2.3 | D10: 227
A11: 1.1 | B11: Tom receives [color=green]3 - Declare Emergency[/color] | C11: 2.4 | D11: 259
A12: 1.1 | B12: Tom receives [color=purple]3 - Strategic Planning[/color] | C12: 2.5 | D12: 286
A13: 1.1 | B13: Karl receives [color=purple]2 - Launch Scout[/color] | C13: 2.6 | D13: 303
A14: 1.1 | B14: Karl receives [color=purple]1 - Launch Scout[/color] | C14: 3.1 | D14: 377
A15: 1.1 | B15: Karl receives [color=red]1 - Evasive Maneuvers[/color] | C15: 3.2 | D15: 401
A16: 1.1 | B16: Cottle receives [color=purple]1 - Launch Scout[/color] | C16: 3.3 | D16: 416
A17: 1.1 | B17: Cottle receives [color=blue]1 - Repair[/color] | C17: 3.4 | D17: 435
A18: 1.1 | B18: Cottle receives [color=blue]1 - Repair[/color] | C18: 3.5 | D18: 443
A19: 1.1 | B19: Gaius receives [color=orange]0 - Force Their Hand[/color] | C19: 3.6 | D19: 474
A20: 1.1 | B20: Gaius receives [color=orange]2 - Consolidate Power[/color] | C20: 4.1 | D20: 519
A21: 1.1 | B21: Gaius receives [color=green]2 - Executive Order[/color] | C21: 4.2 | D21: 542
A22: 1.1 | B22: Gaius receives [color=green]1 - Executive Order[/color] | C22: 4.3 | D22: 570
A23: 1.1 | B23: Gaius receives [color=blue]4 - Scientific Research[/color] | C23: 4.4 | D23: 593
A24: 1.1 | B24: Mutiny Card: Unauthorized Usage buried. | C24: 4.5 | D24: 599
A25: 1.1 | B25: Gaius moved to Hangar Deck | C25: 4.6 | D25: 612
A26: 1.1 | B26: Athena uses their Once-Per-Game ability. | C26: 5.1 | D26: 632
A27: 1.1 | B27: Gaius gains a Miracle Token! | C27: 5.2 | D27: 645
A28: 1.1 | B28: CRISIS: Unexpected Reunion | C28: 5.3 | D28: 703
A29: 1.1 | B29: Unexpected Reunion: Skill Check Initialized | C29: 5.4 | D29: 741
A30: 1.1 | B30: Destiny played [color=orange]3 - Popular Influence[/color] into skill check. | C30: 5.5 | D30: 765
A31: 1.1 | B31: Destiny played [color=purple]2 - Launch Scout[/color] into skill check. | C31: 5.6 | D31: 794
A32: 1.1 | B32: Lee played [color=green]4 - Restore Order[/color] into crisis. | C32: 6.1 | D32: 812
A33: 1.1 | B33: Tom played [color=orange]2 - Consolidate Power[/color] into crisis. | C33: 6.2 | D33: 821
A34: 1.1 | B34: Gaius played [color=orange]2 - Consolidate Power[/color] into crisis. | C34: 6.3 | D34: 838
A35: 1.1 | B35: Gaius played [color=green]2 - Executive Order[/color] into crisis. | C35: 6.4 | D35: 870
A36: 1.1 | B36: Gaius played [color=green]1 - Executive Order[/color] into crisis. | C36: 6.5 | D36: 881
A37: 1.1 | B37: Raider 1, Raider 2 & Raider 3 MOVED to Sector 2 | C37: 6.6 | D37: 915
A38: 1.1 | B38: ************************************ | C38: 7.1 | D38: 948
A39: 1.2 | B39: ************************************ | C39: 7.2 | D39: 958
A40: 1.2 | B40: Beginning Round 1.2 | C40: 7.3 | D40: 975
A41: 1.2 | B41: Athena receives [color=green]5 - Declare Emergency[/color]
A42: 1.2 | B42: Athena receives [color=red]2 - Evasive Maneuvers[/color]
A43: 1.2 | B43: Athena receives [color=blue]2 - Repair[/color]
A44: 1.2 | B44: Athena moved to Command
A45: 1.2 | B45: Viper 2 MOVED to Sector 5
A46: 1.2 | B46: Viper 2 MOVED to Sector 4
A47: 1.2 | B47: CRISIS: Cylon Tracking Device
A48: 1.2 | B48: Cylon Tracking Device: Skill Check Initialized
A49: 1.2 | B49: Destiny played [color=purple]2 - Launch Scout[/color] into skill check.
A50: 1.2 | B50: Destiny played [color=brown]0 - Dradis Contact[/color] into skill check.
A51: 1.2 | B51: Karl played [color=purple]2 - Launch Scout[/color] into crisis.
A52: 1.2 | B52: Karl played [color=red]1 - Evasive Maneuvers[/color] into crisis.
A53: 1.2 | B53: Cottle played [color=purple]1 - Launch Scout[/color] into crisis.
A54: 1.2 | B54: Cottle played [color=blue]1 - Repair[/color] into crisis.
A55: 1.2 | B55: Gaius played [color=blue]4 - Scientific Research[/color] into crisis.
A56: 1.2 | B56: Athena played [color=blue]2 - Repair[/color] into crisis.
A57: 1.2 | B57: Raider 4 & Raider 5 DEPLOYED in Sector 1
A58: 1.2 | B58: Raider 1, Raider 2 & Raider 3 MOVED to Sector 3
A59: 1.2 | B59: Raider 4 & Raider 5 MOVED to Sector 2
A60: 1.2 | B60: ************************************
A61: 1.3 | B61: ************************************
A62: 1.3 | B62: Beginning Round 1.3
A63: 1.3 | B63: Lee receives [color=green]5 - Change of Plans[/color]
A64: 1.3 | B64: Lee receives [color=green]1 - Executive Order[/color]
A65: 1.3 | B65: Lee receives [color=purple]3 - Strategic Planning[/color]
A66: 1.3 | B66: Lee receives [color=red]2 - Evasive Maneuvers[/color]
A67: 1.3 | B67: Lee receives [color=red]4 - Maximum Firepower[/color]
A68: 1.3 | B68: Athena receives [color=brown]0 - Bait[/color]
A69: 1.3 | B69: Cottle receives [color=green]2 - Executive Order[/color]
A70: 1.3 | B70: Cottle receives [color=green]2 - Executive Order[/color]
A71: 1.3 | B71: Lee receives 2 - Executive Order from Cottle
A72: 1.3 | B72: Lee receives 1 - Repair from Cottle
A73: 1.3 | B73: Cottle receives [color=purple]1 - Launch Scout[/color]
A74: 1.3 | B74: Cottle receives [color=purple]5 - Strategic Planning[/color]
A75: 1.3 | B75: Karl receives 1 - Launch Scout from Cottle
A76: 1.3 | B76: Karl receives 5 - Strategic Planning from Cottle
A77: 1.3 | B77: Lee PLAYED [color=green]1 - Executive Order[/color]
A78: 1.3 | B78: CRISIS: Rescue Caprica Survivors
A79: 1.3 | B79: President Lee receives QUORUM card:Arrest Order
A80: 1.3 | B80: President Lee receives QUORUM card:Assign Mission Specialist
A81: 1.3 | B81: CRISIS: Colonial Day
A82: 1.3 | B82: MORALE decreased to 9
A83: 1.3 | B83: Hangar Deck DAMAGED
A84: 1.3 | B84: Gaius sent to Sickbay.
A85: 1.3 | B85: Jump Prep track Set to Red 1
A86: 1.3 | B86: ************************************
A87: 1.4 | B87: ************************************
A88: 1.4 | B88: Beginning Round 1.4
A89: 1.4 | B89: Tom receives [color=orange]4 - Investigative Committee[/color]
A90: 1.4 | B90: Tom receives [color=orange]3 - Investigative Committee[/color]
A91: 1.4 | B91: Tom receives [color=green]0 - All Hands On Deck[/color]
A92: 1.4 | B92: Tom receives [color=green]3 - Restore Order[/color]
A93: 1.4 | B93: Tom receives [color=purple]0 - Quick Thinking[/color]
A94: 1.4 | B94: Lee moved to Quorum Chamber
A95: 1.4 | B95: Tom receives 5 - Change of Plans from Lee
A96: 1.4 | B96: Tom receives 4 - Maximum Firepower from Lee
A97: 1.4 | B97: Tom receives 1 - Repair from Lee
A98: 1.4 | B98: Tom plays Mutiny Card: Blackmail
A99: 1.4 | B99: Mutiny Card: Blackmail discarded.
A100: 1.4 | B100: CRISIS: Bomb Threat
A101: 1.4 | B101: Bomb Threat: Skill Check Initialized
A102: 1.4 | B102: Destiny played [color=green]3 - Declare Emergency[/color] into skill check.
A103: 1.4 | B103: Destiny played [color=orange]4 - Popular Influence[/color] into skill check.
A104: 1.4 | B104: Karl played [color=purple]5 - Strategic Planning[/color] into crisis.
A105: 1.4 | B105: Athena played [color=green]5 - Declare Emergency[/color] into crisis.
A106: 1.4 | B106: Lee played [color=green]2 - Executive Order[/color] into crisis.
A107: 1.4 | B107: Tom played [color=green]3 - Declare Emergency[/color] into crisis.
A108: 1.4 | B108: Tom played [color=orange]4 - Investigative Committee[/color] into crisis.
A109: 1.4 | B109: Tom played [color=orange]3 - Investigative Committee[/color] into crisis.
A110: 1.4 | B110: Tom PLAYED [color=green]5 - Change of Plans[/color]
A111: 1.4 | B111: Tom receives [color=green]3 - Declare Emergency[/color]
A112: 1.4 | B112: Tom receives [color=green]2 - Executive Order[/color]
A113: 1.4 | B113: Cottle receives [color=blue]3 - Scientific Research[/color]
A114: 1.4 | B114: Cottle receives [color=blue]0 - Install Upgrades[/color]
A115: 1.4 | B115: Gaius receives [color=orange]1 - Consolidate Power[/color]
A116: 1.4 | B116: Gaius receives [color=orange]1 - Consolidate Power[/color]
A117: 1.4 | B117: Karl receives [color=purple]1 - Launch Scout[/color]
A118: 1.4 | B118: Karl receives [color=purple]3 - Unorthodox Plan[/color]
A119: 1.4 | B119: Athena receives [color=red]3 - Maximum Firepower[/color]
A120: 1.4 | B120: Athena receives [color=red]5 - Maximum Firepower[/color]
A121: 1.4 | B121: Lee receives [color=green]1 - Executive Order[/color]
A122: 1.4 | B122: Lee receives [color=green]4 - Declare Emergency[/color]
A123: 1.4 | B123: Jump Prep track Set to Red 2
A124: 1.4 | B124: Raider 1 & Raider 2 MOVED to Sector 4
A125: 1.4 | B125: Raider 3 MOVED to Sector 4
A126: 1.4 | B126: Raider 4 & Raider 5 MOVED to Sector 3
A127: 1.4 | B127: ************************************
A128: 1.5 | B128: ************************************
A129: 1.5 | B129: Beginning Round 1.5
A130: 1.5 | B130: Tom moved to Communications
A131: 1.5 | B131: Karl receives [color=green]2 - Executive Order[/color]
A132: 1.5 | B132: Karl receives [color=green]1 - Executive Order[/color]
A133: 1.5 | B133: Karl receives [color=purple]1 - Launch Scout[/color]
A134: 1.5 | B134: Karl receives [color=purple]2 - Launch Scout[/color]
A135: 1.5 | B135: Karl receives [color=red]0 - Dogfight[/color]
A136: 1.5 | B136: Karl moved to Communications
A137: 1.5 | B137: Civilian A & Civilian B MOVED to Sector 5
A138: 1.5 | B138: CRISIS: Earth in Ruins
A139: 1.5 | B139: FOOD decreased to 7
A140: 1.5 | B140: Karl draws Mutiny Card: Feed the People
A141: 1.5 | B141: Karl draws Mutiny Card: Necessary Risk
A142: 1.5 | B142: Mutiny Card: Feed the People buried.
A143: 1.5 | B143: Lee PLAYED [color=red]2 - Evasive Maneuvers[/color]
A144: 1.5 | B144: Raider 1 & Raider 2 MOVED to Sector 5
A145: 1.5 | B145: Raider 4 & Raider 5 MOVED to Sector 4
A146: 1.5 | B146: Viper 2 DAMAGED
A147: 1.5 | B147: Jump Prep track Set to Blue(-3)
A148: 1.5 | B148: ************************************
A149: 1.6 | B149: ************************************
A150: 1.6 | B150: Beginning Round 1.6
A151: 1.6 | B151: Cottle receives [color=orange]1 - Consolidate Power[/color]
A152: 1.6 | B152: Cottle receives [color=purple]3 - Strategic Planning[/color]
A153: 1.6 | B153: Cottle receives [color=purple]4 - Strategic Planning[/color]
A154: 1.6 | B154: Cottle receives [color=blue]3 - Scientific Research[/color]
A155: 1.6 | B155: Cottle receives [color=blue]2 - Repair[/color]
A156: 1.6 | B156: Cottle moved to FTL Control
A157: 1.6 | B157: Cottle PLAYED [color=green]2 - Executive Order[/color]
A158: 1.6 | B158: Viper 3, Viper 4, Viper 5 & Viper 6 LAUNCHED into Sector 5
A159: 1.6 | B159: CRISIS: Forced Water Mining
A160: 1.6 | B160: Forced Water Mining: Skill Check Initialized
A161: 1.6 | B161: Destiny played [color=green]1 - Executive Order[/color] into skill check.
A162: 1.6 | B162: Destiny played [color=blue]1 - Repair[/color] into skill check.
A163: 1.6 | B163: Gaius played [color=orange]0 - Force Their Hand[/color] into crisis.
A164: 1.6 | B164: Gaius played [color=orange]1 - Consolidate Power[/color] into crisis.
A165: 1.6 | B165: Gaius played [color=orange]1 - Consolidate Power[/color] into crisis.
A166: 1.6 | B166: Lee played [color=green]4 - Declare Emergency[/color] into crisis.
A167: 1.6 | B167: Lee played [color=purple]3 - Strategic Planning[/color] into crisis.
A168: 1.6 | B168: Tom played [color=green]0 - All Hands On Deck[/color] into crisis.
A169: 1.6 | B169: Tom played [color=green]3 - Restore Order[/color] into crisis.
A170: 1.6 | B170: Tom played [color=green]3 - Declare Emergency[/color] into crisis.
A171: 1.6 | B171: Tom played [color=green]2 - Executive Order[/color] into crisis.
A172: 1.6 | B172: Karl played [color=green]2 - Executive Order[/color] into crisis.
A173: 1.6 | B173: Karl played [color=purple]2 - Launch Scout[/color] into crisis.
A174: 1.6 | B174: Cottle played [color=blue]0 - Install Upgrades[/color] into crisis.
A175: 1.6 | B175: Cottle played [color=blue]3 - Scientific Research[/color] into crisis.
A176: 1.6 | B176: Cottle played [color=orange]1 - Consolidate Power[/color] into crisis.
A177: 1.6 | B177: Cottle played [color=purple]4 - Strategic Planning[/color] into crisis.
A178: 1.6 | B178: FOOD increased to 8
A179: 1.6 | B179: Cottle played [color=blue]2 - Repair[/color] into crisis.
A180: 1.6 | B180: Viper 1 DAMAGED
A181: 1.6 | B181: Viper 3 DAMAGED
A182: 1.6 | B182: Raider 3, Raider 4 & Raider 5 MOVED to Sector 5
A183: 1.6 | B183: Jump Prep track Set to Blue(-1)
A184: 1.6 | B184: ************************************
A185: 2.1 | B185: ************************************
A186: 2.1 | B186: Beginning Round 2.1
A187: 2.1 | B187: Cottle receives [color=blue]4 - Raptor Specialist[/color]
A188: 2.1 | B188: Cottle receives [color=blue]3 - Scientific Research[/color]
A189: 2.1 | B189: Gaius receives [color=orange]1 - Consolidate Power[/color]
A190: 2.1 | B190: Gaius moved to Command
A191: 2.1 | B191: Viper 4 & Viper 5 MOVED to Sector 4
A192: 2.1 | B192: CRISIS: Legendary Discovery
A193: 2.1 | B193: Legendary Discovery: Skill Check Initialized
A194: 2.1 | B194: Destiny played [color=red]2 - Evasive Maneuvers[/color] into skill check.
A195: 2.1 | B195: Destiny played [color=red]5 - Launch Reserves[/color] into skill check.
A196: 2.1 | B196: Raptor 1 DESTROYED
A197: 2.1 | B197: FOOD decreased to 7
A198: 2.1 | B198: Raider 6, Raider 7 & Raider 8 DEPLOYED in Sector 1
A199: 2.1 | B199: ************************************
A200: 2.2 | B200: ************************************
A201: 2.2 | B201: Beginning Round 2.2
A202: 2.2 | B202: Athena receives [color=red]3 - Maximum Firepower[/color]
A203: 2.2 | B203: Athena receives [color=green]3 - Declare Emergency[/color]
A204: 2.2 | B204: Athena receives [color=green]0 - All Hands On Deck[/color]
A205: 2.2 | B205: Viper 4 & Viper 5 MOVED to Sector 5
A206: 2.2 | B206: CRISIS: Question Procedure
A207: 2.2 | B207: MORALE decreased to 8
A208: 2.2 | B208: Galactica DAMAGED - Loss of Fuel
A209: 2.2 | B209: FUEL decreased to 7
A210: 2.2 | B210: Auto-jumping the fleet.
A211: 2.2 | B211: Jumping the fleet - removing ships from the board...
A212: 2.2 | B212: 3 Vipers removed from the board
A213: 2.2 | B213: 2 Civilians removed from the board
A214: 2.2 | B214: 1 Basestar removed from the board
A215: 2.2 | B215: 8 Raiders removed from the board
A216: 2.2 | B216: Jump Prep track Set to Start
A217: 2.2 | B217: Jump Prep track Set to Start
A218: 2.2 | B218: Jumping the fleet - removing ships from the board...
A219: 2.2 | B219: Jump Prep track Set to Start
A220: 2.2 | B220: FUEL decreased to 6
A221: 2.2 | B221: Fuel reduced by 1
A222: 2.2 | B222: The Fleet jumps to Tylium Planet (Distance 1) - Total distance now 1
A223: 2.2 | B223: Barren Planet moved to the bottom of the destination deck.
A224: 2.2 | B224: Tom PLAYED [color=purple]3 - Strategic Planning[/color]
A225: 2.2 | B225: FUEL increased to 7
A226: 2.2 | B226: FUEL increased to 8
A227: 2.2 | B227: ************************************
A228: 2.3 | B228: ************************************
A229: 2.3 | B229: Beginning Round 2.3
A230: 2.3 | B230: Lee receives [color=orange]5 - Negotiation[/color]
A231: 2.3 | B231: Lee receives [color=green]1 - Executive Order[/color]
A232: 2.3 | B232: Lee receives [color=purple]2 - Launch Scout[/color]
A233: 2.3 | B233: Lee receives [color=red]1 - Evasive Maneuvers[/color]
A234: 2.3 | B234: Lee receives [color=red]3 - Maximum Firepower[/color]
A235: 2.3 | B235: Lee PLAYED [color=green]1 - Executive Order[/color]
A236: 2.3 | B236: Cottle receives [color=blue]1 - Repair[/color]
A237: 2.3 | B237: Cottle receives [color=blue]2 - Repair[/color]
A238: 2.3 | B238: Cottle receives [color=green]1 - Executive Order[/color]
A239: 2.3 | B239: Leadership deck shuffled.
A240: 2.3 | B240: Cottle receives [color=green]2 - Executive Order[/color]
A241: 2.3 | B241: Tom receives 4 - Raptor Specialist from Cottle
A242: 2.3 | B242: Tom receives 1 - Repair from Cottle
A243: 2.3 | B243: President Lee receives QUORUM card:Encourage Mutiny
A244: 2.3 | B244: Quorum card 'Arrest Order' PLAYED and DISCARDED.
A245: 2.3 | B245: Gaius moved to Brig
A246: 2.3 | B246: CRISIS: Domestic Dispute
A247: 2.3 | B247: Domestic Dispute: Skill Check Initialized
A248: 2.3 | B248: Cottle PLAYED [color=blue]3 - Scientific Research[/color]
A249: 2.3 | B249: Destiny played [color=blue]5 - Test the Limits[/color] into skill check.
A250: 2.3 | B250: Destiny played [color=brown]0 - Bait[/color] into skill check.
A251: 2.3 | B251: Destiny deck shuffled.
A252: 2.3 | B252: Karl played [color=purple]3 - Unorthodox Plan[/color] into crisis.
A253: 2.3 | B253: Karl played [color=purple]1 - Launch Scout[/color] into crisis.
A254: 2.3 | B254: Karl played [color=red]0 - Dogfight[/color] into crisis.
A255: 2.3 | B255: Cottle played [color=blue]3 - Scientific Research[/color] into crisis.
A256: 2.3 | B256: Cottle played [color=blue]2 - Repair[/color] into crisis.
A257: 2.3 | B257: Lee played [color=orange]5 - Negotiation[/color] into crisis.
A258: 2.3 | B258: Viper 4 DAMAGED
A259: 2.3 | B259: ************************************
A260: 2.4 | B260: ************************************
A261: 2.4 | B261: Beginning Round 2.4
A262: 2.4 | B262: Tom receives [color=orange]1 - Consolidate Power[/color]
A263: 2.4 | B263: Tom receives [color=orange]2 - Consolidate Power[/color]
A264: 2.4 | B264: Tom receives [color=green]3 - Declare Emergency[/color]
A265: 2.4 | B265: Tom receives [color=green]5 - Change of Plans[/color]
A266: 2.4 | B266: Tom receives [color=purple]5 - A Second Chance[/color]
A267: 2.4 | B267: Tom draws Mutiny Card: Panic
A268: 2.4 | B268: Tom draws Mutiny Card: Send a Message
A269: 2.4 | B269: Tom draws Mutiny Card: Assume Command
A270: 2.4 | B270: Tom draws Mutiny Card: Selfish Act
A271: 2.4 | B271: Tom uses their Once-Per-Game ability.
A272: 2.4 | B272: Tom DISCARDED [color=blue]1 - Repair[/color]
A273: 2.4 | B273: Tom moved to Press Room
A274: 2.4 | B274: Mutiny Card: Assume Command buried.
A275: 2.4 | B275: Mutiny Card: Panic buried.
A276: 2.4 | B276: Mutiny Card: Selfish Act buried.
A277: 2.4 | B277: Tom plays Mutiny Card: Send a Message
A278: 2.4 | B278: Mutiny Card: Send a Message discarded.
A279: 2.4 | B279: FTL Control DAMAGED
A280: 2.4 | B280: Cottle sent to Sickbay.
A281: 2.4 | B281: Athena showed/discarded 'Human Allegiance: End the Chase'.
A282: 2.4 | B282: CRISIS: Rescue Mission (B)
A283: 2.4 | B283: FUEL decreased to 7
A284: 2.4 | B284: Raptor 2 DESTROYED
A285: 2.4 | B285: Jump Prep track Set to Red 1
A286: 2.4 | B286: ************************************
A287: 2.5 | B287: ************************************
A288: 2.5 | B288: Beginning Round 2.5
A289: 2.5 | B289: Karl receives [color=green]2 - Executive Order[/color]
A290: 2.5 | B290: Karl receives [color=green]1 - Executive Order[/color]
A291: 2.5 | B291: Karl receives [color=purple]1 - Launch Scout[/color]
A292: 2.5 | B292: Karl receives [color=purple]4 - Unorthodox Plan[/color]
A293: 2.5 | B293: Karl receives [color=red]2 - Evasive Maneuvers[/color]
A294: 2.5 | B294: Karl moved to Admiral's Quarters
A295: 2.5 | B295: Karl PLAYED [color=green]1 - Executive Order[/color]
A296: 2.5 | B296: Cottle moved to Communications
A297: 2.5 | B297: Cottle receives [color=blue]1 - Repair[/color]
A298: 2.5 | B298: Cottle receives [color=blue]3 - Scientific Research[/color]
A299: 2.5 | B299: CRISIS: Rescue Mission (A)
A300: 2.5 | B300: MORALE decreased to 7
A301: 2.5 | B301: Karl moved to Sickbay
A302: 2.5 | B302: Jump Prep track Set to Red 2
A303: 2.5 | B303: ************************************
A304: 2.6 | B304: ************************************
A305: 2.6 | B305: Beginning Round 2.6
A306: 2.6 | B306: Cottle receives [color=orange]1 - Consolidate Power[/color]
A307: 2.6 | B307: Cottle receives [color=purple]2 - Launch Scout[/color]
A308: 2.6 | B308: Cottle receives [color=purple]1 - Launch Scout[/color]
A309: 2.6 | B309: Cottle receives [color=blue]1 - Repair[/color]
A310: 2.6 | B310: Cottle receives [color=blue]0 - Install Upgrades[/color]
A311: 2.6 | B311: Karl moved to Admiral's Quarters
A312: 2.6 | B312: Cottle PLAYED [color=blue]3 - Scientific Research[/color]
A313: 2.6 | B313: Destiny played [color=purple]1 - Launch Scout[/color] into skill check.
A314: 2.6 | B314: Destiny played [color=brown]3 - Personal Vices[/color] into skill check.
A315: 2.6 | B315: Gaius played [color=orange]1 - Consolidate Power[/color] into crisis.
A316: 2.6 | B316: Athena played [color=green]2 - Executive Order[/color] into crisis.
A317: 2.6 | B317: Athena played [color=green]4 - Declare Emergency[/color] into crisis.
A318: 2.6 | B318: Lee played [color=green]1 - Executive Order[/color] into crisis.
A319: 2.6 | B319: Lee played [color=green]1 - Executive Order[/color] into crisis.
A320: 2.6 | B320: Lee played [color=purple]2 - Launch Scout[/color] into crisis.
A321: 2.6 | B321: Tom played [color=blue]1 - Repair[/color] into crisis.
A322: 2.6 | B322: Tom played [color=orange]1 - Consolidate Power[/color] into crisis.
A323: 2.6 | B323: Tom played [color=orange]2 - Consolidate Power[/color] into crisis.
A324: 2.6 | B324: Tom played [color=green]3 - Declare Emergency[/color] into crisis.
A325: 2.6 | B325: Karl played [color=purple]1 - Launch Scout[/color] into crisis.
A326: 2.6 | B326: Karl played [color=green]2 - Executive Order[/color] into crisis.
A327: 2.6 | B327: Karl played [color=green]1 - Executive Order[/color] into crisis.
A328: 2.6 | B328: Karl played [color=purple]1 - Launch Scout[/color] into crisis.
A329: 2.6 | B329: Karl played [color=purple]4 - Unorthodox Plan[/color] into crisis.
A330: 2.6 | B330: Cottle played [color=purple]2 - Launch Scout[/color] into crisis.
A331: 2.6 | B331: Cottle played [color=purple]1 - Launch Scout[/color] into crisis.
A332: 2.6 | B332: Cottle played [color=blue]1 - Repair[/color] into crisis.
A333: 2.6 | B333: Cottle receives [color=brown]0 - Bait[/color]
A334: 2.6 | B334: Gaius receives [color=brown]0 - Dradis Contact[/color]
A335: 2.6 | B335: Athena receives [color=brown]5 - Exploit Weakness[/color]
A336: 2.6 | B336: Lee receives [color=brown]3 - A Better Machine[/color]
A337: 2.6 | B337: Tom receives [color=brown]3 - Personal Vices[/color]
A338: 2.6 | B338: Karl receives [color=brown]4 - Violent Outbursts[/color]
A339: 2.6 | B339: Cottle draws Mutiny Card: Controversial Speech
A340: 2.6 | B340: Cottle draws Mutiny Card: Bait and Switch
A341: 2.6 | B341: Karl receives [color=purple]0 - Quick Thinking[/color]
A342: 2.6 | B342: Tactics deck shuffled.
A343: 2.6 | B343: Karl receives [color=purple]3 - Unorthodox Plan[/color]
A344: 2.6 | B344: Mutiny Card: Controversial Speech buried.
A345: 2.6 | B345: Cottle DISCARDED [color=blue]0 - Install Upgrades[/color]
A346: 2.6 | B346: Cottle receives [color=blue]5 - Scientific Research[/color]
A347: 2.6 | B347: Cottle receives [color=blue]2 - Repair[/color]
A348: 2.6 | B348: Cottle receives 0 - Quick Thinking from Karl
A349: 2.6 | B349: Cottle receives 3 - Unorthodox Plan from Karl
A350: 2.6 | B350: Karl receives [color=purple]1 - Launch Scout[/color]
A351: 2.6 | B351: Karl receives [color=purple]2 - Launch Scout[/color]
A352: 2.6 | B352: Gaius receives [color=green]0 - All Hands On Deck[/color]
A353: 2.6 | B353: Gaius receives [color=green]2 - Executive Order[/color]
A354: 2.6 | B354: Athena receives [color=blue]2 - Repair[/color]
A355: 2.6 | B355: Athena receives [color=blue]3 - Raptor Specialist[/color]
A356: 2.6 | B356: Lee receives [color=green]3 - Declare Emergency[/color]
A357: 2.6 | B357: Lee receives [color=green]2 - Executive Order[/color]
A358: 2.6 | B358: Tom receives [color=orange]3 - Investigative Committee[/color]
A359: 2.6 | B359: Tom receives [color=orange]1 - Consolidate Power[/color]
A360: 2.6 | B360: CRISIS: Jammed Assault
A361: 2.6 | B361: Basestar 1 deployed in Sector 3
A362: 2.6 | B362: Heavy 1 deployed in Sector 3
A363: 2.6 | B363: Heavy 2 deployed in Sector 3
A364: 2.6 | B364: Raider 1 deployed in Sector 2
A365: 2.6 | B365: Raider 2 deployed in Sector 2
A366: 2.6 | B366: Raider 3 deployed in Sector 2
A367: 2.6 | B367: Raider 4 deployed in Sector 2
A368: 2.6 | B368: Viper 5 deployed in Sector 5
A369: 2.6 | B369: Viper 6 deployed in Sector 6
A370: 2.6 | B370: Civilian A deployed in Sector 1
A371: 2.6 | B371: Civilian B deployed in Sector 4
A372: 2.6 | B372: Civilian C deployed in Sector 5
A373: 2.6 | B373: Civilian D deployed in Sector 6
A374: 2.6 | B374: Jammed Assault: ships deployed
A375: 2.6 | B375: Tom PLAYED [color=green]5 - Change of Plans[/color]
A376: 2.6 | B376: Athena DISCARDED [color=green]0 - All Hands On Deck[/color]
A377: 2.6 | B377: ************************************
A378: 3.1 | B378: ************************************
A379: 3.1 | B379: Beginning Round 3.1
A380: 3.1 | B380: Gaius receives [color=orange]2 - Consolidate Power[/color]
A381: 3.1 | B381: Gaius receives [color=orange]0 - Force Their Hand[/color]
A382: 3.1 | B382: Gaius receives [color=green]1 - Executive Order[/color]
A383: 3.1 | B383: Gaius receives [color=green]3 - Restore Order[/color]
A384: 3.1 | B384: Gaius receives [color=blue]4 - Scientific Research[/color]
A385: 3.1 | B385: Lee draws Mutiny Card: Betrayal of Trust
A386: 3.1 | B386: Lee draws Mutiny Card: Ruined Reputation
A387: 3.1 | B387: Mutiny Card: Betrayal of Trust buried.
A388: 3.1 | B388: Tom showed/discarded 'You are a Cylon Can Damage Galactica'.
A389: 3.1 | B389: Tom REVEALED as a Cylon
A390: 3.1 | B390: Super Crisis 'Bomb on Colonial One' has been dealt to Tom
A391: 3.1 | B391: Tom moved to Resurrection Ship
A392: 3.1 | B392: Karl is now the Admiral.
A393: 3.1 | B393: Admiral's Quarters DAMAGED
A394: 3.1 | B394: Karl sent to Sickbay.
A395: 3.1 | B395: Command DAMAGED
A396: 3.1 | B396: Athena sent to Sickbay.
A397: 3.1 | B397: Tom DISCARDED [color=purple]0 - Quick Thinking[/color]
A398: 3.1 | B398: Tom DISCARDED [color=blue]4 - Raptor Specialist[/color]
A399: 3.1 | B399: Tom DISCARDED [color=orange]1 - Consolidate Power[/color]
A400: 3.1 | B400: Tom DISCARDED [color=orange]3 - Investigative Committee[/color]
A401: 3.1 | B401: ************************************
A402: 3.2 | B402: ************************************
A403: 3.2 | B403: Beginning Round 3.2
A404: 3.2 | B404: Lee DISCARDED [color=brown]3 - A Better Machine[/color]
A405: 3.2 | B405: Athena receives [color=brown]0 - Bait[/color]
A406: 3.2 | B406: Athena DISCARDED [color=red]3 - Maximum Firepower[/color]
A407: 3.2 | B407: Athena moved to Hangar Deck
A408: 3.2 | B408: Hangar Deck REPAIRED
A409: 3.2 | B409: Athena PLAYED [color=blue]2 - Repair[/color]
A410: 3.2 | B410: CRISIS: Send Survey Team
A411: 3.2 | B411: Cottle PLAYED [color=green]1 - Executive Order[/color]
A412: 3.2 | B412: Cottle PLAYED [color=purple]3 - Strategic Planning[/color]
A413: 3.2 | B413: FUEL decreased to 6
A414: 3.2 | B414: Raider 1, Raider 2, Raider 3 & Raider 4 MOVED to Sector 1
A415: 3.2 | B415: Jump Prep track Set to Blue(-3)
A416: 3.2 | B416: ************************************
A417: 3.3 | B417: ************************************
A418: 3.3 | B418: Beginning Round 3.3
A419: 3.3 | B419: Lee receives [color=orange]2 - Consolidate Power[/color]
A420: 3.3 | B420: Lee receives [color=green]4 - Declare Emergency[/color]
A421: 3.3 | B421: Lee receives [color=purple]5 - Strategic Planning[/color]
A422: 3.3 | B422: Lee receives [color=red]3 - Combat Veteran[/color]
A423: 3.3 | B423: Lee receives [color=red]1 - Evasive Maneuvers[/color]
A424: 3.3 | B424: Lee PLAYED [color=green]2 - Executive Order[/color]
A425: 3.3 | B425: Karl moved to Hangar Deck
A426: 3.3 | B426: Karl LAUNCHED Assault Raptor 1 into Sector 6
A427: 3.3 | B427: Karl PLAYED [color=purple]1 - Launch Scout[/color]
A428: 3.3 | B428: Lee PLAYED [color=purple]3 - Strategic Planning[/color]
A429: 3.3 | B429: Crisis Cylon Swarm moved to the bottom of the deck.
A430: 3.3 | B430: President Lee receives QUORUM card:Inspirational Speech
A431: 3.3 | B431: Karl has been ASSIGNED as the Mission Specialist
A432: 3.3 | B432: CRISIS: Water Shortage (A)
A433: 3.3 | B433: FOOD decreased to 6
A434: 3.3 | B434: Jump Prep track Set to Blue(-1)
A435: 3.3 | B435: ************************************
A436: 3.4 | B436: ************************************
A437: 3.4 | B437: Beginning Round 3.4
A438: 3.4 | B438: Tom receives [color=brown]0 - Bait[/color]
A439: 3.4 | B439: Civilian A DESTROYED
A440: 3.4 | B440: POPULATION decreased to 11
A441: 3.4 | B441: Raider 2, Raider 3 & Raider 4 MOVED to Sector 6
A442: 3.4 | B442: Tom moved to Cylon Fleet
A443: 3.4 | B443: ************************************
A444: 3.5 | B444: ************************************
A445: 3.5 | B445: Beginning Round 3.5
A446: 3.5 | B446: Karl receives [color=green]5 - Declare Emergency[/color]
A447: 3.5 | B447: Karl receives [color=green]1 - Executive Order[/color]
A448: 3.5 | B448: Karl receives [color=purple]3 - Strategic Planning[/color]
A449: 3.5 | B449: Karl receives [color=red]1 - Evasive Maneuvers[/color]
A450: 3.5 | B450: Cottle receives [color=blue]1 - Repair[/color]
A451: 3.5 | B451: Engineering deck shuffled.
A452: 3.5 | B452: Cottle receives [color=blue]5 - Test the Limits[/color]
A453: 3.5 | B453: Cottle receives [color=green]2 - Executive Order[/color]
A454: 3.5 | B454: Cottle receives [color=green]1 - Executive Order[/color]
A455: 3.5 | B455: Leadership deck shuffled.
A456: 3.5 | B456: Gaius receives [color=brown]0 - Dradis Contact[/color]
A457: 3.5 | B457: Gaius receives [color=brown]4 - Violent Outbursts[/color]
A458: 3.5 | B458: Destiny deck shuffled.
A459: 3.5 | B459: Cottle plays Mutiny Card: Bait and Switch
A460: 3.5 | B460: Mutiny Card: Bait and Switch discarded.
A461: 3.5 | B461: Athena receives 1 - Repair from Cottle
A462: 3.5 | B462: Athena receives 1 - Repair from Cottle
A463: 3.5 | B463: CRISIS: Lockdown
A464: 3.5 | B464: Lee PLAYED [color=red]1 - Evasive Maneuvers[/color]
A465: 3.5 | B465: Viper 6 DAMAGED
A466: 3.5 | B466: Lee PLAYED [color=red]1 - Evasive Maneuvers[/color]
A467: 3.5 | B467: Athena PLAYED [color=red]1 - Evasive Maneuvers[/color]
A468: 3.5 | B468: Basestar 2 deployed in Sector 2
A469: 3.5 | B469: Viper 7 deployed in Sector 4
A470: 3.5 | B470: Civilian E deployed in Sector 4
A471: 3.5 | B471: Civilian F deployed in Sector 5
A472: 3.5 | B472: Lockdown: ships deployed
A473: 3.5 | B473: Heavy 3 & Heavy 4 DEPLOYED in Sector 2
A474: 3.5 | B474: ************************************
A475: 3.6 | B475: ************************************
A476: 3.6 | B476: Beginning Round 3.6
A477: 3.6 | B477: Cottle receives [color=orange]3 - Investigative Committee[/color]
A478: 3.6 | B478: Cottle receives [color=purple]4 - Strategic Planning[/color]
A479: 3.6 | B479: Cottle receives [color=purple]2 - Launch Scout[/color]
A480: 3.6 | B480: Cottle receives [color=blue]1 - Repair[/color]
A481: 3.6 | B481: Cottle receives [color=blue]1 - Repair[/color]
A482: 3.6 | B482: Cottle PLAYED [color=green]1 - Executive Order[/color]
A483: 3.6 | B483: Karl PLAYED [color=purple]1 - Launch Scout[/color]
A484: 3.6 | B484: Karl PLAYED [color=purple]3 - Strategic Planning[/color]
A485: 3.6 | B485: FOOD increased to 7
A486: 3.6 | B486: Raider 5, Raider 6 & Raider 7 DEPLOYED in Sector 2
A487: 3.6 | B487: Karl plays Mutiny Card: Necessary Risk
A488: 3.6 | B488: Mutiny Card: Necessary Risk removed from the game.
A489: 3.6 | B489: CRISIS: Food Shortage
A490: 3.6 | B490: Raider 1 MOVED to Sector 6
A491: 3.6 | B491: Lee DISCARDED [color=orange]2 - Consolidate Power[/color]
A492: 3.6 | B492: Lee DISCARDED [color=red]3 - Maximum Firepower[/color]
A493: 3.6 | B493: Cottle DISCARDED [color=orange]1 - Consolidate Power[/color]
A494: 3.6 | B494: Cottle DISCARDED [color=blue]1 - Repair[/color]
A495: 3.6 | B495: Cottle DISCARDED [color=blue]1 - Repair[/color]
A496: 3.6 | B496: Raider 5, Raider 6 & Raider 7 MOVED to Sector 3
A497: 3.6 | B497: Auto-jumping the fleet.
A498: 3.6 | B498: Jumping the fleet - removing ships from the board...
A499: 3.6 | B499: 2 Vipers removed from the board
A500: 3.6 | B500: 5 Civilians removed from the board
A501: 3.6 | B501: 2 Basestars removed from the board
A502: 3.6 | B502: 7 Raiders removed from the board
A503: 3.6 | B503: 4 Heavy Raiders removed from the board
A504: 3.6 | B504: Jump Prep track Set to Start
A505: 3.6 | B505: Special: Jammed Assault is no longer in effect.
A506: 3.6 | B506: Jump Prep track Set to Start
A507: 3.6 | B507: Karl PLAYED [color=red]1 - Evasive Maneuvers[/color]
A508: 3.6 | B508: Deep Space moved to the bottom of the destination deck.
A509: 3.6 | B509: Icy Moon moved to the bottom of the destination deck.
A510: 3.6 | B510: Jumping the fleet - removing ships from the board...
A511: 3.6 | B511: Jump Prep track Set to Start
A512: 3.6 | B512: FUEL decreased to 5
A513: 3.6 | B513: Fuel reduced by 1
A514: 3.6 | B514: Basestar deployed in Sector 1. 3 Raiders deployed in Sector 1.3 Civilians deployed in Sector 4.
A515: 3.6 | B515: The Fleet jumps to Cylon Ambush (Distance 3) - Total distance now 4
A516: 3.6 | B516: Entering Sleeper Agent Phase
A517: 3.6 | B517: Tom gives Loyalty card 'You are NOT a Cylon' to Karl
A518: 3.6 | B518: Cottle DISCARDED [color=green]2 - Executive Order[/color]
A519: 3.6 | B519: ************************************
A520: 4.1 | B520: ************************************
A521: 4.1 | B521: Beginning Round 4.1
A522: 4.1 | B522: Gaius receives [color=orange]1 - Consolidate Power[/color]
A523: 4.1 | B523: Gaius receives [color=orange]2 - Consolidate Power[/color]
A524: 4.1 | B524: Gaius receives [color=green]1 - Executive Order[/color]
A525: 4.1 | B525: Gaius receives [color=green]1 - Executive Order[/color]
A526: 4.1 | B526: Gaius receives [color=blue]2 - Repair[/color]
A527: 4.1 | B527: Gaius showed/discarded 'You are a Cylon Can Send a Character to the Brig'.
A528: 4.1 | B528: Gaius REVEALED as a Cylon
A529: 4.1 | B529: Super Crisis 'Inbound Nukes' has been dealt to Gaius
A530: 4.1 | B530: Gaius moved to Resurrection Ship
A531: 4.1 | B531: Quorum card 'Assign Mission Specialist (Karl)' DISCARDED
A532: 4.1 | B532: Gaius DISCARDED [color=orange]0 - Force Their Hand[/color]
A533: 4.1 | B533: Gaius DISCARDED [color=green]1 - Executive Order[/color]
A534: 4.1 | B534: Gaius DISCARDED [color=green]2 - Executive Order[/color]
A535: 4.1 | B535: Gaius DISCARDED [color=orange]2 - Consolidate Power[/color]
A536: 4.1 | B536: Gaius DISCARDED [color=green]0 - All Hands On Deck[/color]
A537: 4.1 | B537: Gaius DISCARDED [color=orange]1 - Consolidate Power[/color]
A538: 4.1 | B538: Gaius DISCARDED [color=orange]2 - Consolidate Power[/color]
A539: 4.1 | B539: Gaius DISCARDED [color=green]1 - Executive Order[/color]
A540: 4.1 | B540: Gaius DISCARDED [color=green]1 - Executive Order[/color]
A541: 4.1 | B541: Gaius DISCARDED [color=blue]2 - Repair[/color]
A542: 4.1 | B542: ************************************
A543: 4.2 | B543: ************************************
A544: 4.2 | B544: Beginning Round 4.2
A545: 4.2 | B545: Athena receives [color=green]4 - Declare Emergency[/color]
A546: 4.2 | B546: Athena receives [color=green]0 - All Hands On Deck[/color]
A547: 4.2 | B547: Athena receives [color=red]1 - Evasive Maneuvers[/color]
A548: 4.2 | B548: Athena moved to FTL Control
A549: 4.2 | B549: Athena PLAYED [color=blue]1 - Repair[/color]
A550: 4.2 | B550: FTL Control REPAIRED
A551: 4.2 | B551: CRISIS: Guilt by Collusion
A552: 4.2 | B552: Guilt by Collusion: Skill Check Initialized
A553: 4.2 | B553: Destiny played [color=blue]1 - Repair[/color] into skill check.
A554: 4.2 | B554: Destiny played [color=orange]3 - Investigative Committee[/color] into skill check.
A555: 4.2 | B555: Lee played [color=green]4 - Declare Emergency[/color] into crisis.
A556: 4.2 | B556: Lee played [color=green]3 - Declare Emergency[/color] into crisis.
A557: 4.2 | B557: Tom played [color=brown]0 - Bait[/color] into crisis.
A558: 4.2 | B558: Cottle played [color=purple]0 - Quick Thinking[/color] into crisis.
A559: 4.2 | B559: Cottle played [color=purple]4 - Strategic Planning[/color] into crisis.
A560: 4.2 | B560: Cottle played [color=purple]2 - Launch Scout[/color] into crisis.
A561: 4.2 | B561: Cottle played [color=brown]0 - Bait[/color] into crisis.
A562: 4.2 | B562: Gaius played [color=brown]0 - Dradis Contact[/color] into crisis.
A563: 4.2 | B563: Athena played [color=green]4 - Declare Emergency[/color] into crisis.
A564: 4.2 | B564: Athena played [color=green]0 - All Hands On Deck[/color] into crisis.
A565: 4.2 | B565: Civilian E DEPLOYED in Sector 4
A566: 4.2 | B566: Raider 4 & Raider 5 DEPLOYED in Sector 1
A567: 4.2 | B567: Raider 1, Raider 2, Raider 3, Raider 4 & Raider 5 MOVED to Sector 2
A568: 4.2 | B568: Jump Prep track Set to Red 1
A569: 4.2 | B569: Athena DISCARDED [color=red]3 - Maximum Firepower[/color]
A570: 4.2 | B570: ************************************
A571: 4.3 | B571: ************************************
A572: 4.3 | B572: Beginning Round 4.3
A573: 4.3 | B573: Lee receives [color=green]3 - Declare Emergency[/color]
A574: 4.3 | B574: Lee receives [color=green]2 - Executive Order[/color]
A575: 4.3 | B575: Lee receives [color=purple]2 - Launch Scout[/color]
A576: 4.3 | B576: Lee receives [color=red]2 - Evasive Maneuvers[/color]
A577: 4.3 | B577: Lee receives [color=red]1 - Evasive Maneuvers[/color]
A578: 4.3 | B578: Lee PLAYED [color=green]2 - Executive Order[/color]
A579: 4.3 | B579: Lee receives [color=green]1 - Executive Order[/color]
A580: 4.3 | B580: Lee receives [color=green]1 - Executive Order[/color]
A581: 4.3 | B581: Lee receives [color=green]2 - Executive Order[/color]
A582: 4.3 | B582: Lee receives [color=green]5 - Change of Plans[/color]
A583: 4.3 | B583: President Lee receives QUORUM card:Assign Arbitrator
A584: 4.3 | B584: Quorum card 'Inspirational Speech' PLAYED and REMOVED.
A585: 4.3 | B585: Lee PLAYED [color=purple]5 - Strategic Planning[/color]
A586: 4.3 | B586: CRISIS: Water Shortage ( C)
A587: 4.3 | B587: Lee DISCARDED [color=green]1 - Executive Order[/color]
A588: 4.3 | B588: Lee DISCARDED [color=green]1 - Executive Order[/color]
A589: 4.3 | B589: Lee DISCARDED [color=purple]2 - Launch Scout[/color]
A590: 4.3 | B590: Lee DISCARDED [color=red]1 - Evasive Maneuvers[/color]
A591: 4.3 | B591: Lee DISCARDED [color=red]3 - Combat Veteran[/color]
A592: 4.3 | B592: Armory DAMAGED
A593: 4.3 | B593: ************************************
A594: 4.4 | B594: ************************************
A595: 4.4 | B595: Beginning Round 4.4
A596: 4.4 | B596: Tom receives [color=red]0 - Dogfight[/color]
A597: 4.4 | B597: Tom receives [color=brown]0 - Dradis Contact[/color]
A598: 4.4 | B598: Raider 1, Raider 2, Raider 3, Raider 4 & Raider 5 MOVED to Sector 3
A599: 4.4 | B599: ************************************
A600: 4.5 | B600: ************************************
A601: 4.5 | B601: Beginning Round 4.5
A602: 4.5 | B602: Karl receives [color=green]2 - Executive Order[/color]
A603: 4.5 | B603: Karl receives [color=purple]2 - Launch Scout[/color]
A604: 4.5 | B604: Karl receives [color=purple]1 - Launch Scout[/color]
A605: 4.5 | B605: Karl receives [color=red]3 - Maximum Firepower[/color]
A606: 4.5 | B606: Karl PLAYED [color=green]1 - Executive Order[/color]
A607: 4.5 | B607: Civilian B, Civilian C, Civilian D & Civilian E MOVED to Sector 5
A608: 4.5 | B608: CRISIS: One Last Cocktail
A609: 4.5 | B609: MORALE decreased to 6
A610: 4.5 | B610: Hangar Deck DAMAGED
A611: 4.5 | B611: Jump Prep track Set to Red 2
A612: 4.5 | B612: ************************************
A613: 4.6 | B613: ************************************
A614: 4.6 | B614: Beginning Round 4.6
A615: 4.6 | B615: Cottle receives [color=orange]4 - Investigative Committee[/color]
A616: 4.6 | B616: Politics deck shuffled.
A617: 4.6 | B617: Cottle receives [color=purple]3 - Strategic Planning[/color]
A618: 4.6 | B618: Tactics deck shuffled.
A619: 4.6 | B619: Cottle receives [color=purple]1 - Launch Scout[/color]
A620: 4.6 | B620: Cottle receives [color=blue]1 - Repair[/color]
A621: 4.6 | B621: Cottle receives [color=blue]1 - Repair[/color]
A622: 4.6 | B622: Lee moved to Sickbay
A623: 4.6 | B623: Karl in Assault Raptor 1 moves to Sector 5
A624: 4.6 | B624: Cottle PLAYED [color=green]2 - Executive Order[/color]
A625: 4.6 | B625: Athena moved to Hangar Deck
A626: 4.6 | B626: Athena PLAYED [color=blue]1 - Repair[/color]
A627: 4.6 | B627: Hangar Deck REPAIRED
A628: 4.6 | B628: CRISIS: Dishonest Tactics
A629: 4.6 | B629: MORALE decreased to 5
A630: 4.6 | B630: Raider 1, Raider 2, Raider 3, Raider 4 & Raider 5 MOVED to Sector 4
A631: 4.6 | B631: Jump Prep track Set to Blue(-3)
A632: 4.6 | B632: ************************************
A633: 5.1 | B633: ************************************
A634: 5.1 | B634: Beginning Round 5.1
A635: 5.1 | B635: Gaius receives [color=#a52a2a]0 - Bait[/color]
A636: 5.1 | B636: Gaius moved to Caprica
A637: 5.1 | B637: Lee draws Mutiny Card: Set the Agenda
A638: 5.1 | B638: CRISIS: Secret Meetings
A639: 5.1 | B639: Crisis Quorum in Uproar moved to the bottom of the deck.
A640: 5.1 | B640: Lee moved to Brig
A641: 5.1 | B641: Athena receives [color=#a52a2a]3 - Personal Vices[/color]
A642: 5.1 | B642: Lee DISCARDED [color=red]2 - Evasive Maneuvers[/color]
A643: 5.1 | B643: Mutiny Card: Set the Agenda discarded.
A644: 5.1 | B644: Jump Prep track Set to Blue(-1)
A645: 5.1 | B645: ************************************
A646: 5.2 | B646: ************************************
A647: 5.2 | B647: Beginning Round 5.2
A648: 5.2 | B648: Athena receives [color=green]1 - Executive Order[/color]
A649: 5.2 | B649: Leadership deck shuffled.
A650: 5.2 | B650: Athena receives [color=red]4 - Maximum Firepower[/color]
A651: 5.2 | B651: Athena receives [color=blue]3 - Scientific Research[/color]
A652: 5.2 | B652: Athena PLAYED [color=green]1 - Executive Order[/color]
A653: 5.2 | B653: Athena receives [color=orange]4 - Investigative Committee[/color]
A654: 5.2 | B654: Athena receives [color=orange]0 - Force Their Hand[/color]
A655: 5.2 | B655: Lee receives 4 - Investigative Committee from Athena
A656: 5.2 | B656: Lee receives 0 - Force Their Hand from Athena
A657: 5.2 | B657: Lee plays Mutiny Card: Ruined Reputation
A658: 5.2 | B658: Mutiny Card: Ruined Reputation discarded.
A659: 5.2 | B659: Athena PLAYED [color=blue]3 - Scientific Research[/color]
A660: 5.2 | B660: Destiny played [color=orange]5 - Investigative Committee[/color] into skill check.
A661: 5.2 | B661: Destiny played [color=green]4 - Restore Order[/color] into skill check.
A662: 5.2 | B662: Lee played [color=orange]4 - Investigative Committee[/color] into crisis.
A663: 5.2 | B663: Tom played [color=red]4 - Maximum Firepower[/color] into crisis.
A664: 5.2 | B664: Karl played [color=purple]2 - Launch Scout[/color] into crisis.
A665: 5.2 | B665: Karl played [color=purple]2 - Launch Scout[/color] into crisis.
A666: 5.2 | B666: Cottle played [color=blue]2 - Repair[/color] into crisis.
A667: 5.2 | B667: Cottle played [color=blue]5 - Scientific Research[/color] into crisis.
A668: 5.2 | B668: Cottle played [color=orange]4 - Investigative Committee[/color] into crisis.
A669: 5.2 | B669: Gaius played [color=green]3 - Restore Order[/color] into crisis.
A670: 5.2 | B670: Athena played [color=blue]3 - Raptor Specialist[/color] into crisis.
A671: 5.2 | B671: Athena played [color=orange]3 - Investigative Committee[/color] into crisis.
A672: 5.2 | B672: Lee moved to Command
A673: 5.2 | B673: CRISIS: Elections Loom
A674: 5.2 | B674: Elections Loom: Skill Check Initialized
A675: 5.2 | B675: Elections Loom: Skill Check Initialized
A676: 5.2 | B676: Destiny played [color=blue]2 - Repair[/color] into skill check.
A677: 5.2 | B677: Destiny played [color=green]3 - Declare Emergency[/color] into skill check.
A678: 5.2 | B678: Lee played [color=green]5 - Change of Plans[/color] into crisis.
A679: 5.2 | B679: Lee played [color=green]3 - Declare Emergency[/color] into crisis.
A680: 5.2 | B680: Tom played [color=purple]5 - A Second Chance[/color] into crisis.
A681: 5.2 | B681: Karl played [color=green]5 - Declare Emergency[/color] into crisis.
A682: 5.2 | B682: Cottle played [color=orange]3 - Investigative Committee[/color] into crisis.
A683: 5.2 | B683: Athena played [color=#a52a2a]0 - Bait[/color] into crisis.
A684: 5.2 | B684: Athena played [color=#a52a2a]0 - Bait[/color] into crisis.
A685: 5.2 | B685: Civilian F DEPLOYED in Sector 4
A686: 5.2 | B686: Auto-jumping the fleet.
A687: 5.2 | B687: Jumping the fleet - removing ships from the board...
A688: 5.2 | B688: 5 Civilians removed from the board
A689: 5.2 | B689: 1 Basestar removed from the board
A690: 5.2 | B690: 5 Raiders removed from the board
A691: 5.2 | B691: Jump Prep track Set to Start
A692: 5.2 | B692: Jump Prep track Set to Start
A693: 5.2 | B693: Jumping the fleet - removing ships from the board...
A694: 5.2 | B694: Jump Prep track Set to Start
A695: 5.2 | B695: FUEL decreased to 4
A696: 5.2 | B696: FUEL decreased to 3
A697: 5.2 | B697: Fuel reduced by 2
A698: 5.2 | B698: POPULATION decreased to 10
A699: 5.2 | B699: POPULATION decreased to 9
A700: 5.2 | B700: The Fleet jumps to Asteroid Field (Distance 3) - Total distance now 7
A701: 5.2 | B701: Icy Moon moved to the bottom of the destination deck.
A702: 5.2 | B702: Karl moves to Hangar Deck and returns Viper 1 to the Reserves
A703: 5.2 | B703: ************************************
A704: 5.3 | B704: ************************************
A705: 5.3 | B705: Beginning Round 5.3
A706: 5.3 | B706: Lee receives [color=orange]5 - Negotiation[/color]
A707: 5.3 | B707: Lee receives [color=green]0 - All Hands On Deck[/color]
A708: 5.3 | B708: Lee receives [color=purple]3 - Strategic Planning[/color]
A709: 5.3 | B709: Lee receives [color=red]2 - Evasive Maneuvers[/color]
A710: 5.3 | B710: Piloting deck shuffled.
A711: 5.3 | B711: Lee receives [color=red]5 - Launch Reserves[/color]
A712: 5.3 | B712: Athena moved to Command
A713: 5.3 | B713: Lee DISCARDED [color=green]0 - All Hands On Deck[/color]
A714: 5.3 | B714: Lee moved to Quorum Chamber
A715: 5.3 | B715: Lee PLAYED [color=green]2 - Executive Order[/color]
A716: 5.3 | B716: Cottle receives [color=green]2 - Executive Order[/color]
A717: 5.3 | B717: Cottle receives [color=green]1 - Executive Order[/color]
A718: 5.3 | B718: Athena receives 1 - Repair from Cottle
A719: 5.3 | B719: Athena receives 1 - Repair from Cottle
A720: 5.3 | B720: Cottle receives [color=purple]3 - Strategic Planning[/color]
A721: 5.3 | B721: Cottle receives [color=purple]2 - Launch Scout[/color]
A722: 5.3 | B722: Lee receives 1 - Launch Scout from Cottle
A723: 5.3 | B723: Lee receives 5 - Test the Limits from Cottle
A724: 5.3 | B724: President Lee receives QUORUM card:Release Cylon Mugshots
A725: 5.3 | B725: President Lee receives QUORUM card:Assign Vice President
A726: 5.3 | B726: CRISIS: Raiding Party
A727: 5.3 | B727: Basestar 1 deployed in Sector 3
A728: 5.3 | B728: Heavy 1 deployed in Sector 4
A729: 5.3 | B729: Heavy 2 deployed in Sector 4
A730: 5.3 | B730: Raider 1 deployed in Sector 3
A731: 5.3 | B731: Raider 2 deployed in Sector 3
A732: 5.3 | B732: Raider 3 deployed in Sector 3
A733: 5.3 | B733: Raider 4 deployed in Sector 4
A734: 5.3 | B734: Raider 5 deployed in Sector 4
A735: 5.3 | B735: Viper 5 deployed in Sector 6
A736: 5.3 | B736: Viper 7 deployed in Sector 6
A737: 5.3 | B737: Civilian C deployed in Sector 5
A738: 5.3 | B738: Civilian D deployed in Sector 6
A739: 5.3 | B739: Civilian E deployed in Sector 6
A740: 5.3 | B740: Raiding Party: ships deployed
A741: 5.3 | B741: ************************************
A742: 5.4 | B742: ************************************
A743: 5.4 | B743: Beginning Round 5.4
A744: 5.4 | B744: Tom receives [color=orange]3 - Investigative Committee[/color]
A745: 5.4 | B745: Tom receives [color=#a52a2a]3 - Personal Vices[/color]
A746: 5.4 | B746: Tom moved to Caprica
A747: 5.4 | B747: SUPER CRISIS: Bomb on Colonial One
A748: 5.4 | B748: Destiny played [color=red]4 - Combat Veteran[/color] into skill check.
A749: 5.4 | B749: Destiny played [color=#a52a2a]4 - Violent Outbursts[/color] into skill check.
A750: 5.4 | B750: Karl played [color=purple]1 - Launch Scout[/color] into crisis.
A751: 5.4 | B751: Karl played [color=red]2 - Evasive Maneuvers[/color] into crisis.
A752: 5.4 | B752: Karl played [color=red]3 - Maximum Firepower[/color] into crisis.
A753: 5.4 | B753: Cottle played [color=purple]3 - Unorthodox Plan[/color] into crisis.
A754: 5.4 | B754: Cottle played [color=purple]3 - Strategic Planning[/color] into crisis.
A755: 5.4 | B755: Cottle played [color=purple]2 - Launch Scout[/color] into crisis.
A756: 5.4 | B756: Gaius played [color=#a52a2a]0 - Bait[/color] into crisis.
A757: 5.4 | B757: Athena played [color=red]4 - Maximum Firepower[/color] into crisis.
A758: 5.4 | B758: Athena played [color=red]5 - Maximum Firepower[/color] into crisis.
A759: 5.4 | B759: Lee played [color=red]5 - Launch Reserves[/color] into crisis.
A760: 5.4 | B760: Lee played [color=red]2 - Evasive Maneuvers[/color] into crisis.
A761: 5.4 | B761: Lee played [color=purple]1 - Launch Scout[/color] into crisis.
A762: 5.4 | B762: Tom played [color=red]0 - Dogfight[/color] into crisis.
A763: 5.4 | B763: Civilian F DEPLOYED in Sector 4
A764: 5.4 | B764: Assault Raptor 1 DESTROYED
A765: 5.4 | B765: ************************************
A766: 5.5 | B766: ************************************
A767: 5.5 | B767: Beginning Round 5.5
A768: 5.5 | B768: Karl receives [color=green]0 - All Hands On Deck[/color]
A769: 5.5 | B769: Karl receives [color=green]1 - Executive Order[/color]
A770: 5.5 | B770: Karl receives [color=purple]4 - Strategic Planning[/color]
A771: 5.5 | B771: Karl receives [color=purple]1 - Launch Scout[/color]
A772: 5.5 | B772: Karl receives [color=red]1 - Evasive Maneuvers[/color]
A773: 5.5 | B773: Cottle receives [color=red]1 - Evasive Maneuvers[/color]
A774: 5.5 | B774: Cottle receives [color=red]0 - Dogfight[/color]
A775: 5.5 | B775: Karl LAUNCHED Viper 8 into Sector 5
A776: 5.5 | B776: Karl PLAYED [color=green]1 - Executive Order[/color]
A777: 5.5 | B777: Civilian F MOVED to Sector 5
A778: 5.5 | B778: Karl receives 1 - Evasive Maneuvers from Cottle
A779: 5.5 | B779: Karl receives 0 - Dogfight from Cottle
A780: 5.5 | B780: CRISIS: Blindsided
A781: 5.5 | B781: Raider 4 & Raider 5 MOVED to Sector 5
A782: 5.5 | B782: Raider 1, Raider 2 & Raider 3 MOVED to Sector 4
A783: 5.5 | B783: Heavy 3 deployed in Sector 1
A784: 5.5 | B784: Heavy 4 deployed in Sector 4
A785: 5.5 | B785: Raider 6 deployed in Sector 2
A786: 5.5 | B786: Raider 7 deployed in Sector 2
A787: 5.5 | B787: Raider 8 deployed in Sector 2
A788: 5.5 | B788: Civilian G deployed in Sector 6
A789: 5.5 | B789: Civilian H deployed in Sector 6
A790: 5.5 | B790: Civilian I deployed in Sector 5
A791: 5.5 | B791: Blindsided: ships deployed
A792: 5.5 | B792: Raptor 3 DESTROYED
A793: 5.5 | B793: Basestar 2 DEPLOYED in Sector 4
A794: 5.5 | B794: ************************************
A795: 5.6 | B795: ************************************
A796: 5.6 | B796: Beginning Round 5.6
A797: 5.6 | B797: Cottle receives [color=orange]1 - Consolidate Power[/color]
A798: 5.6 | B798: Cottle receives [color=purple]0 - Quick Thinking[/color]
A799: 5.6 | B799: Cottle receives [color=purple]2 - Launch Scout[/color]
A800: 5.6 | B800: Cottle receives [color=blue]3 - Scientific Research[/color]
A801: 5.6 | B801: Cottle receives [color=blue]3 - Scientific Research[/color]
A802: 5.6 | B802: Cottle PLAYED [color=green]1 - Executive Order[/color]
A803: 5.6 | B803: Nuke launched
A804: 5.6 | B804: Karl PLAYED [color=purple]4 - Strategic Planning[/color]
A805: 5.6 | B805: Basestar 2 DESTROYED
A806: 5.6 | B806: Karl PLAYED [color=purple]1 - Launch Scout[/color]
A807: 5.6 | B807: CRISIS: Water Shortage (A)
A808: 5.6 | B808: Crisis Resistance moved to the bottom of the deck.
A809: 5.6 | B809: FOOD decreased to 6
A810: 5.6 | B810: Hangar Deck DAMAGED
A811: 5.6 | B811: Jump Prep track Set to Red 1
A812: 5.6 | B812: ************************************
A813: 6.1 | B813: ************************************
A814: 6.1 | B814: Beginning Round 6.1
A815: 6.1 | B815: Gaius receives [color=#a52a2a]5 - Exploit Weakness[/color]
A816: 6.1 | B816: Gaius receives [color=red]1 - Evasive Maneuvers[/color]
A817: 6.1 | B817: Gaius gives Loyalty card 'You are NOT a Cylon' to Karl
A818: 6.1 | B818: Heavy 1, Heavy 2 & Heavy 4 MOVED to Sector 5
A819: 6.1 | B819: Heavy 3 MOVED to Sector 6
A820: 6.1 | B820: Gaius moved to Cylon Fleet
A821: 6.1 | B821: ************************************
A822: 6.2 | B822: ************************************
A823: 6.2 | B823: Beginning Round 6.2
A824: 6.2 | B824: Athena receives [color=green]1 - Executive Order[/color]
A825: 6.2 | B825: Athena receives [color=green]1 - Executive Order[/color]
A826: 6.2 | B826: Athena receives [color=red]3 - Maximum Firepower[/color]
A827: 6.2 | B827: Athena moved to Hangar Deck
A828: 6.2 | B828: Athena PLAYED [color=blue]1 - Repair[/color]
A829: 6.2 | B829: Hangar Deck REPAIRED
A830: 6.2 | B830: CRISIS: Build Cylon Detector
A831: 6.2 | B831: Nuke launched
A832: 6.2 | B832: Heavy 1, Heavy 2 & Heavy 4 REMOVED from Board
A833: 6.2 | B833: Centurion 1 BOARDS Galactica
A834: 6.2 | B834: Centurion 2 BOARDS Galactica
A835: 6.2 | B835: Centurion 3 BOARDS Galactica
A836: 6.2 | B836: Heavy 3 REMOVED from Board
A837: 6.2 | B837: Centurion 4 BOARDS Galactica
A838: 6.2 | B838: ************************************
A839: 6.3 | B839: ************************************
A840: 6.3 | B840: Beginning Round 6.3
A841: 6.3 | B841: Lee receives [color=green]4 - Declare Emergency[/color]
A842: 6.3 | B842: Lee receives [color=green]1 - Executive Order[/color]
A843: 6.3 | B843: Lee receives [color=purple]0 - Quick Thinking[/color]
A844: 6.3 | B844: Lee receives [color=red]4 - Maximum Firepower[/color]
A845: 6.3 | B845: Lee receives [color=red]3 - Maximum Firepower[/color]
A846: 6.3 | B846: Athena receives [color=#a52a2a]0 - Dradis Contact[/color]
A847: 6.3 | B847: Lee moved to Armory
A848: 6.3 | B848: Lee PLAYED [color=green]1 - Executive Order[/color]
A849: 6.3 | B849: Athena moved to Armory
A850: 6.3 | B850: Athena PLAYED [color=blue]1 - Repair[/color]
A851: 6.3 | B851: Armory REPAIRED
A852: 6.3 | B852: Lee PLAYED [color=purple]3 - Strategic Planning[/color]
A853: 6.3 | B853: Centurion 4 DESTROYED
A854: 6.3 | B854: CRISIS: Tactical Strike
A855: 6.3 | B855: Karl PLAYED [color=red]1 - Evasive Maneuvers[/color]
A856: 6.3 | B856: Karl PLAYED [color=red]1 - Evasive Maneuvers[/color]
A857: 6.3 | B857: Basestar 2 deployed in Sector 6
A858: 6.3 | B858: Heavy 1 deployed in Sector 1
A859: 6.3 | B859: Raider 9 deployed in Sector 6
A860: 6.3 | B860: Raider 10 deployed in Sector 6
A861: 6.3 | B861: Raider 11 deployed in Sector 6
A862: 6.3 | B862: Raider 12 deployed in Sector 6
A863: 6.3 | B863: Raider 13 deployed in Sector 6
A864: 6.3 | B864: Civilian J deployed in Sector 3
A865: 6.3 | B865: Civilian K deployed in Sector 4
A866: 6.3 | B866: Civilian L deployed in Sector 5
A867: 6.3 | B867: Tactical Strike: ships deployed
A868: 6.3 | B868: Raider 1, Raider 2 & Raider 3 MOVED to Sector 5
A869: 6.3 | B869: Raider 6, Raider 7 & Raider 8 MOVED to Sector 1
A870: 6.3 | B870: ************************************
A871: 6.4 | B871: ************************************
A872: 6.4 | B872: Beginning Round 6.4
A873: 6.4 | B873: Tom receives [color=red]2 - Evasive Maneuvers[/color]
A874: 6.4 | B874: Tom receives [color=#a52a2a]0 - Dradis Contact[/color]
A875: 6.4 | B875: Athena PLAYED [color=red]1 - Evasive Maneuvers[/color]
A876: 6.4 | B876: Viper 5 DAMAGED
A877: 6.4 | B877: Viper 7 DAMAGED
A878: 6.4 | B878: Athena PLAYED [color=red]2 - Evasive Maneuvers[/color]
A879: 6.4 | B879: Viper 8 is Destroyed. Karl moves to Sickbay
A880: 6.4 | B880: Raider 6, Raider 7 & Raider 8 MOVED to Sector 6
A881: 6.4 | B881: ************************************
A882: 6.5 | B882: ************************************
A883: 6.5 | B883: Beginning Round 6.5
A884: 6.5 | B884: Karl receives [color=red]1 - Evasive Maneuvers[/color]
A885: 6.5 | B885: Karl moved to FTL Control
A886: 6.5 | B886: Karl PLAYED [color=green]2 - Executive Order[/color]
A887: 6.5 | B887: Lee receives [color=orange]2 - Consolidate Power[/color]
A888: 6.5 | B888: Lee PLAYED [color=orange]5 - Negotiation[/color]
A889: 6.5 | B889: Lee PLAYED [color=blue]5 - Test the Limits[/color]
A890: 6.5 | B890: Jump Prep track Set to Red 2
A891: 6.5 | B891: Cottle DISCARDED [color=purple]3 - Strategic Planning[/color]
A892: 6.5 | B892: CRISIS: Unidentified Ship
A893: 6.5 | B893: Unidentified Ship: Skill Check Initialized
A894: 6.5 | B894: Cottle PLAYED [color=blue]3 - Scientific Research[/color]
A895: 6.5 | B895: Destiny played [color=#a52a2a]3 - A Better Machine[/color] into skill check.
A896: 6.5 | B896: Destiny played [color=#a52a2a]0 - Dradis Contact[/color] into skill check.
A897: 6.5 | B897: Cottle played [color=purple]0 - Quick Thinking[/color] into crisis.
A898: 6.5 | B898: Cottle played [color=purple]2 - Launch Scout[/color] into crisis.
A899: 6.5 | B899: Cottle played [color=blue]3 - Scientific Research[/color] into crisis.
A900: 6.5 | B900: Gaius played [color=#a52a2a]5 - Exploit Weakness[/color] into crisis.
A901: 6.5 | B901: Athena played [color=red]3 - Maximum Firepower[/color] into crisis.
A902: 6.5 | B902: Lee played [color=purple]0 - Quick Thinking[/color] into crisis.
A903: 6.5 | B903: Lee played [color=red]3 - Maximum Firepower[/color] into crisis.
A904: 6.5 | B904: Lee played [color=red]4 - Maximum Firepower[/color] into crisis.
A905: 6.5 | B905: Tom played [color=#a52a2a]3 - Personal Vices[/color] into crisis.
A906: 6.5 | B906: Karl played [color=red]1 - Evasive Maneuvers[/color] into crisis.
A907: 6.5 | B907: Karl draws Mutiny Card: The Strong Survive
A908: 6.5 | B908: Gaius receives [color=#a52a2a]3 - A Better Machine[/color]
A909: 6.5 | B909: Gaius receives [color=#a52a2a]5 - Exploit Weakness[/color]
A910: 6.5 | B910: Destiny deck shuffled.
A911: 6.5 | B911: Destiny deck shuffled.
A912: 6.5 | B912: Destiny deck shuffled.
A913: 6.5 | B913: Raider 14 & Raider 15 DEPLOYED in Sector 1
A914: 6.5 | B914: Lee PLAYED [color=green]4 - Declare Emergency[/color]
A915: 6.5 | B915: ************************************
A916: 6.6 | B916: ************************************
A917: 6.6 | B917: Beginning Round 6.6
A918: 6.6 | B918: Cottle receives [color=orange]2 - Consolidate Power[/color]
A919: 6.6 | B919: Cottle receives [color=purple]2 - Launch Scout[/color]
A920: 6.6 | B920: Cottle receives [color=purple]1 - Launch Scout[/color]
A921: 6.6 | B921: Cottle receives [color=blue]4 - Scientific Research[/color]
A922: 6.6 | B922: Cottle receives [color=blue]1 - Repair[/color]
A923: 6.6 | B923: Cottle PLAYED [color=green]2 - Executive Order[/color]
A924: 6.6 | B924: Karl plays Mutiny Card: The Strong Survive
A925: 6.6 | B925: Mutiny Card: The Strong Survive removed from the game.
A926: 6.6 | B926: Civilian C DESTROYED
A927: 6.6 | B927: POPULATION decreased to 8
A928: 6.6 | B928: Jump Prep track Set to Blue(-3)
A929: 6.6 | B929: POPULATION decreased to 7
A930: 6.6 | B930: POPULATION decreased to 6
A931: 6.6 | B931: POPULATION decreased to 5
A932: 6.6 | B932: Remote Planet moved to the bottom of the destination deck.
A933: 6.6 | B933: Jumping the fleet - removing ships from the board...
A934: 6.6 | B934: 9 Civilians removed from the board
A935: 6.6 | B935: 2 Basestars removed from the board
A936: 6.6 | B936: 15 Raiders removed from the board
A937: 6.6 | B937: 1 Heavy Raider removed from the board
A938: 6.6 | B938: Jump Prep track Set to Start
A939: 6.6 | B939: FUEL decreased to 2
A940: 6.6 | B940: Fuel reduced by 1
A941: 6.6 | B941: The Fleet jumps to Tylium Planet (Distance 1) - Total distance now 8
A942: 6.6 | B942: CRISIS: Abandon Galactica
A943: 6.6 | B943: FOOD decreased to 5
A944: 6.6 | B944: Jump Prep track Set to Red 1
A945: 6.6 | B945: Karl receives [color=#a52a2a]4 - Violent Outbursts[/color]
A946: 6.6 | B946: Karl receives [color=#a52a2a]3 - A Better Machine[/color]
A947: 6.6 | B947: Treachery deck shuffled.
A948: 6.6 | B948: ************************************
A949: 7.1 | B949: ************************************
A950: 7.1 | B950: Beginning Round 7.1
A951: 7.1 | B951: Gaius receives [color=red]2 - Evasive Maneuvers[/color]
A952: 7.1 | B952: Gaius receives [color=#a52a2a]5 - Exploit Weakness[/color]
A953: 7.1 | B953: Gaius moved to Caprica
A954: 7.1 | B954: CRISIS: Dangerous Plots
A955: 7.1 | B955: Crisis Water Shortage (B) moved to the bottom of the deck.
A956: 7.1 | B956: MORALE decreased to 4
A957: 7.1 | B957: Jump Prep track Set to Red 2
A958: 7.1 | B958: ************************************
A959: 7.2 | B959: ************************************
A960: 7.2 | B960: Beginning Round 7.2
A961: 7.2 | B961: Athena receives [color=green]3 - Declare Emergency[/color]
A962: 7.2 | B962: Athena receives [color=red]3 - Combat Veteran[/color]
A963: 7.2 | B963: Athena receives [color=blue]2 - Repair[/color]
A964: 7.2 | B964: Athena moved to Command
A965: 7.2 | B965: Athena PLAYED [color=green]1 - Executive Order[/color]
A966: 7.2 | B966: Karl PLAYED [color=purple]1 - Launch Scout[/color]
A967: 7.2 | B967: CRISIS: Rescue the Fleet
A968: 7.2 | B968: Crisis An Ambitious Operation moved to the bottom of the deck.
A969: 7.2 | B969: MORALE decreased to 3
A970: 7.2 | B970: Basestar 1 DEPLOYED in Sector 1
A971: 7.2 | B971: Raider 1, Raider 2 & Raider 3 DEPLOYED in Sector 1
A972: 7.2 | B972: Civilian D, Civilian E & Civilian F DEPLOYED in Sector 4
A973: 7.2 | B973: Raider 1, Raider 2 & Raider 3 MOVED to Sector 2
A974: 7.2 | B974: Jump Prep track Set to Blue(-3)
A975: 7.2 | B975: ************************************
A976: 7.3 | B976: ************************************
A977: 7.3 | B977: Beginning Round 7.3
A978: 7.3 | B978: Lee receives [color=green]1 - Executive Order[/color]
A979: 7.3 | B979: Lee receives [color=green]4 - Declare Emergency[/color]
A980: 7.3 | B980: Lee receives [color=purple]1 - Launch Scout[/color]
A981: 7.3 | B981: Lee receives [color=red]1 - Evasive Maneuvers[/color]
A982: 7.3 | B982: Lee receives [color=red]1 - Evasive Maneuvers[/color]
A983: 7.3 | B983: Lee moved to FTL Control
A984: 7.3 | B984: Athena receives [color=#a52a2a]0 - Bait[/color]
A985: 7.3 | B985: POPULATION decreased to 4
A986: 7.3 | B986: POPULATION decreased to 3
A987: 7.3 | B987: POPULATION decreased to 2

Sheet: Reference
A1: LOCATIONS REFERENCE
A2: Galactica | B2: FTL Control | I2: Action: Jump the fleet if the Jump Preparation track is not in the red zone.* * Might lose population.
A3: Galactica | B3: Weapons Control | I3: Action: Attack 1 Cylon ship with Galactica.
A4: Galactica | B4: Command | I4: Action: Activate up to 2 unmanned vipers.
A5: Galactica | B5: Communications | I5: Action: Look at the back of 2 civilian ships. You may then move them to adjacent area(s).
A6: Galactica | B6: Admiral's Quarters | I6: Action: Choose a character, then pass this skill check to send him to the "Brig." | J6: 7 - GP
A7: Galactica | B7: Research Lab | I7: Action: Draw 1 engineering or 1 tactics Skill Card.
A8: Galactica | B8: Hangar Deck | I8: Action: Launch yourself in a viper. You may then take 1 more action.
A9: Galactica | B9: Armory | I9: Action: Attack a centurion on the Boarding Party track (destroyed on roll of 7-8).
A10: Galactica | B10: Sickbay | I10: You may only draw 1 Skill Card during your Receive Skills step.
A11: Galactica | B11: Brig | I11: You may not move, draw Crisis Cards, or add more than 1 card to skill checks. Action: Pass this skill check to move to any location. | J11: 7 - YP
A12: Colonial One | B12: Press Room | F12: Original | I12: Action: Draw 2 politics Skill Cards.
F13: Daybreak | I13: Action: Choose another Player to draw 1 Mutiny Card. (He does not move to the "Brig.") He keeps 1 of his Mutiny Cards and discards the rest. You may then discard a Mutiny Card.
A14: Colonial One | B14: President's Office | F14: Original | I14: Action: If you are the President, draw 1 Quorum Card. You may then draw 1 additional Quorum Card or play 1 from your hand.
F15: Daybreak | I15: Action: Draw 2 politics Skill Cards.
B16: Administration | F16: Original | I16: Action: Choose a character, then pass this skill check to give him the President title. | J16: 5 YG
F17: Daybreak | I17: Action: Draw 1 Mutiny Card. If the President has any Mutiny Cards, choose a Player to gain the President Title. If the "Accept Prophecy" card is in play, the President may discard it to keep his Title.
A18: Colonial One | B18: Quorum Chamber | F18: Daybreak | I18: Action: If you are the President, draw 1 Quorum Card. You may then draw 1 additional Quorum Card or play 1 from your hand.
A19: Cylon Locations | B19: Caprica | F19: Original | I19: Action: Play your Super Crisis Card or draw 2 Crisis Cards, choose 1 to resolve, and discard the other.* * No Activate Cylon Ships or Prepare for Jump steps.
F20: Pegasus / Daybreak | I20: Action: Play 1 of your Super Crisis Cards or draw 2 Crisis Cards, choose 1 to resolve, and place the other on the bottom of the deck.* * No Activate Cylon Ships step.
B21: Cylon Fleet | I21: Action: Activate all Cylon ships of one type, or launch 2 raiders and 1 heavy raider from each basestar.
B22: Human Fleet | F22: Original | I22: Action: Look at any player's hand, and steal 1 Skill Card (place it in your hand). Then roll a die, and if 5 or higher, damage Galactica.
F23: Pegasus / Daybreak | I23: Action: Look at the top card of the Crisis or Destination deck and place it on the top or bottom of that deck. Then draw 2 Skill Cards of different types (may come from outside your Skill set). Or Infiltrate Galactica.
B24: Resurrection Ship | F24: Original | I24: Action: You may discard your Super Crisis Card to draw a new one. Then, if distance is 7 or less, give your unrevealed Loyalty Card(s) to any other player.
F25: Pegasus / Daybreak | I25: You draw only 1 Skill Card during your Receive Skill Cards step. Action: Draw 1 Super Crisis Card.
B26: Basestar Bridge | F26: Exodus | I26: Action: Choose 2 of the following abilities (must be 2 different ones): -The CAG must place 1 civilian ship (following all placement rules) -Place 1 Basestar or 3 Raiders in any 1 area on the Cylon Fleet board -Roll a die: 1-3: Decrease the Jump Prep track by 1; 4-8: Increase the Pursuit track by 1 -Roll a die: If the result is less than the number of raiders on the main game board, draw 2 Galactica Damage tokens and choose 1 to resolve.
B27: Hub Destroyed | F27: Daybreak | I27: During your Draw Skills step, discard all of your Super Crisis Cards and do not draw Skill Cards. Action: Discard 3 Skill cards to Draw 1 Super Crisis Card and move to the "Cylon Fleet" location.
A28: Pegasus | B28: Pegasus CIC | I28: Action: Choose a basestar and roll a die: 1-3: Damage Pegasus; 4-6: Damage basestar; 7-8: Damage basestar twice
B29: Airlock | I29: Action: Choose a character and pass this Skill check to execute him. Reduce the difficulty of this check by 4 if the character is in the Brig. | J29: 5 - YG
B30: Main Batteries | I30: Action: Choose a space area to affect and roll a die: 1: Destroy 1 civilian ship; 2-3: Damage 1 viper; 4-6: Destroy 2 raiders; 7-8: Destroy 4 raiders
B31: Engine Room | I31: Action: Discard 2 Skill Cards to treat the next Crisis Card drawn this turn as if it had a Prepare for Jump Icon.
A32: New Caprica (Pegasus) | B32: Attack Occupation Forces | I32: Human Action: Roll a die. If 5 or higher, destroy an occupation force on your location. You may discard a Maximum Firepower Skill Card to reroll this die roll.
B33: Detain a Human | I33: Cylon Action: If you are in a location containing a human character and an occupation force, roll a die: 1-3: Move the human to Detention; 4-7: Move the human to the Medical Center.
B34: Resistance HQ | I34: Human Action: Choose a character on NC (human or Cylon), then pass this check to execute him. | J34: 7 GPO
B35: Occupation Authority | I35: Human Action: If you are the President, you may draw 1 Quorum Card. Then you may play 1 Quorum Card. Cylon Action: Activate 1 occupation force and then place 1 occupation force on this location.
B36: Breeder's Canyon | I36: Human Action: Reduce the highest resource by 1 to advance the fleet marker 1 space up the Jump track. Cylon Action: Draw and resolve the top card of the Crisis deck. Skip the Prepare for Jump step
B37: Shipyard | I37: Human Action: Prepare or evacuate 1 civilian ship. If you evacuate, you may then move to any Galactica location. Cylon Action: Look at the top of the Locked stack, and place it on the top or bottom of the stack.
B38: Medical Center | I38: You may only draw 1 Skill Card during your Receive Skills step.
B39: Detention | I39: You may not move or add more than 2 cards to Skill checks. Action: Pass this Skill check to move to any location.
A40: The Demetrius (Daybreak) | B40: Bridge | I40: Action: If there is no Mission on the Active Mission space, Activate the top card of the Mission Deck. Do not draw a Crisis Card this turn.
A41: Cylon Location | B41: Tactical Plot | I41: Action: Look at the top card of the Mission deck and place it on the top or bottom of the deck.
A42: Cylon Location | B42: Captain's Cabin | I42: Action: Choose a Skill type (it may be from outside your Skill Set). Each Player (including Cylon Players), draws 1 Skill Card of that type.
A43: Cylon Location | B43: Active Mission | I43: When the Fleet Jumps: If this card is faceup and has a Distance number on it, place it next to the Earth Objective card. If this card is faceup and does not have a Distance number, discard it. If this card is facedown, reshuffle it into the Mission deck.
A44: Rebel Basestar (Daybreak) | B44: Hybrid Tank | I44: Action: Discard a Miracle token or a Super Crisis card to look at the top 5 cards of the Crisis Deck. Then, place them on the top of the deck in the order of your choosing.
B45: Datastream | I45: Action: Discard a Miracle token or a Super Crisis card to search 1 Skill deck and its discard pile for any 3 cards. Then add those cards to your hand and shuffle the discard pile into the deck.
B46: Raider Bay | I46: Action: Discard a Miracle token or a Super Crisis card to choose a Space Area. Place either 2 Raiders or 4 Vipers in this area and immediately Activate them.
A48: CHARACTER REFERENCE
A49: Name | B49: Politics | C49: Leadership | D49: Tactics | E49: Piloting | F49: Engineering | G49: Treachery | H49: Faith | I49: Abilities | J49: Starting Location | K49: Game | L49: President | M49: Admiral | N49: CAG | O49: BGG Card Image ID | P49: BGG Cylon Card Image ID | Q49: BGG Sympathizer Card Image ID | R49: Banner ID | S49: Cylon Banner ID | T49: President Banner ID | U49: Admiral Banner ID | V49: CAG Banner ID | W49: Alternate Banner ID | X49: Alternate Cylon Banner ID
A50: Adama | C50: 3 | D50: 2 | I50: Inspirational Leader: When you draw a Crisis Card all 1 strength Skill Cards count positive for the skill check. Command Authority: Once per game, after resolving a skill check, instead of discarding the used Skill Cards, draw them into your hand. Emotionally Attached: You may not activate the 'Admiral's Quarters' location. | J50: Admiral's Quarters | K50: B | L50: 12 | M50: 2 | N50: 13 | O50: 456785 | P50: 664765 | R50: 544211 | S50: 551658 | T50: 1302932 | U50: 1263070 | V50: 1263088
A51: Apollo | B51: 0.2 | C51: 0.2 | D51: 1 | E51: 2 | I51: Alert Viper Pilot: When a viper is placed in a space area from the 'Reserves', you may choose to pilot it and take 1 action. You may only do this when you are on a Galactica location, excluding the brig. CAG - Action: Once per game, you may activate up to 6 unmanned vipers. Headstrong: When you are forced to discard skill cards you must discard randomly | J51: Sector 5 / Sector 6 | K51: B | L51: 9 | M51: 10 | N51: 1 | O51: 456784 | P51: 664759 | R51: 544204 | S51: 551665 | T51: 1263108 | U51: 1263072 | V51: 1263090 | W51: 762824
A52: Baltar | B52: 2 | C52: 1 | F52: 1 | I52: Delusional Intuition: After you draw a Crisis Card, draw 1 Skill Card of your choice. (It may be from outside your skill set.) Cylon Detector - Action: Once per game, you may look at all Loyalty Cards belonging to another player. Coward: You start the game with 2 Loyalty Cards (instead of 1). | J52: Research Lab | K52: B | L52: 2 | M52: 27 | N52: 27 | O52: 459265 | P52: 664757 | R52: 544202 | S52: 551652 | T52: 1263109 | U52: 1263073 | V52: 1263091
A53: Boomer | D53: 2 | E53: 2 | F53: 1 | I53: Recon: At the end of your turn, you may look at the top card of the Crisis Deck and place it on the top or bottom. Mysterious Intuition: Once per game, before resolving a skill check on a Crisis Card, choose the result (Pass or Fail), instead of resolving it normally. Sleeper Agent: During the Sleeper Agent Phase, you are dealt 2 Loyalty Cards (instead of 1) and then moved to the 'Brig' location. | J53: Armory | K53: B | L53: 25 | M53: 15 | N53: 5 | O53: 456789 | P53: 664760 | R53: 544206 | S53: 551655 | T53: 1263110 | U53: 1263074 | V53: 1263092
A54: Chief | B54: 1 | C54: 2 | F54: 2 | I54: Maintenance Engineer: During your turn, after you use a 'Repair' skill card, you may take another action (once/turn). Blind Devotion: Once per game, after cards have been added to a Skill Check (but before revealing them), you may choose a skill type. All cards of the chosen type are considered strength 0. Reckless: Your hand limit is 8 (instead of 10). | J54: Hangar Deck | K54: B | L54: 14 | M54: 20 | N54: 21 | O54: 459266 | P54: 664764 | R54: 544210 | S54: 551664 | T54: 1263113 | U54: 1263077 | V54: 1263095
A55: Helo | C55: 2 | D55: 2 | E55: 1 | I55: ECO Officer: During your turn, you may re-roll a die that was just rolled (once per turn). You must use the new result. Moral Compass: Once per game, after a player makes a choice on a Crisis Card, you may change it. Stranded: Your character is not placed on the game board at the start of the game. Whilst not on the game board you may not move, be moved, or take actions. At the start of your 2nd turn, place your character on the 'Hanger Deck' location. | J55: Stranded on Caprica | K55: B | L55: 13 | M55: 6 | N55: 10 | O55: 456787 | P55: 664761 | R55: 544207 | S55: 551660 | T55: 1263117 | U55: 1263081 | V55: 1263099 | W55: 906068
A56: Roslin | B56: 3 | C56: 2 | I56: Religious Visions : When you draw Crisis Cards, draw 2 and choose 1 to resolve. Place the other on the bottom of the deck. Skilled Politician Action: Once per game, draw 4 Quorum Cards. Choose 1 to resolve and place the rest on the bottom of the deck. You do not need to be President to use this ability. Terminal Illness : In order to activate a location you must first discard 2 Skill Cards. | J56: President's Office | K56: B | L56: 1 | M56: 30 | N56: 31 | O56: 456786 | P56: 664763 | Q56: 562779 | R56: 544209 | S56: 551661 | T56: 1248698 | U56: 1263083 | V56: 1263101 | W56: 1054002 | X56: 1073866
A57: Starbuck | C57: 0.1 | D57: 2 | E57: 2 | F57: 0.1 | I57: Expert Pilot: When you start your turn piloting a viper, you may take 2 actions during your Action Step (instead of 1). Secret Destiny: Once per game, immediately after a Crisis Card is revealed, discard it and draw a new one. Insubordinate: When a player chooses you with the ' Admiral's Quarters' location, reduce the difficulty by 3. | J57: Hangar Deck | K57: B | L57: 31 | M57: 13 | N57: 2 | O57: 459267 | P57: 664748 | R57: 544208 | S57: 551657 | T57: 1270646 | U57: 1270645 | V57: 1263102
A58: Tigh | C58: 2 | D58: 3 | I58: Cylon Hatred: When a player activates the 'Admiral's Quarters' location, you may choose to reduce the difficulty by 3. Declare Martial Law - Action: Once per game, give the President title to the Admiral. Alcoholic: At the start of any player's turn, if you have exactly 1 Skill Card in your hand you must discard it. | J58: Command | K58: B | L58: 26 | M58: 3 | N58: 15 | O58: 459268 | P58: 664762 | R58: 544203 | S58: 551654 | T58: 1263120 | U58: 1263085 | V58: 1263103
A59: Zarek | B59: 2 | C59: 2 | D59: 1 | I59: Friends In Low Places: When a player activates the 'Administration' or the 'Brig' location, you may choose to reduce or increase the difficulty by 2. Unconventional Tactics - Action: Once per game, lose 1 population to gain 1 of any other resource type. Convicted Criminal: You may not activate locations occupied by other characters (except the 'Brig') | J59: Administration | K59: B | L59: 4 | M59: 24 | N59: 24 | O59: 456783 | P59: 664758 | R59: 544205 | S59: 551656 | T59: 1263122 | U59: 1263087 | V59: 1263105
A60: Cain | C60: 2.1 | D60: 2.1 | I60: Intolerant: When an "Admiral's Quarters" Skill check is passed with a 10 or more, you may choose to execute that character instead of sending him to the "Brig." Blind Jump - Action: Once per game, if at 6 or less distance, draw 2 civilian ships and destroy them to immediately jump the fleet (even if the fleet marker is on a red space). The Admiral only draws 1 Destination Card. Bent on Revenge: You may not activate the "FTL Control" or "Engine Room" locations. | J60: Pegasus CIC / Command | K60: P | L60: 20 | M60: 1 | N60: 14 | O60: 868412 | P60: 868413 | R60: 544871 | S60: 551659 | T60: 1263111 | U60: 1263075 | V60: 1263093 | W60: 1053998
A61: Dee | C61: 1 | D61: 3 | F61: 1 | I61: Efficient: When you activate the "Communications" location, you may look at every civilian ship on the game board and may move any number of them. Fast Learner: Once per game, before making a Skill check, look at the top 3 cards of any Skill deck (even outside your Skill set), and add all of them to either the Skill check or your hand. Emotionally Fragile: When morale is reduced to 2 or less, you are executed. If you are human, do not lose 1 morale. | J61: Communications | K61: P | L61: 21 | M61: 11 | N61: 18 | O61: 908973 | P61: 908972 | R61: 544872 | S61: 551666 | T61: 1263114 | U61: 1263078 | V61: 1263096
A62: Ellen | B62: 2 | C62: 2 | G62: 1 | I62: Politically Adroit: When you end your Movement step in the same location as another human player, you may give that player 1 Skill Card from your hand to draw 2 Skill Cards. Manipulative: Once per game, you may take the Admiral or President title at the start of your turn. Return that title to its previous owner at the end of your turn. Nothing But Trouble: Your Skill set includes Treachery. (Human players can't use text abilities of Treachery Cards.) | J62: Admiral's Quarters | K62: P | L62: 8 | M62: 25 | N62: 25 | O62: 908975 | P62: 908974 | R62: 544875 | S62: 551662 | T62: 1263115 | U62: 1263079 | V62: 1263097
A63: Kat | C63: 1 | D63: 2 | E63: 2 | I63: Hotshot: When you would roll a die during your Action step, you may instead discard a Skill Card. Use the card's strength +2 instead of the die roll. Sacrifice - Action: Once per game while piloting a viper, send yourself to "Sickbay" to destroy 5 raiders, 2 heavy raiders, 1 basestar, or 1 civilian ship in your space area. Stim Junkie: At the end of your Action step, if you are in the same location or space area that you were in at the start of your turn, you are moved to "Sickbay." | J63: Hangar Deck | K63: P | L63: 32 | M63: 14 | N63: 3 | O63: 908979 | P63: 908978 | R63: 544873 | S63: 551668 | T63: 1263118 | U63: 1263082 | V63: 1263100 | W63: 1054001
A64: Cavil | D64: 1 | F64: 0.1 | G64: 0.1 | I64: Primacy - Action: Place 1 basestar in front of Galactica, or if all basestars are in play, you may remove 1 from the game board. You may then place 3 raiders in front of Galactica and 1 civilian ship behind Galactica. Aggressive Tactics - Movement: Once per game you may take 2 Actions. Lies and Secrets: When a player reveals a "You are a Cylon" Loyalty Card, you must discard all Skill Cards in your hand. | J64: Cylon Fleet | K64: P | L64: 99 | M64: 99 | N64: 99 | O64: 868411 | P64: 878337 | R64: 544870 | S64: 511663
A65: Leoben | B65: 1 | F65: 0.1 | G65: 0.1 | I65: Glimpse the Face of God - Movement: Draw 2 cards from the top of the Destiny deck, then place 2 cards from your hand on the top of the Destiny deck. Cryptic Message - Action: Once per game, exchange your hand of Skill Cards with another player's hand of Skill Cards. Clouded: You may not voluntarily move to a location that contains another character. | J65: Human Fleet | K65: P | L65: 99 | M65: 99 | N65: 99 | O65: 878336 | P65: 878338 | R65: 544874 | S65: 551653
A66: Six | C66: 1 | F66: 0.1 | G66: 0.1 | I66: Intimate - Movement: Draw 1 Skill Card at random from a player's hand. Then, that player draws 1 card from the Skill deck of your choice (it may be from outside his Skill set). Human Delusion: Once per game, after all Skill Cards played into a Skill check have been revealed, you may play any number of Skill Cards from your hand into the check. Conflicted Loyalties: You must discard 1 Skill Card to activate the "Cylon Fleet" location | J66: Caprica | K66: P | L66: 99 | M66: 99 | N66: 99 | O66: 878339 | P66: 878335 | R66: 544876 | S66: 551667
A67: Anders | C67: 2 | D67: 2.1 | E67: 0.1 | I67: Star Player Action: Discard any number of Skill Cards. Then draw that number of Skill Cards from any one type within your skill set. Longshot: Once per game, you may choose the result of a die roll on your turn instead of rolling it. This result cannot be modified or rerolled. Starts on the Bench: Skip the Receive Skills Step of your first turn | J67: Armory | K67: E | L67: 30 | M67: 18 | N67: 8 | O67: 908969 | P67: 908968 | R67: 878727 | S67: 878728 | T67: 1263107 | U67: 1263071 | V67: 1263089
A68: Cally | B68: 1 | C68: 1 | D68: 1 | F68: 2 | I68: Quick Fix: On your turn, once all Skill Cards played into a skill check have been revealed, you may choose 1 card to discard before resolving skill check abilities and totalling strength Discharge of a Firearm Action: Once per game, you may execute another character who is in your current location. Impuslive: You cannot contribute only 1 Skill Card into a skill check. You must either contribute no Skill Cards or contribute 2 or more Skill Cards. (Disregard this while you are in the Brig.) | J68: Hangar Deck | K68: E | L68: 16 | M68: 21 | N68: 22 | O68: 908971 | P68: 908970 | R68: 878729 | S68: 878730 | T68: 1263112 | U68: 1263076 | V68: 1263094 | W68: 1053999 | X68: 1073865
A69: Gaeta | B69: 0.2 | C69: 0.2 | D69: 2 | F69: 1 | I69: FTL Operator: Anytime FTL Control is activated, you may reroll the die. You must use the new result. Coup Action: Once per game, you may take the Admiral title. If you are in the Brig when you take this action, move immediately to Command before taking the title. Misguided: You may not play more than 3 cards into any skill check | J69: FTL Control | K69: E | L69: 11 | M69: 7 | N69: 17 | O69: 908977 | P69: 908976 | R69: 878731 | S69: 878732 | T69: 1263116 | U69: 1263080 | V69: 1263098 | W69: 1054000
A70: Tory | B70: 3 | C70: 1 | D70: 1 | I70: Adaptable: After any player uses the action on a Quorum Card, you may draw 2 Skill Cards of your choice (they may be from outside your skill set). Influential Action: Once per game, you may examine the top 5 cards of the Quorum deck, and return them to the top of the deck in any order you choose (even if you are not currently the President). Amoral: When you are the current player, you must choose the first option listed on any Crisis Cards that say Current Player Chooses. | J70: Press Room | K70: E | L70: 6 | M70: 29 | N70: 28 | O70: 908967 | P70: 908980 | R70: 878733 | S70: 878734 | T70: 1263121 | U70: 1263086 | V70: 1263104
A71: Cottle | B71: 1 | D71: 2 | F71: 2 | I71: Treatment Action: Choose a Human Player and draw 2 Skill Cards from his Skill Set. Then, give him two Skill Cards from your hand. Quarantine Action: Once per game, look at each Civilian Ship on the board. Choose 1 and draw a new Civilian ship to replace it if possible. Shuffle the chosen ship back into the pile of unused Civilian Ships. Specialized: You cannot use the Actions printed on Engineering Skill Cards. | J71: Research Lab | K71: D | L71: 17 | M71: 22 | N71: 23
A72: Hoshi | C72: 2 | D72: 2 | F72: 1 | I72: Dutiful: Once during your turn, if you Activate Command, Communications, or Weapons Control, you may discard 1 Skill Card to immediately Activate that Location again. Organized Action: Once per game, if you are not in the Brig, Activate any three undamaged Locations, regardless of where you are. You cannot Activate the same Location more than once nor any Cylon Locations. Reluctant: You must discard 1 Skill Card to use an Action printed on a Skill Card. | J72: Communications | K72: D | L72: 22 | M72: 8 | N72: 19
A73: Hot Dog | C73: 1 | D73: 1 | E73: 2 | F73: 1 | I73: Memento: Once per turn, immediately after Population is reduced, you may draw the top 3 cards from the Piloting deck, discard 1 of them, and keep the other 2 cards. Escort: Once per game, before flipping over a Civilian Ship in a space area and destroying it, you may destroy an undamaged Viper instead. Shuffle the Civilian Ship back into the pile of unused Civilian Ships. Forced to Eject: Any time a Viper you are piloting is damaged, destroy it instead. | J73: Hangar Deck | K73: D | L73: 29 | M73: 16 | N73: 6
A74: Lampkin | B74: 3 | D74: 2 | I74: Deceitful: When a Crisis Card requires you to discard Skill Cards, reduce the number of cards you discard by 1 (once per Crisis Card). Attorney Action: Once per game, move a Character in the Brig to any non-Hazardous Location on Galactica. If he belongs to another Player, take all of that Player's Skill Cards. Kleptomania: If you end your Movement Step in a Location with another Player, you must discard 2 Skill Cards. If you cannot, you are sent to the Brig at the end of your turn. | J74: Administration | K74: D | L74: 5 | M74: 28 | N74: 29
A75: D'Anna | B75: 0.1 | C75: 0.1 | F75: 0.1 | G75: 0.1 | I75: Visions Action: If you are Infiltrating, choose a Human Player and look at 1 of his Loyalty Cards at random. Then, end your Infiltration and move to the Resurrection Ship. Don't Trust Anyone Action: Once per game, draw 2 Super Crisis Cards. Heretic: If you are on the Resurrection Ship Location (but not the Hub Destroyed Location), you must discard a Super Crisis Card to move to a different Location. | J75: Human Fleet | K75: D | L75: 99 | M75: 99 | N75: 99
A76: Simon | D76: 0.1 | F76: 1 | G76: 0.1 | I76: Calculating: You may contribute 2 Skill Cards to Skill Checks, or 3 Skill Cards while you are Infiltrating. Ignore this ability when you are in the Brig. Modifications: Once per game, at the start of a Player's Activate Cylon Ships step, either choose a Cylon Ship type to Activate or Launch Raiders. Ignore any Activate Cylon Ships icons on the bottom of the Crisis Card. Logic Bound: When you play any Skill Cards into a Skill Check, you must play 1 face up. | J76: Cylon Fleet | K76: D | L76: 99 | M76: 99 | N76: 99
A77: Doral | B77: 0.1 | D77: 0.1 | G77: 1 | I77: Industrious: While Infiltrating, draw 2 extra Skill Cards on your turn instead of 1. Ignore this ability while you are in Sickbay. Meticulous: Once per game, when you use an Action to end your Infiltration, you may move to any Cylon Location and take another Action instead of moving to the Resurrection Ship. Vanity: You cannot contribute to Skill Checks during another Player's Action Step. | J77: Caprica | K77: D | L77: 99 | M77: 99 | N77: 99
A78: Athena | C78: 0.1 | E78: 1 | F78: 0.1 | I78: For Love: Once per turn, when another Player must discard 1 or more Skill Cards (except when discarding down to his hand limit), you may draw 1 Treachery Skill Card to reduce the number of cards he discards by 1. Resolute Action: Once per game, activate any undamaged Location. Grieving: When you are in a Hazardous Location, you cannot draw Skill Cards during your Receive Skills or Draw Skills step. | J78: Hangar Deck | K78: D | L78: 99 | M78: 99 | N78: 99
A79: Gaius | B79: 2 | C79: 2 | F79: 1 | I79: Cult Leader Action: Choose a Player in the same Location as you and either give him one of your Miracle Tokens or take his Miracle Token. Broadcast Action: Discard 3 Miracle Tokens to raise any Resource by 2. You can have up to 3 Miracle Tokens. Spiritual Crisis: You cannot use an Action printed on a You Are a Cylon Loyalty Card unless you are in the Brig. | J79: Admiral's Quarters | K79: D | L79: 15 | M79: 26 | N79: 26
A80: Karl | C80: 2 | D80: 2 | E80: 1 | I80: Raptor Pilot: When you look at the top card as a result of the Launch Scout Skill Card, look at the top 2 cards instead and, in the order of your choosing, place each card on the top or bottom of the deck. No One Gets Left Behind: Once per game, during the Remove Ships step of Jumping the Fleet, lose 1 Fuel to gain 2 Population. Family Commitments: If you are not on Galactica, draw 1 fewer Skill Card during your Receive Skill Step. | J80: Admiral's Quarters | K80: D | L80: 23 | M80: 12 | N80: 4
A81: Lee | B81: 0.2 | C81: 0.2 | D81: 1 | E81: 2 | I81: Forward Thinker: After you use an Executive Order Skill Card and the chosen player has finished moving and taking Actions, you may Activate your current Location. Choose a Different Path: Once per game, when you must make a choice on a Crisis Card, you may choose to have the result be The Current Player discards 5 Skill Cards. Moral Dilemma: When you draw a Mutiny Card, you must discard 2 Skill Cards. | J81: Admiral's Quarters | K81: D | L81: 3 | M81: 23 | N81: 9
A82: Tom | B82: 2 | C82: 2 | D82: 1 | I82: Necessary Steps: Each time a Player draws a Mutiny Card, you instead look at the top 2 cards of the Mutiny Deck, give 1 to that Player, and place the other on the bottom of the deck. Abuse Power Action: Once per game, draw 4 Mutiny Cards. Choose 1 of them to play and place the other 3 Mutiny Cards on the bottom of the deck. Ignore your Necessary Steps ability and do not move to the Brig. Disreputable: You start the game with 1 Mutiny Card. | J82: Weapons Control | K82: D | L82: 10 | M82: 9 | N82: 20
A83: Elosha | B83: 2 | C83: 1 | H83: 1 | I83: Spiritual Advisor: On your turn, before making a Skill Check, you may look at the top 2 cards of the Destiny Deck and place them back on top. You may then choose to reshuffle the Destiny Deck. All This Has Happened Before Action: Once per game, you may discard 3 random Skill Cards to look through the discarded Crisis Cards, choose 1 of them, and place it on top of the Crisis Deck. Will Not Fight: You only draw 4 Skill Cards during your Receive Skills Step. | J83: President's Office | K83: R | L83: 7 | M83: 31 | N83: 30
A84: Kelly | C84: 3 | D84: 1 | F84: 1 | I84: Landing Signals Officer: Whenever a Viper in space would be activated on your turn, you may move that Viper to an adjacent space area immediately prior to activation. Clash with Centurions Action: Once per game, damage an occupied location on Galactica to destroy up to two Centurions on the Boarding Party track. Ruthless: All Skill Checks on your turn are considered Reckless, even if no Reckless Skill Cards are played. | J84: Command | K84: R | L84: 27 | M84: 5 | N84: 11
A85: Racetrack | C85: 1 | D85: 2 | E85: 2 | I85: Expert Raptor Pilot: When a Raptor is risked by a die roll, you may reroll the die. You must keep the new result. Critical Discovery Action: Once per game you may look at the top four cards of the Destination Deck. Place two on the top of the deck, and two on the bottom. Mutineer: If the President or Admiral Reveal as a Cylon, you are sent to the Brig. | J85: Hangar Deck | K85: R | L85: 24 | M85: 17 | N85: 7
A86: Seelix | C86: 0.1 | D86: 2 | E86: 0.1 | F86: 2 | I86: Avionics Expert Action: During your turn, if you are in the Hangar Deck location, you may play a Repair Skill Card from your hand to repair up to 3 damaged Vipers. Break the Chains of Society Movement or Action: Once per game, draw 6 Piloting or Engineering Skill Cards in any combination. Knuckle Dragger: You may not launch yourself in a Vipers if there are any damaged Vipers. | J86: Hangar Deck | K86: R | L86: 18 | M86: 19 | N86: 12
A87: Shaw | B87: 1 | C87: 2 | D87: 2 | I87: Necessary Action Movement: Look at the top 3 Skill Cards of the Leadership or Tactics deck. You may discard a card from your hand to keep one of those cards. Put the remaining cards on the bottom of the deck. Razor: Once per game, you may draw and destroy 1 Civilian Ship to cancel a Crisis Card. Authority Issues: You draw 2 Treachery Cards whenever you are the target of a Quorum or Skill Card effect. | J87: Command or Pegasus CIC | K87: R | L87: 28 | M87: 4 | N87: 16
A89: COMBAT REFERENCE
A90: Target | B90: Attacker | D90: Roll | E90: Result
A91: Raider | B91: any | D91: 3-8 | E91: Destroyed
A92: Heavy/Centurion | B92: any | D92: 7-8 | E92: Destroyed
A93: Viper | B93: any | D93: 5-7 | E93: Damaged
B94: any | D94: 8 | E94: Destroyed
A95: Viper Mark VII | B95: any | D95: 6-7 | E95: Damaged
B96: any | D96: 8 | E96: Destroyed
A97: Assault Raptor | B97: any | D97: 7-8 | E97: Destroyed
A98: Galactica | B98: Raider | D98: 8 | E98: Damaged
B99: Basestar | D99: 4-8 | E99: Damaged
A100: Basestar | B100: Viper | D100: 8 | E100: Damaged
B101: Assault Raptor | D101: 7-8 | E101: Damaged
B102: Galactica | D102: 5-8 | E102: Damaged
B103: Nuke | D103: 1-2 | E103: 2x Damaged
D104: 3-6 | E104: Destroyed
D105: 7-8 | E105: Dstry +3 Raiders
B106: Exodus Nuke | D106: 1-2 | E106: 2x Damaged
D107: 3-6 | E107: Destroyed
D108: 7 | E108: Destroyed + 3 Raiders
D109: 8 | E109: All Ships in Sector
A112: SKILL CARD REFERENCE
A113: Type | B113: Value | C113: Title | I113: Description | K113: Game | L113: 0 | M113: 1 | N113: 2 | O113: 3 | P113: 4 | Q113: 5 | R113: 6
A114: Politics | B114: 1-2 | C114: Consolidate Power | I114: Action: Draw 2 Skill Cards of any type(s). They may come from outside your skill set. | K114: B | L114: 0 | M114: 8 | N114: 6 | O114: 0 | P114: 0 | Q114: 0 | R114: 0
B115: 3-5 | C115: Investigative Committee | I115: Play before cards are added to a skill check. All Skill Cards are played face up during this skill check (including Destiny). | K115: B | L115: 0 | M115: 0 | N115: 0 | O115: 4 | P115: 2 | Q115: 1 | R115: 0
B116: 1-2 | C116: Support the People | I116: Reckless: Play before cards are added to a Skill check. Each human player with 4 or less Skill Cards in hand may draw 2 Skill Cards. | K116: P | L116: 0 | M116: 1 | N116: 1 | O116: 0 | P116: 0 | Q116: 0 | R116: 0
B117: 3-5 | C117: Preventative Policy | I117: Movement: Choose 1 resource type. The next loss of this resource type during this turn is reduced by 1. | K117: P | L117: 0 | M117: 0 | N117: 0 | O117: 1 | P117: 1 | Q117: 1 | R117: 0
B118: 0 | C118: Red Tape | I118: Skill Check: Discard all 5 and 6 strength cards from this skill check (before totalling strength). | K118: E | L118: 3 | M118: 0 | N118: 0 | O118: 0 | P118: 0 | Q118: 0 | R118: 0
B119: 6 | C119: Political Prowess | I119: Play before making a skill check triggered by a location. Do not make a skill check; instead, it automatically passes or fails (your choice) | K119: E | L119: 0 | M119: 0 | N119: 0 | O119: 0 | P119: 0 | Q119: 0 | R119: 1
B120: 0 | C120: Force Their Hand | I120: Skill Check: If the Current Player is a Human, he may play 1 Skill Card face up into this Check. If he does not, he must draw 1 Mutiny Card. | K120: D | L120: 2 | M120: 0 | N120: 0 | O120: 0 | P120: 0 | Q120: 0 | R120: 0
B121: 3-4 | C121: Popular Influence | I121: Action: Draw 2 Quorum Cards and choose 1 to give to the President. Then, either play or discard the other card. | K121: D | L121: 0 | M121: 0 | N121: 0 | O121: 1 | P121: 1 | Q121: 0 | R121: 0
B122: 5 | C122: Negotiation | I122: Action: Place a Basestar in front of Galacticaand draw a Politics card. Do not launch or Activate any Cylon ships for the rest of this turn. | K122: D | L122: 0 | M122: 0 | N122: 0 | O122: 0 | P122: 0 | Q122: 1 | R122: 0
B123: 1-3 | C123: Quorum Debate | I123: Play after all Skill Cards played into a Skill Check have been revealed. Draw one Politics or Treachery Skill Card and put it into the Skill Check or your hand. | K123: R | L123: 0 | M123: 1 | N123: 1 | O123: 1 | P123: 0 | Q123: 0 | R123: 0
B124: 4-5 | C124: Positive Spin | I124: Play immediately after 1 or more resources are lost due to a Crisis. Draw 2 Skill Cards of any type(s). They may come from outside your Skill Set. Limit 1 Positive Spin per turn. | K124: R | L124: 0 | M124: 0 | N124: 0 | O124: 0 | P124: 1 | Q124: 1 | R124: 0
A125: Leadership | B125: 1-2 | C125: Executive Order | I125: Action: Choose any other player. He may move his character and then take 1 action OR not move and take 2 actions. [Limit 1 "XO" per turn.] | K125: B | L125: 0 | M125: 8 | N125: 6 | O125: 0 | P125: 0 | Q125: 0 | R125: 0
B126: 3-5 | C126: Declare Emergency | I126: Play after strength is totaled in a skill check to reduce its difficulty by 2. Limit of 1 "Declare Emergency" card used per skill check. | K126: B | L126: 0 | M126: 0 | N126: 0 | O126: 4 | P126: 2 | Q126: 1 | R126: 0
B127: 1-2 | C127: Major Victory | I127: Play after you destroy a basestar or a centurion on the Boarding Party track. Roll a die. If 5 or higher, gain 1 morlae. Limit of 1 "Major Victory" card used per turn. | K127: P | L127: 0 | M127: 1 | N127: 1 | O127: 0 | P127: 0 | Q127: 0 | R127: 0
B128: 3-5 | C128: At Any Cost | I128: Reckless: Play before cards are added to a Skill check. All Treachery Cards in the Skill check count as positive strength. | K128: P | L128: 0 | M128: 0 | N128: 0 | O128: 1 | P128: 1 | Q128: 1 | R128: 0
B129: 0 | C129: Iron Will | I129: Skill Check: If total strength in this skill check is within 4 of the difficulty, do not trigger the fail effect. If total strength in this skill check is 0 or less, lose 1 morale. | K129: E | L129: 3 | M129: 0 | N129: 0 | O129: 0 | P129: 0 | Q129: 0 | R129: 0
B130: 6 | C130: State of Emergency | I130: Action: Lose 1 Food. Each player may then move or take 1 Action (starting with the player who played this card and proceding clockwise). | K130: E | L130: 0 | M130: 0 | N130: 0 | O130: 0 | P130: 0 | Q130: 0 | R130: 1
B131: 0 | C131: All Hands On Deck | I131: Skill Check: For Each Skill Card in this Skill Check with a strength of 0, add 1 to the Skill Check's total Strength. | K131: D | L131: 2 | M131: 0 | N131: 0 | O131: 0 | P131: 0 | Q131: 0 | R131: 0
B132: 3-4 | C132: Restore Order | I132: Play before cards are added to a Skill Check. Do not resolve Skill Check abilities while resolving this Skill Check. | K132: D | L132: 0 | M132: 0 | N132: 0 | O132: 1 | P132: 1 | Q132: 0 | R132: 0
B133: 5 | C133: Change of Plans | I133: Play this card after a Skill Check is Passed. Instead of resolving the 'Pass' result, each Human draws two Skill Cards. | K133: D | L133: 0 | M133: 0 | N133: 0 | O133: 0 | P133: 0 | Q133: 1 | R133: 0
B134: 1-3 | C134: Give the Order | I134: Action: If you are not in the Brig, Activate an undamaged Location you do not currently occupy. | K134: R | L134: 0 | M134: 1 | N134: 1 | O134: 1 | P134: 0 | Q134: 0 | R134: 0
B135: 4-5 | C135: General Quarters | I135: Action: Choose two other different Human players. Each chosen player may either move or take an Action. Limit one Executive Order, Critical Situation, or General Quarters per turn. | K135: R | L135: 0 | M135: 0 | N135: 0 | O135: 0 | P135: 1 | Q135: 1 | R135: 0
A136: Tactics | B136: 1-2 | C136: Launch Scout | I136: Action: Risk 1 Raptor to roll a die. If 3 or higher, look at the top card of the Crisis or Destination deck and place it on the top or the bottom. Otherwise, destroy 1 Raptor. | K136: B | L136: 0 | M136: 8 | N136: 6 | O136: 0 | P136: 0 | Q136: 0 | R136: 0
B137: 3-5 | C137: Strategic Planning | I137: Play before any die roll to add 2 to the result. Limit of 1 "Strategic Planning" card used per die roll. | K137: B | L137: 0 | M137: 0 | N137: 0 | O137: 4 | P137: 2 | Q137: 1 | R137: 0
B138: 1-2 | C138: Guts and Initiative | I138: Reckless: Play before cards are added to a Skill check. Do not add cards from the Destiny deck into this Skill check. | K138: P | L138: 0 | M138: 1 | N138: 1 | O138: 0 | P138: 0 | Q138: 0 | R138: 0
B139: 3-5 | C139: Critical Situation | I139: Movement: Take 1 Action. Only 1 "Critical Situation" or "Executive Order" card may be used per turn. | K139: P | L139: 0 | M139: 0 | N139: 0 | O139: 1 | P139: 1 | Q139: 1 | R139: 0
B140: 0 | C140: Trust Instincts | I140: Skill Check: Add the top 2 cards from the top of the Destiny Deck (before totalling strength). Resolve Skill Check Abilities on these cards. | K140: E | L140: 3 | M140: 0 | N140: 0 | O140: 0 | P140: 0 | Q140: 0 | R140: 0
B141: 6 | C141: Scout for Fuel | I141: Action: Risk 1 raptor to roll 1 die. If you roll 4+, gain 1 Fuel. Othersize, destroy the raptor. | K141: E | L141: 0 | M141: 0 | N141: 0 | O141: 0 | P141: 0 | Q141: 0 | R141: 1
B142: 0 | C142: Quick Thinking | I142: The Current Player may choose 1 card with a strength of 3 or less (not a Quick Thinking card) to remove from this check and add to his hand. | K142: D | L142: 2 | M142: 0 | N142: 0 | O142: 0 | P142: 0 | Q142: 0 | R142: 0
B143: 3-4 | C143: Unorthodox Plan | I143: Action: Activate one of the following Locations, even if it is damaged: Command, Armory, Weapons Control, or Communications. | K143: D | L143: 0 | M143: 0 | N143: 0 | O143: 1 | P143: 1 | Q143: 0 | R143: 0
B144: 5 | C144: A Second Chance | I144: Play before cards are added to a Skill Check. If the check passes the printed Difficulty by 4 or more, the Current Player gains a Miracle token. | K144: D | L144: 0 | M144: 0 | N144: 0 | O144: 0 | P144: 0 | Q144: 1 | R144: 0
B145: 1-3 | C145: Coordinate Defense | I145: Action: If you are in the Armory or Command locations, Activate your current Location twice. Limit one Coordinate Defense per turn. | K145: R | L145: 0 | M145: 1 | N145: 1 | O145: 1 | P145: 0 | Q145: 0 | R145: 0
B146: 4-5 | C146: Mission Brief | I146: Play before a die roll is made. After the die roll, you may re-roll the die. You must use the new result. Limit of one Mission Brief per die roll. | K146: R | L146: 0 | M146: 0 | N146: 0 | O146: 0 | P146: 1 | Q146: 1 | R146: 0
A147: Piloting | B147: 1-2 | C147: Evasive Maneuvers | I147: Play after any viper is attacked to reroll the die. If the viper is piloted, subtract 2 from the new roll. | K147: B | L147: 0 | M147: 8 | N147: 6 | O147: 0 | P147: 0 | Q147: 0 | R147: 0
B148: 3-5 | C148: Maximum Firepower | I148: Action: Play while piloting a viper to attack up to 4 times. | K148: B | L148: 0 | M148: 0 | N148: 0 | O148: 4 | P148: 2 | Q148: 1 | R148: 0
B149: 1-2 | C149: Full Throttle | I149: Movement or Action: If piloting a viper, you may move to any space area. You may then attack 1 Cylon ship in your area (even if you didn't move). | K149: P | L149: 0 | M149: 1 | N149: 1 | O149: 0 | P149: 0 | Q149: 0 | R149: 0
B150: 3-5 | C150: Run Interference | I150: Play before raiders are activated. The first 4 raiders activating in your space area automatically miss (do not roll for them). | K150: P | L150: 0 | M150: 0 | N150: 0 | O150: 1 | P150: 1 | Q150: 1 | R150: 0
B151: 0 | C151: Protect the Fleet | I151: Skill Check: If at least 3 strength in piloting Skill Cards are in this skill check, the current player may activate one unmanned viper. | K151: E | L151: 3 | M151: 0 | N151: 0 | O151: 0 | P151: 0 | Q151: 0 | R151: 0
B152: 6 | C152: Best of the Best | I152: Play before a piloted viper makes an attack. Instead of rolling the attack, roll a die and destroy that many raiders in the viper's space area. | K152: E | L152: 0 | M152: 0 | N152: 0 | O152: 0 | P152: 0 | Q152: 0 | R152: 1
B153: 0 | C153: Dogfight | I153: Skill Check: The Current Player may damage 1 Viper in a Space Area or the Reserves to remove 1 other Skill Card from this Skill Check. | K153: D | L153: 2 | M153: 0 | N153: 0 | O153: 0 | P153: 0 | Q153: 0 | R153: 0
B154: 3-4 | C154: Combat Veteran | I154: Action: Choose an Unmanned Viper in the Reserves or a Space Area and Activate it up to 3 times. | K154: D | L154: 0 | M154: 0 | N154: 0 | O154: 1 | P154: 1 | Q154: 0 | R154: 0
B155: 5 | C155: Launch Reserves | I155: Action: Place up to 2 Unmanned Vipers from the Reserves into a Space Area containing a piloted Viper. Then, Activate those Unmanned Vipers. | K155: D | L155: 0 | M155: 0 | N155: 0 | O155: 0 | P155: 0 | Q155: 1 | R155: 0
B156: 1-3 | C156: Wingman | I156: Action: Play while piloting a Viper to move an unmanned Viper to your space area, and Activate it. Then take another Action. | K156: R | L156: 0 | M156: 1 | N156: 1 | O156: 1 | P156: 0 | Q156: 0 | R156: 0
B157: 4-5 | C157: Raptor Assault | I157: Action: Risk 1 Raptor to roll a die. If 4 or higher, choose a space area and destroy up to 3 Raiders or 1 Heavy Raider, or damage a Basestar in that space area. Otherwise, destroy 1 Raptor. | K157: R | L157: 0 | M157: 0 | N157: 0 | O157: 0 | P157: 1 | Q157: 1 | R157: 0
A158: Engineering | B158: 1-2 | C158: Repair | I158: Action: Repair your current location, or if you are in the "Hanger Deck" location, you may repair up to 2 damaged vipers. | K158: B | L158: 0 | M158: 8 | N158: 6 | O158: 0 | P158: 0 | Q158: 0 | R158: 0
B159: 3-5 | C159: Scientific Research | I159: Play before cards are added to a skill check. All engineering cards in the skill check count as positive strength. | K159: B | L159: 0 | M159: 0 | N159: 0 | O159: 4 | P159: 2 | Q159: 1 | R159: 0
B160: 1-2 | C160: Jury Rigged | I160: Reckless: Play before cards are added to a Skill check to reduce its difficulty by 4. | K160: P | L160: 0 | M160: 1 | N160: 1 | O160: 0 | P160: 0 | Q160: 0 | R160: 0
B161: 3-5 | C161: Calculations | I161: Play after a die is rolled to add or subtract 1 from the result. Only 1 "Calculations" card may be used per die roll. | K161: P | L161: 0 | M161: 0 | N161: 0 | O161: 1 | P161: 1 | Q161: 1 | R161: 0
B162: 0 | C162: Establish Network | I162: Skill Check: Each engineering Skill Card in this skill check counts as double strength (before totalling strength) | K162: E | L162: 3 | M162: 0 | N162: 0 | O162: 0 | P162: 0 | Q162: 0 | R162: 0
B163: 6 | C163: Build Nuke | I163: Action: The Admiral gains one Nuke token | K163: E | L163: 0 | M163: 0 | N163: 0 | O163: 0 | P163: 0 | Q163: 0 | R163: 1
B164: 0 | C164: Install Upgrades | I164: Skill Check: If the Skill Check passes, the Current Player draws two Engineering Skill Cards. If the Skill Check Fails, he draws one Engineering Skill Card. | K164: D | L164: 2 | M164: 0 | N164: 0 | O164: 0 | P164: 0 | Q164: 0 | R164: 0
B165: 3-4 | C165: Raptor Specialist | I165: Action: Either destroy a Raptor to gain an Assault Raptor, or return a destroyed Raptor to the Reserves. | K165: D | L165: 0 | M165: 0 | N165: 0 | O165: 1 | P165: 1 | Q165: 0 | R165: 0
B166: 5 | C166: Test the Limits | I166: Action: If the Fleet Marker is not on a blue space of the Jump Prep track, increase the track by 1 and roll a die. If 5 or lower, Damage Galactica. | K166: D | L166: 0 | M166: 0 | N166: 0 | O166: 0 | P166: 0 | Q166: 1 | R166: 0
B167: 1-3 | C167: Damage Control | I167: Play when Galactica is damaged, Return the damage token to the pool and draw a new token. You must keep the new token. | K167: R | L167: 0 | M167: 1 | N167: 1 | O167: 1 | P167: 0 | Q167: 0 | R167: 0
B168: 4-5 | C168: Calculate Coordinates | I168: Play after a Destination card is selected. Discard that Destination, draw the top card of the Destination deck, and resolve it instead. You must keep the new Destination. | K168: R | L168: 0 | M168: 0 | N168: 0 | O168: 0 | P168: 1 | Q168: 1 | R168: 0
A169: Treachery | B169: 1 | C169: Broadcast Location | I169: Reckless Skill check: Place 1 basestar in front of Galactica and 1 civilian ship behind Galactica. Only 1 of this ability may be resolved in each Skill check. | K169: P | L169: 0 | M169: 8 | N169: 0 | O169: 0 | P169: 0 | Q169: 0 | R169: 0
B170: 1 | C170: By Your Command | I170: Reckless Skill check: Activate all raiders, heavy raiders and occupation forces (but not centurions). Only 1 of this ability may be resolved in each Skill check. | K170: P | L170: 0 | M170: 4 | N170: 0 | O170: 0 | P170: 0 | Q170: 0 | R170: 0
B171: 2 | C171: Special Destiny | I171: Reckless Skill check: Each player draws 1 Treachery Skill Card. Only 1 of this ability may be resolved in each Skill check. | K171: P | L171: 0 | M171: 0 | N171: 5 | O171: 0 | P171: 0 | Q171: 0 | R171: 0
B172: 2 | C172: God's Plan | I172: Movement: Exchange this card with the top card of the Destiny deck. | K172: P | L172: 0 | M172: 0 | N172: 3 | O172: 0 | P172: 0 | Q172: 0 | R172: 0
B173: 3 | C173: Sabotage | I173: Play when a human player discards a Treachery Skill Card. Damage Galactica. Only 1 "Sabotage" card may be used per turn. | K173: P | L173: 0 | M173: 0 | N173: 0 | O173: 4 | P173: 0 | Q173: 0 | R173: 0
B174: 3 | C174: Human Weakness | I174: Action: If at least 1 human player is in the "Brig" or "Detention," reduce the highest resource by 1 | K174: P | L174: 0 | M174: 0 | N174: 0 | O174: 2 | P174: 0 | Q174: 0 | R174: 0
B175: 0 | C175: Bait | I175: Skill Check: Place 1 Civilian Ship behind Galactica. Whenever a player chooses to discard this card, he draws 1 Mutiny Card. | K175: D | L175: 6 | M175: 0 | N175: 0 | O175: 0 | P175: 0 | Q175: 0 | R175: 0
B176: 0 | C176: Dradis Contact | I176: Skill Check: Place 2 Raiders in front of Galactica. Whenever a Player chooses to discard this card, he draws 1 Mutiny Card. | K176: D | L176: 6 | M176: 0 | N176: 0 | O176: 0 | P176: 0 | Q176: 0 | R176: 0
B177: 3 | C177: Personal Vices | I177: Skill Check: Each Human player draws 1 Treachery Card. If the Current Player is Human, he also draws 1 Mutiny Card. | K177: D | L177: 0 | M177: 0 | N177: 0 | O177: 4 | P177: 0 | Q177: 0 | R177: 0
B178: 3 | C178: A Better Machine | I178: Skill Check: The Current Player shuffles 2 Treachery Skill Cards into the Destiny Deck. | K178: D | L178: 0 | M178: 0 | N178: 0 | O178: 4 | P178: 0 | Q178: 0 | R178: 0
B179: 4 | C179: Violent Outbursts | I179: Skill Check: The Current Player is sent to Sickbay. | K179: D | L179: 0 | M179: 0 | N179: 0 | O179: 0 | P179: 3 | Q179: 0 | R179: 0
B180: 5 | C180: Exploit Weakness | I180: Skill Check: The Current Player must choose a Human Player to draw a Mutiny Card. | K180: D | L180: 0 | M180: 0 | N180: 0 | O180: 0 | P180: 0 | Q180: 3 | R180: 0
B181: 0 | C181: Price of Failure | I181: Skill Check: If this Skill Check is failed, the Current Player must discard 1 random Skill Card. If the total strength in this Skill Check is 0 or less, the Current Player must discard 2 Skill Cards. Only 1 of this ability may be resolved in each Skill Check. | K181: R | L181: 3 | M181: 0 | N181: 0 | O181: 0 | P181: 0 | Q181: 0 | R181: 0
B182: 4 | C182: The Plan | I182: Action: Activate two Cylon Locations. | K182: R | L182: 0 | M182: 0 | N182: 0 | O182: 0 | P182: 1 | Q182: 0 | R182: 0
B183: 1 | C183: Betrayal From Within | I183: Reckless Skill Check: Place 1 Centurion marker on the start of the Boarding Party track. Only 1 of this ability may be resolved in each Skill Check. | K183: R | L183: 0 | M183: 2 | N183: 0 | O183: 0 | P183: 0 | Q183: 0 | R183: 0
B184: 2 | C184: Seeds of Doubt | I184: Skill Check: This Skill Check is now Reckless. | K184: R | L184: 0 | M184: 0 | N184: 3 | O184: 0 | P184: 0 | Q184: 0 | R184: 0
B185: 3 | C185: Change of Command | I185: Play when the Admiral Title changes hands (except when the Admiral Reveals his Loyalty Card). Decrease Morale by 1. | K185: R | L185: 0 | M185: 0 | N185: 0 | O185: 2 | P185: 0 | Q185: 0 | R185: 0
A186: Faith | B186: 1-2 | C186: Higher Power | I186: Skill Check: If this Skill Check is not Reckless, all Faith Skill Cards in this Skill Check count as positive strength. Movement or Action: Draw 2 Treachery Skill Cards. | K186: R | L186: 0 | M186: 8 | N186: 6 | O186: 0 | P186: 0 | Q186: 0 | R186: 0
B187: 3-5 | C187: Godsent | I187: Movement or Action: Move up to 3 Raiders in one space area to an adjacent space area. | K187: R | L187: 0 | M187: 0 | N187: 0 | O187: 4 | P187: 2 | Q187: 1 | R187: 0
B188: 1-2 | C188: Touch Their Souls | I188: Movement or Action: Choose any other player. That player discards 2 skill card, then draws 2 Skill Cards from any Skill of your choice. Treachery discarded in this manner is not added to the Destiny deck. | K188: R | L188: 0 | M188: 1 | N188: 1 | O188: 0 | P188: 0 | Q188: 0 | R188: 0
B189: 3-5 | C189: Worthy of Survival | I189: Reckless: Play after cards have been added to a Skill Check (but before revealing them). Choose a skill type that is not positive for the Skill Check. Cards of that type now count as positive. | K189: R | L189: 0 | M189: 0 | N189: 0 | O189: 1 | P189: 1 | Q189: 1 | R189: 0
B190: 0 | C190: Prayer Heard | I190: Skill Check: Each player may draw one Faith Skill Card. | K190: R | L190: 3 | M190: 0 | N190: 0 | O190: 0 | P190: 0 | Q190: 0 | R190: 0
B191: 6 | C191: Leap of Faith | I191: Action: Decrease the Jump Preparation track by 2 or increase the Hand of Fate counter by 1, then increase any Resource by 1. | K191: R | L191: 0 | M191: 0 | N191: 0 | O191: 0 | P191: 0 | Q191: 0 | R191: 1
B192: 1-3 | C192: Guide Them to Their Destiny | I192: Play before cards are added to a skill check. Look at the top two cards of the Destiny deck. | K192: R | L192: 0 | M192: 1 | N192: 1 | O192: 1 | P192: 0 | Q192: 0 | R192: 0
B193: 4-5 | C193: Blind Faith | I193: Skill Check: Shuffle four Faith Skill Cards into the Destiny Deck (after totaling strength). | K193: R | L193: 0 | M193: 0 | N193: 0 | O193: 0 | P193: 1 | Q193: 1 | R193: 0
A195: CYLON LEADER AGENDAS
A196: Sympathetic Agendas | B196: Convert the Infidels | H196: H | I196: Resources all at 3 or lower
B197: Join the Colonials | H197: H | I197: Infiltrating and not in the Brig or Detention
B198: Guide them to Destiny | H198: H | I198: Population and Morale are within 2 of each other
B199: Prove their Worth | H199: H | I199: At least 5 raptors/vipers are damaged or destroyed
B200: The Illusion of Hope | H200: C | I200: 6 or more units of distance have been travelled
B201: Salvage Their Equipment | H201: C | I201: 2 or fewer Galactica locations are damaged
A202: Hostile Agendas | B202: Show Their True Nature | H202: C | I202: Either you are in the Brig/Detention or you have been executed
B203: Siege Warfare | H203: C | I203: Every resource is in the red
B204: Reduce Them to Ruins | H204: C | I204: 4 or more Galactica and/or Pegasus locations are damaged -and- Morale is 3 or lower
B205: Genocide | H205: C | I205: Food and Population are 2 or lower
B206: Grant Mercy | H206: H | I206: Population, Morale or Food is at 2 or lower
B207: Mutual Annihalation | H207: H | I207: You have played a Super Crisis Card
A209: CYLON LEADER MOTIVES
A210: Human Allegiance | B210: End the Chase | I210: Reveal this card if FTL Control or Admiral's Quarters is damaged.
B211: Make an Ally | I211: Reveal this card if another Player is in the Brig and you have a Mutiny Card.
B212: Remove the Threat | I212: Reveal this card if the game is over and at least 4 Vipers are damaged or destroyed.
B213: Improve Efficiency | I213: Reveal this card if the game is over and you have at least 1 Politics card, 1 Tactics card, and 1 Engineering card in your hand of Skill Cards.
B214: Learn to Cherish | I214: Reveal this card if the game is over and Population is 6 or less.
B215: Pressure their Leaders | I215: Reveal this card if the game is over and Morale is 5 or less.
B216: Keep them Docile | I216: Reveal this card if the game is over and Food is 4 or less.
A217: Cylon Allegiance | B217: A Justified Response | I217: Reveal this card if the Fleet Marker is on a Blue Space of the Jump Preparation track and there are no Raiders, Heavy Raiders, or Basestars on the Main Game Board.
B218: No Unneccessary Force | I218: Reveal this card if 5 or more Distance has been traveled and no Centurions are on the Boarding Party track.
B219: Savor their Demise | I219: Reveal this card if the game is over and 7 or more Distance has been traveled.
B220: Fight with Honor | I220: Reveal this card if the game is over and you have at least 3 Treachery cards in your hand of Skill Cards.
B221: Subjects for Study | I221: Reveal this card if the game is over and Population is 4 or more.
B222: A False Sense of Security | I222: Reveal this card if the game is over and Morale is 3 or more.
B223: Harvest their Resources | I223: Reveal this card if the game is over and Food is 2 or more.
A225: LOYALTY CARDS
B226: You are NOT a Cylon
A227: B | B227: 11
A228: P | B228: 1
A229: E | B229: 5
B230: You are a Cylon
A231: B | B231: You are a Cylon Can Send a Character to Sickbay
A232: B | B232: You are a Cylon Can Send a Character to the Brig
A233: B | B233: You are a Cylon Can Reduce Morale by 1
A234: B | B234: You are a Cylon Can Damage Galactica
A235: P | B235: You are a Cylon Can Make Players Draw Treachery
A236: E | B236: You are a Cylon Can Place a Centurion Token on the Boarding Party Track
A237: E | B237: You are a Cylon Can Decrease the Jump Preparation Track by 2
A238: R | B238: You are a Cylon Can Manipulate Super Crisis Cards
A239: R | B239: You are a Cylon Can Manipulate Skill Cards
A240: C | B240: You are a Cylon Can Wreak Havoc | J240: +1 Super Crisis
A241: C | B241: You are a Cylon Can Activate Cylon Ships | J241: 1 Type of choice. If space is clear, place 1 Basestar and 2 Civilians
A242: C | B242: You are a Cylon Can Destroy Military Vessels | J242: 1 Viper, 1 Raptor
A243: C | B243: You are a Cylon Can Destroy Civilian Ships | J243: Draw 3, destroy 1.
A244: C | B244: You are a Cylon Can Set A Trap
B245: Personal Goals
A246: E | B246: Stand and Fight: 10 or More Raiders (else -1 Population)
A247: E | B247: Sacrifice: 6 Vipers Damaged or Destroyed (else -1 Fuel)
A248: E | B248: Devastation: Admiral has no Remaining Nuke Tokens (else -1 Morale)
A249: E | B249: Use Caution: The Fleet has made a 1-Distance Jump (else -1 Population)
A250: E | B250: Acquire Power: 2 or More Title Cards at the Same Time (else -1 Food)
A251: E | B251: Political Intrigue: The President is in the Brig (else -1 Food)
A252: E | B252: Selfish: Discard Skill Cards Equal to 20 Strength (else -1 Fuel)
A253: E | B253: Self-Destruction: In the Brig or Sickbay (else -1 Morale)
B254: Final Five
A255: E | B255: Whoever Examines this Card is Executed
A256: E | B256: If this Card is Examined, Cylon Ships are Activated
A257: E | B257: If this Card is Examined, Galactica is Damaged Twice
A258: E | B258: If this Card is Examined, You are Executed
A259: E | B259: Whoever Examines this Card is Sent to the Brig
A261: FLAWS
A262: Selfish | B262: B | C262: Reveal this card when you have no Skill Cards in your hand. You may not contribute to Skill Checks if you have 3 or fewer Skill Cards in your hand. Action: If Distance is 6 or more, Reveal and Discard this card. Draw 4 Skill Cards. These may come from outside your Skill Set.
A263: Absent-Minded | B263: B | C263: Reveal this card when you play an even number of Skill Cards into a Skill Check. You may not play more than 2 Skill Cards into Skill Checks. If Distance is 6 or more, you may Reveal and Discard this card afer cards have been revealed in a Skill Check. Add any number of cards from your hand to the Skill Check.
A264: Paranoid | B264: B | C264: Reveal this card if you play cards face-up into a Skill Check. For the remainder of the game, you play cards face-up into Skill Checks. If Distance is 6 or more, you may Reveal and Discard this card when another player contributes to a Skill Check. Look at those cards, and you may put any number of them into your hand before adding the rest to the Skill Check.
A265: Power Hungry | B265: B | C265: Reveal this card when the Fleet reaches 6 Distance if you don't hold a Title. You may not hold Titles. If Distance is 6 or more, you may Reveal and Discard this card when an Event is drawn. You make the choice for the Event.
A266: Intolerant | B266: B | C266: Reveal this card when the Fleet reaches 6 Distance if no one is in the Brig. You are sent to the Brig. Action: If Distance is 6 or more, choose one character and move them to the Brig.
A267: Reckless | B267: B | C267: Reveal this card if you play a Strategic Planning. All die rolls you make suffer a -1 penalty. If Distance is 6 or more, you may Reveal and Discard this card before a die roll is made. You choose the result (it may not be modified).
A268: Maverick | B268: B | C268: Reveal this card if you play an Executive Order. You may not be the target of Executive Orders. Movement: If Distance is 6 or more, Reveal and Discard this card. Move and take an Action, or take an Action and then move.
A269: Pacifist | B269: B | C269: Reveal this card if a Cylon ship or Centurion is destroyed on your turn. You must discard 1 random card every time a Basestar, Heavy Raider, Centurion, or Occupation Force is destroyed. If Distance is 6 or more, you may Reveal and Discard this card immediately before Cylon Ships are activated. Choose a Cylon Ship activation to resolve instead.
A270: Antisocial | B270: B | C270: Reveal this card if you begin your turn in the same Location as any other Player. You may not voluntarily move to a Location that contains another Character. Action: If Distance is 6 or more, Reveal and Discard this card. You may Activate up to two unoccupied Locations (including your Location, if no one else is there - you may Activate the same Location twice).
A271: Impatient | B271: P | C271: Reveal this card if the Fleet Token reaches the Auto Jump space on the Jump Prep Track. Every time the Fleet Jumps, you are sent to Sickbay. If Distance is 6 or more, you may Reveal and Discard this card when the Fleet Jumps. You draw 3 Destinations instead of the Admiral, and choose one to resolve.
A272: Amoral | B272: P | C272: Reveal this card if you choose the bottom choice on a Player Chooses Crisis. You must choose the top choice on all Crisis cards where the choice is yours to make. If Distance is 6 or more, you may Reveal and Discard this card before a Skill Check is made. You choose the outcome.
A273: Secretive | B273: E | C273: Reveal this card when another Player looks at any of your Loyalty Cards. Shuffle two You Are Not a Cylon cards into the Loyalty Deck, then draw two Loyalty Cards. Action: If Distance is 6 or more, Reveal and Discard this card. You may look at either the last card in the Loyalty Deck or every card in the You Are Not a Cylon deck.
A274: CONS | B274: E | C274: Consequence-related Flaw? Is there anything else that affects all of Exodus? Or should we do a module-based one?
A275: Irreverent | B275: R | C275: Reveal this card if you draw Faith during your Movement step. You may not draw Faith cards. If Distance is 6 or more, you may Reveal and Discard this card before the cards in a Skill Check are revealed. Treat all cards played into the Skill Check as Faith cards.
A276: ??? | B276: R | C276: Reveal this card when another Player looks at any of your Loyalty Cards. Shuffle two You Are Not a Cylon cards into the Loyalty Deck, then draw two Loyalty Cards. Action: If Distance is 6 or more, Reveal and Discard this card. Either play one Quorum Card of your choice from the Quorum hand, or draw 4 Quorum cards, play one, and discard the others.
A278: CYLON FLEET REFERENCE
A279: Fleet Board | B279: Roll
A280: Sector 1 | B280: 7-8
A281: Sector 2 | B281: 5-6
A282: Sector 3 | B282: 3
A283: Sector 4 | B283: 1
A284: Sector 5 | B284: 2
A285: Sector 6 | B285: 4

Sheet: Reference2
C2: Choice | G2: Cylon Attack | H2: Skill Check | P2: Activation | Q2: Jump Track | S2: Cylon Attack Deployment ( #xsector)
A3: Crisis Cards | B3: Cards Played | C3: Current Player | D3: President | E3: Admiral | F3: CAG | H3: Politics | I3: Leadership | J3: Tactics | K3: Piloting | L3: Engineering | M3: Difficulty | N3: Partial | O3: Consequence | R3: Description | S3: Basestars | T3: Heavy Raiders | U3: Raiders | V3: Vipers | W3: Civilians
A4: A Traitor Accused | C4: X | H4: X | I4: X | M4: 8 | P4: R | Q4: X | R4: Current Player Chooses: Pass: No Effect; Fail: the Current Player chooses a character to send to the "Brig." OR The Current Player discards 5 Skill Cards. | X4: B
A5: Admiral Grilled | C5: X | H5: X | I5: X | M5: 9 | P5: R | Q5: X | R5: Current Player Chooses: Pass: No Effect; Fail: -1 Morale, and the Admiral discards 2 Skill Cards. OR -1 Morale. | X5: B
A6: Ambush | G6: X | P6: B | R6: Training New Pilots: Keep this card in play until the Fleet Jumps. Each Unmanned Viper suffers a -2 penalty to its attack rolls. | S6: 1x4 | U6: 4x[1,4] | V6: 2x5 | W6: 1x[3,5,6] | X6: B
A7: Analyze Enemy Fighter | C7: X | J7: X | L7: X | M7: 7 | P7: R | Q7: X | R7: Current Player Chooses: Pass: Repair 1 destroyed Raptor; Fail: -1 population. OR Roll a die. If 4 or lower, -1 population and the current player discards 2 Skill Cards. | X7: B
A8: Besieged | G8: X | P8: R | R8: Heavy Casualties: The 4 Raiders that were just setup are immediately activated. | S8: 1x5 | T8: 1x4 | U8: 4x6 | V8: 2x6 | W8: 1x[1,2,6] | X8: B
A9: Boarding Parties | G9: X | P9: H | R9: Surprise Assault: There are no Vipers in this setup. | S9: 1x2 | T9: 2x[1,3] | U9: 4x2 | W9: 1x4,2x5 | X9: B
A10: Bomb Threat | C10: X | H10: X | I10: X | J10: X | M10: 13 | P10: R | Q10: X | R10: Current Player Chooses: Pass: No Effect; Fail: -1 Morale and draw a Civilian ship and destroy it. OR Roll a die. If 4 or lower, trigger the "Fail" effect of this card. | X10: B
A11: Build Cylon Detector | E11: X | P11: H | R11: Admiral Chooses: Discard 1 Nuke Token. If you do not have any Nuke tokens, you may not choose this option. OR -1 Morale, and the Admiral discards 2 Skill Cards. | X11: B
A12: Colonial Day | C12: X | H12: X | J12: X | M12: 10 | P12: B | Q12: X | R12: Current Player Chooses: Pass: +1 Morale; Fail: -2 Morale. OR -1 Morale. | X12: B
A13: Crash Landing | J13: X | K13: X | M13: 6 | P13: H | R13: Pass: No Effect; Fail: The Admiral may spend 1 fuel. If he does not, -1 Morale, and the Current Player is sent to "Sickbay." | X13: B
A14: Crippled Raider | C14: X | J14: X | L14: X | M14: 10 | P14: R | Q14: X | R14: Current Player Chooses: Pass: Increase the Jump Prep track by 1; Fail: -1 population. OR Roll a die. If 4 or lower, place 3 Raiders in front of Galactica and 1 Civilian ship behind it. | X14: B
A15: Cylon Accusation | H15: X | I15: X | J15: X | M15: 10 | P15: R | R15: Pass: No Effect; Fail: The Current Player is placed in the "Brig" location. | X15: B
A16: Cylon Screenings | C16: X | H16: X | I16: X | M16: 9 | P16: R | R16: Current Player Chooses: Pass: No Effect; Fail: -1 Morale, and the Current Player looks at 1 random Loyalty Card belonging to the President or Admiral. OR Each player discards 2 Skill Cards. | X16: B
A17: Cylon Swarm | G17: X | P17: B | R17: Massive Deployment: Keep this card in play until the Fleet Jumps. Each time a Basestar launches Raiders or Heavy Raiders, it launches 1 additional ship of the same type. | S17: 1x1 | T17: 1x2 | U17: 5x1 | V17: 1x[5,6] | W17: 1x[4,5,6] | X17: B
A18: Cylon Tracking Device | J18: X | K18: X | L18: X | M18: 10 | P18: R | R18: Pass: No Effect; Fail: Destroy 1 Raptor and place a Basestar in front of Galactica and 2 Civilian ships behind it. | X18: B
A19: Cylon Virus | J19: X | L19: X | M19: 13 | P19: L | R19: Pass: No Effect; Fail: All characters in the "FTL Control" location are sent to "Sickbay." Then place 1 Centurion marker at the start of the Boarding Party track. | X19: B
A20: Declare Martial Law | E20: X | P20: B | R20: Admiral Chooses: -1 Morale and the Admiral receives the President Title. OR -1 Population and the Admiral discards 2 Skill Cards | X20: B
A21: Detector Sabotage | I21: X | J21: X | M21: 8 | P21: H | Q21: X | R21: Pass: No Effect; Fail: All characters in the "Research Lab" location are sent to "Sickbay." Keep this card in play. Players may not look at other players' Loyalty Cards. | X21: B
A22: Elections Loom | H22: X | I22: X | M22: 8 | N22: 5 | P22: H | Q22: X | R22: Pass: No Effect; 5+: -1 Morale; Fail: -1 Morale, and the President discards 4 Skill Cards. | X22: B
A23: Food Shortage | D23: X | P23: R | Q23: X | R23: President Chooses: -2 Food. OR -1 Food. The President discards 2 Skill Cards and the Current Player discards 3 Skill Cards. | X23: B
A24: Food Shortage | D24: X | P24: R | Q24: X | R24: President Chooses: -2 Food. OR -1 Food. The President discards 2 Skill Cards and the Current Player discards 3 Skill Cards. | X24: B
A25: Food Shortage | D25: X | P25: R | Q25: X | R25: President Chooses: -2 Food. OR -1 Food. The President discards 2 Skill Cards and the Current Player discards 3 Skill Cards. | X25: B
A26: Food Shortage | D26: X | P26: R | Q26: X | R26: President Chooses: -2 Food. OR -1 Food. The President discards 2 Skill Cards and the Current Player discards 3 Skill Cards. | X26: B
A27: Forced Water Mining | C27: X | H27: X | I27: X | J27: X | L27: X | M27: 17 | P27: R | Q27: X | R27: Current Player Chooses: Pass: +1 Food; Fail: -1 Population, -1 Morale. OR +1 Food, -1 Morale, and each player discards 1 random Skill Card. | X27: B
A28: Fulfiller of Prophecy | C28: X | H28: X | I28: X | M28: 6 | P28: B | R28: Current Player Chooses: Pass: The Current Player draws 1 Politics Skill Card; Fail: -1 Population. OR Current Player discards 1 Skill Card. After the Activate Cylon Ships step, return to the Resolve Crisis step (Draw a new Crisis Card and resolve it). | X28: B
A29: Guilt by Collusion | I29: X | J29: X | M29: 9 | P29: R | Q29: X | R29: Pass: The Current Player may choose a character to move to the "Brig."; Fail: -1 Morale. | X29: B
A30: Hangar Accident | J30: X | K30: X | L30: X | M30: 10 | N30: 7 | P30: H | Q30: X | R30: Pass: No Effect; 7+: -1 Population; Fail: -1 Population and damage 2 Vipers in the "Reserves." | X30: B
A31: Heavy Assault | G31: X | P31: R | R31: Heavy Bombardment: Each Basestar immediately attacks Galactica. | S31: 1x[1,2] | V31: 1x6 | W31: 1x[4,5,6] | X31: B
A32: Informing the Public | C32: X | H32: X | I32: X | M32: 7 | P32: R | Q32: X | R32: Current Player Chooses: Pass: Current Player looks at 1 random Loyalty Card belonging to any player; Fail: -2 Morale. OR Roll a die. On a 4 or lower, -1 Morale and -1 Population. | X32: B
A33: Jammed Assault | G33: X | P33: R | R33: Communications Jamming: Keep this card in play until the Fleet Jumps. Players may not activate the "Communications" location. | S33: 1x3 | T33: 2x3 | U33: 4x2 | V33: 1x[5,6] | W33: 1x[1,4,5,6] | X33: B
A34: Jump Computer Failure | J34: X | L34: X | M34: 7 | P34: L | R34: Pass: No Effect; Fail: -1 Population and move the Fleet token 1 space towards the start of the Jump Prep track. | X34: B
A35: Keep Tabs on Visitor | C35: X | H35: X | I35: X | J35: X | M35: 12 | P35: R | Q35: X | R35: Current Player Chooses: Pass: No Effect; Fail: Roll a die. If 4 or lower, -2 Population. OR The Current Player discards 4 random Skill Cards. | X35: B
A36: Legendary Discovery | J36: X | K36: X | M36: 14 | P36: L | R36: Pass: Place this card next to the Kobol Objective card. It counts as 1 Distance; Fail: -1 Food and destroy 1 Raptor. | X36: B
A37: Loss of a Friend | H37: X | I37: X | M37: 9 | N37: 7 | P37: H | Q37: X | R37: Pass: No Effect; 7+: The Current Player discards 2 Skill Cards; Fail: -1 Morale, and the Current Player discards 2 Skill Cards. | X37: B
A38: Low Supplies | H38: X | I38: X | M38: 7 | P38: R | R38: Pass: No Effect; Fail: -1 Morale. If Food is less than 6, -1 additional Morale. | X38: B
A39: Mandatory Testing | H39: X | I39: X | M39: 13 | N39: 9 | P39: H | Q39: X | R39: Pass: The President looks at 1 random Loyalty card of the Current Player; 9+: No Effect; Fail: -1 Morale. | X39: B
A40: Missing G4 Explosives | I40: X | J40: X | M40: 7 | P40: R | R40: Pass: No Effect; Fail: -1 Food, and all characters in the "Armory" location are sent to the "Brig." | X40: B
A41: Network Computers | C41: X | H41: X | J41: X | L41: X | M41: 11 | P41: R | Q41: X | R41: Current Player Chooses: Pass: Increase the Jump Prep track by 1; Fail: -1 Population and place 1 Centurion marker at the start of the Boarding Party track. OR -1 Population and decrease the Jump Prep track by 1. | X41: B
A42: Prison Labor | H42: X | I42: X | J42: X | M42: 10 | P42: R | R42: Pass: No Effect; Fail: -1 Morale, -1 Food. | X42: B
A43: Prisoner Revolt | H43: X | I43: X | J43: X | M43: 11 | N43: 6 | P43: H | Q43: X | R43: Pass: No Effect; 6+: -1 Population; Fail: -1 Population, and the President chooses another player to receive the President title. | X43: B
A44: Raiding Party | G44: X | P44: R | R44: FTL Failure: Move the Fleet token 1 space towards the start of the Jump Prep track. | S44: 1x3 | T44: 2x4 | U44: 3x3,2x4 | V44: 2x6 | W44: 1x5,2x6 | X44: B
A45: Requested Resignation | E45: X | P45: B | R45: Admiral Chooses: The President and Admiral both discard 2 Skill Cards. OR The President may choose to give the President title to the Admiral, or move to the "Brig" location. | X45: B
A46: Rescue Caprica Survivors | D46: X | P46: R | Q46: X | R46: President Chooses:-1 Fuel, -1 Food, +1 Population. OR -1 Morale. | X46: B
A47: Rescue Mission (A) | E47: X | P47: B | Q47: X | R47: Admiral Chooses: -1 Morale, Current Player is sent to "Sickbay." OR -1 Fuel and destroy 1 Raptor. | X47: B
A48: Rescue Mission (B) | E48: X | P48: R | Q48: X | R48: Admiral Chooses: -1 Morale, Current Player is sent to "Sickbay." OR -1 Fuel and destroy 1 Raptor. | X48: B
A49: Rescue the Fleet | E49: X | P49: R | Q49: X | R49: Admiral Chooses: -2 Population. OR -1 Morale, place 1 Basestar and 3 Raiders in front of Galactica, and 3 Civilian ships behind Galactica. | X49: B
A50: Resistance | H50: X | I50: X | J50: X | M50: 12 | N50: 9 | P50: H | Q50: X | R50: Pass: No Effect; 9+: -1 Food; Fail: -1 Food, -1 Fuel. | X50: B
A51: Riots(A) | E51: X | P51: B | Q51: X | R51: Admiral Chooses: -1 Food, -1 Morale. OR -1 Population, -1 Fuel. | X51: B
A52: Riots(B) | E52: X | P52: L | R52: Admiral Chooses: -1 Food, -1 Morale. OR -1 Population, -1 Fuel. | X52: B
A53: Scouting for Fuel | C53: X | J53: X | K53: X | M53: 12 | P53: R | Q53: X | R53: Current Player Chooses: Pass: +1 Fuel; Fail: -1 Fuel and destroy 1 Raptor. OR Roll a die. If 4 or lower, -1 Fuel. | X53: B
A54: Scouting for Water | C54: X | J54: X | K54: X | M54: 9 | P54: R | Q54: X | R54: Current Player Chooses: Pass: +1 Food; Fail: -1 Fuel and destroy 1 Raptor. OR -1 Food. | X54: B
A55: Security Breach | I55: X | J55: X | M55: 6 | P55: L | R55: Pass: No Effect; Fail: -1 Morale, and all characters in the "Command" location are sent to "Sickbay." | X55: B
A56: Send Survey Team | C56: X | J56: X | K56: X | L56: X | M56: 15 | P56: R | Q56: X | R56: Current Player Chooses: Pass: No Effect; Fail: The Current Player is sent to "Sickbay" and destroy 1 Raptor. OR Roll a die. If 5 or less, -1 Fuel. | X56: B
A57: Sleep Deprivation | E57: X | P57: B | Q57: X | R57: Admiral Chooses: Return all undamaged Vipers on the game board to the "Reserves." Current Player is sent to "Sickbay." OR -1 Morale. | X57: B
A58: Surrounded | G58: X | P58: B | R58: Panic: The Current Player must discard 3 Skill Cards. | S58: 1x2 | T58: 1x3 | U58: 4x1,3x3 | V58: 1x[5,6] | W58: 1x[4,5,6] | X58: B
A59: Tactical Strike | G59: X | P59: R | R59: Hangar Assault: Damage 2 Vipers in the reserves. | S59: 1x6 | T59: 1x1 | U59: 5x6 | V59: 2x5 | W59: 1x[3,4,5] | X59: B
A60: Terrorist Bomber | I60: X | J60: X | M60: 9 | P60: H | Q60: X | R60: Pass: No Effect; Fail: -1 Morale, and the Current Player is sent to "Sickbay." | X60: B
A61: Terrorist Investigations | H61: X | I61: X | M61: 12 | N61: 6 | P61: H | Q61: X | R61: Pass: Current Player looks at 1 random Loyalty Card belonging to any player; 6+: No effect; Fail: -1 Morale. | X61: B
A62: The Olympic Carrier | H62: X | I62: X | K62: X | M62: 11 | N62: 8 | P62: H | Q62: X | R62: Pass: No Effect; 8+: -1 Population; Fail: -1 Morale, -1 Population. | X62: B
A63: Thirty-Three | G63: X | P63: R | R63: Relentless Pursuit: Keep in play until a Civilian ship or Basestar is destroyed. If this card is in play when the Fleet Jumps, shuffle it back into the Crisis deck. | S63: 1x1 | V63: 1x[5,6] | W63: 1x[3,4,5,6] | X63: B
A64: Unexpected Reunion | H64: X | I64: X | J64: X | M64: 8 | P64: R | R64: Pass: No Effect; Fail: -1 Morale, and the Current Player discards his hand of Skill Cards. | X64: B
A65: Unidentified Ship | J65: X | K65: X | M65: 10 | P65: L | R65: Pass: No Effect; Fail: -1 Population. | X65: B
A66: Water Sabotaged | C66: X | H66: X | I66: X | J66: X | M66: 13 | P66: R | Q66: X | R66: Current Player Chooses: Pass: No Effect; Fail: -2 Food. OR - 1 Food. | X66: B
A67: Water Shortage ( C) | D67: X | P67: B | R67: President Chooses: -1 Food. OR The President discards 2 Skill Cards, then the Current Player discards 3 Skill Cards. | X67: B
A68: Water Shortage (A) | D68: X | P68: B | Q68: X | R68: President Chooses: -1 Food. OR The President discards 2 Skill Cards, then the Current Player discards 3 Skill Cards. | X68: B
A69: Water Shortage (A) | D69: X | P69: B | Q69: X | R69: President Chooses: -1 Food. OR The President discards 2 Skill Cards, then the Current Player discards 3 Skill Cards. | X69: B
A70: Water Shortage (A) | D70: X | P70: B | Q70: X | R70: President Chooses: -1 Food. OR The President discards 2 Skill Cards, then the Current Player discards 3 Skill Cards. | X70: B
A71: Water Shortage (B) | D71: X | P71: R | Q71: X | R71: President Chooses: -1 Food. OR The President discards 2 Skill Cards, then the Current Player discards 3 Skill Cards. | X71: B
A72: Weapon Malfunction | J72: X | K72: X | L72: X | M72: 11 | P72: L | R72: Pass: No Effect; Fail: Damage 2 Vipers in space areas. All characters in the "Weapons Control" location are sent to "Sickbay." | X72: B
A73: Witch Hunt | H73: X | I73: X | M73: 10 | N73: 6 | P73: H | Q73: X | R73: Pass: No Effect; 6+: -1 Morale; Fail: -1 Morale. Current Player chooses a character and moves him to "Sickbay." | X73: B
A74: A Verdict of Guilty | E74: X | P74: B | Q74: X | R74: Admiral Chooses: Current Player is Executed and the Admiral discards 3 Skill Cards. OR Damage Galactica twice. | X74: P
A75: An Offer of Peace | H75: X | I75: X | M75: 12 | N75: 6 | P75: L | R75: Pass: No Effect; 6+: Shuffle 2 Treachery Cards into the Destiny deck; Fail: -1 Morale and shuffle 2 Treachery Cards into the Destiny deck. | X75: P
A76: Assassination Plot | D76: X | P76: B | Q76: X | R76: President Chooses: The Admiral and the Current Player must both discard 3 Skill Cards and draw 3 Treachery Cards. OR Admiral is Executed. | X76: P
A77: Civilian Ship Nuked | D77: X | P77: R | Q77: X | R77: President Chooses: Draw 1 Civilian ship and destroy it. Then each player discards 1 Skill Card and draws 1 Treachery Card. OR Draw and destroy 2 Civilian ships. | X77: P
A78: Code Blue | C78: X | H78: X | I78: X | J78: X | M78: 13 | P78: H | Q78: X | R78: Current Player Chooses: Pass: The Current Player looks at 1 random Loyalty Card of any player; Fail: -1 Morale and the Current Player is sent to the Brig. OR Each player discards 2 Skill Cards and draws 2 Treachery Cards. | X78: P
A79: Defending a Prisoner | H79: X | I79: X | M79: 11 | P79: H | Q79: X | R79: Pass: No Effect; Fail: -1 Morale and roll a die. If 4 or lower, the Current Player is Executed. | X79: P
A80: Dogfight | G80: X | P80: R | R80: Constant Barrage: Keep this card in play until the Fleet Jumps or no Raiders remain on the board. Each time Raiders are activated, launch two Raiders from each Basestar (do not activate the new Raiders). | S80: 1x3 | U80: 2x[3,4] | V80: 1x[5,6] | W80: 1x6 | X80: P
A81: Food Hoarding in the Fleet | D81: X | P81: R | Q81: X | R81: President Chooses: -1 Morale and roll a die. If 3 or less, draw and destroy 1 Civilian ship. OR -2 Food. | X81: P
A82: Medical Breakthrough | H82: X | I82: X | L82: X | M82: 12 | N82: 6 | P82: H | R82: Pass: Each Human player draws 1 Skill Card; 6+ No Effect; Fail: -1 Morale and each player discards 1 Skill Card and draws 1 Treachery Card. | X82: P
A83: Pressure the Supply Ships | E83: X | P83: R | Q83: X | R83: Admiral Chooses: +1 Food and -1 Morale. The Admiral discards 2 Skill Cards and draws 2 Treachery Cards. OR -2 Food. | X83: P
A84: Reunite the Fleet | C84: X | H84: X | I84: X | M84: 10 | P84: R | R84: Current Player Chooses: Pass: +1 Population; Fail: -1 Morale and each player discards 1 Skill Card and draws 1 Treachery Card. OR Current Player discards 2 random Skill Cards and draws 2 Treachery Cards. | X84: P
A85: Review Galactica's Log | H85: X | I85: X | J85: X | M85: 14 | N85: 6 | P85: R | Q85: X | R85: Pass: No Effect; 6+: The Admiral must discard 3 Skill Cards; Fail: -1 Morale and the Admiral must discard 5 Skill Cards. | X85: P
A86: Sabotage Investigated | J86: X | L86: X | M86: 9 | P86: H | Q86: X | R86: Pass: -1 Food; Fail: -1 Morale, -1 Fuel, -1 Food. | X86: P
A87: Scar | G87: X | P87: R | R87: Personal Vendetta: Keep this card in play until the Fleet Jumps or Scar is destroyed. Whenever Raiders are activated, activate the Scar Raider twice. Scar may only be destroyed by a roll of 7 or 8. Scar deploys in Sector 2. | V87: 1x[5,6] | W87: 2x4 | X87: P
A88: Standoff with Pegasus | H88: X | I88: X | J88: X | K88: X | M88: 22 | P88: L | R88: Pass: Current Player may move 1 character from the Brig to any other Galactica location; Fail: -1 Population, -1 Morale, and damage 1 Viper in a space area (if able). | X88: P
A89: Suspicious Election Results | E89: X | P89: R | R89: Give the President title to the character (aside from the current President) highest in the line of succession. OR The Admiral discards 1 random Skill Card and draws 1 Treachery Card. | X89: P
A90: The Black Market | C90: X | H90: X | I90: X | J90: X | M90: 13 | P90: R | Q90: X | R90: Current Player Chooses: Pass: +1 Food; Fail: -2 Food, -1 Morale. OR -1 Food and each player discards 1 Skill Card and draws 1 Treachery Card. | X90: P
A91: The Guardians | G91: X | P91: B | R91: Raptor Crew Captured: Keep this card in play until the Fleet Jumps. When a Basestar is destroyed, lose 1 Morale and destroy 1 Raptor. | S91: 1x1 | T91: 1x3 | U91: 2x[2,6] | V91: 1x[5,6] | W91: 1x4 | X91: P
A92: Training Snafu | I92: X | K92: X | M92: 8 | P92: B | Q92: X | R92: Pass: No Effect; Fail: Damage 3 Vipers in space areas or in the Reserves. | X92: P
A93: Unsettling Stories | C93: X | H93: X | I93: X | M93: 9 | P93: R | Q93: X | R93: Current Player Chooses: Pass: No Effect; Fail -1 Morale, and each player discards 1 Skill Card and draws 1 Treachery Card. OR -1 Morale. | X93: P
A94: Airlock Leak | J94: X | L94: X | M94: 6 | P94: H | R94: Pass: No Effect; Fail: Damage Galactica and the Current Player is sent to Sickbay. | X94: E
A95: Ambushed by the Press | D95: X | P95: R | Q95: X | R95: President Chooses: -1 Morale. OR The President must discard all of his Skill Cards. | X95: E
A96: Appoint Head of Security | E96: X | P96: L | R96: Admiral Chooses: Return all undamaged Vipers on the game board to the Reserves. Then the Admiral must discard 2 random Skill Cards. OR -1 Morale and damage Galactica once. | X96: E
A97: Centurion Assault | J97: X | K97: X | M97: 9 | P97: L | R97: Pass: No Effect; Fail: Destroy 1 Raptor and the current player is sent to Sickbay. | X97: E
A98: Consult the Prisoner | C98: X | H98: X | J98: X | L98: X | M98: 13 | P98: B | Q98: X | R98: Current Player Chooses: Pass: Increase the Jump Preparation track by 1; Fail: Each player discards 1 Skill Card and the Current Player is sent to the Brig. OR The Admiral discards 2 Skill Cards and the Current Player discards 3 Skill Cards. | X98: E
A99: Controversial Manuscript | D99: X | P99: R | Q99: X | R99: President Chooses: -1 Morale. OR +1 Morale and damage Galactica twice. | X99: E
A100: Cylon Genocide | C100: X | H100: X | I100: X | J100: X | L100: X | M100: 21 | P100: R | Q100: X | R100: Current Player Chooses: Pass: Destroy all Cylon ships currently on the main game board; Fail: -1 Morale, then Activate Basestars, Launch Raiders, Activate Heavy Raiders. OR Roll a die. If 4 or lower, the Current Player is sent to the Brig. | X100: E
A101: Detente | F101: X | P101: L | R101: CAG Chooses: All Vipers in space areas are returned to the Reserves. All characters who were piloting vipers are placed in the Hangar Deck. Increase the Pursuit Track by 1. OR Activate Basestars, Activate Raiders, Activate Heavy Raiders. | X101: E
A102: Divisive Behavior | H102: X | I102: X | J102: X | M102: 10 | O102: X | P102: H | Q102: X | R102: Pass: No effect; Fail -1 Morale; Consequence: The Current Player chooses another player to send to Sickbay. | X102: E
A103: Familiar Face | C103: X | H103: X | I103: X | J103: X | M103: 12 | P103: R | Q103: X | R103: Current Player Chooses: Pass: The Admiral may choose a character to send to the Brig; Fail: -1 Morale and the Admiral must discard all of his Skill Cards. OR -1 Morale. | X103: E
A104: Guilty Conscience | H104: X | I104: X | M104: 7 | P104: H | Q104: X | R104: Pass: No Effect; Fail: The Current Player discards 3 random Skill Cards. | X104: E
A105: Haunted by the Past | H105: X | I105: X | M105: 12 | O105: X | P105: H | Q105: X | R105: Pass: No Effect; Fail: Each player must discard 1 random Skill Card; Consequence: The current player gives any Title Cards he has to the player (aside from himself) highest on the Line of Succession. | X105: E
A106: Hera Rescued | C106: X | H106: X | I106: X | M106: 10 | P106: R | Q106: X | R106: Current Player Chooses: Pass: No Effect; Fail: -2 Morale and destroy 1 Raptor. OR -1 Morale. | X106: E
A107: Hidden Explosives | E107: X | P107: R | Q107: X | R107: Admiral Chooses: Destroy 1 Raptor and the Current Player is sent to Sickbay. OR -1 Morale. | X107: E
A108: Hidden Identity | H108: X | I108: X | J108: X | M108: 12 | P108: L | R108: Pass: No Effect; Fail: -1 Morale. Current player is sent to the Brig. | X108: E
A109: In the Ring | H109: X | I109: X | J109: X | M109: 12 | O109: X | P109: H | Q109: X | R109: Pass: +1 Morale; Fail: -1 Morale and the Current Player is sent to Sickbay; Consequence: The Current Player chooses another player to send to Sickbay. | X109: E
A110: Interrogation | E110: X | P110: B | R110: Admiral Chooses: The Admiral chooses another player to send to Sickbay. The Admiral may then look at 1 of that character's Loyalty Cards at random. OR The Admiral discards 2 Skill Cards, then the Current Player discards 3 Skill Cards. | X110: E
A111: Joe's Bar | H111: X | I111: X | L111: X | M111: 12 | P111: R | Q111: X | R111: Pass: +1 Morale; Fail: -1 Morale and the Current Player is sent to the Brig. | X111: E
A112: Labor Dispute | D112: X | P112: B | R112: -2 Morale. OR -1 Fuel and decrease Jump Prep track by 1. | X112: E
A113: Medal of Distinction | E113: X | P113: B | Q113: X | R113: Admiral Chooses: +1 Morale, place 2 Civilian ships on the game board and then activate Raiders. OR -1 Morale. | X113: E
A114: Mysterious Guide | C114: X | H114: X | I114: X | M114: 11 | P114: R | R114: Current Player Chooses: Pass: Increase the Jump Preparation track by 1; Fail: -1 Fuel and the Current Player discards all of his Skill Cards. OR -1 Morale. | X114: E
A115: Mysterious Message | C115: X | H115: X | L115: X | M115: 9 | P115: R | Q115: X | R115: Current Player Chooses: Pass: The Current Player may search the Destiny deck and choose 2 cards to discard. He then reshuffles the Destiny deck; Fail: Launch Raiders, Activate Basestars. OR Activate Basestars. | X115: E
A116: Power Failure | I116: X | J116: X | L116: X | M116: 14 | O116: X | P116: H | R116: Pass: No Effect; Fail: Reduce the Jump Preparation track by 1; Consequence: Damage Galactica once. | X116: E
A117: Raiders Inbound | F117: X | P117: H | R117: CAG Chooses: -1 Population and damage Galactica once. OR The CAG and the Admiral must each discard 3 Skill Cards. | X117: E
A118: Raptor Malfunction | C118: X | J118: X | K118: X | L118: X | M118: 12 | P118: R | Q118: X | R118: Current Player Chooses: Pass: No Effect; Fail: Damage Galactica once and destroy 1 Raptor. OR The Current Player is sent to Sickbay. | X118: E
A119: Return to Duty | F119: X | P119: R | R119: CAG Chooses: Any character on Galactica with piloting in his skill set may immediately launch himself in a Viper. Then Launch Raiders. OR Activate Basestars. | X119: E
A120: Review Camera Footage | F120: X | P120: B | R120: CAG Chooses: Damage 2 Vipers in the Reserves (if able) and increase the Pursuit track by 1. The CAG may then activate 1 Unmanned Viper. OR The CAG discards 2 Skill Cards, then the Current Player discards 3 Skill Cards. | X120: E
A121: Set a Trap | C121: X | I121: X | J121: X | M121: 10 | P121: R | R121: Current Player Chooses: Pass: Destroy a Centurion on the Boarding Party track; Fail: Place a Centurion at the start of the Boarding Party track. The Current Player is sent to Sickbay. OR Roll a die. If 4 or lower, place a Centurion at the start of the Boarding Party track. | X121: E
A122: Strange Beacon | J122: X | K122: X | L122: X | M122: 13 | P122: R | R122: Pass: Current Player chooses 1 space area on the main game board and removes all Cylon ships in that area; Fail: Decrease the Jump Preparation track by 1. | X122: E
A123: Temple of the Five | J123: X | L123: X | M123: 9 | P123: L | R123: Pass: The Current Player may draw 2 Skill Cards; Fail: Decrease the Jump Preparation track by 1. | X123: E
A124: The Circle | D124: X | P124: R | Q124: X | R124: President Chooses: You must choose another player to receive the President title or the Current Player is Executed. OR The President discards 2 Skill Cards, then the Current Player discards 3 Skill Cards. | X124: E
A125: The Passage | C125: X | J125: X | K125: X | L125: X | M125: 14 | P125: R | Q125: X | R125: Current Player Chooses: Pass: Increase the Jump Preparation track by 1; Fail: Destroy 2 Civilian ships. OR Roll a die. If 6 or lower, the Current Player is sent to Sickbay. | X125: E
A126: Threat of a Super Nova | I126: X | K126: X | L126: X | M126: 10 | O126: X | P126: H | Q126: X | R126: Pass: No Effect; Fail: -1 Population and damage Galactica; Consequence: Activate Basestars. | X126: E
A127: Tracked by Radiation | F127: X | P127: B | R127: CAG Chooses: Place a Basestar and 3 Raiders in front of Galactica and 2 Civilian ships behind Galactica. OR -1 Fuel. | X127: E
A128: Training a Rookie | F128: X | P128: L | R128: CAG Chooses: Activate one Unmanned Viper. Then Activate Raiders. OR The CAG chooses 2 Vipers that are not currently damaged or destroyed and moves them to the Damaged Viper box. | X128: E
A129: Truth and Reconciliation | D129: X | P129: B | Q129: X | R129: President Chooses: -1 Morale and the President must choose a character to send to the "Brig." OR The President discards 2 Skill Cards, then the Current Player discards 3 Skill Cards. | X129: E
A130: Unexplained Deaths | I130: X | J130: X | M130: 8 | P130: R | Q130: X | R130: Pass: No Effect; Fail: -1 Morale, -1 Population. | X130: E
A131: Unfair Bias | H131: X | I131: X | J131: X | M131: 12 | P131: R | Q131: X | R131: Pass: No Effect; Fail: Damage Galactica and the Current Player discards his hand of Skill Cards. | X131: E
A132: Unwelcome Faces | E132: X | P132: R | Q132: X | R132: Admiral Chooses: The Admiral must discard all of his Skill Cards and then choose a character to send to the Brig. OR -1 Morale and Damage Galactica once. | X132: E
A133: Widespread Starvation | D133: X | P133: R | Q133: X | R133: President Chooses: -2 Food. OR -1 Food, -1 Population. | X133: E
A134: A Desperate Pact | C134: X | H134: X | I134: X | K134: X | M134: 15 | P134: R | R134: Current Player Chooses: Pass: No Effect; Fail: -1 Morale and give the President title to the player (aside from the current President) highest on the line of succession OR The President discards 3 skill cards, then the Current Player draws 1 Mutiny Card. | X134: D
A135: Abandon Galactica | E135: X | P135: B | Q135: X | R135: Admiral Chooses: Discard 1 nuke token. If you do not have any nuke tokens, you cannot choose this option. OR -1 Food and the Admiral draws 2 Treachery cards. | X135: D
A136: An Ambitious Operation | E136: X | P136: R | Q136: X | R136: Admiral Chooses: -1 Fuel. The Admiral chooses another player to gain 1 Miracle Token. OR Roll a die. On a 4 or less, -1 Fuel. | X136: D
A137: Blindsided | G137: X | P137: R | R137: Pluck Out Their Eyes: Destroy 1 Raptor. | S137: 1x[1,4] | T137: 1x[1,4] | U137: 3x2 | V137: 1x6 | W137: 2x6,1,5 | X137: D
A138: Consult the Hybrid | H138: X | I138: X | M138: 10 | P138: H | Q138: X | R138: Pass: The current player draws a Mutiny Card and 2 Skill Cards (they may be from outside his skill set); Fail: -1 Food and shuffle 2 Treachery into the Destiny Deck. | X138: D
A139: Dangerous Plots | D139: X | P139: B | Q139: X | R139: President Chooses: The Admiral and the President both draw 1 Mutiny Card. OR -1 Morale, and the Current Player discards 3 Skill Cards. | X139: D
A140: Dishonest Tactics | D140: X | P140: R | Q140: X | R140: President Chooses: -1 Morale and the President may choose 1 Player to move from the Brig to Command. OR -1 Fuel and the President draws 2 Quorum Cards. | X140: D
A141: Domestic Dispute | H141: X | J141: X | M141: 9 | P141: R | R141: Pass: No Effect; Fail: -1 Morale, and the Current Player is sent to Sickbay. | X141: D
A142: Earth in Ruins | C142: X | H142: X | I142: X | J142: X | M142: 9 | P142: R | Q142: X | R142: Current Player Chooses: Pass: -1 Morale; Fail: -2 Morale. OR -1 Food and the current player draws 1 Mutiny Card. | X142: D
A143: Enemy of my Enemy | C143: X | H143: X | I143: X | K143: X | M143: 13 | P143: R | Q143: X | R143: Current Player Chooses: Pass: -1 Morale; Fail: -2 Morale and damage Galactica. OR Damage Galactica twice. | X143: D
A144: Event Horizon | G144: X | P144: R | R144: Gravity Well: Keep this card in play until the fleet jumps. No player can activate a Viper unless he first discards a Skill Card. | S144: 1x[2,4] | U144: 2x[1,4] | V144: 1x[1,5,6] | X144: D
A145: Galactica Falling Apart | C145: X | I145: X | K145: X | L145: X | M145: 8 | P145: R | Q145: X | R145: Current Player Chooses: Pass: No Effect; Fail: -1 Morale and damage Galactica OR Roll a die. On a 6 or lower, -1 Food. | X145: D
A146: Give In To Despair | H146: X | I146: X | M146: 14 | N146: 9 | P146: H | Q146: X | R146: Pass: No Effect; 9+: -1 Food and the current player draws 3 Treachery Cards; Fail: -2 Morale | X146: D
A147: Hornet's Nest | G147: X | P147: R | R147: Suppressive Fire: Keep this card in play until the fleet jumps or a basestar is destroyed. Players cannot use actions on Piloting Cards. | S147: 1x3 | U147: 3x[1,4] | V147: 1x[1,5] | W147: 1x1,2x6 | X147: D
A148: Hybrid in Panic | J148: X | L148: X | M148: 12 | N148: 8 | P148: H | Q148: X | R148: Pass: Increase the Jump Preparation track by 1; 8+: The current player discards 2 skill cards; Fail: -1 Fuel | X148: D
A149: Incitement to Mutiny | H149: X | I149: X | J149: X | M149: 13 | N149: 7 | P149: H | Q149: X | R149: Pass: No Effect; 7+: Shuffle 2 Treachery Cards into the Destiny Deck; Fail: Shuffle 4 Treachery Cards into the Destiny Deck | X149: D
A150: Insubordinate Crew | I150: X | J150: X | M150: 12 | P150: R | R150: Pass: No Effect; Fail: -1 Morale and each player that does not have a Mutiny Card draws 1 Mutiny Card. | X150: D
A151: Lockdown | G151: X | P151: H | R151: Concerted Attack: Keep this card in play until the fleet jumps or a Basestar is destroyed. Players cannot activate the Armory location. | S151: 1x2 | T151: 2x[1,2] | V151: 1x4 | W151: 1x[4,5] | X151: D
A152: One Last Cocktail | C152: X | J152: X | L152: X | M152: 7 | P152: B | Q152: X | R152: Current Player Chooses: Pass: No Effect; Fail: -1 Food, -1 Morale OR Roll a die. On a 6 or lower, -1 morale and the President is sent to the Brig. | X152: D
A153: Question Procedure | D153: X | P153: B | Q153: X | R153: President Chooses: -1 Morale. OR Damage Galactica, and the President discards 3 skill cards. | X153: D
A154: Quorum in Uproar | H154: X | J154: X | M154: 8 | P154: L | R154: Pass: No Effect; Fail: The President discards 2 random Quorum Cards and 2 random skill cards. | X154: D
A155: Rallying Support | H155: X | J155: X | M155: 8 | P155: R | Q155: X | R155: Pass: No Effect; Fail: -1 Population and the current player draws 1 Mutiny Card and 1 Treachery Card. | X155: D
A156: Reactor Critical | J156: X | K156: X | L156: X | M156: 7 | P156: L | R156: Pass: The current player draws 2 Treachery Cards; Fail: -1 Fuel | X156: D
A157: Rebuild Trust | H157: X | I157: X | M157: 9 | P157: R | R157: Pass: Each character in the Brig may move to any location on Galactica; Fail: -2 Morale | X157: D
A158: Religious Turmoil | C158: X | H158: X | J158: X | M158: 7 | P158: R | Q158: X | R158: Current Player Chooses: Pass: No Effect; Fail: -1 Morale and each player discards 1 Skill Card OR Roll a die. On a 4 or lower, -1 Food and -1 Population. | X158: D
A159: Reprisal | G159: X | P159: R | R159: Opportunity for Treason: Shuffle 2 Treachery Cards into the Destiny Deck. Then the Current Player draws a Mutiny Card. | S159: 1x6 | T159: 1x4 | U159: 2x1,3x4 | V159: 1x[2,3] | W159: 1x[1,5] | X159: D
A160: Requisition for Demetrius | E160: X | P160: B | R160: Admiral Chooses: -1 Food then roll a die. On a 6 or lower, shuffle 2 Treachery cards into the Destiny deck. OR The Admiral draws 1 Mutiny Card and 2 Treachery Cards. | X160: D
A161: Secret Meetings | C161: X | H161: X | J161: X | L161: X | M161: 9 | P161: R | Q161: X | R161: Current Player Chooses: Pass: No Effect; Fail: -1 Morale OR The current player draws 1 Mutiny Card. Then he chooses a player to draw 1 Mutiny Card. | X161: D
A162: Starvation in Dogsville | D162: X | P162: R | Q162: X | R162: President Chooses: Roll a die. On a 4 or less, -1 population and -1 food OR Roll a die, One a 4 or less, -2 food. | X162: D
A163: Trial by Fire | G163: X | P163: R | R163: Cavalry's Here: The human fleet gains an Assault Raptor. The current player places it in a space area with a viper launch icon and may immediately activate it. | S163: 1x4 | T163: 2x1 | U163: 3x1 | V163: 1x2 | W163: 1x6 | X163: D
A164: Confrontation at Gunpoint | H164: X | I164: X | M164: 13 | N164: 2 | O164: X | P164: H | R164: Pass: The Current Player looks at the top 3 cards of the Crisis deck and places each on the top or bottom in any order; Fail: The President may choose to discard his hand of Quorum cards, or the President is Executed; Prove Faith 2: The President may move another player from the Brig to any Location on Galactica. | X164: R
A165: Deciphering the Music | H165: X | J165: X | L165: X | M165: 11 | N165: 3 | O165: X | P165: R | Q165: X | R165: Pass: The Current Player looks at the top 3 cards of the Destination deck and places one on the bottom and two on top in any order; Fail: The Current Player discards all of his Skill Cards; Prove Faith 3: Increase the Jump Preparation track by 1. | X165: R
A166: Harsh Reality | I166: X | J166: X | M166: 10 | N166: 1 | O166: X | P166: B | Q166: X | R166: Pass: No Effect; Fail: -1 Morale, -1 Food; Prove Faith: Every Human player may draw 2 Faith Skill Cards. | X166: R
A167: Not to be Human | I167: X | L167: X | M167: 11 | N167: 1 | O167: X | P167: H | Q167: X | R167: Pass: The Current Player may choose a revealed Cylon to discard all his Skill Cards; Fail: Launch Raider, Activate Raiders; Prove Faith: The Current Player may activate 1 unmanned Viper for each PF card in this Skill Check (limit 3). | X167: R
A168: Rookie Mistake | I168: X | K168: X | M168: 9 | N168: 1 | O168: X | P168: L | R168: Pass: Current Player may activate an unmanned Viper; Fail: Current Player must destroy one piloted Viper. If there are no piloted Vipers, Current Player is sent to Sickbay; Prove Faith: Current Player may look at 1 Civilian, then move it to an adjacent space sector. | X168: R
A169: The Road Less Traveled | H169: X | I169: X | J169: X | M169: 18 | P169: L | R169: Pass: Place this card next to the Kobol Objective card. It counts as 1 Distance; Fail: -1 Fuel, and the Current Player is sent to the Brig. | X169: R
A170: Visions of Your Own Death | H170: X | I170: X | M170: 7 | N170: 1 | O170: X | P170: R | Q170: X | R170: Pass: No Effect; Fail: The President discards 2 Skill Cards and moves to the 'Sickbay' location; Prove Faith: The President and the Current Player may each draw 1 Skill Card for each PF card in the check (limit 3). | X170: R
A173: New Caprica Deck | B173: New Caprica Deck
A174: A Cylon Ally | E174: X | P174: R/O | Q174: X | R174: Admiral Chooses: Prepare or Evacuate 1 Civilian ship and roll a die. If the result is 5 or less, the Current Player is sent to Detention. If the Current Player is not on New Caprica you may not choose this option. OR Admiral discards 2 Skill Cards and Current Player discards 3 Skill Cards.
A175: Arrests at Night | C175: X | I175: X | J175: X | M175: 10 | P175: L | Q175: X | R175: Current Player Chooses: Pass: No Effect; Fail: -1 Morale and Current Player is sent to Detention if on New Caprica. OR Each player discards 2 Skill Cards and draws 2 Treachery Cards.
A176: Attack on the Power Plant | D176: X | P176: L | Q176: X | R176: President Chooses: -1 Morale and each Human player draws 2 Skill Cards. OR -1 Population and +1 Morale.
A177: Betrayed From Within | H177: X | I177: X | M177: 9 | N177: 6 | P177: R | Q177: X | R177: Pass: No Effect; 6+: Current Player discards 2 random Skill Cards and draws 2 Treachery Cards. Fail: Current Player is Executed.
A178: Brutal Treatment | C178: X | H178: X | J178: X | M178: 9 | P178: B/O | Q178: X | R178: Current Player Chooses: Pass: No Effect; Fail: -1 Morale and the Current Player is sent to Medical Center if on New Caprica. OR Current Player chooses a Human player on New Caprica to send to Detention.
A179: Centurion Ambush | J179: X | K179: X | M179: 7 | P179: R | Q179: X | R179: Pass: No Effect; Fail: -1 Population and the Current Player is sent to Medical Center if on New Caprica.
A180: Contact Informant | C180: X | H180: X | J180: X | M180: 9 | P180: R/O | Q180: X | R180: Current Player Chooses: Pass: No Effect; Fail: -1 Morale and -1 Population. OR -1 Population.
A181: Contact Raptor | H181: X | L181: X | M181: 7 | P181: R | Q181: X | R181: Pass: No Effect; Fail: -1 Morale and the Current Player discards 2 Skill Cards.
A182: Decode Cylon Maps | J182: X | L182: X | M182: 8 | P182: H/O | R182: Pass: Prepare or Evacuate 1 Civilian ship; Fail: -1 Morale and place 1 Occupation force on Occupation Authority.
A183: Demanded Surrender | D183: X | P183: B/O | R183: President Chooses: President chooses a Human player on New Caprica to send to Detention. OR -1 Morale.
A184: Dissent Among Cylons | H184: X | I184: X | M184: 12 | N184: 7 | P184: L | Q184: X | R184: Pass: Each Human player may draw 2 Skill Cards; 7+: No Effect; Fail: -1 Morale.
A185: Establish Sanitation | D185: X | P185: R | Q185: X | R185: President Chooses: Skip the Prepare for Jump step of this turn. OR -1 Morale.
A186: Execution List | D186: X | P186: H/O | Q186: X | R186: President Chooses: Roll a die. If 5 or less, the President is Executed. OR -1 Population.
A187: Held for Questioning | C187: X | H187: X | I187: X | J187: X | M187: 10 | P187: H/O | Q187: X | R187: Current Player Chooses: Pass: No Effect; Fail: -1 Morale and the Current Player is sent to Detention if on New Caprica. OR Current Player must discard 3 random Skill Cards.
A188: Hiding Underground | C188: X | I188: X | J188: X | M188: 9 | P188: R/O | Q188: X | R188: Current Player Chooses: Pass: No Effect; Fail: -1 Food. OR Current Player chooses a Human player on New Caprica to send to Detention.
A189: Intra-Atmos Entry | I189: X | J189: X | K189: X | L189: X | M189: 15 | N189: 9 | P189: H | Q189: X | R189: Pass: Prepare or Evacuate 1 Civilian ship. Then increase the Jump Prep track by 1; 9+: No Effect; Fail: -1 Fuel. Then damage Galactica if it is in orbit of New Caprica.
A190: Keeping Hera Hidden | D190: X | P190: R/O | Q190: X | R190: President Chooses: Shuffle 2 Treachery Cards into the Destiny deck. OR President chooses a Human player on NC to send to Detention.
A191: Labor Union Strike | H191: X | J191: X | M191: 13 | N191: 10 | P191: R/O | Q191: X | R191: Pass: +1 Morale; 10+: No Effect; Fail: -1 Food and if the Current Player is on New Caprica, he is sent to Detention.
A192: Marine Reinforcements | E192: X | P192: R | R192: Admiral Chooses: Destroy 1 Occupation force. Admiral discards 2 Skill Cards and Current Player discards 3 Skill Cards. OR Admiral chooses a Human player on New Caprica to send to Detention.
A193: Meet Liaison Officer | H193: X | J193: X | M193: 10 | P193: R | Q193: X | R193: Pass: No Effect; Fail: -1 Fuel and destroy 1 Raptor.
A194: NCP Graduation | E194: X | P194: H | Q194: X | R194: Admiral Chooses: -1 Morale. OR -1 Population.
A195: NCP Recruitment | C195: X | H195: X | I195: X | M195: 8 | P195: R | R195: Current Player Chooses: Pass: No Effect; Fail: -1 Morale. OR Each player discards 2 Skill Cards and draws 2 Treachery Cards.
A196: Organize the Pilots | H196: X | K196: X | M196: 9 | P196: B | R196: Pass: Prepare or Evacuate 1 Civilian ship; Fail: Destroy the top ship of the Locked Civilian Stack, or Prepared if Locked is empty.
A197: Playing with Emotions | C197: X | H197: X | J197: X | M197: 7 | P197: L | Q197: X | R197: Current Player Chooses: Pass: No Effect; Fail: -1 Morale. OR Current Player must discard 2 random Skill Cards and draw 2 Treachery Cards.
A198: Prepare for a Fight | C198: X | I198: X | J198: X | L198: X | M198: 8 | P198: R/O | Q198: X | R198: Current Player Chooses: Pass: Destroy 1 Occupation force; Fail: -1 Morale and Current Player is sent to Detention if on New Caprica. OR Current Player chooses a Human player on New Caprica to send to Medical Center.
A199: Prepare the Civilians | H199: X | I199: X | M199: 9 | P199: R | Q199: X | R199: Pass: No Effect; Fail: -1 Food and place 1 Occupation force at Occupation Authority.
A200: Recover Launch Keys | I200: X | J200: X | L200: X | M200: 10 | P200: B | R200: Pass: Prepare or Evacuate 1 Civilian ship; Fail: -1 Population. If the current player is on New Caprica, he is sent to Detention.
A201: Rescue Detainees | C201: X | I201: X | J201: X | M201: 9 | P201: H/O | Q201: X | R201: Current Player Chooses: Pass: Current Player may move a character from Detention to any other New Caprica location; Fail: -1 Morale. OR Roll a die. If 4 or lower, the Current Player chooses a Human player on New Caprica to send to Detention.
A202: Resistance Bombing | I202: X | J202: X | L202: X | M202: 12 | N202: 7 | P202: B/O | R202: Pass: Admiral may choose to lose 1 Morale to Execute a Revealed Cylon or destroy 2 Occupation forces; 7+: No Effect; Fail: -1 Morale, -1 Population.
A203: Second Thoughts | H203: X | I203: X | M203: 9 | P203: B/O | Q203: X | R203: Pass: Current Player may move a character from Detention to any other New Caprica location; Fail: -1 Morale.
A206: Battle of the Colony Deck | B206: New Caprica Deck
A207: Secrets Revealed | F207: X | P207: R/D | R207: CAG Chooses: -1 Morale and land one Viper from space (if able). OR CAG discards 3 random skill cards.
A208: Close to a Black Hole | E208: X | P208: R/D | R208: Admiral Chooses: Destroy one Viper (in space if able) and one Raptor, increase Hand of Fate counter by 2. OR Decrease Hand of Fate counter by 2, then: Activate Raiders, Activate Defenders, Activate Heavy Raiders.
A209: Fighting Alongside Centurions | H209: X | J209: X | M209: 9 | P209: P | R209: Pass: Current Player chooses a Defender to destroy; Fail: -1 Food, then: Sneak Attack, Sneak Attack.
A210: Ready to Battle | E210: X | P210: H/S | R210: Admiral Chooses: Every Human Player may draw 2 Tactics Skill Cards, then decreases the Hand of Fate counter by 1, then: Place Defenders. OR Admiral may lose 1 Fuel to repair one Galactica Location or 2 damaged Vipers, then: Activate Defenders.
A211: Sending the Fleet Away | E211: X | P211: H/S | R211: Admiral Chooses: The Admiral must discard 4 Skill Cards, then pass the Admiral title to the next character in the line of succession. OR -2 Population.
A212: Crazy Raptor Assault | I212: X | J212: X | K212: X | M212: 12 | P212: R/D | Q212: X | R212: Pass: Current Player may move any one human to position 3 on the Assault Track; Fail: -1 Fuel, destroy a Raptor.
A213: Secret of the Opera House | D213: X | P213: R/D | Q213: X | R213: President Chooses: Damage Galactica and move Hera one position to the left. OR Sneak Attack, Activate Defenders.
A214: Nukes Fired | J214: X | K214: X | M214: 12 | P214: R/D | Q214: X | R214: Pass: Damage Colony twice; Fail: Damage Galactica twice.
A215: Dealing with Past Decisions | H215: X | I215: X | M215: 8 | P215: P | Q215: X | R215: Pass: No Effect; Fail: -1 Morale and the Current Player is sent to Sickbay.
A216: Galactica's Hybrid | H216: X | L216: X | M216: 9 | P216: H/D | Q216: X | R216: Pass: Current Player chooses one Galactica Location to repair; Fail: -1 Fuel, -1 Morale.
A217: Casualties of Battle | H217: X | I217: X | J217: X | M217: 12 | N217: 8 | P217: R/D | R217: Pass: Current Player may choose to Execute a Cylon player; 8+: No Effect; Fail: Current Player is Executed.
A218: Centurion Counterattack | I218: X | J218: X | M218: 10 | N218: 6 | P218: A | R218: Pass: No Effect; 6+: Place one Centurion on the start of the Boarding Party track; Fail: Place one Centurion on the start of the Boarding Party track and Damage Galactica.
A219: Gun Barrage | I219: X | J219: X | L219: X | M219: 10 | P219: A | Q219: X | R219: Pass: Current Player can either damage Colony or destroy a Defender; Fail: Damage Galactica.
A220: Helped by the Enemy | C220: X | H220: X | I220: X | J220: X | M220: 12 | P220: P | R220: Current Player Chooses: Pass: Move Hera one position to the left; Fail: Activate All Defenders, then place a Centurion on the Boarding Party track. OR -1 Population.
A221: Treating the Wounded | H221: X | I221: X | M221: 7 | N221: 4 | P221: P | Q221: X | R221: Pass: No Effect; 4+: Current Player must send another Human player to Sickbay; Fail: -2 Food, and Current Player is sent to Sickbay.
A222: Spatial Distortions | C222: X | J222: X | K222: X | L222: X | M222: 7 | P222: A | Q222: X | R222: Current Player Chooses: Pass: No Effect; Fail: Damage Galactica. OR -1 Fuel.
A223: Experiments on Hera | H223: X | I223: X | J223: X | M223: 10 | N223: 6 | P223: R/D | R223: Pass: No Effect; 6+: -1 Morale; Fail: -1 Morale, and place Hera on Position 6 of the Assault Track.
A224: Prepare to Abandon Ship | H224: X | I224: X | J224: X | M224: 11 | P224: P | Q224: X | R224: Pass: +1 Morale; Fail: -1 Morale and damage Galactica.
A225: Messengers from God | I225: X | M225: 8 | P225: R/D | Q225: X | R225: Pass: +1 Morale; Fail: -1 Morale; Prove Faith: Decrease the Difficulty of this Skill Check by the number of PF cards in the check.
A226: Recall the Fighters | J226: X | K226: X | M226: 10 | P226: R/D | Q226: X | R226: Pass: Remove one Raider from each space area (where able) and decrease the Hand of Fate counter by 1; Fail: Damage a Viper (in space if able) and the Admiral must discard 2 random Skill Cards.
A227: Perfection | H227: X | I227: X | K227: X | M227: 14 | O227: X | P227: A | Q227: X | R227: Pass: All Humans on the Assault Track may move to an adjacent position; Fail: The rightmost Human on the Assault Track is sent to Sickbay; Consequence: Damage Galactica.
A228: Rage | H228: X | I228: X | L228: X | M228: 12 | N228: 7 | P228: H/S | Q228: X | R228: Pass: No Effect; 7+: Activate Raiders; Fail: Activate Raiders, then Current Player must choose another Human player to Execute.
A229: Destiny's Hand | I229: X | J229: X | K229: X | M229: 12 | P229: A | R229: Pass: Each player who participated in this Skill Check may draw 2 Faith Skill Cards; Fail: Increase Hand of Fate counter by 2.
A230: Using Cylon Technology | C230: X | H230: X | I230: X | L230: X | M230: 10 | P230: H/D | Q230: X | R230: Pass: Current Player choose 2 Galactica Locations to repair; Fail: -1 Morale and damage Galactica. OR Damage Galactica, and all characters in Weapons Control are sent to Sickbay.
A231: Civilians Left Behind | H231: X | I231: X | J231: X | M231: 13 | N231: 8 | P231: R/D | Q231: X | R231: Pass: No Effect; 8+: Destroy a Raptor; Fail: Destroy a Raptor, then the Admiral draws three Civilian ships and chooses two of them to destroy.
A232: Interim President | H232: X | I232: X | M232: 7 | P232: R/D | R232: Pass: The Admiral may choose a player and give them the President title; Fail: -1 Population. If Population is now 5 or less, -1 Morale.
A233: Crossing the Line | H233: X | I233: X | J233: X | K233: X | M233: 20 | N233: 16 | P233: R/D | Q233: X | R233: Pass: +1 Morale, and all Humans on the Assault Track may move to an adjacent position; 16+: +1 Morale; Fail: -1 Morale, -1 Population, -1 Food.
A234: Haunted by Lives Past | D234: X | P234: R/H | R234: President Chooses: +1 Morale, then: Activate All Defenders, Place Defenders. OR -2 Morale.
A235: Old Enmities | D235: X | P235: R/H | R235: President Chooses: +1 Morale, damage Galactica, and increase the Hand of Fate counter by 1. OR -1 Food, the Current Player is sent to the Brig, decrease the Hand of Fate counter by 1.
A236: One Act of Bravery | C236: X | H236: X | I236: X | J236: X | M236: 10 | P236: R/H | R236: Current Player Chooses: Pass: Decrease Hand of Fate counter by 1; Fail: Current Player must discard all of his Skill Cards or move to the Brig. OR Current Player must send a Human from the Assault Track to Sickbay. You cannot choose this option if there are no Humans on the Assault Track.
A239: Super Crisis Cards
A240: Super Crisis Cards | B240: In Hand | C240: Discard | H240: Politics | I240: Leadership | J240: Tactics | K240: Piloting | L240: Engineering | M240: Difficulty | N240: Partial | O240: Consequence | P240: Activation | Q240: Jump Track | R240: Description | S240: Basestars | T240: Heavy Raiders | U240: Raiders | V240: Vipers | W240: Civilians
A241: Bomb on Colonial One | J241: X | K241: X | L241: X | M241: 15 | R241: Pass: No Effect; Fail : -2 Morale, and all characters on Colonial One are sent to 'Sickbay'. Keep this card in play. Characters may not move to Colonial One for the rest of the game. | X241: B
A242: Cylon Intruders | I242: X | J242: X | M242: 18 | N242: 14 | R242: Pass: No Effect; 14+: Place 1 Centurion marker at the start of the Boarding Party track; Fail: Damage Galactica and place 2 Centurion markers at the start of the Boarding Party Track. | X242: B
A243: Fleet Mobilization | I243: X | J243: X | K243: X | L243: X | M243: 24 | R243: Pass: Activate Basestars, Launch Raiders; Fail : -1 Morale, and Activate Basestars, Activate Raiders, Activate Heavy Raiders, Launch Raiders. | X243: B
A244: Inbound Nukes | I244: X | J244: X | M244: 15 | R244: Pass: No Effect; Fail: -1 Fuel, -1 Food, and -1 Population. | X244: B
A245: Massive Assault | P245: H/B | R245: 1) Activate Heavy Raiders, Activate Basestars. 2) Setup Ships. 3) Power Failure: Move the Fleet token 2 spaces towards the start of the Jump Preparation track. | S245: 1x[2,3] | T245: 1x3 | U245: 4x2,2x3 | V245: 1x[5,6] | W245: 2x[5,6] | X245: B
A246: Demand Peace' Manifesto | R246: Admiral Chooses: -1 Morale and damage Galactica twice. OR The President and Admiral each discard their hand of Skill Cards. | X246: P
A247: Footage Transmitted | H247: X | I247: X | J247: X | M247: 17 | N247: 12 | R247: Pass: Each player draws 1 Treachery; 12+: Each Revealed Cylon player draws 2 Treachery; Fail: Each Revealed Cylon player draws 2 Treachery and 1 Super Crisis Card. | X247: P
A248: Lured into a Trap | P248: R | R248: 1) Activate Raiders. 2) Setup Ships. 3) Dangerous Repairs are Necessary: Keep this card in play until after the Fleet Jumps. Any character in either Engine Room or FTL Control when the fleet jumps is Executed. | S248: 1x[2,3] | T248: 1x4 | U248: 3x[2,3] | V248: 1x[5,6] | W248: 1x[5,6] | X248: P
A249: Psychological Warfare | R249: President Chooses: -1 Morale, each player discards 2 Skill Cards and draws 2 Treachery. OR Each Revealed Cylon draws 2 Treachery, then discard the Destiny deck and build a new one of 6 Treachery Cards. | X249: P
A250: The Farm | J250: X | L250: X | M250: 15 | N250: 8 | R250: Pass: No Effect; 8+: -1 Food; Fail: -1 Food, -1 Population. Keep this card in play. Human players may not use their once-per-game abilities. | X250: P
A251: Fighting Blind | R251: CAG Chooses: Place 2 Centurions at the start of the Boarding Party track. OR The CAG is Executed. | X251: E
A252: Fire All Missiles | J252: X | K252: X | M252: 22 | O252: X | R252: Pass: No Effect; Fail: Draw 2 Civilian Ships to destroy; Consequences: Damage Galactica twice. | X252: E
A253: Human Prisoner | I253: X | J253: X | M253: 18 | R253: Pass: No Effect; Fail: The Cylon player who played this card chooses one Human player and takes all of his Skill Cards. That human player's character is then sent to Sickbay. | X253: E
A254: Facing the Impossible | M254: 10 | R254: Pass: No Effect; Fail: -1 Food, -1 Morale, -1 Population | X254: R
A255: Frak Earth | H255: X | I255: X | M255: 13 | N255: 1 | O255: X | R255: Pass: No Effect; Fail: -1 Population and place this card next to the Kobol Objective card. It counts as -1 Distance. Prove Faith: All revealed Cylons may draw 2 Faith Skill Cards | X255: R
A258: End-Game Battles | C258: Discard | H258: Politics | I258: Leadership | J258: Tactics | K258: Piloting | L258: Engineering | M258: Value | N258: Partial | O258: Consequence | P258: Activation | Q258: Jump Track | R258: Description | S258: Basestars | T258: Heavy Raiders | U258: Raiders | V258: Vipers | W258: Civilians
A259: Battle of New Caprica | S259: 1x[2,3] | U259: 4x[2,3] | V259: 2x[5,6] | X259: P
A260: Battle of the Ionian Nebula | S260: 1x[2,3] | U260: 4x[2,3] | V260: 2x[5,6] | X260: E
A261: Battle of the Colony | U261: 2x[1,4] | X261: R

Sheet: Posting Templates
A1: REFERENCE DATA: | C1: INTERRUPTS FOR SKILL CHECK | E1: CURRENT HAND EMAILS | O1: Start of Turn
E2: of:= IF(AND(['Game State'.$G3]="X";['Game State'.$H3]="X");"[color=purple]" & [.$A$68] & "[/color] ";IF(['Game State'.$G3]="X";"[color=orange]President[/color] ";IF(['Game State'.$H3]="X";"[color=green]Admiral[/color] ";""))) & IF(['Game State'.$I3]<>"";"[color=teal]CAG[/color] ";"") & IF([Loyalty.E18] = 1;"[color=brown]Mutineer[/color] ";"") & IF([.$A$45]="X";"";IF(['Board Status'.$P$12]=[.$E3];"[color=orange]"&['Board Status'.$Q$12] & "[/color] ";"") & IF(['Board Status'.$P$13]=[.$E3];"[color=orange]"&['Board Status'.$Q$13] & "[/color] ";"") & IF(['Board Status'.$P$14]=[.$E3];"[color=orange]"&['Board Status'.$Q$14] & "[/color] ";"") & IF(['Board Status'.$P$15]=[.$E3];"[color=orange]"&['Board Status'.$Q$15] & "[/color] ";"")) ->  | F2: of:=IF(AND(['Game State'.$G4]="X";['Game State'.$H4]="X");"[color=purple]" & [.$A$68] & "[/color] ";IF(['Game State'.$G4]="X";"[color=orange]President[/color] ";IF(['Game State'.$H4]="X";"[color=green]Admiral[/color] ";""))) & IF(['Game State'.$I4]<>"";"[color=teal]CAG[/color] ";"") & IF([Loyalty.E18] = 2;"[color=brown]Mutineer[/color] ";"") & IF([.$A$45]="X";"";IF(['Board Status'.$P$12]=[.$F3];"[color=orange]"&['Board Status'.$Q$12] & "[/color] ";"") & IF(['Board Status'.$P$13]=[.$F3];"[color=orange]"&['Board Status'.$Q$13] & "[/color] ";"") & IF(['Board Status'.$P$14]=[.$F3];"[color=orange]"&['Board Status'.$Q$14] & "[/color] ";"") & IF(['Board Status'.$P$15]=[.$F3];"[color=orange]"&['Board Status'.$Q$15] & "[/color] ";"")) ->  | G2: of:=IF(AND(['Game State'.$G5]="X";['Game State'.$H5]="X");"[color=purple]" & [.$A$68] & "[/color] ";IF(['Game State'.$G5]="X";"[color=orange]President[/color] ";IF(['Game State'.$H5]="X";"[color=green]Admiral[/color] ";""))) & IF(['Game State'.$I5]<>"";"[color=teal]CAG[/color] ";"") & IF([Loyalty.E18] = 3;"[color=brown]Mutineer[/color] ";"") & IF([.$A$45]="X";"";IF(['Board Status'.$P$12]=[.$G3];"[color=orange]"&['Board Status'.$Q$12] & "[/color] ";"") & IF(['Board Status'.$P$13]=[.$G3];"[color=orange]"&['Board Status'.$Q$13] & "[/color] ";"") & IF(['Board Status'.$P$14]=[.$G3];"[color=orange]"&['Board Status'.$Q$14] & "[/color] ";"") & IF(['Board Status'.$P$15]=[.$G3];"[color=orange]"&['Board Status'.$Q$15] & "[/color] ";"")) -> [color=orange]President[/color]  | H2: of:=IF(AND(['Game State'.$G6]="X";['Game State'.$H6]="X");"[color=purple]" & [.$A$68] & "[/color] ";IF(['Game State'.$G6]="X";"[color=orange]President[/color] ";IF(['Game State'.$H6]="X";"[color=green]Admiral[/color] ";""))) & IF(['Game State'.$I6]<>"";"[color=teal]CAG[/color] ";"") & IF([Loyalty.E18] = 4;"[color=brown]Mutineer[/color] ";"") & IF([.$A$45]="X";"";IF(['Board Status'.$P$12]=[.$H3];"[color=orange]"&['Board Status'.$Q$12] & "[/color] ";"") & IF(['Board Status'.$P$13]=[.$H3];"[color=orange]"&['Board Status'.$Q$13] & "[/color] ";"") & IF(['Board Status'.$P$14]=[.$H3];"[color=orange]"&['Board Status'.$Q$14] & "[/color] ";"") & IF(['Board Status'.$P$15]=[.$H3];"[color=orange]"&['Board Status'.$Q$15] & "[/color] ";"")) ->  | I2: of:= IF(AND(['Game State'.$G7]="X";['Game State'.$H7]="X");"[color=purple]" & [.$A$68] & "[/color] ";IF(['Game State'.$G7]="X";"[color=orange]President[/color] ";IF(['Game State'.$H7]="X";"[color=green]Admiral[/color] ";""))) & IF(['Game State'.$I7]<>"";"[color=teal]CAG[/color] ";"") & IF([Loyalty.E18] = 5;"[color=brown]Mutineer[/color] ";"") & IF([.$A$45]="X";"";IF(['Board Status'.$P$12]=[.$I3];"[color=orange]"&['Board Status'.$Q$12] & "[/color] ";"") & IF(['Board Status'.$P$13]=[.$I3];"[color=orange]"&['Board Status'.$Q$13] & "[/color] ";"") & IF(['Board Status'.$P$14]=[.$I3];"[color=orange]"&['Board Status'.$Q$14] & "[/color] ";"") & IF(['Board Status'.$P$15]=[.$I3];"[color=orange]"&['Board Status'.$Q$15] & "[/color] ";"")) -> [color=green]Admiral[/color]  | J2: of:=IF(AND(['Game State'.$G8]="X";['Game State'.$H8]="X");"[color=purple]" & [.$A$68] & "[/color] ";IF(['Game State'.$G8]="X";"[color=orange]President[/color] ";IF(['Game State'.$H8]="X";"[color=green]Admiral[/color] ";""))) & IF(['Game State'.$I8]<>"";"[color=teal]CAG[/color] ";"") & IF([Loyalty.E18] = 6;"[color=brown]Mutineer[/color] ";"") & IF([.$A$45]="X";"";IF(['Board Status'.$P$12]=[.$J3];"[color=orange]"&['Board Status'.$Q$12] & "[/color] ";"") & IF(['Board Status'.$P$13]=[.$J3];"[color=orange]"&['Board Status'.$Q$13] & "[/color] ";"") & IF(['Board Status'.$P$14]=[.$J3];"[color=orange]"&['Board Status'.$Q$14] & "[/color] ";"") & IF(['Board Status'.$P$15]=[.$J3];"[color=orange]"&['Board Status'.$Q$15] & "[/color] ";"")) ->  | K2: of:=IF(AND(['Game State'.$G9]="X";['Game State'.$H9]="X");"[color=purple]" & [.$A$68] & "[/color] ";IF(['Game State'.$G9]="X";"[color=orange]President[/color] ";IF(['Game State'.$H9]="X";"[color=green]Admiral[/color] ";""))) & IF(['Game State'.$I9]<>"";"[color=teal]CAG[/color] ";"") & IF([Loyalty.E18] = 7;"[color=brown]Mutineer[/color] ";"") & IF([.$A$45]="X";"";IF(['Board Status'.$P$12]=[.$K3];"[color=orange]"&['Board Status'.$Q$12] & "[/color] ";"") & IF(['Board Status'.$P$13]=[.$K3];"[color=orange]"&['Board Status'.$Q$13] & "[/color] ";"") & IF(['Board Status'.$P$14]=[.$K3];"[color=orange]"&['Board Status'.$Q$14] & "[/color] ";"") & IF(['Board Status'.$P$15]=[.$K3];"[color=orange]"&['Board Status'.$Q$15] & "[/color] ";"")) -> [color=orange][/color] [color=orange][/color] [color=orange][/color] [color=orange][/color]  | O2: of:=IF([.$A$4]<>"";IF([.$A$48]="X";"[IMG]http://dl.dropbox.com/u/" & [.$A$17] & "/Banners/" & [.$A$4] & ".jpg[/IMG]";"[imageid=" & [.$A$4] & " medium]");"") -> [IMG]http://dl.dropbox.com/u/11356574/Banners/Moderator.jpg[/IMG]
A3: Preferred Moderator Banner | C3: of:=IF([.$A$4]<>"";IF([.$A$48]="X";"[IMG]http://dl.dropbox.com/u/" & [.$A$17] & "/Banners/" & [.$A$4] & ".jpg[/IMG]";"[imageid=" & [.$A$4] & " medium]");"") -> [IMG]http://dl.dropbox.com/u/11356574/Banners/Moderator.jpg[/IMG] | E3: of:=['Skill Cards'.A30] -> Gaius | F3: of:=['Skill Cards'.B30] -> Athena | G3: of:=['Skill Cards'.C30] -> Lee | H3: of:=['Skill Cards'.D30] -> Tom | I3: of:=['Skill Cards'.E30] -> Karl | J3: of:=['Skill Cards'.F30] -> Cottle | K3: of:=['Skill Cards'.G30] -> 0 | L3: Presidential Attachment | O3: of:= "[b][i][size=" & IF([.$A$48]<>"";4;14) & "]Turn " & ['Game State'.L1] & "." & ['Game State'.M1] & ": " & INDIRECT(ADDRESS(2;4+[.$A$36]))&INDIRECT(ADDRESS(3;4+[.$A$36])) & " is the Current Player.[/b][/i][/size]" -> [b][i][size=4]Turn 7.3: [color=orange]President[/color] Lee is the Current Player.[/b][/i][/size]
A4: Moderator | C4: of:=IF([.$A$48]="X";"[code]";"[q=""Interrupts for " & ['Skill Cards'.$H$2] & """]") -> [code] | E4: of:=['Game State'.B3] -> Shadowed | F4: of:=['Game State'.B4] -> Karantor | G4: of:=['Game State'.B5] -> Zoronos | H4: of:=['Game State'.B6] -> Tymber | I4: of:=['Game State'.B7] -> Simmons | J4: of:=['Game State'.B8] -> Masnie | K4: of:=['Game State'.B9] -> 0 | N4: of:=2+(['Game State'.$L$1] - 1) * [.$A$33] + ['Game State'.$M$1] -> 41 | O4: of:= IF([.$A$48] = "X";"[IMG][/IMG]";"[imageid=" & INDIRECT("'Notes and Thoughts'." & ADDRESS([.$N$4]; 3)) & " large]") -> [IMG][/IMG]
C5: of:="[size="&IF([.$A$48]="X";5;14)&"][b]Interrupts for " & ['Skill Cards'.$H$2]& " - " &['Skill Cards'.$P$2] & IF(['Skill Cards'.$Q$2]="";"";"("&['Skill Cards'.$Q$2]&")") & IF(['Skill Cards'.$I$2]="X";[.$A$8] & "Y[/color]";"") & IF(['Skill Cards'.$J$2]="X";[.$A$9] & "G[/color]";"") & IF(['Skill Cards'.$K$2]="X";[.$A$10] & "P[/color]";"") & IF(['Skill Cards'.$L$2]="X";[.$A$11] & "R[/color]";"") & IF(['Skill Cards'.$M$2]="X";[.$A$12] & "B[/color]";"") &  IF(['Skill Cards'.$N$2]="X";[.$A$13] & "O[/color]";"") & "[/b][/size]" -> [size=5][b]Interrupts for  - [/b][/size] | E5: of:="BSG " & ['Game State'.$C1] & " - Turn " & ['Game State'.$L$1] & "." & ['Game State'.$M$1] & " Current Hand" -> BSG 1 - Turn 7.3 Current Hand | F5: of:="BSG " & ['Game State'.$C1] & " - Turn " & ['Game State'.$L$1] & "." & ['Game State'.$M$1] & " Current Hand" -> BSG 1 - Turn 7.3 Current Hand | G5: of:="BSG " & ['Game State'.$C1] & " - Turn " & ['Game State'.$L$1] & "." & ['Game State'.$M$1] & " Current Hand" -> BSG 1 - Turn 7.3 Current Hand | H5: of:="BSG " & ['Game State'.$C1] & " - Turn " & ['Game State'.$L$1] & "." & ['Game State'.$M$1] & " Current Hand" -> BSG 1 - Turn 7.3 Current Hand | I5: of:="BSG " & ['Game State'.$C1] & " - Turn " & ['Game State'.$L$1] & "." & ['Game State'.$M$1] & " Current Hand" -> BSG 1 - Turn 7.3 Current Hand | J5: of:="BSG " & ['Game State'.$C1] & " - Turn " & ['Game State'.$L$1] & "." & ['Game State'.$M$1] & " Current Hand" -> BSG 1 - Turn 7.3 Current Hand | K5: of:="BSG " & ['Game State'.$C1] & " - Turn " & ['Game State'.$L$1] & "." & ['Game State'.$M$1] & " Current Hand" -> BSG 1 - Turn 7.3 Current Hand
C6: of:="Looking for "&IF([.C61]<>"";[.C61]&IF(COUNTIF([.C62:.C66];"<>")>0;IF(COUNTIF([.C61:.C66];"<>")>2;",";"")&CHAR(10);"");"")&IF([.C62]<>"";IF(AND([.C61]<>"";COUNTIF([.C63:.C66];"<>")=0);"and/or ";"")&[.C62]&IF(COUNTIF([.C63:.C66];"<>")>0;IF(COUNTIF([.C61:.C66];"<>")>2;",";"")&CHAR(10);"");"")&IF([.C63]<>"";IF(AND(COUNTIF([.C61:.C62];"<>")>0;COUNTIF([.C64:.C66];"<>")=0);"and/or ";"")&[.C63]&IF(COUNTIF([.C64:.C66];"<>")>0;IF(COUNTIF([.C61:.C66];"<>")>2;",";"")&CHAR(10);"");"")&IF([.C64]<>"";IF(AND(COUNTIF([.C61:.C63];"<>")>0;COUNTIF([.C65:.C66];"<>")=0);"and/or ";"")&[.C64]&IF(COUNTIF([.C65:.C66];"<>")>0;IF(COUNTIF([.C61:.C66];"<>")>2;",";"")&CHAR(10);"");"")&IF([.C65]<>"";IF(AND([.C66]="";COUNTIF([.C61:.C64];"<>")>0);"and/or ";"")&[.C65]&IF(IF([.C66]<>"");IF(COUNTIF([.C61:.C66];"<>")>2;",";"")&CHAR(10);"");"")&IF([.C66]<>"";IF(COUNTIF([.C61:.C65];"<>")>0;"and/or ";"")&[.C66];"")&"." -> Looking for [color=orange]Investigative Committee[/color],
[color=green]Restore Order[/color],
[color=purple]A Second Chance[/color],
and/or [color=blue]Scientific Research[/color]. | E6: of:="[b]"&[.E2]&[.E3]&"[/b]"&", your current hand, including your draw, is:" -> [b]Gaius[/b], your current hand, including your draw, is: | F6: of:="[b]"&[.F2]&[.F3]&"[/b]"&", your current hand, including your draw, is:" -> [b]Athena[/b], your current hand, including your draw, is: | G6: of:="[b]"&[.G2]&[.G3]&"[/b]"&", your current hand, including your draw, is:" -> [b][color=orange]President[/color] Lee[/b], your current hand, including your draw, is: | H6: of:="[b]"&[.H2]&[.H3]&"[/b]"&", your current hand, including your draw, is:" -> [b]Tom[/b], your current hand, including your draw, is: | I6: of:="[b]"&[.I2]&[.I3]&"[/b]"&", your current hand, including your draw, is:" -> [b][color=green]Admiral[/color] Karl[/b], your current hand, including your draw, is: | J6: of:="[b]"&[.J2]&[.J3]&"[/b]"&", your current hand, including your draw, is:" -> [b]Cottle[/b], your current hand, including your draw, is: | K6: of:="[b]"&[.K2]&['Game State'.$E9]&"[/b]"&", your current hand, including your draw, is:"&IF([.$A$48]="X";"[LIST]";"") -> [b][color=orange][/color] [color=orange][/color] [color=orange][/color] [color=orange][/color] [/b], your current hand, including your draw, is:[LIST] | L6: of:= "As [i]President[/i], the Quorum has provided you with the following:" -> As [i]President[/i], the Quorum has provided you with the following: | O6: of:="[b]"&INDIRECT(ADDRESS(2;4+[.$A$36]))&INDIRECT(ADDRESS(3;4+[.$A$36]))&" draws <PLACEHOLDER> by CO.[/b]" -> [b][color=orange]President[/color] Lee draws <PLACEHOLDER> by CO.[/b]
A7: Skill Colors | C7: of:=IF(['Skill Cards'.$I$25]<>"";"[b][color=orange]Investigative committee[/color][/b] in play, all cards "&IF(['Game State'.$M$36]<>"";"except destiny ";"")&"are played face up." & CHAR(10);"")&IF(['Skill Cards'.$J$25]<>"";"[b][color=green]Restore Order[/color][/b] is in play, Skill Check abilities will not be resolved."& CHAR(10);"")&IF(['Skill Cards'.$J$26]<>"";"It is [b][color=green]Adama's[/color][/b] turn, all 1s are positive. "& CHAR(10);"")&IF(['Skill Cards'.$N$25]<>"";"This skill check is [b][color=brown]Reckless[/color][/b].";"") ->  | E7: of:=IF(['Skill Cards'.A33]<>"";['Skill Cards'.A33];"") -> [color=red]1 - Evasive Maneuvers[/color] | F7: of:=IF(['Skill Cards'.B33]<>"";['Skill Cards'.B33];"") -> [color=green]1 - Executive Order[/color] | G7: of:=IF(['Skill Cards'.C33]<>"";['Skill Cards'.C33];"") -> [color=orange]0 - Force Their Hand[/color] | H7: of:=IF(['Skill Cards'.D33]<>"";['Skill Cards'.D33];"") -> [color=orange]3 - Investigative Committee[/color] | I7: of:=IF(['Skill Cards'.E33]<>"";['Skill Cards'.E33];"") -> [color=green]0 - All Hands On Deck[/color] | J7: of:=IF(['Skill Cards'.F33]<>"";['Skill Cards'.F33];"") -> [color=orange]1 - Consolidate Power[/color] | K7: of:=IF(['Skill Cards'.G33]<>"";['Skill Cards'.G33];"") ->  | L7: of:=IF(['Quorum Cards'.$C16]<>"";['Quorum Cards'.$C16];"") -> Presidential Pardon
A8: [color=orange] | E8: of:=IF(['Skill Cards'.A34]<>"";['Skill Cards'.A34];"") -> [color=red]2 - Evasive Maneuvers[/color] | F8: of:=IF(['Skill Cards'.B34]<>"";['Skill Cards'.B34];"") -> [color=green]3 - Declare Emergency[/color] | G8: of:=IF(['Skill Cards'.C34]<>"";['Skill Cards'.C34];"") -> [color=orange]2 - Consolidate Power[/color] | H8: of:=IF(['Skill Cards'.D34]<>"";['Skill Cards'.D34];"") -> [color=red]2 - Evasive Maneuvers[/color] | I8: of:=IF(['Skill Cards'.E34]<>"";['Skill Cards'.E34];"") -> [color=red]0 - Dogfight[/color] | J8: of:=IF(['Skill Cards'.F34]<>"";['Skill Cards'.F34];"") -> [color=orange]2 - Consolidate Power[/color] | K8: of:=IF(['Skill Cards'.G34]<>"";['Skill Cards'.G34];"") ->  | L8: of:=IF(['Quorum Cards'.$C17]<>"";['Quorum Cards'.$C17];"") -> Encourage Mutiny | O8: Crisis Announcement
A9: [color=green] | C9: of:=INDIRECT("'Game State'." & ADDRESS(2+[.$A$36];5)) & " (" & INDIRECT("'Skill Cards'." & ADDRESS(18+[.$A$36];2)) & ")" & " - " & IF(AND(INDIRECT("'Game State'." & ADDRESS(2+[.$A$36];12))="X";INDIRECT("'Game State'." & ADDRESS(2+[.$A$36];4))<>"X");"CYLON";IF(INDIRECT("'Skill Cards'."&ADDRESS(18+[.$A$36];2)) = 0;"PASS: No Cards";IF(OR([.$A$39]="X";['Game State'.$M$36]="X");"";IF(['Skill Cards'.$M$2]="";IF(OR(INDIRECT("'Skill Cards'." & ADDRESS(149;[.$A$36]))="X";INDIRECT("'Skill Cards'." & ADDRESS(153;[.$A$36]))="X");"";"PASS: No Politics or Engineering");IF(INDIRECT("'Skill Cards'." & ADDRESS(149;[.$A$36]))="X";"";"PASS: No Politics"))))) -> Lee (7) -  | E9: of:=IF(['Skill Cards'.A35]<>"";['Skill Cards'.A35];"") -> [color=blue]4 - Scientific Research[/color] | F9: of:=IF(['Skill Cards'.B35]<>"";['Skill Cards'.B35];"") -> [color=green]3 - Declare Emergency[/color] | G9: of:=IF(['Skill Cards'.C35]<>"";['Skill Cards'.C35];"") -> [color=green]1 - Executive Order[/color] | H9: of:=IF(['Skill Cards'.D35]<>"";['Skill Cards'.D35];"") -> [color=#a52a2a]0 - Dradis Contact[/color] | I9: of:=IF(['Skill Cards'.E35]<>"";['Skill Cards'.E35];"") -> [color=#a52a2a]3 - A Better Machine[/color] | J9: of:=IF(['Skill Cards'.F35]<>"";['Skill Cards'.F35];"") -> [color=purple]1 - Launch Scout[/color] | K9: of:=IF(['Skill Cards'.G35]<>"";['Skill Cards'.G35];"") ->  | L9: of:=IF(['Quorum Cards'.$C18]<>"";['Quorum Cards'.$C18];"") -> Assign Arbitrator | O9: of:="[imageid=" & IF(INDIRECT("'Crisis Cards'." & ADDRESS([.$N12];7)) = "X";[.$A$51];[.$A$4]) & " medium]" -> [imageid=Moderator medium]
A10: [color=purple] | C10: of:=INDIRECT("'Game State'." & ADDRESS(3+MOD([.$A$36];[.$A$33]);5)) & " (" & INDIRECT("'Skill Cards'." & ADDRESS(19+MOD([.$A$36];[.$A$33]);2)) & ")" & " - " & IF(AND(INDIRECT("'Game State'." & ADDRESS(3+MOD([.$A$36];[.$A$33]);12))="X";INDIRECT("'Game State'." & ADDRESS(3+MOD([.$A$36];[.$A$33]);4))<>"X");"CYLON";IF(INDIRECT("'Skill Cards'."&ADDRESS(19+MOD([.$A$36];[.$A$33]);2)) = 0;"PASS: No Cards";IF(OR([.$A$39]="X";['Game State'.$M$36]="X");"";IF(['Skill Cards'.$M$2]="";IF(OR(INDIRECT("'Skill Cards'." & ADDRESS(149;1+MOD([.$A$36];[.$A$33])))="X";INDIRECT("'Skill Cards'." & ADDRESS(153;1+MOD([.$A$36];[.$A$33])))="X");"";"PASS: No Politics or Engineering");IF(INDIRECT("'Skill Cards'." & ADDRESS(149;1+MOD([.$A$36];[.$A$33])))="X";"";"PASS: No Politics"))))) -> Tom (5) - CYLON | E10: of:=IF(['Skill Cards'.A36]<>"";['Skill Cards'.A36];"") -> [color=#a52a2a]5 - Exploit Weakness[/color] | F10: of:=IF(['Skill Cards'.B36]<>"";['Skill Cards'.B36];"") -> [color=red]3 - Combat Veteran[/color] | G10: of:=IF(['Skill Cards'.C36]<>"";['Skill Cards'.C36];"") -> [color=green]4 - Declare Emergency[/color] | H10: of:=IF(['Skill Cards'.D36]<>"";['Skill Cards'.D36];"") -> [color=#a52a2a]0 - Dradis Contact[/color] | I10: of:=IF(['Skill Cards'.E36]<>"";['Skill Cards'.E36];"") -> [color=#a52a2a]4 - Violent Outbursts[/color] | J10: of:=IF(['Skill Cards'.F36]<>"";['Skill Cards'.F36];"") -> [color=purple]2 - Launch Scout[/color] | K10: of:=IF(['Skill Cards'.G36]<>"";['Skill Cards'.G36];"") ->  | L10: of:=IF(['Quorum Cards'.$C19]<>"";['Quorum Cards'.$C19];"") -> Release Cylon Mugshots | O10: [floatleft][imageid=][/floatleft]
A11: [color=red] | C11: of:=INDIRECT("'Game State'." & ADDRESS(3+MOD([.$A$36]+1;[.$A$33]);5)) & " (" & INDIRECT("'Skill Cards'." & ADDRESS(19+MOD([.$A$36]+1;[.$A$33]);2)) & ")" & " - " & IF(AND(INDIRECT("'Game State'." & ADDRESS(3+MOD([.$A$36]+1;[.$A$33]);12))="X";INDIRECT("'Game State'." & ADDRESS(3+MOD([.$A$36]+1;[.$A$33]);4))<>"X");"CYLON";IF(INDIRECT("'Skill Cards'."&ADDRESS(19+MOD([.$A$36] + 1;[.$A$33]);2)) = 0;"PASS: No Cards";IF(OR([.$A$39]="X";['Game State'.$M$36]="X");"";IF(['Skill Cards'.$M$2]="";IF(OR(INDIRECT("'Skill Cards'." & ADDRESS(149;1+MOD([.$A$36]+1;[.$A$33])))="X";INDIRECT("'Skill Cards'." & ADDRESS(153;1+MOD([.$A$36]+1;[.$A$33])))="X");"";"PASS: No Politics or Engineering");IF(INDIRECT("'Skill Cards'." & ADDRESS(149;1+MOD([.$A$36]+1;[.$A$33])))="X";"";"PASS: No Politics"))))) -> Karl (5) -  | E11: of:=IF(['Skill Cards'.A37]<>"";['Skill Cards'.A37];"") ->  | F11: of:=IF(['Skill Cards'.B37]<>"";['Skill Cards'.B37];"") -> [color=blue]2 - Repair[/color] | G11: of:=IF(['Skill Cards'.C37]<>"";['Skill Cards'.C37];"") -> [color=purple]1 - Launch Scout[/color] | H11: of:=IF(['Skill Cards'.D37]<>"";['Skill Cards'.D37];"") -> [color=#a52a2a]3 - Personal Vices[/color] | I11: of:=IF(['Skill Cards'.E37]<>"";['Skill Cards'.E37];"") -> [color=#a52a2a]4 - Violent Outbursts[/color] | J11: of:=IF(['Skill Cards'.F37]<>"";['Skill Cards'.F37];"") -> [color=blue]1 - Repair[/color] | K11: of:=IF(['Skill Cards'.G37]<>"";['Skill Cards'.G37];"") ->  | L11: of:=IF(['Quorum Cards'.$C20]<>"";['Quorum Cards'.$C20];"") -> Assign Vice President | O11: of:="[i]" -> [i]
A12: [color=blue] | C12: of:=IF([.$A$33] > 3;INDIRECT("'Game State'." & ADDRESS(3+MOD([.$A$36]+2;[.$A$33]);5)) & " (" & INDIRECT("'Skill Cards'." & ADDRESS(19+MOD([.$A$36]+2;[.$A$33]);2)) & ")" & " - " & IF(AND(INDIRECT("'Game State'." & ADDRESS(3+MOD([.$A$36]+2;[.$A$33]);12))="X";INDIRECT("'Game State'." & ADDRESS(3+MOD([.$A$36]+2;[.$A$33]);4))<>"X");"CYLON";IF(INDIRECT("'Skill Cards'."&ADDRESS(19+MOD([.$A$36] + 2;[.$A$33]);2)) = 0;"PASS: No Cards";IF(OR([.$A$39]="X";['Game State'.$M$36]="X");"";IF(['Skill Cards'.$M$2]="";IF(OR(INDIRECT("'Skill Cards'." & ADDRESS(149;1+MOD([.$A$36]+2;[.$A$33])))="X";INDIRECT("'Skill Cards'." & ADDRESS(153;1+MOD([.$A$36]+2;[.$A$33])))="X");"";"PASS: No Politics or Engineering");IF(INDIRECT("'Skill Cards'." & ADDRESS(149;1+MOD([.$A$36]+2;[.$A$33])))="X";"";"PASS: No Politics")))));"") -> Cottle (6) -  | E12: of:=IF(['Skill Cards'.A38]<>"";['Skill Cards'.A38];"") ->  | F12: of:=IF(['Skill Cards'.B38]<>"";['Skill Cards'.B38];"") -> [color=#a52a2a]0 - Dradis Contact[/color] | G12: of:=IF(['Skill Cards'.C38]<>"";['Skill Cards'.C38];"") -> [color=red]1 - Evasive Maneuvers[/color] | H12: of:=IF(['Skill Cards'.D38]<>"";['Skill Cards'.D38];"") ->  | I12: of:=IF(['Skill Cards'.E38]<>"";['Skill Cards'.E38];"") ->  | J12: of:=IF(['Skill Cards'.F38]<>"";['Skill Cards'.F38];"") -> [color=blue]4 - Scientific Research[/color] | K12: of:=IF(['Skill Cards'.G38]<>"";['Skill Cards'.G38];"") ->  | L12: of:=IF(['Quorum Cards'.$C21]<>"";['Quorum Cards'.$C21];"") ->  | N12: of:=IF(['Game State'.$N$27]="IN SPACE";3+COUNTIF(['Crisis Cards'.$B$4:.$B$163];"<>");143+COUNTIF(['Crisis Cards'.$B$174:.$B$203];"<>")) -> 34 | O12: of:="[size=14][b]" & IF(INDIRECT("'Crisis Cards'."&ADDRESS([.$N12];7)) = "X";"[color=red]";"") & INDIRECT("'Crisis Cards'."&ADDRESS([.$N12];2)) & IF(INDIRECT("'Crisis Cards'."&ADDRESS([.$N12];7)) = "X";"[/color]";"") & IF(INDIRECT("'Crisis Cards'."&ADDRESS([.$N12];13)) <> "";" - " & INDIRECT("'Crisis Cards'."&ADDRESS([.$N12];13))&IF(INDIRECT("'Crisis Cards'."&ADDRESS([.$N12];14))<>"";"("&INDIRECT("'Crisis Cards'."&ADDRESS([.$N12];14))&")";"") & IF(INDIRECT("'Crisis Cards'."&ADDRESS([.$N12];8)) = "X";"[color=orange]Y[/color]";"") & IF(INDIRECT("'Crisis Cards'."&ADDRESS([.$N12];9)) = "X";"[color=green]G[/color]";"") & IF(INDIRECT("'Crisis Cards'."&ADDRESS([.$N12];10)) = "X";"[color=purple]P[/color]";"") & IF(INDIRECT("'Crisis Cards'."&ADDRESS([.$N12];11)) = "X";"[color=red]R[/color]";"") & IF(INDIRECT("'Crisis Cards'."&ADDRESS([.$N12];12)) = "X";"[color=blue]B[/color]";"");"") & "[/b][/size][/i]" -> [size=14][b]Rescue the Fleet[/b][/size][/i]
A13: [color=brown] | C13: of:=IF([.$A$33] > 4;INDIRECT("'Game State'." & ADDRESS(3+MOD([.$A$36]+3;[.$A$33]);5)) & " (" & INDIRECT("'Skill Cards'." & ADDRESS(19+MOD([.$A$36]+3;[.$A$33]);2)) & ")" & " - " & IF(AND(INDIRECT("'Game State'." & ADDRESS(3+MOD([.$A$36]+3;[.$A$33]);12))="X";INDIRECT("'Game State'." & ADDRESS(3+MOD([.$A$36]+3;[.$A$33]);4))<>"X");"CYLON";IF(INDIRECT("'Skill Cards'."&ADDRESS(19+MOD([.$A$36]+3;[.$A$33]);2)) = 0;"PASS: No Cards";IF(OR([.$A$39]="X";['Game State'.$M$36]="X");"";IF(['Skill Cards'.$M$2]="";IF(OR(INDIRECT("'Skill Cards'." & ADDRESS(149;1+MOD([.$A$36]+3;[.$A$33])))="X";INDIRECT("'Skill Cards'." & ADDRESS(153;1+MOD([.$A$36]+3;[.$A$33])))="X");"";"PASS: No Politics or Engineering");IF(INDIRECT("'Skill Cards'." & ADDRESS(149;1+MOD([.$A$36]+3;[.$A$33])))="X";"";"PASS: No Politics")))));"") -> Gaius (4) - CYLON | E13: of:=IF(['Skill Cards'.A39]<>"";['Skill Cards'.A39];"") ->  | F13: of:=IF(['Skill Cards'.B39]<>"";['Skill Cards'.B39];"") -> [color=#a52a2a]3 - Personal Vices[/color] | G13: of:=IF(['Skill Cards'.C39]<>"";['Skill Cards'.C39];"") -> [color=red]1 - Evasive Maneuvers[/color] | H13: of:=IF(['Skill Cards'.D39]<>"";['Skill Cards'.D39];"") ->  | I13: of:=IF(['Skill Cards'.E39]<>"";['Skill Cards'.E39];"") ->  | J13: of:=IF(['Skill Cards'.F39]<>"";['Skill Cards'.F39];"") ->  | K13: of:=IF(['Skill Cards'.G39]<>"";['Skill Cards'.G39];"") ->  | L13: of:=IF(['Quorum Cards'.$C22]<>"";['Quorum Cards'.$C22];"") ->  | O13: [clear]
A14: [color=gray] | C14: of:=IF([.$A$33] > 5;INDIRECT("'Game State'." & ADDRESS(3+MOD([.$A$36]+4;[.$A$33]);5)) & " (" & INDIRECT("'Skill Cards'." & ADDRESS(19+MOD([.$A$36]+4;[.$A$33]);2)) & ")" & " - " & IF(AND(INDIRECT("'Game State'." & ADDRESS(3+MOD([.$A$36]+4;[.$A$33]);12))="X";INDIRECT("'Game State'." & ADDRESS(3+MOD([.$A$36]+4;[.$A$33]);4))<>"X");"CYLON";IF(INDIRECT("'Skill Cards'."&ADDRESS(19+MOD([.$A$36]+4;[.$A$33]);2)) = 0;"PASS: No Cards";IF(OR([.$A$39]="X";['Game State'.$M$36]="X");"";IF(['Skill Cards'.$M$2]="";IF(OR(INDIRECT("'Skill Cards'." & ADDRESS(149;1+MOD([.$A$36]+4;[.$A$33])))="X";INDIRECT("'Skill Cards'." & ADDRESS(153;1+MOD([.$A$36]+4;[.$A$33])))="X");"";"PASS: No Politics or Engineering");IF(INDIRECT("'Skill Cards'." & ADDRESS(149;1+MOD([.$A$36]+4;[.$A$33])))="X";"";"PASS: No Politics")))));"") -> Athena (8) -  | E14: of:=IF(['Skill Cards'.A40]<>"";['Skill Cards'.A40];"") ->  | F14: of:=IF(['Skill Cards'.B40]<>"";['Skill Cards'.B40];"") -> [color=#a52a2a]5 - Exploit Weakness[/color] | G14: of:=IF(['Skill Cards'.C40]<>"";['Skill Cards'.C40];"") ->  | H14: of:=IF(['Skill Cards'.D40]<>"";['Skill Cards'.D40];"") ->  | I14: of:=IF(['Skill Cards'.E40]<>"";['Skill Cards'.E40];"") ->  | J14: of:=IF(['Skill Cards'.F40]<>"";['Skill Cards'.F40];"") ->  | K14: of:=IF(['Skill Cards'.G40]<>"";['Skill Cards'.G40];"") ->  | L14: of:=IF(['Quorum Cards'.$C23]<>"";['Quorum Cards'.$C23];"") ->  | O14: of:=IF(INDIRECT("'Crisis Cards'." & ADDRESS([.$N12];3))="X";"[b]"&INDIRECT(ADDRESS(2;4+[.$A$36]))&INDIRECT(ADDRESS(3;4+[.$A$36]))&"[/b], ";IF(INDIRECT("'Crisis Cards'." & ADDRESS([.$N12];4))="X";"[b]"&INDIRECT(ADDRESS(2;4+MATCH("X";['Game State'.$G$3:.$G$9];0)))&INDIRECT(ADDRESS(3;4+MATCH("X";['Game State'.$G$3:.$G$9];0)))&"[/b], ";IF(INDIRECT("'Crisis Cards'." & ADDRESS([.$N12];5))="X";"[b]"&INDIRECT(ADDRESS(2;4+MATCH("X";['Game State'.$H$3:.$H$9];0)))&INDIRECT(ADDRESS(3;4+MATCH("X";['Game State'.$H$3:.$H$9];0)))&"[/b], ";IF(INDIRECT("'Crisis Cards'." & ADDRESS([.$N12];6))="X";"[b]"&INDIRECT(ADDRESS(2;4+MATCH("X";['Game State'.$I$3:.$I$9];0)))&INDIRECT(ADDRESS(3;4+MATCH("X";['Game State'.$I$3:.$I$9];0)))&"[/b], ";"")))) -> [b][color=green]Admiral[/color] Karl[/b], 
C15: of:=IF([.$A$33] > 6;INDIRECT("'Game State'." & ADDRESS(3+MOD([.$A$36]+5;[.$A$33]);5)) & " (" & INDIRECT("'Skill Cards'." & ADDRESS(19+MOD([.$A$36]+5;[.$A$33]);2)) & ")" & " - " & IF(AND(INDIRECT("'Game State'." & ADDRESS(3+MOD([.$A$36]+5;[.$A$33]);12))="X";INDIRECT("'Game State'." & ADDRESS(3+MOD([.$A$36]+5;[.$A$33]);4))<>"X");"CYLON";IF(INDIRECT("'Skill Cards'."&ADDRESS(19+MOD([.$A$36]+5;[.$A$33]);2)) = 0;"PASS: No Cards";IF(OR([.$A$39]="X";['Game State'.$M$36]="X");"";IF(['Skill Cards'.$M$2]="";IF(OR(INDIRECT("'Skill Cards'." & ADDRESS(149;1+MOD([.$A$36]+5;[.$A$33])))="X";INDIRECT("'Skill Cards'." & ADDRESS(153;1+MOD([.$A$36]+5;[.$A$33])))="X");"";"PASS: No Politics or Engineering");IF(INDIRECT("'Skill Cards'." & ADDRESS(149;1+MOD([.$A$36]+5;[.$A$33])))="X";"";"PASS: No Politics")))));"") ->  | E15: of:=IF(['Skill Cards'.A41]<>"";['Skill Cards'.A41];"") ->  | F15: of:=IF(['Skill Cards'.B41]<>"";['Skill Cards'.B41];"") ->  | G15: of:=IF(['Skill Cards'.C41]<>"";['Skill Cards'.C41];"") ->  | H15: of:=IF(['Skill Cards'.D41]<>"";['Skill Cards'.D41];"") ->  | I15: of:=IF(['Skill Cards'.E41]<>"";['Skill Cards'.E41];"") ->  | J15: of:=IF(['Skill Cards'.F41]<>"";['Skill Cards'.F41];"") ->  | K15: of:=IF(['Skill Cards'.G41]<>"";['Skill Cards'.G41];"") ->  | L15: of:=IF(['Quorum Cards'.$C24]<>"";['Quorum Cards'.$C24];"") -> 
A16: Dropbox | C16: of:=IF([.$A$48]="X";"[/code]";"[/q]") -> [/code] | E16: of:=IF(['Skill Cards'.A42]<>"";['Skill Cards'.A42];"") ->  | F16: of:=IF(['Skill Cards'.B42]<>"";['Skill Cards'.B42];"") ->  | G16: of:=IF(['Skill Cards'.C42]<>"";['Skill Cards'.C42];"") ->  | H16: of:=IF(['Skill Cards'.D42]<>"";['Skill Cards'.D42];"") ->  | I16: of:=IF(['Skill Cards'.E42]<>"";['Skill Cards'.E42];"") ->  | J16: of:=IF(['Skill Cards'.F42]<>"";['Skill Cards'.F42];"") ->  | K16: of:=IF(['Skill Cards'.G42]<>"";['Skill Cards'.G42];"") ->  | L16: of:=IF(['Quorum Cards'.$C25]<>"";['Quorum Cards'.$C25];"") ->  | O16: Destinations for Jump / Scout Destination
A17: 11356574 | C17: of:="Send in your COs for [color=green]Declare Emergency[/color]" & IF([.C69]<>"";IF(COUNTIF([.C68:.C71];"<>") > 2;", ";" and/or ") & [.C69];"") & IF([.C70]<>"";IF(COUNTIF([.C68:.C71];"<>") > 2;", ";"") & IF([.C71]="";" and/or ";"") & [.C70];"") & IF([.C71]<>"";", and/or " & [.C71];"") & "." -> Send in your COs for [color=green]Declare Emergency[/color] and/or [color=green]Change of Plans[/color]. | E17: of:=IF(['Skill Cards'.A43]<>"";['Skill Cards'.A43];"") ->  | F17: of:=IF(['Skill Cards'.B43]<>"";['Skill Cards'.B43];"") ->  | G17: of:=IF(['Skill Cards'.C43]<>"";['Skill Cards'.C43];"") ->  | H17: of:=IF(['Skill Cards'.D43]<>"";['Skill Cards'.D43];"") ->  | I17: of:=IF(['Skill Cards'.E43]<>"";['Skill Cards'.E43];"") ->  | J17: of:=IF(['Skill Cards'.F43]<>"";['Skill Cards'.F43];"") ->  | K17: of:=IF(['Skill Cards'.G43]<>"";['Skill Cards'.G43];"") ->  | L17: of:=IF(['Quorum Cards'.$C26]<>"";['Quorum Cards'.$C26];"") ->  | N17: of:=IF(COUNTIF(['Board Status'.$Q$12:.$Q$15];"=Mission Specialist")<>0;MATCH(INDIRECT("'Board Status'."&ADDRESS(11+MATCH("Mission Specialist";['Board Status'.$Q$12:.$Q$15]);16));['Game State'.$E$3:.$E$9];0);MATCH("X";['Game State'.$H$3:.$H$9];0)) -> 5 | O17: of:="[b]" & INDIRECT(ADDRESS(2; 4 + [.$N$17])) & INDIRECT(ADDRESS(3;4+[.$N$17])) & "[/b], the top " & IF(COUNTIF(['Board Status'.$Q$12:.$Q$15];"=Mission Specialist")<>0;"three";"two") & " cards of the destination deck are:" -> [b][color=green]Admiral[/color] Karl[/b], the top two cards of the destination deck are:
E18: of:=IF(['Skill Cards'.A44]<>"";['Skill Cards'.A44];"") ->  | F18: of:=IF(['Skill Cards'.B44]<>"";['Skill Cards'.B44];"") ->  | G18: of:=IF(['Skill Cards'.C44]<>"";['Skill Cards'.C44];"") ->  | H18: of:=IF(['Skill Cards'.D44]<>"";['Skill Cards'.D44];"") ->  | I18: of:=IF(['Skill Cards'.E44]<>"";['Skill Cards'.E44];"") ->  | J18: of:=IF(['Skill Cards'.F44]<>"";['Skill Cards'.F44];"") ->  | K18: of:=IF(['Skill Cards'.G44]<>"";['Skill Cards'.G44];"") ->  | L18: of:=IF(['Quorum Cards'.$C27]<>"";['Quorum Cards'.$C27];"") ->  | O18: of:=IF([.$A$48]="X";"[LIST]";"") -> [LIST]
C19: SKILL CHECK | E19: of:=IF(['Skill Cards'.A45]<>"";['Skill Cards'.A45];"") ->  | F19: of:=IF(['Skill Cards'.B45]<>"";['Skill Cards'.B45];"") ->  | G19: of:=IF(['Skill Cards'.C45]<>"";['Skill Cards'.C45];"") ->  | H19: of:=IF(['Skill Cards'.D45]<>"";['Skill Cards'.D45];"") ->  | I19: of:=IF(['Skill Cards'.E45]<>"";['Skill Cards'.E45];"") ->  | J19: of:=IF(['Skill Cards'.F45]<>"";['Skill Cards'.F45];"") ->  | K19: of:=IF(['Skill Cards'.G45]<>"";['Skill Cards'.G45];"") ->  | L19: of:=IF(['Quorum Cards'.$C28]<>"";['Quorum Cards'.$C28];"") ->  | N19: of:=9 + COUNTIF(['Destination Cards'.$C$9:.$C$51];"<>") -> 13 | O19: of:=IF([.$A$48]="X";"[*]";"") & "[b]" & INDIRECT("'Destination Cards'."&ADDRESS([.$N19];2)) & "[/b]" & IF([.$A$42]="X";"";" - Distance: " & INDIRECT("'Destination Cards'."&ADDRESS([.$N19];4)) & ", Fuel: " & INDIRECT("'Destination Cards'."&ADDRESS([.$N19];5)) & ". " & IF(INDIRECT("'Destination Cards'."&ADDRESS([.$N19];6)) <> ""; INDIRECT("'Destination Cards'."&ADDRESS([.$N19];6)) & " ";"") & IF(INDIRECT("'Destination Cards'."&ADDRESS([.$N19];7)) <> ""; INDIRECT("'Destination Cards'."&ADDRESS([.$N19];7)); "")) -> [*][b]Tylium Planet[/b] - Distance: 1, Fuel: -1. Admiral may risk 1 Raptor:  Roll 1-2  lose Raptor; 3-8  +2 fuel.
A20: Game/Thread | E20: of:=IF(['Skill Cards'.A46]<>"";['Skill Cards'.A46];"") ->  | F20: of:=IF(['Skill Cards'.B46]<>"";['Skill Cards'.B46];"") ->  | G20: of:=IF(['Skill Cards'.C46]<>"";['Skill Cards'.C46];"") ->  | H20: of:=IF(['Skill Cards'.D46]<>"";['Skill Cards'.D46];"") ->  | I20: of:=IF(['Skill Cards'.E46]<>"";['Skill Cards'.E46];"") ->  | J20: of:=IF(['Skill Cards'.F46]<>"";['Skill Cards'.F46];"") ->  | K20: of:=IF(['Skill Cards'.G46]<>"";['Skill Cards'.G46];"") ->  | L20: of:=IF(['Quorum Cards'.$C29]<>"";['Quorum Cards'.$C29];"") ->  | N20: of:=10 + COUNTIF(['Destination Cards'.$C$9:.$C$51];"<>") -> 14 | O20: of:=IF([.$A$48]="X";"[*]";"") & "[b]" & INDIRECT("'Destination Cards'."&ADDRESS([.$N20];2)) & "[/b]" & IF([.$A$42]="X";"";" - Distance: " & INDIRECT("'Destination Cards'."&ADDRESS([.$N20];4)) & ", Fuel: " & INDIRECT("'Destination Cards'."&ADDRESS([.$N20];5)) & ". " & IF(INDIRECT("'Destination Cards'."&ADDRESS([.$N20];6)) <> ""; INDIRECT("'Destination Cards'."&ADDRESS([.$N20];6)) & " ";"") & IF(INDIRECT("'Destination Cards'."&ADDRESS([.$N20];7)) <> ""; INDIRECT("'Destination Cards'."&ADDRESS([.$N20];7)); "")) -> [*][b]Barren Planet[/b] - Distance: 2, Fuel: -2. 
A21: 690806 | C21: of:=IF([.$A$4]<>"";IF([.$A$48]="X";"[IMG]http://dl.dropbox.com/u/" & [.$A$17] & "/Banners/" & [.$A$4] & ".jpg[/IMG]";"[imageid=" & [.$A$4] & " medium]");"") -> [IMG]http://dl.dropbox.com/u/11356574/Banners/Moderator.jpg[/IMG] | E21: of:=IF(['Skill Cards'.A47]<>"";['Skill Cards'.A47];"") ->  | F21: of:=IF(['Skill Cards'.B47]<>"";['Skill Cards'.B47];"") ->  | G21: of:=IF(['Skill Cards'.C47]<>"";['Skill Cards'.C47];"") ->  | H21: of:=IF(['Skill Cards'.D47]<>"";['Skill Cards'.D47];"") ->  | I21: of:=IF(['Skill Cards'.E47]<>"";['Skill Cards'.E47];"") ->  | J21: of:=IF(['Skill Cards'.F47]<>"";['Skill Cards'.F47];"") ->  | K21: of:=IF(['Skill Cards'.G47]<>"";['Skill Cards'.G47];"") ->  | L21: of:=IF(['Quorum Cards'.$C30]<>"";['Quorum Cards'.$C30];"") ->  | N21: of:=11 + COUNTIF(['Destination Cards'.$C$9:.$C$51];"<>") -> 15 | O21: of:=IF(COUNTIF(['Board Status'.$Q$12:.$Q$15];"=Mission Specialist")=0;IF([.$A$48]="X";"[/LIST]";"");IF([.$A$48]="X";"[*]";"") & "[b]" & INDIRECT("'Destination Cards'."&ADDRESS([.$N21];2)) & "[/b]" & IF([.$A$42]="X";"";" - Distance: " & INDIRECT("'Destination Cards'."&ADDRESS([.$N21];4)) & ", Fuel: " & INDIRECT("'Destination Cards'."&ADDRESS([.$N21];5)) & ". " & IF(INDIRECT("'Destination Cards'."&ADDRESS([.$N21];6)) <> ""; INDIRECT("'Destination Cards'."&ADDRESS([.$N21];6)) & " ";"") & IF(INDIRECT("'Destination Cards'."&ADDRESS([.$N21];7)) <> ""; INDIRECT("'Destination Cards'."&ADDRESS([.$N21];7)); ""))) -> [/LIST]
C22: of:=IF([.$A$48]="X";"[code]";"[q=""" & ['Skill Cards'.$H$2] & """]") -> [code] | E22: of:=IF(['Skill Cards'.A48]<>"";['Skill Cards'.A48];"") ->  | F22: of:=IF(['Skill Cards'.B48]<>"";['Skill Cards'.B48];"") ->  | G22: of:=IF(['Skill Cards'.C48]<>"";['Skill Cards'.C48];"") ->  | H22: of:=IF(['Skill Cards'.D48]<>"";['Skill Cards'.D48];"") ->  | I22: of:=IF(['Skill Cards'.E48]<>"";['Skill Cards'.E48];"") ->  | J22: of:=IF(['Skill Cards'.F48]<>"";['Skill Cards'.F48];"") ->  | K22: of:=IF(['Skill Cards'.G48]<>"";['Skill Cards'.G48];"") ->  | L22: of:=IF(['Quorum Cards'.$C31]<>"";['Quorum Cards'.$C31];"") ->  | O22: of:=IF(AND([.$A$48]="X";COUNTIF(['Board Status'.$Q$12:.$Q$15];"=Mission Specialist")<>0);"[/LIST]";"") -> 
A23: Skill Names | C23: of:="[size="&IF([.$A$48]="X";5;14)&"][b]" & ['Skill Cards'.$H$2]& " - " &['Skill Cards'.$P$2] & IF(['Skill Cards'.$Q$2]="";"";"("&['Skill Cards'.$Q$2]&")") & IF(['Skill Cards'.$I$2]="X";[.$A$8] & "Y[/color]";"") & IF(['Skill Cards'.$J$2]="X";[.$A$9] & "G[/color]";"") & IF(['Skill Cards'.$K$2]="X";[.$A$10] & "P[/color]";"") & IF(['Skill Cards'.$L$2]="X";[.$A$11] & "R[/color]";"") & IF(['Skill Cards'.$M$2]="X";[.$A$12] & "B[/color]";"") &  IF(['Skill Cards'.$N$2]="X";[.$A$13] & "O[/color]";"") & "[/b][/size]" -> [size=5][b] - [/b][/size] | E23: of:=IF(['Skill Cards'.A49]<>"";['Skill Cards'.A49];"") ->  | F23: of:=IF(['Skill Cards'.B49]<>"";['Skill Cards'.B49];"") ->  | G23: of:=IF(['Skill Cards'.C49]<>"";['Skill Cards'.C49];"") ->  | H23: of:=IF(['Skill Cards'.D49]<>"";['Skill Cards'.D49];"") ->  | I23: of:=IF(['Skill Cards'.E49]<>"";['Skill Cards'.E49];"") ->  | J23: of:=IF(['Skill Cards'.F49]<>"";['Skill Cards'.F49];"") ->  | K23: of:=IF(['Skill Cards'.G49]<>"";['Skill Cards'.G49];"") ->  | L23: of:=IF(['Quorum Cards'.$C32]<>"";['Quorum Cards'.$C32];"") -> 
A24: of:=[.A8] & "Politics[/color]" -> [color=orange]Politics[/color] | C24: of:=IF(['Skill Cards'.$I$25]<>"";"[b][color=orange]Investigative committee[/color][/b] in play, all cards "&IF(['Game State'.$M$36]<>"";"except destiny ";"")&"are played face up." & CHAR(10);"")&IF(['Skill Cards'.$J$25]<>"";"[b][color=green]Restore Order[/color][/b] is in play, Skill Check abilities will not be resolved."& CHAR(10);"")&IF(['Skill Cards'.$J$26]<>"";"It is [b][color=green]Adama's[/color][/b] turn, all 1s are positive. "& CHAR(10);"")&IF(['Skill Cards'.$N$25]<>"";"This skill check is [b][color=brown]Reckless[/color][/b].";"") ->  | E24: of:=IF(['Skill Cards'.A50]<>"";['Skill Cards'.A50];"") ->  | F24: of:=IF(['Skill Cards'.B50]<>"";['Skill Cards'.B50];"") ->  | G24: of:=IF(['Skill Cards'.C50]<>"";['Skill Cards'.C50];"") ->  | H24: of:=IF(['Skill Cards'.D50]<>"";['Skill Cards'.D50];"") ->  | I24: of:=IF(['Skill Cards'.E50]<>"";['Skill Cards'.E50];"") ->  | J24: of:=IF(['Skill Cards'.F50]<>"";['Skill Cards'.F50];"") ->  | K24: of:=IF(['Skill Cards'.G50]<>"";['Skill Cards'.G50];"") ->  | L24: of:=IF(['Quorum Cards'.$C33]<>"";['Quorum Cards'.$C33];"") ->  | O24: Caprica / Religious Visions / Scout Crisis
A25: of:=[.A9] & "Leadership[/color]" -> [color=green]Leadership[/color] | E25: of:=IF(['Skill Cards'.A51]<>"";['Skill Cards'.A51];"") ->  | F25: of:=IF(['Skill Cards'.B51]<>"";['Skill Cards'.B51];"") ->  | G25: of:=IF(['Skill Cards'.C51]<>"";['Skill Cards'.C51];"") ->  | H25: of:=IF(['Skill Cards'.D51]<>"";['Skill Cards'.D51];"") ->  | I25: of:=IF(['Skill Cards'.E51]<>"";['Skill Cards'.E51];"") ->  | J25: of:=IF(['Skill Cards'.F51]<>"";['Skill Cards'.F51];"") ->  | K25: of:=IF(['Skill Cards'.G51]<>"";['Skill Cards'.G51];"") ->  | L25: of:=IF(['Quorum Cards'.$C34]<>"";['Quorum Cards'.$C34];"") ->  | O25: of:="[b]" & INDIRECT(ADDRESS(2;4+[.$A$36])) & INDIRECT(ADDRESS(3;4+[.$A$36])) & "[/b], the top two cards of the Crisis Deck are:" -> [b][color=orange]President[/color] Lee[/b], the top two cards of the Crisis Deck are:
A26: of:=[.A10] & "Tactics[/color]" -> [color=purple]Tactics[/color] | C26: of:="Destiny - " & IF(['Skill Cards'.$K$26]<>"";"0 cards";IF(AND(['Skill Cards'.$I$25]<>"";['Game State'.$M$36]="");['Skill Cards'.H3] & ", " &['Skill Cards'.H4];"2 cards")) -> Destiny - 2 cards | E26: of:=IF(['Skill Cards'.A52]<>"";['Skill Cards'.A52];"") ->  | F26: of:=IF(['Skill Cards'.B52]<>"";['Skill Cards'.B52];"") ->  | G26: of:=IF(['Skill Cards'.C52]<>"";['Skill Cards'.C52];"") ->  | H26: of:=IF(['Skill Cards'.D52]<>"";['Skill Cards'.D52];"") ->  | I26: of:=IF(['Skill Cards'.E52]<>"";['Skill Cards'.E52];"") ->  | J26: of:=IF(['Skill Cards'.F52]<>"";['Skill Cards'.F52];"") ->  | K26: of:=IF(['Skill Cards'.G52]<>"";['Skill Cards'.G52];"") ->  | L26: of:=IF(['Quorum Cards'.$C35]<>"";['Quorum Cards'.$C35];"") ->  | O26: of:=IF([.$A$48]="X";"[LIST]";"") -> [LIST]
A27: of:=[.A11] & "Piloting[/color]" -> [color=red]Piloting[/color] | C27: of:=INDIRECT(ADDRESS(73+MOD([.$A$36];[.$A$33]);3)) -> Tom (5) - (1 max) | E27: of:=IF(['Skill Cards'.A53]<>"";['Skill Cards'.A53];"") ->  | F27: of:=IF(['Skill Cards'.B53]<>"";['Skill Cards'.B53];"") ->  | G27: of:=IF(['Skill Cards'.C53]<>"";['Skill Cards'.C53];"") ->  | H27: of:=IF(['Skill Cards'.D53]<>"";['Skill Cards'.D53];"") ->  | I27: of:=IF(['Skill Cards'.E53]<>"";['Skill Cards'.E53];"") ->  | J27: of:=IF(['Skill Cards'.F53]<>"";['Skill Cards'.F53];"") ->  | K27: of:=IF(['Skill Cards'.G53]<>"";['Skill Cards'.G53];"") ->  | L27: of:=IF(['Quorum Cards'.$C36]<>"";['Quorum Cards'.$C36];"") ->  | N27: of:=IF(['Game State'.$N$27]="IN SPACE";4+COUNTIF(['Crisis Cards'.$B$4:.$B$163];"<>");137+COUNTIF(['Crisis Cards'.$B$174:.$B$203];"<>")) -> 35 | O27: of:=IF([.$A$48]="X";"[*]";"")&"[b]"&IF(INDIRECT("'Crisis Cards'."&ADDRESS([.$N27];7))="X";"[color=red]";"")&INDIRECT("'Crisis Cards'."&ADDRESS([.$N27];1))&IF(INDIRECT("'Crisis Cards'."&ADDRESS([.$N27];7))="X";"[/color]";"")&IF(INDIRECT("'Crisis Cards'."&ADDRESS([.$N27];13))<>"";" - "&INDIRECT("'Crisis Cards'."&ADDRESS([.$N27];13))&IF(INDIRECT("'Crisis Cards'."&ADDRESS([.$N27];14))<>"";"("&INDIRECT("'Crisis Cards'."&ADDRESS([.$N27];14))&")";"")&IF(INDIRECT("'Crisis Cards'."&ADDRESS([.$N27];8))="X";"[color=orange]Y[/color]";"")&IF(INDIRECT("'Crisis Cards'."&ADDRESS([.$N27];9))="X";"[color=green]G[/color]";"")&IF(INDIRECT("'Crisis Cards'."&ADDRESS([.$N27];10))="X";"[color=purple]P[/color]";"")&IF(INDIRECT("'Crisis Cards'."&ADDRESS([.$N27];11))="X";"[color=red]R[/color]";"")&IF(INDIRECT("'Crisis Cards'."&ADDRESS([.$N27];12))="X";"[color=blue]B[/color]";"");"")&"[/b]"&IF([.$A$42]="X";"";":"&IF(INDIRECT("'Crisis Cards'."&ADDRESS([.$N27];7))="";" " & INDIRECT("'Crisis Cards'."&ADDRESS([.$N27];18));"")&IF(INDIRECT("'Crisis Cards'."&ADDRESS([.$N27];16))="R";" Activate Raiders";IF(INDIRECT("'Crisis Cards'."&ADDRESS([.$N27];16))="H";" Activate Heavy Raiders";IF(INDIRECT("'Crisis Cards'."&ADDRESS([.$N27];16))="B";" Activate Basestars";IF(INDIRECT("'Crisis Cards'."&ADDRESS([.$N27];16))="L";" Launch Raiders";""))))&IF(INDIRECT("'Crisis Cards'."&ADDRESS([.$N27];17))="X";", Prepare for Jump";IF(INDIRECT("'Crisis Cards'."&ADDRESS([.$N27];7))="X";". " & INDIRECT("'Crisis Cards'."&ADDRESS([.$N27];18));" (no Jump)."))) -> [*][b]Sleep Deprivation[/b]: Admiral Chooses: Return all undamaged Vipers on the game board to the "Reserves." Current Player is sent to "Sickbay." OR -1 Morale. Activate Basestars, Prepare for Jump
A28: of:=[.A12] & "Engineering[/color]" -> [color=blue]Engineering[/color] | C28: of:=INDIRECT(ADDRESS(73+MOD([.$A$36]+1;[.$A$33]);3)) -> Karl (5) -  | E28: of:=IF(['Skill Cards'.A54]<>"";['Skill Cards'.A54];"") ->  | F28: of:=IF(['Skill Cards'.B54]<>"";['Skill Cards'.B54];"") ->  | G28: of:=IF(['Skill Cards'.C54]<>"";['Skill Cards'.C54];"") ->  | H28: of:=IF(['Skill Cards'.D54]<>"";['Skill Cards'.D54];"") ->  | I28: of:=IF(['Skill Cards'.E54]<>"";['Skill Cards'.E54];"") ->  | J28: of:=IF(['Skill Cards'.F54]<>"";['Skill Cards'.F54];"") ->  | K28: of:=IF(['Skill Cards'.G54]<>"";['Skill Cards'.G54];"") ->  | L28: of:=IF(['Quorum Cards'.$C37]<>"";['Quorum Cards'.$C37];"") ->  | N28: of:=IF(['Game State'.$N$27]="IN SPACE";5+COUNTIF(['Crisis Cards'.$B$4:.$B$163];"<>");145+COUNTIF(['Crisis Cards'.$B$174:.$B$203];"<>")) -> 36 | O28: of:=IF([.$A$48]="X";"[*]";"")&"[b]"&IF(INDIRECT("'Crisis Cards'."&ADDRESS([.$N28];7))="X";"[color=red]";"")&INDIRECT("'Crisis Cards'."&ADDRESS([.$N28];1))&IF(INDIRECT("'Crisis Cards'."&ADDRESS([.$N28];7))="X";"[/color]";"")&IF(INDIRECT("'Crisis Cards'."&ADDRESS([.$N28];13))<>"";" - "&INDIRECT("'Crisis Cards'."&ADDRESS([.$N28];13))&IF(INDIRECT("'Crisis Cards'."&ADDRESS([.$N28];14))<>"";"("&INDIRECT("'Crisis Cards'."&ADDRESS([.$N28];14))&")";"")&IF(INDIRECT("'Crisis Cards'."&ADDRESS([.$N28];8))="X";"[color=orange]Y[/color]";"")&IF(INDIRECT("'Crisis Cards'."&ADDRESS([.$N28];9))="X";"[color=green]G[/color]";"")&IF(INDIRECT("'Crisis Cards'."&ADDRESS([.$N28];10))="X";"[color=purple]P[/color]";"")&IF(INDIRECT("'Crisis Cards'."&ADDRESS([.$N28];11))="X";"[color=red]R[/color]";"")&IF(INDIRECT("'Crisis Cards'."&ADDRESS([.$N28];12))="X";"[color=blue]B[/color]";"");"")&"[/b]"&IF([.$A$42]="X";"";":"&IF(INDIRECT("'Crisis Cards'."&ADDRESS([.$N28];7))="";" " & INDIRECT("'Crisis Cards'."&ADDRESS([.$N28];18));"")&IF(INDIRECT("'Crisis Cards'."&ADDRESS([.$N28];16))="R";" Activate Raiders";IF(INDIRECT("'Crisis Cards'."&ADDRESS([.$N28];16))="H";" Activate Heavy Raiders";IF(INDIRECT("'Crisis Cards'."&ADDRESS([.$N28];16))="B";" Activate Basestars";IF(INDIRECT("'Crisis Cards'."&ADDRESS([.$N28];16))="L";" Launch Raiders";""))))&IF(INDIRECT("'Crisis Cards'."&ADDRESS([.$N28];17))="X";", Prepare for Jump";IF(INDIRECT("'Crisis Cards'."&ADDRESS([.$N28];7))="X";". " & INDIRECT("'Crisis Cards'."&ADDRESS([.$N28];18));" (no Jump)."))) -> [*][b]A Traitor Accused  - 8[color=orange]Y[/color][color=green]G[/color][/b]: Current Player Chooses: Pass: No Effect; Fail: the Current Player chooses a character to send to the "Brig." OR The Current Player discards 5 Skill Cards. Activate Raiders, Prepare for Jump
A29: [color=brown]Treachery[/color] | C29: of:=INDIRECT(ADDRESS(73+MOD([.$A$36]+2;[.$A$33]);3)) -> Cottle (6) -  | O29: of:=IF([.$A$48]="X";"[/LIST]";"") -> [/LIST]
A30: [color=gray]Faith[/color] | C30: of:=INDIRECT(ADDRESS(73+MOD([.$A$36]+3;[.$A$33]);3)) -> Gaius (4) - (1 max) | D30: Bene | E30: of:="You have [b][color=blue]" & ['Ionian Nebula'.$B$2] & "[/color][/b] Benevolent Trauma." -> You have [b][color=blue]0[/color][/b] Benevolent Trauma. | F30: of:="You have [b][color=blue]" & ['Ionian Nebula'.$B$3] & "[/color][/b] Benevolent Trauma." -> You have [b][color=blue]0[/color][/b] Benevolent Trauma. | G30: of:="You have [b][color=blue]" & ['Ionian Nebula'.$B$4] & "[/color][/b] Benevolent Trauma." -> You have [b][color=blue]0[/color][/b] Benevolent Trauma. | H30: of:="You have [b][color=blue]" & ['Ionian Nebula'.$B$5] & "[/color][/b] Benevolent Trauma." -> You have [b][color=blue]0[/color][/b] Benevolent Trauma. | I30: of:="You have [b][color=blue]" & ['Ionian Nebula'.$B$6] & "[/color][/b] Benevolent Trauma." -> You have [b][color=blue]0[/color][/b] Benevolent Trauma. | J30: of:="You have [b][color=blue]" & ['Ionian Nebula'.$B$7] & "[/color][/b] Benevolent Trauma." -> You have [b][color=blue]0[/color][/b] Benevolent Trauma. | K30: of:="You have [b][color=blue]" & ['Ionian Nebula'.$B$8] & "[/color][/b] Benevolent Trauma." -> You have [b][color=blue]0[/color][/b] Benevolent Trauma.
C31: of:=IF([.$A$33]>4;INDIRECT(ADDRESS(73+MOD([.$A$36]+4;[.$A$33]);3));"") -> Athena (8) - (2 max) | D31: Ant | E31: of:="You have [b][color=red]" & ['Ionian Nebula'.$C$2] & "[/color][/b] Antagonistic Trauma." -> You have [b][color=red]0[/color][/b] Antagonistic Trauma. | F31: of:="You have [b][color=red]" & ['Ionian Nebula'.$C$3] & "[/color][/b] Antagonistic Trauma." -> You have [b][color=red]0[/color][/b] Antagonistic Trauma. | G31: of:="You have [b][color=red]" & ['Ionian Nebula'.$C$4] & "[/color][/b] Antagonistic Trauma." -> You have [b][color=red]0[/color][/b] Antagonistic Trauma. | H31: of:="You have [b][color=red]" & ['Ionian Nebula'.$C$5] & "[/color][/b] Antagonistic Trauma." -> You have [b][color=red]0[/color][/b] Antagonistic Trauma. | I31: of:="You have [b][color=red]" & ['Ionian Nebula'.$C$6] & "[/color][/b] Antagonistic Trauma." -> You have [b][color=red]0[/color][/b] Antagonistic Trauma. | J31: of:="You have [b][color=red]" & ['Ionian Nebula'.$C$7] & "[/color][/b] Antagonistic Trauma." -> You have [b][color=red]0[/color][/b] Antagonistic Trauma. | K31: of:="You have [b][color=red]" & ['Ionian Nebula'.$C$8] & "[/color][/b] Antagonistic Trauma." -> You have [b][color=red]0[/color][/b] Antagonistic Trauma. | O31: Most Recent Destination
A32: Player Count | C32: of:=IF([.$A$33]>5;INDIRECT(ADDRESS(73+MOD([.$A$36]+5;[.$A$33]);3));"") -> Lee (7) -  | N32: of:=8 + COUNTIF(['Destination Cards'.$C$9:.$C$51];"<>") -> 12 | O32: of:="[b]" & INDIRECT("'Destination Cards'."&ADDRESS([.$N32];3)) & "[/b] - Distance: " & INDIRECT("'Destination Cards'."&ADDRESS([.$N32];4)) & ", Fuel: " & INDIRECT("'Destination Cards'."&ADDRESS([.$N32];5)) & ". " & IF(INDIRECT("'Destination Cards'."&ADDRESS([.$N32];6)) <> ""; INDIRECT("'Destination Cards'."&ADDRESS([.$N32];6)) & " ";"") & IF(INDIRECT("'Destination Cards'."&ADDRESS([.$N32];7)) <> ""; INDIRECT("'Destination Cards'."&ADDRESS([.$N32];7)); "") -> [b]Tylium Planet[/b] - Distance: 1, Fuel: -1. Admiral may risk 1 Raptor:  Roll 1-2  lose Raptor; 3-8  +2 fuel.
A33: of:=MAX(['Game State'.$C$3:.$C$9]) -> 6 | C33: of:=IF([.$A$33]>6;INDIRECT(ADDRESS(73+MOD([.$A$36]+6;[.$A$33]);3));"") -> 
E34: GEEKLIST ENTRIES | O34: Most Recent Crisis Played
A35: Current Player | C35: of:=IF([.$A$48]="X";"[/code]";"[/q]") -> [/code] | D35: Card | E35: of:=INDIRECT("'reference'." & ADDRESS(40+MATCH([.E3];[Reference.$A$50:.$A$88];0);IF(OR(['Game State'.$L3]="";['Game State'.$F3]="LH";['Game State'.$F3]="LS");14;15))) -> 908967 | F35: of:=INDIRECT("'reference'." & ADDRESS(40+MATCH([.F3];[Reference.$A$50:.$A$88];0);IF(OR(['Game State'.$L4]="";['Game State'.$F4]="LH";['Game State'.$F4]="LS");14;15))) -> 908977 | G35: of:=INDIRECT("'reference'." & ADDRESS(40+MATCH([.G3];[Reference.$A$50:.$A$88];0);IF(OR(['Game State'.$L5]="";['Game State'.$F5]="LH";['Game State'.$F5]="LS");14;15))) -> 19 | H35: of:=INDIRECT("'reference'." & ADDRESS(40+MATCH([.H3];[Reference.$A$50:.$A$88];0);IF(OR(['Game State'.$L6]="";['Game State'.$F6]="LH";['Game State'.$F6]="LS");14;15))) -> 0 | I35: of:=INDIRECT("'reference'." & ADDRESS(40+MATCH([.I3];[Reference.$A$50:.$A$88];0);IF(OR(['Game State'.$L7]="";['Game State'.$F7]="LH";['Game State'.$F7]="LS");14;15))) -> 23 | J35: of:=INDIRECT("'reference'." & ADDRESS(40+MATCH([.J3];[Reference.$A$50:.$A$88];0);IF(OR(['Game State'.$L8]="";['Game State'.$F8]="LH";['Game State'.$F8]="LS");14;15))) -> 25 | K35: of:=INDIRECT("'reference'." & ADDRESS(40+MATCH([.K3];[Reference.$A$50:.$A$88];0);IF(OR(['Game State'.$L9]="";['Game State'.$F9]="LH";['Game State'.$F9]="LS");14;15))) -> 0 | N35: of:=[.N12] -> 34 | O35: of:="[b]"&IF(INDIRECT("'Crisis Cards'."&ADDRESS([.$N35];7))="X";"[color=red]";"")&INDIRECT("'Crisis Cards'."&ADDRESS([.$N35];2))&IF(INDIRECT("'Crisis Cards'."&ADDRESS([.$N35];7))="X";"[/color]";"")&IF(INDIRECT("'Crisis Cards'."&ADDRESS([.$N35];13))<>"";" - "&INDIRECT("'Crisis Cards'."&ADDRESS([.$N35];13))&IF(INDIRECT("'Crisis Cards'."&ADDRESS([.$N35];14))<>"";"("&INDIRECT("'Crisis Cards'."&ADDRESS([.$N35];14))&")";"")&IF(INDIRECT("'Crisis Cards'."&ADDRESS([.$N35];8))="X";"[color=orange]Y[/color]";"")&IF(INDIRECT("'Crisis Cards'."&ADDRESS([.$N35];9))="X";"[color=green]G[/color]";"")&IF(INDIRECT("'Crisis Cards'."&ADDRESS([.$N35];10))="X";"[color=purple]P[/color]";"")&IF(INDIRECT("'Crisis Cards'."&ADDRESS([.$N35];11))="X";"[color=red]R[/color]";"")&IF(INDIRECT("'Crisis Cards'."&ADDRESS([.$N35];12))="X";"[color=blue]B[/color]";"");"")&"[/b]"&IF([.$A$42]="X";"";":"&IF(INDIRECT("'Crisis Cards'."&ADDRESS([.$N35];7))="";" " & INDIRECT("'Crisis Cards'."&ADDRESS([.$N35];18));"")&IF(INDIRECT("'Crisis Cards'."&ADDRESS([.$N35];16))="R";" Activate Raiders";IF(INDIRECT("'Crisis Cards'."&ADDRESS([.$N35];16))="H";" Activate Heavy Raiders";IF(INDIRECT("'Crisis Cards'."&ADDRESS([.$N35];16))="B";" Activate Basestars";IF(INDIRECT("'Crisis Cards'."&ADDRESS([.$N35];16))="L";" Launch Raiders";""))))&IF(INDIRECT("'Crisis Cards'."&ADDRESS([.$N35];17))="X";", Prepare for Jump";IF(INDIRECT("'Crisis Cards'."&ADDRESS([.$N35];7))="X";". " & INDIRECT("'Crisis Cards'."&ADDRESS([.$N35];18));" (no Jump)."))) -> [b]Rescue the Fleet[/b]: Admiral Chooses: -2 Population. OR -1 Morale, place 1 Basestar and 3 Raiders in front of Galactica, and 3 Civilian ships behind Galactica. Activate Raiders, Prepare for Jump
A36: of:=['Game State'.$M$1] -> 3 | C36: of:=IF(['Skill Cards'.$I$25]<>"";"Running Tally: " & IF(['Game State'.$M$36]="";IF(['Skill Cards'.I24]<>0;[.A8] & IF(['Skill Cards'.I24]>0;"+";"") & ['Skill Cards'.I24] & "[/color] ";"") & IF(['Skill Cards'.J24]<>0;[.A9] & IF(['Skill Cards'.J24] > 0;"+";"") &  ['Skill Cards'.J24] & "[/color] ";"") & IF(['Skill Cards'.K24]<>0;[.A10] & IF(['Skill Cards'.K24]>0;"+";"") &  ['Skill Cards'.K24] & "[/color] ";"") & IF(['Skill Cards'.L24]<>0;[.A11] & IF(['Skill Cards'.L24]>0;"+";"") &  ['Skill Cards'.L24] & "[/color] ";"") & IF(['Skill Cards'.M24]<>0;[.A12] & IF(['Skill Cards'.M24]>0;"+";"") &  ['Skill Cards'.M24] & "[/color] ";"")& IF(['Skill Cards'.N24]<>0;[.A13] & IF(['Skill Cards'.N24]>0;"+";"") &  ['Skill Cards'.N24] & "[/color] ";"") & IF(['Skill Cards'.O24]<>0;[.A14] & IF(['Skill Cards'.O24]>0;"+";"") &  ['Skill Cards'.O24] & "[/color] ";"") & " = [b]" & IF(['Skill Cards'.P24] >= ['Skill Cards'.P2];"[color=green]";IF(AND(['Skill Cards'.$Q$2]<>"";['Skill Cards'.$P$24]>['Skill Cards'.$Q$2]);"[color=orange]";"[color=red]")) &  ['Skill Cards'.P24] & " - " & ['Skill Cards'.P25] & "[/color][/b].";"[b][color=red]0 - FAIL[/color][/b]"&IF(['Skill Cards'.$K$25]="";" +/- Destiny.";""));"") ->  | D36: Banner | E36: of:=INDIRECT("'reference'." & ADDRESS(40+MATCH([.E3];[Reference.$A$50:.$A$88];0);IF(AND(['Game State'.$L3]="X";['Game State'.$D3]="");18;IF(['Game State'.$H3]<>"";20;IF(['Game State'.$G3]<>"";19;IF(['Game State'.$I3]<>"";21;17)))))) -> 878733 | F36: of:=INDIRECT("'reference'." & ADDRESS(40+MATCH([.F3];[Reference.$A$50:.$A$88];0);IF(AND(['Game State'.$L4]="X";['Game State'.$D4]="");18;IF(['Game State'.$H4]<>"";20;IF(['Game State'.$G4]<>"";19;IF(['Game State'.$I4]<>"";21;17)))))) -> 0 | G36: of:=INDIRECT("'reference'." & ADDRESS(40+MATCH([.G3];[Reference.$A$50:.$A$88];0);IF(AND(['Game State'.$L5]="X";['Game State'.$D5]="");18;IF(['Game State'.$H5]<>"";20;IF(['Game State'.$G5]<>"";19;IF(['Game State'.$I5]<>"";21;17)))))) -> 0 | H36: of:=INDIRECT("'reference'." & ADDRESS(40+MATCH([.H3];[Reference.$A$50:.$A$88];0);IF(AND(['Game State'.$L6]="X";['Game State'.$D6]="");18;IF(['Game State'.$H6]<>"";20;IF(['Game State'.$G6]<>"";19;IF(['Game State'.$I6]<>"";21;17)))))) -> 0 | I36: of:=INDIRECT("'reference'." & ADDRESS(40+MATCH([.I3];[Reference.$A$50:.$A$88];0);IF(AND(['Game State'.$L7]="X";['Game State'.$D7]="");18;IF(['Game State'.$H7]<>"";20;IF(['Game State'.$G7]<>"";19;IF(['Game State'.$I7]<>"";21;17)))))) -> 0 | J36: of:=INDIRECT("'reference'." & ADDRESS(40+MATCH([.J3];[Reference.$A$50:.$A$88];0);IF(AND(['Game State'.$L8]="X";['Game State'.$D8]="");18;IF(['Game State'.$H8]<>"";20;IF(['Game State'.$G8]<>"";19;IF(['Game State'.$I8]<>"";21;17)))))) -> 0 | K36: of:=INDIRECT("'reference'." & ADDRESS(40+MATCH([.K3];[Reference.$A$50:.$A$88];0);IF(AND(['Game State'.$L9]="X";['Game State'.$D9]="");18;IF(['Game State'.$H9]<>"";20;IF(['Game State'.$G9]<>"";19;IF(['Game State'.$I9]<>"";21;17)))))) -> 0
C37: of:="Send in your COs for [color=green]Declare Emergency[/color]" & IF([.C69]<>"";IF(COUNTIF([.C68:.C71];"<>") > 2;", ";" and/or ") & [.C69];"") & IF([.C70]<>"";IF(COUNTIF([.C68:.C71];"<>") > 2;", ";"") & IF([.C71]="";" and/or ";"") & [.C70];"") & IF([.C71]<>"";", and/or " & [.C71];"") & "." -> Send in your COs for [color=green]Declare Emergency[/color] and/or [color=green]Change of Plans[/color]. | E37: of:="[size=18]Round " & IF(['Game State'.$M$1]>1;['Game State'.$L$1]+1;['Game State'.$L$1]) & ".1 - " & [.E3] & "[/size]" -> [size=18]Round 8.1 - Gaius[/size] | F37: of:="[size=18]Round " & IF(['Game State'.$M$1]>2;['Game State'.$L$1]+1;['Game State'.$L$1]) & ".2 - " & [.F3] & "[/size]" -> [size=18]Round 8.2 - Athena[/size] | G37: of:="[size=18]Round " & IF(['Game State'.$M$1]>3;['Game State'.$L$1]+1;['Game State'.$L$1]) & ".3 - " & [.G3] & "[/size]" -> [size=18]Round 7.3 - Lee[/size] | H37: of:="[size=18]Round " & IF(['Game State'.$M$1]>4;['Game State'.$L$1]+1;['Game State'.$L$1]) & ".4 - " & [.H3] & "[/size]" -> [size=18]Round 7.4 - Tom[/size] | I37: of:="[size=18]Round " & IF(['Game State'.$M$1]>5;['Game State'.$L$1]+1;['Game State'.$L$1]) & ".5 - " & [.I3] & "[/size]" -> [size=18]Round 7.5 - Karl[/size] | J37: of:="[size=18]Round "&['Game State'.$L$1]&".6 - "&[.J3]&"[/size]" -> [size=18]Round 7.6 - Cottle[/size] | K37: of:="[size=18]Round "&['Game State'.$L$1]&".6 - "&[.K3]&"[/size]" -> [size=18]Round 7.6 - 0[/size] | O37: Mutiny (most recently dealt)
A38: Suppress Auto-Pass | E38: of:="[username=" & ['Game State'.$B3] & "]" -> [username=Shadowed] | F38: of:="[username=" & ['Game State'.$B4] & "]" -> [username=Karantor] | G38: of:="[username=" & ['Game State'.$B5] & "]" -> [username=Zoronos] | H38: of:="[username=" & ['Game State'.$B6] & "]" -> [username=Tymber] | I38: of:="[username=" & ['Game State'.$B7] & "]" -> [username=Simmons] | J38: of:="[username=" & ['Game State'.$B8] & "]" -> [username=Masnie] | K38: of:="[username=" & ['Game State'.$B9] & "]" -> [username=] | O38: of:="[b]" & INDIRECT("'Mutiny'." & ADDRESS(12 + [.$N$41]; 3)) & "[/b], your Mutiny Card is:" -> [b][/b], your Mutiny Card is:
A39: X | C39: TALLY | E39: [b]Draw:[/b] | F39: [b]Draw:[/b] | G39: [b]Draw:[/b] | H39: [b]Draw:[/b] | I39: [b]Draw:[/b] | J39: [b]Draw:[/b] | K39: [b]Draw:[/b]
E40: [b]Move:[/b] | F40: [b]Move:[/b] | G40: [b]Move:[/b] | H40: [b]Move:[/b] | I40: [b]Move:[/b] | J40: [b]Move:[/b] | K40: [b]Move:[/b] | N40: of:=COUNTIF([Mutiny.C13:.C34];"<>") - 1 -> -1 | O40: of:="[b]" & INDIRECT("'Mutiny'." & ADDRESS(12 + [.$N$40]; 2)) & "[/b]" -> [b]Deck[/b]
A41: Suppress Full Text | C41: of:="Tally: " & IF(['Skill Cards'.I24]<>0;[.A8] & IF(['Skill Cards'.I24]>0;"+";"") & ['Skill Cards'.I24] & "[/color] ";"") & IF(['Skill Cards'.J24]<>0;[.A9] & IF(['Skill Cards'.J24] > 0;"+";"") &  ['Skill Cards'.J24] & "[/color] ";"") & IF(['Skill Cards'.K24]<>0;[.A10] & IF(['Skill Cards'.K24]>0;"+";"") &  ['Skill Cards'.K24] & "[/color] ";"") & IF(['Skill Cards'.L24]<>0;[.A11] & IF(['Skill Cards'.L24]>0;"+";"") &  ['Skill Cards'.L24] & "[/color] ";"") & IF(['Skill Cards'.M24]<>0;[.A12] & IF(['Skill Cards'.M24]>0;"+";"") &  ['Skill Cards'.M24] & "[/color] ";"")& IF(['Skill Cards'.N24]<>0;[.A13] & IF(['Skill Cards'.N24]>0;"+";"") &  ['Skill Cards'.N24] & "[/color] ";"") & IF(['Skill Cards'.O24]<>0;[.A14] & IF(['Skill Cards'.O24]>0;"+";"") &  ['Skill Cards'.O24] & "[/color] ";"") & " = [b]" & IF(['Skill Cards'.P24] >= ['Skill Cards'.P2];"[color=green]";IF(AND(['Skill Cards'.$Q$2]<>"";['Skill Cards'.$P$24]>=['Skill Cards'.$Q$2]);"[color=orange]";"[color=red]")) &  ['Skill Cards'.P24] & " - " & ['Skill Cards'.P25] & "[/color][/b]." & IF(['Skill Cards'.$J$26]="X";" Consequence Triggered.";"") & IF(['Skill Cards'.$N$26]="X";" [color=brown][b]Reckless[/b][/color] Skill Check(s) Triggered.";"") & IF(['Skill Cards'.$M$25]<>"";" Don't forget [b][color=blue]Quick Fix[/color][/b]!";"") -> Tally:  = [b][color=green]0 - [/color][/b]. | E41: [b]Action:[/b] | F41: [b]Action:[/b] | G41: [b]Action:[/b] | H41: [b]Action:[/b] | I41: [b]Action:[/b] | J41: [b]Action:[/b] | K41: [b]Action:[/b] | N41: of:=[.N40]+1 -> 0 | O41: of:="[b]" & INDIRECT("'Mutiny'." & ADDRESS(12 + [.$N$41]; 2)) & "[/b]" -> [b]15[/b]
C43: INTERRUPTS FOR DIE ROLL | E43: Turn record begins at: | F43: Turn record begins at: | G43: Turn record begins at: | H43: Turn record begins at: | I43: Turn record begins at: | J43: Turn record begins at: | K43: Turn record begins at: | O43: Super Crisis (most recently dealt)
A44: Suppress Assignments | O44: of:="[b]" & INDIRECT("'Crisis Cards'." &ADDRESS([.$N$46];2)) & "[/b], your Super Crisis is:" -> [b]Gaius[/b], your Super Crisis is:
C45: of:=IF([.$A$4]<>"";IF([.$A$48]="X";"[IMG]http://dl.dropbox.com/u/" & [.$A$17] & "/Banners/" & [.$A$4] & ".jpg[/IMG]";"[imageid=" & [.$A$4] & " medium]");"") -> [IMG]http://dl.dropbox.com/u/11356574/Banners/Moderator.jpg[/IMG] | O45: of:=IF([.$A$48]="X";"[LIST]";"") -> [LIST]
C46: of:=IF([.$A$48]="X";"[code]";"[q=""Interrupts for <PLACEHOLDER>""]") -> [code] | E46: Useful BGG Die Roller Macros | N46: of:=240+COUNTIF(['Crisis Cards'.$B$241:.$B$255];"<>") + COUNTIF(['Crisis Cards'.$C$241:.$C$255];"<>") -> 242 | O46: of:=IF([.$A$48]="X";"[*]";"")&"[b]"&IF(INDIRECT("'Crisis Cards'."&ADDRESS([.$N46];16))<>"";"[color=red]";"")&INDIRECT("'Crisis Cards'."&ADDRESS([.$N46];1))&IF(INDIRECT("'Crisis Cards'."&ADDRESS([.$N46];16))<>"";"[/color]";"")&IF(INDIRECT("'Crisis Cards'."&ADDRESS([.$N46];13))<>"";" - "&INDIRECT("'Crisis Cards'."&ADDRESS([.$N46];13))&IF(INDIRECT("'Crisis Cards'."&ADDRESS([.$N46];14))<>"";"("&INDIRECT("'Crisis Cards'."&ADDRESS([.$N46];14))&")";"")&IF(INDIRECT("'Crisis Cards'."&ADDRESS([.$N46];8))="X";"[color=orange]Y[/color]";"")&IF(INDIRECT("'Crisis Cards'."&ADDRESS([.$N46];9))="X";"[color=green]G[/color]";"")&IF(INDIRECT("'Crisis Cards'."&ADDRESS([.$N46];10))="X";"[color=purple]P[/color]";"")&IF(INDIRECT("'Crisis Cards'."&ADDRESS([.$N46];11))="X";"[color=red]R[/color]";"")&IF(INDIRECT("'Crisis Cards'."&ADDRESS([.$N46];12))="X";"[color=blue]B[/color]";"");"")&"[/b]"&IF([.$A$42]="X";"";": "& INDIRECT("'Crisis Cards'."&ADDRESS([.$N46];18))) -> [*][b]Inbound Nukes - 15[color=green]G[/color][color=purple]P[/color][/b]: Pass: No Effect; Fail: -1 Fuel, -1 Food, and -1 Population.
A47: vBB | C47: of:="[size="&IF([.A48]="X";5;14)&"][b]Interrupts for <PLACEHOLDER>[/b][/size]" -> [size=5][b]Interrupts for <PLACEHOLDER>[/b][/size] | E47: of:= "1custom" & 8 - COUNTIF(['Game State'.$X$3:.$X$10];"<>") - COUNTIF(['Game State'.$Y$3:.$Y$10];"<>") & "{" & IF(VLOOKUP("FTL Control";['Game State'.$W$3:.$Y$10];2;0)="";"FTL Control;";"") & IF(VLOOKUP("Weapons Control";['Game State'.$W$3:.$Y$10];2;0)="";"Weapons Control;";"") & IF(VLOOKUP("Command";['Game State'.$W$3:.$Y$10];2;0)="";"Command;";"") & IF(VLOOKUP("Admiral's Quarters";['Game State'.$W$3:.$Y$10];2;0)="";"Admiral's Quarters;";"") & IF(VLOOKUP("Hangar Deck";['Game State'.$W$3:.$Y$10];2;0)="";"Hangar Deck;";"") & IF(VLOOKUP("Armory";['Game State'.$W$3:.$Y$10];2;0)="";"Armory;";"") & IF(VLOOKUP("Fuel - Resource";['Game State'.$W$3:.$Y$10];3;0)="";"Fuel;";"") & IF(VLOOKUP("Food - Resource";['Game State'.$W$3:.$Y$10];3;0)="";"Food;";"") & "}" -> 1custom5{FTL Control;Weapons Control;Hangar Deck;Armory;Food;} | O47: of:=IF([.$A$48]="X";"[/LIST]";"") -> [/LIST]
A48: X | C48: Looking for [color=purple]Strategic Planning[/color]. | E48: of:="1custom" & 4 - COUNTIF(['Game State'.$AC$3:.$AC$6];"<>") & "{" & IF(VLOOKUP("Pegasus CIC";['Game State'.$AB$3:.$AD$6];2;0)="";"Pegasus CIC;";"") & IF(VLOOKUP("Airlock";['Game State'.$AB$3:.$AD$6];2;0)="";"Airlock;";"") & IF(VLOOKUP("Main Batteries";['Game State'.$AB$3:.$AD$6];2;0)="";"Main Batteries;";"") & IF(VLOOKUP("Engine Room";['Game State'.$AB$3:.$AD$6];2;0)="";"Engine Room;";"") & "} " -> 1custom4{Pegasus CIC;Airlock;Main Batteries;Engine Room;} 
E49: of:="1custom" & IF(['Game State'.$N$30] = "Ionian Nebula"; 6 - COUNTIF([Ships.$J$42:.$J$47];"<>"); 4 - COUNTIF([Ships.$J$42:.$J$45];"<>")) & "{" & IF([Ships.$J$42]="";[Ships.$I$42] & ";";"") & IF([Ships.$J$43]="";[Ships.$I$43] & ";";"") & IF([Ships.$J$44]="";[Ships.$I$44] & ";";"") & IF([Ships.$J$45]="";[Ships.$I$45] & ";";"") & IF(['Game State'.$N$30]="Ionian Nebula";IF([Ships.$J$46]="";[Ships.$I$46] & ";";"") & IF([Ships.$J$47]="";[Ships.$I$47] & ";";"");"") & "}" -> 1custom4{Structural Damage;Weapons Disabled;Hangar Disabled;Critical Hit - 2;} | O49: GEEKLIST ENTRY v2.0
A50: BANNERS | C50: of:=INDIRECT("'Game State'."&ADDRESS(2+[.$A$36];5))& " (" & INDIRECT("'Skill Cards'." & ADDRESS(18+[.$A$36];2)) & ")" &" - "&IF(AND(INDIRECT("'Game State'."&ADDRESS(2+[.$A$36];12))="X";INDIRECT("'Game State'."&ADDRESS(2+[.$A$36];4))<>"X");"CYLON";IF(INDIRECT("'Skill Cards'."&ADDRESS(18+[.$A$36];2)) = 0;"PASS: No Cards";IF([.$A$39]="X";"";IF(OR([.$A$39]="X";INDIRECT("'Skill Cards'." & ADDRESS(141;[.$A$36]))="X");"";"PASS: No Tactics")))) -> Lee (7) -  | E50: of:= "1custom" & [Ships.D37] & "{" & IF([Ships.$D$25]<>"";"Civilian A;";"") & IF([Ships.$D$26]<>"";"Civilian B;";"") & IF([Ships.$D$27]<>"";"Civilian C;";"") & IF([Ships.$D$28]<>"";"Civilian D;";"") & IF([Ships.$D$29]<>"";"Civilian E;";"") & IF([Ships.$D$30]<>"";"Civilian F;";"") & IF([Ships.$D$31]<>"";"Civilian G;";"") & IF([Ships.$D$32]<>"";"Civilian H;";"") & IF([Ships.$D$33]<>"";"Civilian I;";"") & IF([Ships.$D$34]<>"";"Civilian J;";"") & IF([Ships.$D$35]<>"";"Civilian K;";"") & IF([Ships.$D$36]<>"";"Civilian L;";"") & "}" -> 1custom6{Civilian G;Civilian H;Civilian I;Civilian J;Civilian K;Civilian L;} | N50: of:=1+(['Game State'.$L$1] - 1) * [.$A$33] + ['Game State'.$M$1] -> 40 | O50: of:="[size=14][b][url=http://boardgamegeek.com/article/" & INDIRECT("'Notes and Thoughts'." & ADDRESS([.$N$50]; 2)) & "#" & INDIRECT("'Notes and Thoughts'." & ADDRESS([.$N$50]; 2)) & "]Turn " & INDIRECT("'Notes and Thoughts'." & ADDRESS([.$N$50]; 1)) & "[/url][/b][/size]" -> [size=14][b][url=http://boardgamegeek.com/article/#]Turn 7.2[/url][/b][/size]
A51: 647924 | B51: Dradis | C51: of:=INDIRECT("'Game State'." & ADDRESS(3+MOD([.$A$36];[.$A$33]);5)) & " (" & INDIRECT("'Skill Cards'." & ADDRESS(19+MOD([.$A$36];[.$A$33]);2)) & ")" & " - " & IF(AND(INDIRECT("'Game State'." & ADDRESS(3+MOD([.$A$36];[.$A$33]);12))="X";INDIRECT("'Game State'." & ADDRESS(3+MOD([.$A$36];[.$A$33]);4))<>"X");"CYLON";IF(INDIRECT("'Skill Cards'."&ADDRESS(19+MOD([.$A$36];[.$A$33]);2)) = 0;"PASS: No Cards";IF(OR([.$A$39]="X";INDIRECT("'Skill Cards'." & ADDRESS(151;1+MOD([.$A$36];[.$A$33])))="X");"";"PASS: No Tactics"))) -> Tom (5) - CYLON | E51: 1custom4{Basestar damaged twice:;Basestar Destroyed;Basestar Destroyed;Basestar Destroyed, along with 3 Raiders} | O51: of:="[imageid=" & INDIRECT(ADDRESS(33; 5+MOD([.$A$36] + [.$A$33] - 2; [.$A$33]))) & " small]" -> [imageid= small]
A52: 606444 | B52: Jump | C52: of:=INDIRECT("'Game State'." & ADDRESS(3+MOD([.$A$36]+1;[.$A$33]);5)) & " (" & INDIRECT("'Skill Cards'." & ADDRESS(19+MOD([.$A$36]+1;[.$A$33]);2)) & ")" & " - " & IF(AND(INDIRECT("'Game State'." & ADDRESS(3+MOD([.$A$36]+1;[.$A$33]);12))="X";INDIRECT("'Game State'." & ADDRESS(3+MOD([.$A$36]+1;[.$A$33]);4))<>"X");"CYLON";IF(INDIRECT("'Skill Cards'."&ADDRESS(19+MOD([.$A$36] + 1;[.$A$33]);2)) = 0;"PASS: No Cards";IF(OR([.$A$39]="X";INDIRECT("'Skill Cards'." & ADDRESS(151;1+MOD([.$A$36]+1;[.$A$33])))="X");"";"PASS: No Tactics"))) -> Karl (5) -  | O52: Draws
A53: 606443 | B53: Sleeper | C53: of:=IF([.$A$33] > 3;INDIRECT("'Game State'." & ADDRESS(3+MOD([.$A$36]+2;[.$A$33]);5)) & " (" & INDIRECT("'Skill Cards'." & ADDRESS(19+MOD([.$A$36]+2;[.$A$33]);2)) & ")" & " - " & IF(AND(INDIRECT("'Game State'." & ADDRESS(3+MOD([.$A$36]+2;[.$A$33]);12))="X";INDIRECT("'Game State'." & ADDRESS(3+MOD([.$A$36]+2;[.$A$33]);4))<>"X");"CYLON";IF(INDIRECT("'Skill Cards'."&ADDRESS(19+MOD([.$A$36] + 2;[.$A$33]);2)) = 0;"PASS: No Cards";IF(OR([.$A$39]="X";INDIRECT("'Skill Cards'." & ADDRESS(151;1+MOD([.$A$36]+2;[.$A$33])))="X");"";"PASS: No Tactics")))) -> Cottle (6) -  | O53: [b]Move:[/b]
A54: 735196 | B54: Crisis | C54: of:=IF([.$A$33] > 4;INDIRECT("'Game State'." & ADDRESS(3+MOD([.$A$36]+3;[.$A$33]);5)) & " (" & INDIRECT("'Skill Cards'." & ADDRESS(19+MOD([.$A$36]+3;[.$A$33]);2)) & ")" & " - " & IF(AND(INDIRECT("'Game State'." & ADDRESS(3+MOD([.$A$36]+3;[.$A$33]);12))="X";INDIRECT("'Game State'." & ADDRESS(3+MOD([.$A$36]+3;[.$A$33]);4))<>"X");"CYLON";IF(INDIRECT("'Skill Cards'."&ADDRESS(19+MOD([.$A$36]+3;[.$A$33]);2)) = 0;"PASS: No Cards";IF(OR([.$A$39]="X";INDIRECT("'Skill Cards'." & ADDRESS(151;1+MOD([.$A$36]+3;[.$A$33])))="X");"";"PASS: No Tactics")))) -> Gaius (4) - CYLON | O54: [b]Action:[/b]
A55: 769204 | B55: Mod | C55: of:=IF([.$A$33] > 5;INDIRECT("'Game State'." & ADDRESS(3+MOD([.$A$36]+4;[.$A$33]);5)) & " (" & INDIRECT("'Skill Cards'." & ADDRESS(19+MOD([.$A$36]+4;[.$A$33]);2)) & ")" & " - " & IF(AND(INDIRECT("'Game State'." & ADDRESS(3+MOD([.$A$36]+4;[.$A$33]);12))="X";INDIRECT("'Game State'." & ADDRESS(3+MOD([.$A$36]+4;[.$A$33]);4))<>"X");"CYLON";IF(INDIRECT("'Skill Cards'."&ADDRESS(19+MOD([.$A$36]+4;[.$A$33]);2)) = 0;"PASS: No Cards";IF(OR([.$A$39]="X";INDIRECT("'Skill Cards'." & ADDRESS(151;1+MOD([.$A$36]+4;[.$A$33])))="X");"";"PASS: No Tactics")));"") -> Athena (8) - 
A56: 797170 | B56: CyMod | C56: of:=IF([.$A$33] > 6;INDIRECT("'Game State'." & ADDRESS(3+MOD([.$A$36]+5;[.$A$33]);5)) & " (" & INDIRECT("'Skill Cards'." & ADDRESS(19+MOD([.$A$36]+5;[.$A$33]);2)) & ")" & " - " & IF(AND(INDIRECT("'Game State'." & ADDRESS(3+MOD([.$A$36]+5;[.$A$33]);12))="X";INDIRECT("'Game State'." & ADDRESS(3+MOD([.$A$36]+5;[.$A$33]);4))<>"X");"CYLON";IF(INDIRECT("'Skill Cards'."&ADDRESS(19+MOD([.$A$36]+5;[.$A$33]);2)) = 0;"PASS: No Cards";IF(OR([.$A$39]="X";INDIRECT("'Skill Cards'." & ADDRESS(151;1+MOD([.$A$36]+5;[.$A$33])))="X");"";"PASS: No Tactics")));"") ->  | O56: [imageid=735201 original inline][imageid= small inline]
A57: 830752 | B57: Lurker | C57: of:=IF([.$A$48]="X";"[/code]";"[/q]") -> [/code] | O57: [b]XO1:[/b]
A58: 735201 | B58: XO To: | C58: of:=IF(['Game State'.$M$36]="X";"Send in your COs for [color=blue]Calculations[/color].";"") ->  | O58: [b]XO2:[/b]
A59: 900699 | B59: Benev L
A60: 900700 | B60: Benev R | O60: of:="[imageid=" & IF(INDIRECT("'Crisis Cards'."&ADDRESS([.$N61];7)) = "X";[.$A$51];[.$A$54]) & " small]" -> [imageid=735196 small]
A61: 900695 | B61: Ant L | C61: of:=IF(['Skill Cards'.$I$25]="";"[color=orange]Investigative Committee[/color]";"") -> [color=orange]Investigative Committee[/color] | D61: IC | N61: of:=IF(['Game State'.$N$27]="IN SPACE";3+COUNTIF(['Crisis Cards'.$B$6:.$B$163];"<>");136+COUNTIF(['Crisis Cards'.$B$167:.$B$196];"<>")) -> 32 | O61: of:="[size=12][b]" & IF(INDIRECT("'Crisis Cards'."&ADDRESS([.$N61];7)) = "X";"[color=red]";"") & INDIRECT("'Crisis Cards'."&ADDRESS([.$N61];2)) & IF(INDIRECT("'Crisis Cards'."&ADDRESS([.$N61];7)) = "X";"[/color]";"") & IF(INDIRECT("'Crisis Cards'."&ADDRESS([.$N61];13)) <> "";" - " & INDIRECT("'Crisis Cards'."&ADDRESS([.$N61];13))&IF(INDIRECT("'Crisis Cards'."&ADDRESS([.$N61];14))<>"";"("&INDIRECT("'Crisis Cards'."&ADDRESS([.$N61];14))&")";"") & IF(INDIRECT("'Crisis Cards'."&ADDRESS([.$N61];8)) = "X";"[color=orange]Y[/color]";"") & IF(INDIRECT("'Crisis Cards'."&ADDRESS([.$N61];9)) = "X";"[color=green]G[/color]";"") & IF(INDIRECT("'Crisis Cards'."&ADDRESS([.$N61];10)) = "X";"[color=purple]P[/color]";"") & IF(INDIRECT("'Crisis Cards'."&ADDRESS([.$N61];11)) = "X";"[color=red]R[/color]";"") & IF(INDIRECT("'Crisis Cards'."&ADDRESS([.$N61];12)) = "X";"[color=blue]B[/color]";"");"") & "[/b][/size]" -> [size=12][b]Abandon Galactica[/b][/size]
A62: 900696 | B62: Ant R | C62: of:=IF(AND(['Game State'.M41]<>"";['Game State'.M36]="";['Skill Cards'.J25]="");"[color=green]Restore Order[/color]";"") -> [color=green]Restore Order[/color] | D62: Restore | O62: of:=IF(INDIRECT("'Crisis Cards'." & ADDRESS([.$N61];3))="X";"[b]"&INDIRECT(ADDRESS(2;3+[.$A$36]))&INDIRECT(ADDRESS(3;3+[.$A$36]))&"[/b] chooses ";IF(INDIRECT("'Crisis Cards'." & ADDRESS([.$N61];4))="X";"[b]"&INDIRECT(ADDRESS(2;4+MATCH("X";['Game State'.$G$3:.$G$9];0)))&INDIRECT(ADDRESS(3;4+MATCH("X";['Game State'.$G$3:.$G$9];0)))&"[/b] chooses ";IF(INDIRECT("'Crisis Cards'." & ADDRESS([.$N61];5))="X";"[b]"&INDIRECT(ADDRESS(2;4+MATCH("X";['Game State'.$H$3:.$H$9];0)))&INDIRECT(ADDRESS(3;4+MATCH("X";['Game State'.$H$3:.$H$9];0)))&"[/b] chooses ";IF(INDIRECT("'Crisis Cards'." & ADDRESS([.$N61];6))="X";"[b]"&INDIRECT(ADDRESS(2;4+MATCH("X";['Game State'.$I$3:.$I$9];0)))&INDIRECT(ADDRESS(3;4+MATCH("X";['Game State'.$I$3:.$I$9];0)))&"[/b] chooses";"")))) -> [b][color=green]Admiral[/color] Karl[/b] chooses 
A63: 900687 | B63: Ally End | C63: of:=IF(AND(['Game State'.M41]<>"";['Skill Cards'.K25]="");"[color=purple]A Second Chance[/color]";"") -> [color=purple]A Second Chance[/color] | D63: Chance
A64: 900674 | C64: of:=IF(['Skill Cards'.M2]="";"[color=blue]Scientific Research[/color]";"") -> [color=blue]Scientific Research[/color] | D64: SR | N64: of:=INDIRECT("'Crisis Cards'." & ADDRESS([.$N$61];16)) -> B | O64: of:=IF([.$N$64] = "R";"Raiders Activate:";IF([.$N$64] = "H";"Heavy Raiders Activate:";IF([.$N$64] = "B";"Basestars Activate:";IF([.$N$64] = "L";"Raiders Launch:";"")))) -> Basestars Activate:
A65: 954448 | B65: Xroads | C65: of:=IF(['Game State'.M42]<>"";"[color=grey]Guide Them To Their Destiny[/color]";"") ->  | D65: Guide
A66: 713177 | B66: New Cap | C66: of:=IF(AND(['Game State'.$M$36]="X";['Skill Cards'.$N$25]="");"ONE of the following: [color=orange]Support The People[/color], [color=green]At Any Cost[/color], [color=purple]Guts And Initiative[/color], " & IF(['Game State'.M41]="";"or ";"") & "[color=blue]Jury Rigged[/color]" & IF(['Game State'.M41]<>"";" or [color=green]Restore Order[/color]";"");"") ->  | D66: Reckless | O66: of:= "[b]Jump Prep track increases to [color=" & IF(['Game State'.$Q$28]="x";"red]Red 1";IF(['Game State'.$R$28]="x";"red]Red 2";IF(['Game State'.$S$28]="x";"blue]Blue (-3)";IF(['Game State'.$T$28]="x";"blue]Blue (-1)";IF(['Game State'.$P$28]="x";"green]AUTO JUMP";""))))) & "[/color].[/b]" -> [b]Jump Prep track increases to [color=blue]Blue (-3)[/color].[/b]
A68: Dictator | B68: PrAdmiral | C68: [color=green]Declare Emergency[/color] | D68: Declare
C69: of:=IF(['Game State'.M41]<>"";"[color=green]Change of Plans[/color]";"") -> [color=green]Change of Plans[/color] | D69: Change
C70: of:=IF(['Game State'.M42]<>"";"[color=orange]Quorum Debate[/color]";"") ->  | D70: Debate
C71: of:=IF(AND(['Game State'.M42]<>"";['Skill Cards'.N25]="");"[color=grey]Worthy of Survival[/color]";"") ->  | D71: Worthy
C73: of:=[.E3]&" (" & ['Skill Cards'.B19] & ")" & " - "&IF(['Skill Cards'.B19]=0;"PASS: No Cards";IF(['Game State'.N3]="Brig";"(1 max)";IF(AND(['Game State'.D3]="X";[.E3]="Simon");"(3 max)";IF(OR(['Game State'.D3]="X";['Game State'.N3]="Detention";[.E3]="Simon");"(2 max)";IF(['Game State'.L3]="X";"(1 max)";IF([.E3]="Cally";IF( ['Skill Cards'.B19] = 1;"PASS: Impulsive";"(not 1)");IF([.E3]="Gaeta";"(3 max)";""))))))) -> Gaius (4) - (1 max)
C74: of:=[.F3] &" (" & ['Skill Cards'.B20] & ")" & " - "&IF(['Skill Cards'.B20]=0;"PASS: No Cards";IF(['Game State'.N4]="Brig";"(1 max)";IF(AND(['Game State'.D4]="X";[.F3]="Simon");"(3 max)";IF(OR(['Game State'.D4]="X";['Game State'.N4]="Detention";[.F3] = "Simon");"(2 max)";IF(['Game State'.L4]="X";"(1 max)";IF([.F3]="Cally";IF( ['Skill Cards'.B20] = 1;"PASS: Impulsive";"(not 1)");IF([.F3]="Gaeta";"(3 max)";""))))))) -> Athena (8) - (2 max)
C75: of:=[.G3] &" (" & ['Skill Cards'.B21] & ")" & " - "&IF(['Skill Cards'.B21]=0;"PASS: No Cards";IF(['Game State'.N5]="Brig";"(1 max)";IF(AND(['Game State'.D5]="X";[.G3]="Simon");"(3 max)";IF(OR(['Game State'.D5]="X";['Game State'.N5]="Detention";[.G3]="Simon");"(2 max)";IF(['Game State'.L5]="X";"(1 max)";IF([.G3]="Cally";IF( ['Skill Cards'.B21] = 1;"PASS: Impulsive";"(not 1)");IF([.G3]="Gaeta";"(3 max)";""))))))) -> Lee (7) - 
C76: of:=[.H3]&" (" & ['Skill Cards'.B22] & ")" & " - "&IF(['Skill Cards'.B22]=0;"PASS: No Cards";IF(['Game State'.N6]="Brig";"(1 max)";IF(AND(['Game State'.D6]="X";[.H3]="Simon");"(3 max)";IF(OR(['Game State'.D6]="X";['Game State'.N6]="Detention";[.H3]="Simon");"(2 max)";IF(['Game State'.L6]="X";"(1 max)";IF([.H3]="Cally";IF( ['Skill Cards'.B22] = 1;"PASS: Impulsive";"(not 1)");IF([.H3]="Gaeta";"(3 max)";""))))))) -> Tom (5) - (1 max)
C77: of:=[.I3]&" (" & ['Skill Cards'.B23] & ")" & " - "&IF(['Skill Cards'.B23]=0;"PASS: No Cards";IF(['Game State'.N7]="Brig";"(1 max)";IF(AND(['Game State'.D7]="X";[.I3]="Simon");"(3 max)";IF(OR(['Game State'.D7]="X";['Game State'.N7]="Detention";[.I3]="Simon");"(2 max)";IF(['Game State'.L7]="X";"(1 max)";IF([.I3]="Cally";IF( ['Skill Cards'.B23] = 1;"PASS: Impulsive";"(not 1)");IF([.I3]="Gaeta";"(3 max)";""))))))) -> Karl (5) - 
C78: of:=[.J3]&" (" & ['Skill Cards'.B24] & ")" & " - "&IF(['Skill Cards'.B24]=0;"PASS: No Cards";IF(['Game State'.N8]="Brig";"(1 max)";IF(AND(['Game State'.D8]="X";[.J3]="Simon");"(3 max)";IF(OR(['Game State'.D8]="X";['Game State'.N8]="Detention";[.J3]="Simon");"(2 max)";IF(['Game State'.L8]="X";"(1 max)";IF([.J3]="Cally";IF( ['Skill Cards'.B24] = 1;"PASS: Impulsive";"(not 1)");IF([.J3]="Gaeta";"(3 max)";""))))))) -> Cottle (6) - 
C79: of:=[.H3]&" (" & ['Skill Cards'.B25] & ")" & " - "&IF(['Skill Cards'.B25]=0;"PASS: No Cards";IF(['Game State'.N9]="Brig";"(1 max)";IF(AND(['Game State'.D9]="X";[.H3]="Simon");"(3 max)";IF(OR(['Game State'.D9]="X";['Game State'.N9]="Detention";[.H3]="Simon");"(2 max)";IF(['Game State'.L9]="X";"(1 max)";IF([.H3]="Cally";IF( ['Skill Cards'.B25] = 1;"PASS: Impulsive";"(not 1)");IF([.H3]="Gaeta";"(3 max)";""))))))) -> Tom () - 

Sheet: Image Data
A1: Game | B1: of:=['Game State'.C1] -> 1 | C1: of:= ['Game State'.L1] & "." & ['Game State'.M1] -> 7.3 | D1: of:=IF(['Game State'.M36]="X";"Pegasus";"NoPegasus") -> NoPegasus | E1: of:=IF(['Game State'.M37]="X";"Exodus";"NoExodus") -> NoExodus | F1: of:=IF(['Game State'.M41]<>"";"Daybreak";"NoDaybreak") -> Daybreak | G1: of:=IF(['Game State'.M42]<>"";"Revelations";"NoRevelations") -> NoRevelations | H1: of:=['Game State'.N30] -> Kobol | I1: of:=['Game State'.N33] -> Standard | J1: log
A2: Characters | B2: of:=['Game State'.E3] -> Gaius | C2: of:=['Game State'.E4] -> Athena | D2: of:=['Game State'.E5] -> Lee | E2: of:=['Game State'.E6] -> Tom | F2: of:=IF(['Game State'.E7]<> "";['Game State'.E7];"") -> Karl | G2: of:=IF(['Game State'.E8]<> "";['Game State'.E8];"") -> Cottle | H2: of:=IF(['Game State'.E9]<> "";['Game State'.E9];"") -> 
A3: of:=IF([.B3]<>"";"Option";";Option") -> Option | B3: of:=['Game State'.W32] -> OutlineCounters
A4: Resources | B4: of:=['Game State'.Q$19] -> 2 | C4: of:=['Game State'.$R$19] -> 5 | D4: of:=['Game State'.$S$19] -> 3 | E4: of:=['Game State'.$T$19] -> 2
A5: PlayerCards | B5: of:=['Skill Cards'.$B$19] -> 4 | C5: of:=['Skill Cards'.$B$20] -> 8 | D5: of:=['Skill Cards'.$B$21] -> 7 | E5: of:=['Skill Cards'.$B$22] -> 5 | F5: of:=['Skill Cards'.$B$23] -> 5 | G5: of:=['Skill Cards'.$B$24] -> 6 | H5: of:=['Skill Cards'.$B$25] -> 
A6: PlayerLocations | B6: of:=['Game State'.N3] & IF(['Game State'.J3]>20;"!";IF(['Game State'.J3]>10;"*";"")) -> Caprica | C6: of:=['Game State'.N4] & IF(['Game State'.J4]>20;"!";IF(['Game State'.J4]>10;"*";"")) -> Command | D6: of:=['Game State'.N5] & IF(['Game State'.J5]>20;"!";IF(['Game State'.J5]>10;"*";"")) -> FTL Control | E6: of:=['Game State'.N6] & IF(['Game State'.J6]>20;"!";IF(['Game State'.J6]>10;"*";"")) -> Caprica | F6: of:=['Game State'.N7] & IF(['Game State'.J7]>20;"!";IF(['Game State'.J7]>10;"*";"")) -> FTL Control | G6: of:=['Game State'.N8] & IF(['Game State'.J8]>20;"!";IF(['Game State'.J8]>10;"*";"")) -> Communications | H6: of:=['Game State'.N9] & IF(['Game State'.J9]>20;"!";IF(['Game State'.J9]>10;"*";"")) -> 
A7: SkillDecks | B7: of:=['Skill Cards'.$D$19] -> 15 | C7: of:=['Skill Cards'.$D$20] -> 4 | D7: of:=['Skill Cards'.$D$21] -> 6 | E7: of:=['Skill Cards'.$D$22] -> 2 | F7: of:=['Skill Cards'.$D$23] -> 6 | G7: of:=['Skill Cards'.$D$24] -> 14 | H7: of:=['Skill Cards'.$D$25] -> 0
A8: Reserves | B8: of:=[Ships.$F$13] -> 7 | C8: of:=[Ships.$C$13] -> 0 | D8: of:=[Ships.$C$46] -> 1 | E8: of:=IF([.I1]="Cylon Fleet";[Ships.$F$21];0) -> 0 | F8: of:=IF([.I1]="Cylon Fleet";[Ships.$C$21];0) -> 0 | G8: of:=IF(['Game State'.M41]<>"";[Ships.$C$55];"") -> 0
A9: Decks | B9: of:=['Skill Cards'.$D$26] -> 4 | C9: of:=['Crisis Cards'.$C$171] -> 69 | D9: of:=['Crisis Cards'.$C$204] -> 30 | E9: of:=['Quorum Cards'.$G$3] -> 9 | F9: of:=['Quorum Cards'.$G$5] -> 2 | G9: of:=['Crisis Cards'.$C$256] -> 3 | H9: of:=IF(['Game State'.M41]<>"";[Mutiny.B12];"") -> 15 | I9: of:=IF(['Game State'.N30]="Earth";"";"") -> 
A10: CivShips | B10: of:=[Ships.D37] -> 6 | C10: of:=[Ships.$G$38] -> 0 | D10: of:=[Ships.$G$39] -> 0
A11: Roles | B11: of:=['Game State'.M1] -> 3 | C11: of:=MATCH("X";['Game State'.G3:.G9]) -> 3 | D11: of:=['Quorum Cards'.G4] -> 5 | E11: of:=MATCH("X";['Game State'.H3:.H9]) -> 5 | F11: of:=['Game State'.C20] -> 0 | G11: of:=IF([.I1]="Cylon Fleet";MATCH("X";['Game State'.I3:.I9]);0) -> 0 | H11: of:=[Loyalty.E18] -> 0
A12: JumpTrack | B12: of:=['Game State'.R30] -> 3 | C12: of:=IF([.I1]="Cylon Fleet";['Game State'.R38];"") -> 
A13: of:=IF(['Game State'.N30]="New Caprica";"GamePhase";";GamePhase") -> ;GamePhase | B13: of:=['Game State'.S30] -> 1
A14: of:=IF([.B14]="";";Assignments";"Assignments") -> ;Assignments | B14: of:=IF(['Board Status'.P12]<>"";LEFT(['Board Status'.Q12];4);"") ->  | C14: of:=IF(['Board Status'.P12]<>"";MATCH(['Board Status'.P12];['Game State'.E3:.E9];0);"") ->  | D14: of:=IF(['Board Status'.P13]<>"";LEFT(['Board Status'.Q13];4);"") ->  | E14: of:=IF(['Board Status'.P13]<>"";MATCH(['Board Status'.P13];['Game State'.E3:.E9];0);"") ->  | F14: of:=IF(['Board Status'.P14]<>"";LEFT(['Board Status'.Q14];4);"") ->  | G14: of:=IF(['Board Status'.P14]<>"";MATCH(['Board Status'.P14];['Game State'.E3:.E9];0);"") ->  | H14: of:=IF(['Board Status'.P15]<>"";LEFT(['Board Status'.Q15];4);"") ->  | I14: of:=IF(['Board Status'.P15]<>"";MATCH(['Board Status'.P15];['Game State'.E7:.E13];0);"") -> 
A15: of:=IF(SUM([.B15:.E15])=0;";BoardingParty";"BoardingParty") -> BoardingParty | B15: of:=[Ships.O15] -> 3 | C15: of:=[Ships.P15] -> 0 | D15: of:=[Ships.Q15] -> 0 | E15: of:=[Ships.R15] -> 0
A16: of:=IF(SUM([.B16:.D16])=0;";OccForce";"OccForce") -> ;OccForce | B16: of:=[Ships.O16] -> 0 | C16: of:=[Ships.P16] -> 0 | D16: of:=[Ships.Q16] -> 0
A17: of:=IF([.B17]="";";Distance";"Distance") -> Distance | B17: of:=IF(['Destination Cards'.C9]="";"";IF(['Destination Cards'.C9]="Legendary Discovery";"LD";IF(['Destination Cards'.C9]="The Road Less Traveled";"LT";IF(['Destination Cards'.C9]="Frak Earth";"FE";['Destination Cards'.D9])))) -> 1 | C17: of:=IF(['Destination Cards'.C10]="";"";IF(['Destination Cards'.C10]="Legendary Discovery";"LD";IF(['Destination Cards'.C10]="The Road Less Traveled";"LT";IF(['Destination Cards'.C10]="Frak Earth";"FE";['Destination Cards'.D10])))) -> 3 | D17: of:=IF(['Destination Cards'.C11]="";"";IF(['Destination Cards'.C11]="Legendary Discovery";"LD";IF(['Destination Cards'.C11]="The Road Less Traveled";"LT";IF(['Destination Cards'.C11]="Frak Earth";"FE";['Destination Cards'.D11])))) -> 3 | E17: of:=IF(['Destination Cards'.C12]="";"";IF(['Destination Cards'.C12]="Legendary Discovery";"LD";IF(['Destination Cards'.C12]="The Road Less Traveled";"LT";IF(['Destination Cards'.C12]="Frak Earth";"FE";['Destination Cards'.D12])))) -> 1 | F17: of:=IF(['Destination Cards'.C13]="";"";IF(['Destination Cards'.C13]="Legendary Discovery";"LD";IF(['Destination Cards'.C13]="The Road Less Traveled";"LT";IF(['Destination Cards'.C13]="Frak Earth";"FE";['Destination Cards'.D13])))) ->  | G17: of:=IF(['Destination Cards'.C14]="";"";IF(['Destination Cards'.C14]="Legendary Discovery";"LD";IF(['Destination Cards'.C14]="The Road Less Traveled";"LT";IF(['Destination Cards'.C14]="Frak Earth";"FE";['Destination Cards'.D14])))) ->  | H17: of:=IF(['Destination Cards'.C15]="";"";IF(['Destination Cards'.C15]="Legendary Discovery";"LD";IF(['Destination Cards'.C15]="The Road Less Traveled";"LT";IF(['Destination Cards'.C15]="Frak Earth";"FE";['Destination Cards'.D15])))) ->  | I17: of:=IF(['Destination Cards'.C16]="";"";IF(['Destination Cards'.C16]="Legendary Discovery";"LD";IF(['Destination Cards'.C16]="The Road Less Traveled";"LT";IF(['Destination Cards'.C16]="Frak Earth";"FE";['Destination Cards'.D16])))) ->  | J17: of:=IF(['Destination Cards'.C17]="";"";IF(['Destination Cards'.C17]="Legendary Discovery";"LD";IF(['Destination Cards'.C17]="The Road Less Traveled";"LT";IF(['Destination Cards'.C17]="Frak Earth";"FE";['Destination Cards'.D17])))) -> 
A18: of:=IF(COUNTIF([.B18:.K18];"")=6;";BoardSpecial";"BoardSpecial") -> BoardSpecial | B18: of:=IF(['Board Status'.E11]="";"";['Board Status'.E11]) ->  | C18: of:=IF(['Board Status'.G11]="";"";['Board Status'.G11]) ->  | D18: of:=IF(['Board Status'.J11]="";"";['Board Status'.J11]) ->  | E18: of:=IF(['Board Status'.L11]="";"";['Board Status'.L11]) ->  | F18: of:=IF(['Board Status'.H10]="";"";['Board Status'.H10]) ->  | G18: of:=IF(['Board Status'.A16]="";"";"Colonial One") ->  | H18: of:=IF(['Board Status'.E7]="";"";['Board Status'.E7]) ->  | I18: of:=IF(['Board Status'.H7]="";"";['Board Status'.H7]) ->  | J18: of:=IF(['Board Status'.L7]="";"";['Board Status'.L7]) ->  | K18: of:=IF(['Board Status'.O34]="";"";"Pegasus") -> 
A19: OPG | B19: of:=['Game State'.K3] -> 0 | C19: of:=['Game State'.K4] -> 0 | D19: of:=['Game State'.K5] -> 1 | E19: of:=IF(['Game State'.K6]<>"";['Game State'.K6];"") -> 0 | F19: of:=IF(['Game State'.K7]<>"";['Game State'.K7];"") -> 1 | G19: of:=IF(['Game State'.K8]<>"";['Game State'.K8];"") -> 1 | H19: of:=IF(['Game State'.K9]<>"";['Game State'.K9];"") -> 
A20: of:=IF(['Board Status'.D10]=0;";Damage";"Damage") -> Damage | B20: of:=IF(['Game State'.X3]="X";['Game State'.W3];"") ->  | C20: of:=IF(['Game State'.X4]="X";['Game State'.W4];"") ->  | D20: of:=IF(['Game State'.X5]="X";['Game State'.W5];"") ->  | E20: of:=IF(['Game State'.X6]="X";['Game State'.W6];"") ->  | F20: of:=IF(['Game State'.X7]="X";['Game State'.W7];"") ->  | G20: of:=IF(['Game State'.X8]="X";['Game State'.W8];"") -> Command | H20: of:=IF(['Game State'.X9]="X";['Game State'.W9];"") -> Admiral's Quarters | I20: of:=IF(['Game State'.X10]="X";['Game State'.W10];"") ->  | J20: of:=IF(AND(['Game State'.AC3]="X";[.K18]="");['Game State'.AB3];"") ->  | K20: of:=IF(AND(['Game State'.AC4]="X";[.K18]="");['Game State'.AB4];"") ->  | L20: of:=IF(AND(['Game State'.AC5]="X";[.K18]="");['Game State'.AB5];"") ->  | M20: of:=IF(AND(['Game State'.AC6]="X";[.K18]="");['Game State'.AB6];"") -> 
A21: of:=IF(['Board Status'.A37]="";";Graveyard";"Graveyard") -> ;Graveyard | B21: of:=IF(['Board Status'.$A37]="";"";['Board Status'.$A37]) ->  | C21: of:=IF(['Board Status'.$A38]="";"";['Board Status'.$A38]) ->  | D21: of:=IF(['Board Status'.$A39]="";"";['Board Status'.$A39]) ->  | E21: of:=IF(['Board Status'.$A40]="";"";['Board Status'.$A40]) ->  | F21: of:=IF(['Board Status'.$A41]="";"";['Board Status'.$A41]) ->  | G21: of:=IF(['Board Status'.$A42]="";"";['Board Status'.$A42]) ->  | H21: of:=IF(['Board Status'.$A43]="";"";['Board Status'.$A43]) ->  | I21: of:=IF(['Board Status'.$A44]="";"";['Board Status'.$A44]) ->  | J21: of:=IF(['Board Status'.$A45]="";"";['Board Status'.$A45]) -> 
A22: of:=IF([.B22]="";";Cylons";"Cylons") -> Cylons | B22: of:=IF(['Game State'.L3]="X";['Game State'.C3];"") -> 1 | C22: of:=IF([.B22]="";"";['Game State'.F3]) -> C | D22: of:=IF([.C22]="";"";['Game State'.M3]) -> 1 | E22: of:=IF([.C22]="";"";IF(['Game State'.D3]="X";1;0)) -> 0
A23: of:=IF([.B23]="";";Cylons";"Cylons") -> Cylons | B23: of:=IF(['Game State'.L4]="X";['Game State'.C4];"") -> 2 | C23: of:=IF([.B23]="";"";['Game State'.F4]) -> L | D23: of:=IF([.C23]="";"";['Game State'.M4]) -> 0 | E23: of:=IF([.C23]="";"";IF(['Game State'.D4]="X";1;0)) -> 1
A24: of:=IF([.B24]="";";Cylons";"Cylons") -> ;Cylons | B24: of:=IF(['Game State'.L5]="X";['Game State'.C5];"") ->  | C24: of:=IF([.B24]="";"";['Game State'.F5]) ->  | D24: of:=IF([.C24]="";"";['Game State'.M5]) ->  | E24: of:=IF([.C24]="";"";IF(['Game State'.D5]="X";1;0)) -> 
A25: of:=IF([.B25]="";";Cylons";"Cylons") -> Cylons | B25: of:=IF(['Game State'.L6]="X";['Game State'.C6];"") -> 4 | C25: of:=IF([.B25]="";"";['Game State'.F6]) -> C | D25: of:=IF([.C25]="";"";['Game State'.M6]) -> 0 | E25: of:=IF([.C25]="";"";IF(['Game State'.D6]="X";1;0)) -> 0
A26: of:=IF([.C26]="";";Cylons";"Cylons") -> ;Cylons | B26: of:=IF(['Game State'.L7]="X";['Game State'.C7];"") ->  | C26: of:=IF([.B26]="";"";['Game State'.F7]) ->  | D26: of:=IF([.C26]="";"";['Game State'.M7]) ->  | E26: of:=IF([.C26]="";"";IF(['Game State'.D7]="X";1;0)) -> 
A27: of:=IF([.B27]="";";Cylons";"Cylons") -> ;Cylons | B27: of:=IF(['Game State'.L8]="X";['Game State'.C8];"") ->  | C27: of:=IF([.B27]="";"";['Game State'.F8]) ->  | D27: of:=IF([.C27]="";"";['Game State'.M8]) ->  | E27: of:=IF([.C27]="";"";IF(['Game State'.D8]="X";1;0)) -> 
A28: of:=IF([.B28]="";";Cylons";"Cylons") -> ;Cylons | B28: of:=IF(['Game State'.L9]="X";['Game State'.C9];"") ->  | C28: of:=IF([.B28]="";"";['Game State'.F9]) ->  | D28: of:=IF([.C28]="";"";['Game State'.M9]) ->  | E28: of:=IF([.C28]="";"";IF(['Game State'.D9]="X";1;0)) -> 
A29: of:=IF([.B29]="";";Basestar";"Basestar") -> Basestar | B29: of:=IF([Ships.K37]="";IF([Ships.L37]="";"";[Ships.L37]*-1);[Ships.K37]) -> 1 | C29: of:=IF([Ships.M37]="";"";IF(['Game State'.$N$30]="Ionian Nebula";"IN-";"") & LEFT([Ships.M37];6)) ->  | D29: of:=IF([Ships.M37]="";"";IF(ISERR(FIND("|";[Ships.M37]));"";IF(['Game State'.$N$30]="Ionian Nebula";"IN-";"") & MID([Ships.M37];FIND("|";[Ships.M37])+2;6))) -> 
A30: of:=IF([.B30]="";";Basestar";"Basestar") -> ;Basestar | B30: of:=IF([Ships.K38]="";IF([Ships.L38]="";"";[Ships.L38]*-1);[Ships.K38]) ->  | C30: of:=IF([Ships.M38]="";"";IF(['Game State'.$N$30]="Ionian Nebula";"IN-";"") & LEFT([Ships.M38];6)) ->  | D30: of:=IF([Ships.M38]="";"";IF(ISERR(FIND("|";[Ships.M38]));"";IF(['Game State'.$N$30]="Ionian Nebula";"IN-";"") & MID([Ships.M38];FIND("|";[Ships.M38])+2;6))) -> 
A31: of:=IF([.B31]="";";Scar";"Scar") -> ;Scar | B31: of:=IF([Ships.O18]=0;"";OFFSET([Ships.K4];[Ships.O18];0)) -> 
A32: of:=IF([.B32]="";";Option";"Option") -> ;Option | B32: of:=['Game State'.W29] -> 0
A33: of:=IF(SUM([.C33:.F33])=0;";Sector";"Sector") -> ;Sector | B33: 1 | C33: of:=[Ships.O11] -> 0 | D33: of:=IF([.$B$31]=1;[Ships.O$10]-1;[Ships.O$10]) -> 0 | E33: of:=[Ships.O5] -> 0 | F33: of:=[Ships.O6] -> 0 | G33: of:=[Ships.O7] -> 0
A34: of:=IF(SUM([.C34:.F34])=0;";Sector";"Sector") -> Sector | B34: 2 | C34: of:=[Ships.P11] -> 0 | D34: of:=IF([.$B$31]=2;[Ships.P$10]-1;[Ships.P$10]) -> 3 | E34: of:=[Ships.P5] -> 0 | F34: of:=[Ships.P6] -> 0 | G34: of:=[Ships.P7] -> 0
A35: of:=IF(SUM([.C35:.F35])=0;";Sector";"Sector") -> ;Sector | B35: 3 | C35: of:=[Ships.Q11] -> 0 | D35: of:=IF([.$B$31]=3;[Ships.Q$10]-1;[Ships.Q$10]) -> 0 | E35: of:=[Ships.Q5] -> 0 | F35: of:=[Ships.Q6] -> 0 | G35: of:=[Ships.Q7] -> 0
A36: of:=IF(SUM([.C36:.F36])=0;";Sector";"Sector") -> ;Sector | B36: 4 | C36: of:=[Ships.R11] -> 0 | D36: of:=IF([.$B$31]=4;[Ships.R$10]-1;[Ships.R$10]) -> 0 | E36: of:=[Ships.R5] -> 0 | F36: of:=[Ships.R6] -> 0 | G36: of:=[Ships.R7] -> 0
A37: of:=IF(SUM([.C37:.F37])=0;";Sector";"Sector") -> ;Sector | B37: 5 | C37: of:=[Ships.S11] -> 0 | D37: of:=IF([.$B$31]=5;[Ships.S$10]-1;[Ships.S$10]) -> 0 | E37: of:=[Ships.S5] -> 0 | F37: of:=[Ships.S6] -> 0 | G37: of:=[Ships.S7] -> 0
A38: of:=IF(SUM([.C38:.F38])=0;";Sector";"Sector") -> ;Sector | B38: 6 | C38: of:=[Ships.T11] -> 0 | D38: of:=IF([.$B$31]=6;[Ships.T$10]-1;[Ships.T$10]) -> 0 | E38: of:=[Ships.T5] -> 0 | F38: of:=[Ships.T6] -> 0 | G38: of:=[Ships.T7] -> 0
A39: of:=IF([.B39]="";";Civilians";"Civilians") -> ;Civilians | B39: of:=IF([Ships.E25]="";"";[Ships.E25]) ->  | C39: of:=IF([Ships.E25]="";"";RIGHT([Ships.B25];1)) -> 
A40: of:=IF([.B40]="";";Civilians";"Civilians") -> ;Civilians | B40: of:=IF([Ships.E26]="";"";[Ships.E26]) ->  | C40: of:=IF([Ships.E26]="";"";RIGHT([Ships.B26];1)) -> 
A41: of:=IF([.B41]="";";Civilians";"Civilians") -> ;Civilians | B41: of:=IF([Ships.E27]="";"";[Ships.E27]) ->  | C41: of:=IF([Ships.E27]="";"";RIGHT([Ships.B27];1)) -> 
A42: of:=IF([.B42]="";";Civilians";"Civilians") -> Civilians | B42: of:=IF([Ships.E28]="";"";[Ships.E28]) -> 4 | C42: of:=IF([Ships.E28]="";"";RIGHT([Ships.B28];1)) -> D
A43: of:=IF([.B43]="";";Civilians";"Civilians") -> Civilians | B43: of:=IF([Ships.E29]="";"";[Ships.E29]) -> 4 | C43: of:=IF([Ships.E29]="";"";RIGHT([Ships.B29];1)) -> E
A44: of:=IF([.B44]="";";Civilians";"Civilians") -> Civilians | B44: of:=IF([Ships.E30]="";"";[Ships.E30]) -> 4 | C44: of:=IF([Ships.E30]="";"";RIGHT([Ships.B30];1)) -> F
A45: of:=IF([.B45]="";";Civilians";"Civilians") -> ;Civilians | B45: of:=IF([Ships.E31]="";"";[Ships.E31]) ->  | C45: of:=IF([Ships.E31]="";"";RIGHT([Ships.B31];1)) -> 
A46: of:=IF([.B46]="";";Civilians";"Civilians") -> ;Civilians | B46: of:=IF([Ships.E32]="";"";[Ships.E32]) ->  | C46: of:=IF([Ships.E32]="";"";RIGHT([Ships.B32];1)) -> 
A47: of:=IF([.B47]="";";Civilians";"Civilians") -> ;Civilians | B47: of:=IF([Ships.E33]="";"";[Ships.E33]) ->  | C47: of:=IF([Ships.E33]="";"";RIGHT([Ships.B33];1)) -> 
A48: of:=IF([.B48]="";";Civilians";"Civilians") -> ;Civilians | B48: of:=IF([Ships.E34]="";"";[Ships.E34]) ->  | C48: of:=IF([Ships.E34]="";"";RIGHT([Ships.B34];1)) -> 
A49: of:=IF([.B49]="";";Civilians";"Civilians") -> ;Civilians | B49: of:=IF([Ships.E35]="";"";[Ships.E35]) ->  | C49: of:=IF([Ships.E35]="";"";RIGHT([Ships.B35];1)) -> 
A50: of:=IF([.B50]="";";Civilians";"Civilians") -> ;Civilians | B50: of:=IF([Ships.E36]="";"";[Ships.E36]) ->  | C50: of:=IF([Ships.E36]="";"";RIGHT([Ships.B36];1)) -> 
A51: of:=IF([.B51]="";";Option";"Option") -> ;Option | B51: of:=['Game State'.W27] -> 0
A52: of:=IF([.B52]="";";Option";"Option") -> Option | B52: of:=['Game State'.W28] -> JPG
A53: of:=IF(SUM([.C53:.D53])=0;";CylonFleet";"CylonFleet") -> ;CylonFleet | B53: 1 | C53: of:=[Ships.O14] -> 0 | D53: of:=[Ships.O13] -> 0
A54: of:=IF(SUM([.C54:.D54])=0;";CylonFleet";"CylonFleet") -> ;CylonFleet | B54: 2 | C54: of:=[Ships.P14] -> 0 | D54: of:=[Ships.P13] -> 0
A55: of:=IF(SUM([.C55:.D55])=0;";CylonFleet";"CylonFleet") -> ;CylonFleet | B55: 3 | C55: of:=[Ships.Q14] -> 0 | D55: of:=[Ships.Q13] -> 0
A56: of:=IF(SUM([.C56:.D56])=0;";CylonFleet";"CylonFleet") -> ;CylonFleet | B56: 4 | C56: of:=[Ships.R14] -> 0 | D56: of:=[Ships.R13] -> 0
A57: of:=IF(SUM([.C57:.D57])=0;";CylonFleet";"CylonFleet") -> ;CylonFleet | B57: 5 | C57: of:=[Ships.S14] -> 0 | D57: of:=[Ships.S13] -> 0
A58: of:=IF(SUM([.C58:.D58])=0;";CylonFleet";"CylonFleet") -> ;CylonFleet | B58: 6 | C58: of:=[Ships.T14] -> 0 | D58: of:=[Ships.T13] -> 0
A59: of:=IF(AND(['Game State'.$N$30]="Ionian Nebula";['Destination Cards'.$D$6] < 8);"Allies";";Allies") -> ;Allies | B59: of:=INDIRECT("'Ionian Nebula'." & ADDRESS(17+['Ionian Nebula'.$A$55];1)) -> 0 | C59: of:=INDIRECT("'Ionian Nebula'." & ADDRESS(17+['Ionian Nebula'.$A$55];2)) -> 0 | D59: of:=INDIRECT("'Ionian Nebula'." & ADDRESS(18+['Ionian Nebula'.$A$55];1)) -> ALLIES | E59: of:=INDIRECT("'Ionian Nebula'." & ADDRESS(18+['Ionian Nebula'.$A$55];2)) -> 0 | F59: of:=INDIRECT("'Ionian Nebula'." & ADDRESS(19+['Ionian Nebula'.$A$55];1)) -> Name | G59: of:=INDIRECT("'Ionian Nebula'." & ADDRESS(19+['Ionian Nebula'.$A$55];2)) -> Location
A60: of:=IF(AND(['Game State'.$N$30]="Ionian Nebula";['Destination Cards'.$D$6] < 8);"Trauma";";Trauma") -> ;Trauma | B60: of:=SUM(['Ionian Nebula'.B2:.C2]) -> 0 | C60: of:=SUM(['Ionian Nebula'.B3:.C3]) -> 0 | D60: of:=SUM(['Ionian Nebula'.B4:.C4]) -> 0 | E60: of:=SUM(['Ionian Nebula'.B5:.C5]) -> 0 | F60: of:=SUM(['Ionian Nebula'.B6:.C6]) -> 0 | G60: of:=SUM(['Ionian Nebula'.B7:.C7]) -> 0 | H60: of:=SUM(['Ionian Nebula'.B8:.C8]) -> 0
A61: LoyaltyCards | B61: of:=[Loyalty.B14] -> 0 | C61: of:=[Loyalty.C14] -> 3 | D61: of:=[Loyalty.D14] -> 2 | E61: of:=[Loyalty.E14] -> 0 | F61: of:=[Loyalty.F14] -> 4 | G61: of:=[Loyalty.G14] -> 2 | H61: of:=[Loyalty.H14] -> 0
A62: BGColor | B62: 43 | C62: 58 | D62: 102
A63: ResourceDamage | B63: of:=IF(VLOOKUP("Fuel - Resource";['Game State'.$W$3:.$Y$10];3;0)="";0;1) -> 1 | C63: of:=IF(VLOOKUP("Food - Resource";['Game State'.$W$3:.$Y$10];3;0)="";0;1) -> 0
A64: DamagedCivilians | B64: of:=SUMPRODUCT(VALUE(LEFT([Ships.$C$25:.$C$36];2))<=2;[Ships.$F25:.$F$36]="X") -> 0 | C64: of:=SUMPRODUCT(VALUE(LEFT([Ships.$C$25:.$C$36];2))>2;VALUE(LEFT([Ships.$C$25:.$C$36];2))<=8;[Ships.$F25:.$F$36]="X") -> 2 | D64: of:=SUMPRODUCT(VALUE(LEFT([Ships.$C$25:.$C$36];2))>8;VALUE(LEFT([Ships.$C$25:.$C$36];2))<=10;[Ships.$F25:.$F$36]="X") -> 1 | E64: of:=SUMPRODUCT(VALUE(LEFT([Ships.$C$25:.$C$36];2))=11;[Ships.$F25:.$F$36]="X") -> 0 | F64: of:=SUMPRODUCT(VALUE(LEFT([Ships.$C$25:.$C$36];2))=12;[Ships.$F25:.$F$36]="X") -> 0
A65: of:=IF(['Game State'.M41]="";";";"") & "Mutiny" -> Mutiny | B65: of:=[Mutiny.B3] -> 0 | C65: of:=[Mutiny.B4] -> 0 | D65: of:=[Mutiny.B5] -> 0 | E65: of:=[Mutiny.B6] -> 0 | F65: of:=[Mutiny.B7] -> 0 | G65: of:=[Mutiny.B8] -> 0 | H65: of:=[Mutiny.B9] -> 0

Sheet: Notes and Thoughts
A1: Turn | B1: Start Post | C1: Start Image | D1: Notes & Thoughts
A2: Initial | B2: BLANK | C2: BLANK
A3: of:=IF(['Game Log'.C2]<>"";['Game Log'.C2];"") -> 1.1
A4: of:=IF(['Game Log'.C3]<>"";['Game Log'.C3];"") -> 1.2
A5: of:=IF(['Game Log'.C4]<>"";['Game Log'.C4];"") -> 1.3
A6: of:=IF(['Game Log'.C5]<>"";['Game Log'.C5];"") -> 1.4
A7: of:=IF(['Game Log'.C6]<>"";['Game Log'.C6];"") -> 1.5
A8: of:=IF(['Game Log'.C7]<>"";['Game Log'.C7];"") -> 1.6
A9: of:=IF(['Game Log'.C8]<>"";['Game Log'.C8];"") -> 2.1
A10: of:=IF(['Game Log'.C9]<>"";['Game Log'.C9];"") -> 2.2
A11: of:=IF(['Game Log'.C10]<>"";['Game Log'.C10];"") -> 2.3
A12: of:=IF(['Game Log'.C11]<>"";['Game Log'.C11];"") -> 2.4
A13: of:=IF(['Game Log'.C12]<>"";['Game Log'.C12];"") -> 2.5
A14: of:=IF(['Game Log'.C13]<>"";['Game Log'.C13];"") -> 2.6
A15: of:=IF(['Game Log'.C14]<>"";['Game Log'.C14];"") -> 3.1
A16: of:=IF(['Game Log'.C15]<>"";['Game Log'.C15];"") -> 3.2
A17: of:=IF(['Game Log'.C16]<>"";['Game Log'.C16];"") -> 3.3
A18: of:=IF(['Game Log'.C17]<>"";['Game Log'.C17];"") -> 3.4
A19: of:=IF(['Game Log'.C18]<>"";['Game Log'.C18];"") -> 3.5
A20: of:=IF(['Game Log'.C19]<>"";['Game Log'.C19];"") -> 3.6
A21: of:=IF(['Game Log'.C20]<>"";['Game Log'.C20];"") -> 4.1
A22: of:=IF(['Game Log'.C21]<>"";['Game Log'.C21];"") -> 4.2
A23: of:=IF(['Game Log'.C22]<>"";['Game Log'.C22];"") -> 4.3
A24: of:=IF(['Game Log'.C23]<>"";['Game Log'.C23];"") -> 4.4
A25: of:=IF(['Game Log'.C24]<>"";['Game Log'.C24];"") -> 4.5
A26: of:=IF(['Game Log'.C25]<>"";['Game Log'.C25];"") -> 4.6
A27: of:=IF(['Game Log'.C26]<>"";['Game Log'.C26];"") -> 5.1
A28: of:=IF(['Game Log'.C27]<>"";['Game Log'.C27];"") -> 5.2
A29: of:=IF(['Game Log'.C28]<>"";['Game Log'.C28];"") -> 5.3
A30: of:=IF(['Game Log'.C29]<>"";['Game Log'.C29];"") -> 5.4
A31: of:=IF(['Game Log'.C30]<>"";['Game Log'.C30];"") -> 5.5
A32: of:=IF(['Game Log'.C31]<>"";['Game Log'.C31];"") -> 5.6
A33: of:=IF(['Game Log'.C32]<>"";['Game Log'.C32];"") -> 6.1
A34: of:=IF(['Game Log'.C33]<>"";['Game Log'.C33];"") -> 6.2
A35: of:=IF(['Game Log'.C34]<>"";['Game Log'.C34];"") -> 6.3
A36: of:=IF(['Game Log'.C35]<>"";['Game Log'.C35];"") -> 6.4
A37: of:=IF(['Game Log'.C36]<>"";['Game Log'.C36];"") -> 6.5
A38: of:=IF(['Game Log'.C37]<>"";['Game Log'.C37];"") -> 6.6
A39: of:=IF(['Game Log'.C38]<>"";['Game Log'.C38];"") -> 7.1
A40: of:=IF(['Game Log'.C39]<>"";['Game Log'.C39];"") -> 7.2
A41: of:=IF(['Game Log'.C40]<>"";['Game Log'.C40];"") -> 7.3
A42: of:=IF(['Game Log'.C41]<>"";['Game Log'.C41];"") -> 
A43: of:=IF(['Game Log'.C42]<>"";['Game Log'.C42];"") -> 
A44: of:=IF(['Game Log'.C43]<>"";['Game Log'.C43];"") -> 
A45: of:=IF(['Game Log'.C44]<>"";['Game Log'.C44];"") -> 
A46: of:=IF(['Game Log'.C45]<>"";['Game Log'.C45];"") -> 
A47: of:=IF(['Game Log'.C46]<>"";['Game Log'.C46];"") -> 
A48: of:=IF(['Game Log'.C47]<>"";['Game Log'.C47];"") -> 
A49: of:=IF(['Game Log'.C48]<>"";['Game Log'.C48];"") -> 
A50: of:=IF(['Game Log'.C49]<>"";['Game Log'.C49];"") -> 
A51: of:=IF(['Game Log'.C50]<>"";['Game Log'.C50];"") -> 
A52: of:=IF(['Game Log'.C51]<>"";['Game Log'.C51];"") -> 
A53: of:=IF(['Game Log'.C52]<>"";['Game Log'.C52];"") -> 
A54: of:=IF(['Game Log'.C53]<>"";['Game Log'.C53];"") -> 
A55: of:=IF(['Game Log'.C54]<>"";['Game Log'.C54];"") -> 
A56: of:=IF(['Game Log'.C55]<>"";['Game Log'.C55];"") -> 
A57: of:=IF(['Game Log'.C56]<>"";['Game Log'.C56];"") -> 
A58: of:=IF(['Game Log'.C57]<>"";['Game Log'.C57];"") -> 
A59: of:=IF(['Game Log'.C58]<>"";['Game Log'.C58];"") -> 
A60: of:=IF(['Game Log'.C59]<>"";['Game Log'.C59];"") -> 
A61: of:=IF(['Game Log'.C60]<>"";['Game Log'.C60];"") -> 
A62: of:=IF(['Game Log'.C61]<>"";['Game Log'.C61];"") -> 
A63: of:=IF(['Game Log'.C62]<>"";['Game Log'.C62];"") -> 
A64: of:=IF(['Game Log'.C63]<>"";['Game Log'.C63];"") -> 
A65: of:=IF(['Game Log'.C64]<>"";['Game Log'.C64];"") -> 
A66: of:=IF(['Game Log'.C65]<>"";['Game Log'.C65];"") -> 
A67: of:=IF(['Game Log'.C66]<>"";['Game Log'.C66];"") -> 
A68: of:=IF(['Game Log'.C67]<>"";['Game Log'.C67];"") -> 
A69: of:=IF(['Game Log'.C68]<>"";['Game Log'.C68];"") -> 
A70: of:=IF(['Game Log'.C69]<>"";['Game Log'.C69];"") -> 
A71: of:=IF(['Game Log'.C70]<>"";['Game Log'.C70];"") -> 
A72: of:=IF(['Game Log'.C71]<>"";['Game Log'.C71];"") -> 
A73: of:=IF(['Game Log'.C72]<>"";['Game Log'.C72];"") -> 
A74: of:=IF(['Game Log'.C73]<>"";['Game Log'.C73];"") -> 
A75: of:=IF(['Game Log'.C74]<>"";['Game Log'.C74];"") -> 
A76: of:=IF(['Game Log'.C75]<>"";['Game Log'.C75];"") -> 
A77: of:=IF(['Game Log'.C76]<>"";['Game Log'.C76];"") -> 
A78: of:=IF(['Game Log'.C77]<>"";['Game Log'.C77];"") -> 
A79: of:=IF(['Game Log'.C78]<>"";['Game Log'.C78];"") -> 
A80: of:=IF(['Game Log'.C79]<>"";['Game Log'.C79];"") -> 
A81: of:=IF(['Game Log'.C80]<>"";['Game Log'.C80];"") -> 
A82: of:=IF(['Game Log'.C81]<>"";['Game Log'.C81];"") -> 
A83: of:=IF(['Game Log'.C82]<>"";['Game Log'.C82];"") -> 
A84: of:=IF(['Game Log'.C83]<>"";['Game Log'.C83];"") -> 

Sheet: Achievements
D1: of:=IF(['Posting Templates'.E3]<>"";['Posting Templates'.E3];"") -> Gaius | E1: of:=IF(['Posting Templates'.F3]<>"";['Posting Templates'.F3];"") -> Athena | F1: of:=IF(['Posting Templates'.G3]<>"";['Posting Templates'.G3];"") -> Lee | G1: of:=IF(['Posting Templates'.H3]<>"";['Posting Templates'.H3];"") -> Tom | H1: of:=IF(['Posting Templates'.I3]<>"";['Posting Templates'.I3];"") -> Karl | I1: of:=IF(['Posting Templates'.J3]<>"";['Posting Templates'.J3];"") -> Cottle | J1: of:=IF(['Posting Templates'.K3]<>"";['Posting Templates'.K3];"") -> 
A2: Who? | B2: Name: | C2: Description | D2: Progress | K2: Special
A3: Adama | B3: Delegate Authority: | C3: Issue an Executive Order to another player who then activates the Admiral's Quarters.
A4: Adama | B4: It's All Mine!: | C4: Use Command Authority to grab at least three value-5 cards.
A5: Admiral | B5: Political Beast: | C5: Acquire the Presidency through Administration.
A6: Admiral | B6: Fill It to the Rim: | C6: Choose at least two Tylium Planet destinations.
A7: Admiral | B7: Seven-League Boots: | C7: Choose three distance-3 destinations.
A8: Apollo | B8: Aces of Aces: | C8: Destroy 9 Cylon ships in a single turn.
A9: Apollo | B9: Cautious: | C9: Do not discard for the whole game.
A10: Apollo | B10: Fat Apollo: | C10: On your turn, pass a skill check which awards +1 Food, or, choose a Destination which awards +1 Food and succeed at the die roll.
A11: Apollo | B11: They Set Them Up, I Knock Them Down: | C11: Use both nukes during activation of the Alert Viper Pilot ability.
A12: Apollo | B12: Fly Away Home: | C12: Use your Alert Viper Pilot ability to Reveal as a Cylon.
A13: Baltar | B13: Ladies' Man: | C13: Be the only human male character in the game.
A14: Baltar | B14: Detector Protector: | C14: Be the only player to put cards into the "Detector Sabotage" crisis and pass it.
A15: Baltar | B15: Campaign Promises: | C15: Be the President during the New Caprica phase while Laura Roslin is human.
A16: Baltar | B16: You Can Tell Me, I'm a Doctor: | C16: Examine one or more loyalty cards of at least three other players.
A17: Baltar | B17: One-Track Mind: | C17: Never use Delusional Intuition to draw Tactics or Piloting cards.
A18: Baltar | B18: Pocket Rockets: | C18: Receive two "You Are a Cylon" loyalty cards at the beginning of the game.
A19: Baltar | B19: Gotcha!: | C19: Use Cylon Detector on a hidden Cylon.
A20: Baltar | B20: Jack of All Trades: | C20: Use Delusional Intuition to draw all five non-Treachery skill card types in one game.
A21: Baltar | B21: Truly Delusional: | C21: Use Delusional Intuition to draw Treachery twice in one game.
A22: Baltar | B22: Leave Me To My Work!: | C22: Win a game without ever leaving the Research Lab.
A23: Boomer | B23: Special Mission: | C23: Destroy a Basestar with distance at 8 or more.
A24: Boomer | B24: Black Out: | C24: Draw the "Water Sabotaged" or "Missing G4 Explosives" crisis on your turn.
A25: Boomer | B25: Out of Character: | C25: Issue an Executive Order.
A26: Boomer | B26: Always Be Prepared: | C26: Play at least three Executive Orders while in the Brig.
A27: Boomer | B27: Athena Rising: | C27: Receive the "You Are a Sympathizer" or "You Are a Sympathetic Cylon" loyalty card.
A28: Boomer | B28: Can't Cage the Beast: | C28: Reveal as a Cylon without ever having been in the Brig.
A29: Boomer | B29: Thank You, Sir: | C29: Reveal as a Cylon, sending William Adama to Sick Bay.
A30: Boomer | B30: Raptor Expert: | C30: Risk at least five Raptors in one game without losing any.
A31: Boomer | B31: Threesome: | C31: Share a location with both Chief Tyrol and Helo.
A32: Boomer | B32: Trust Me: | C32: Use Mysterious Intuiton to pass the "Cylon Virus" crisis.
A33: Boomer | B33: Life Sentence: | C33: Win the game (regardless of Loyalty) without leaving the Brig after the Sleeper Phase.
A34: Cain | B34: Placeholder: | C34: Find new Cain Achievements.
A35: Chief | B35: Non-Commissioned Officer: | C35: Become Admiral Tyrol.
A36: Chief | B36: Workers of the World, Unite!: | C36: Become President Tyrol.
A37: Chief | B37: Jock Block: | C37: Put Helo in the Brig, while Boomer is also in the game and is Human.
A38: Cylon | B38: Evolve Emotions: | C38: Receive the Sympathizer Card while already holding a Cylon Loyalty Card.
A39: Cylon | B39: Double the cylon victory: | C39: Win the game with 2 "You are a Cylon" cards, which may be revealed, unrevealed, or mix and matched.
A40: Cylon | B40: Wolf in Sheep's Clothing: | C40: Win the game without Revealing.
A41: Cylon | B41: By Your Command: | C41: Reveal as a Cylon on an Executive Order.
A42: Cylon Team | B42: Successful Sale: | C42: Win the game as Cylon by Centurion destruction.
A43: Cylon Team | B43: Silent Explosion: | C43: Win the game as Cylon by damaging six Galactica locations.
A44: Cylon Team | B44: Resorting to Cannibalism: | C44: Win the game as Cylon by reducing Food to zero.
A45: Cylon Team | B45: Out of Gas: | C45: Win the game as Cylon by reducing Fuel to zero.
A46: Cylon Team | B46: What's the Point?: | C46: Win the game as Cylon by reducing Morale to zero.
A47: Cylon Team | B47: Extinction: | C47: Win the game as Cylon by reducing Population to zero.
A48: Cylon Team | B48: Decimation: | C48: Win the game after destroying all 12 Civilian ships.
A49: Cylon Team | B49: No Mercy!: | C49: Win the game as Cylon in 20 turns or less.
A50: Cylon Team | B50: The Black Plague was here: | C50: Win the game due to all human characters getting executed
A51: Cylon Team | B51: No Way Out: | C51: Win the game while fulfilling multiple victory conditions.
A52: Cylon Team | B52: Lightning Coup: | C52: Brig all Human players in one turn.
A53: Cylon Team | B53: Meltdown: | C53: Force a loss from a Destination Card.
A54: Cylon Team | B54: All Aboard!: | C54: Place all four Centurion markers aboard Galactica.
A55: Cylon Team | B55: Oh, This Is Bound To Work Out Well: | C55: All Cylons reveal before Galactica jumps for the first time.
A56: Cylon Team | B56: You're Goin' Nowhere!: | C56: Win the game before the Sleeper Phase.
A57: Dee | B57: Placeholder: | C57: Find new Dee Achievements.
A58: Ellen | B58: Placeholder: | C58: Find new Ellen Achievements.
A59: Helo | B59: Unlucky: | C59: At least six times in a game, fail a reroll of the dice.
A60: Helo | B60: Never seen: | C60: Get executed before your Stranded weakness resolves.
A61: Helo | B61: Fraternizer: | C61: Receive the Sympathizer card while Stranded.
A62: Human | B62: Live Vicariously: | C62: Only action taken on your turn throughout the game is to XO another player.
A63: Human Team | B63: Rush Hour: | C63: Win the game as Human in 30 turns or less.
A64: Human Team | B64: Offer a Lift: | C64: Win the game as Human while all Cylons are still unrevealed.
A65: Human Team | B65: The Scenic Route: | C65: Win the game as Human while jumping a distance of 10 before reaching Kobol.
A66: Human Team | B66: Are We There Yet?: | C66: Win the game as Human while needing six or more jumps.
A67: Human Team | B67: Sunday Drive: | C67: Win the game as Human without ever having activated FTL Control.
A68: Human Team | B68: Security: | C68: Deny all Cylon players their Reveal abilities (Brig or Airlock).
A69: Human Team | B69: Toothless Tiger: | C69: Destroy a single basestar's hangar bay and weapons systems.
A70: Human Team | B70: Avenger of the Twelve Colonies: | C70: Destroy every basestar that appears through the course of the game, and win.
A71: Human Team | B71: This Old Battlestar: | C71: Have five Galactica locations damaged, then Repair them all.
A72: Human Team | B72: 300 tough: | C72: Take out 2 centurions without the use of Quorum cards
A73: Human Team | B73: Robot Butler: | C73: Win the game with a Centurion aboard Galactica.
A74: Human Team | B74: Exemplary Leadership: | C74: Win the game without the Admiral or President titles ever changing hands.
A75: Kat | B75: Can't Kick the Habit: | C75: Be sent to Sickbay because of Stim Junkie at least twice in one game.
A76: Military Leader | B76: Darling of the Press: | C76: Have at least six Politics cards in your hand.
A77: Military Leader | B77: Handyman: | C77: Repair at least one Galactica location.
A78: Pilot | B78: Hotshot: | C78: Destroy 10 raiders within the span of one jump.
A79: Pilot | B79: The Porkins Award: | C79: Launch in a Viper and get shot down by Raiders in the same turn.
A80: Pilot | B80: Cut the Red Wire!: | C80: Play a Piloting card into the Bomb on Colonial One Super Crisis, and pass it.
A81: Pilot | B81: Death Blossom: | C81: Use Maximum Firepower twice in a single turn.
A82: Pilot | B82: Rogue squadron elite: | C82: Destroy a basestar while piloting a viper, with that viper.
A83: Pilot | B83: Too drunk to be pulling the trigger: | C83: Fire at and miss 3 raiders in a row.
A84: Player | B84: Winston Churchill: | C84: Become PrAdmiral.
A85: Player | B85: Hypochondriac: | C85: Go to Sickbay three or more times in a game.
A86: Player | B86: Full Colors: | C86: Have at least one skill card of every colour in your hand.
A87: Player | B87: Destined for the Brig: | C87: Hold four loyalty cards (five if Boomer or Baltar).
A88: Player | B88: Unluckiest: | C88: Most Skill Cards forced to discard as a result of a Crisis or Reveal
A89: Player | B89: Most Trusted: | C89: Most XOs Received
A90: Player | B90: Most Skilled: | C90: Most Skill Cards played as actions or interrupts | D90: of:=SUM([.D91:.D110])+SUM([.D112:.D114]) -> 0 | E90: of:=SUM([.E91:.E110])+SUM([.E112:.E114]) -> 0 | F90: of:=SUM([.F91:.F110])+SUM([.F112:.F114]) -> 0 | G90: of:=SUM([.G91:.G110])+SUM([.G112:.G114]) -> 0 | H90: of:=SUM([.H91:.H110])+SUM([.H112:.H114]) -> 0 | I90: of:=SUM([.I91:.I110])+SUM([.I112:.I114]) -> 0 | J90: of:=SUM([.J91:.J110])+SUM([.J112:.J114]) -> 0
A91: Player | B91: Panic Monger: | C91: Play 6 or more Declare Emergencies in a game.
A92: Player | B92: Pencil Pusher: | C92: Play 6 or more Investigative Committees in a game.
A93: Player | B93: Angel of Death: | C93: Play 6 or more Maximum Firepowers in a game.
A94: Player | B94: Duct Tape Hoarder: | C94: Play 6 or more Repairs in a game.
A95: Player | B95: Genius: | C95: Play 6 or more Scientific Researches in a game.
A96: Player | B96: Power Hungry: | C96: Play 8 or more Consolidate Powers in a game.
A97: Player | B97: Slippery Eel: | C97: Play 8 or more Evasive Maneuvers in a game.
A98: Player | B98: Sloth: | C98: Play 8 or more Executive Orders in a game.
A99: Player | B99: Explorer: | C99: Play 8 or more Launch Scouts in a game.
A100: Player | B100: Strategist: | C100: Play 8 or more Strategic Plannings in a game.
A101: Player | B101: Party in the Streets: | C101: Play 4 or more Major Victories in a game.
A102: Player | B102: Loss Prevention: | C102: Play 4 or more Preventive Ploicies in a game.
A103: Player | B103: XO? I Don't Need No Stinkin' XO!: | C103: Play 4 or more Critical Situations in a game.
A104: Player | B104: Endless Numbers: | C104: Play 4 or more Calculations in a game.
A105: Player | B105: Defensive Screen: | C105: Play 4 or more Run Interference in a game.
A106: Player | B106: Pedal to the Metal: | C106: Play 4 or more Full Throttles in a game.
A107: Player | C107: Play 4 or more At Any Cost in a game.
A108: Player | B108: Populist: | C108: Play 4 or more Support the People in a game.
A109: Player | B109: Guts of Steel: | C109: Play 4 or more Guts & Initiative in a game.
A110: Player | B110: Jury Tampering: | C110: Play 4 or more Jury Rigged in a game.
A111: Human Team | B111: Irresponsible: | C111: Trigger 4 or more Reckless interrupts in a game.
A112: Revealed Cylon | B112: Saboteur: | C112: Play 4 or more Sabotages in a game.
A113: Revealed Cylon | B113: True Believer: | C113: Play 4 or more God's Plans in a game.
A114: Revealed Cylon | B114: Hit Them In The Weak Spot: | C114: Play 4 or more Human Weaknesses in a game.
A115: Player | B115: Get Us Out Of Here!: | C115: Repair FTL Control and activate it on the same turn.
A116: Politician | B116: Tables Turned: | C116: Become Admiral.
A117: Politician | B117: RTFM: | C117: Play at least one Evasive Maneuvers to save a Pilot from damage or destruction.
A118: President | B118: Omnipotent: | C118: Draw the last card of the quorum deck.
A119: President | B119: Sarah Palin: | C119: Fail at least three Inspirational Speeches.
A120: President | B120: Weight Watcher: | C120: Fail at least two Food Rationings.
A121: Revealed Cylon | B121: Fear of Change: | C121: At the game's end, have never picked any skill cards from outside your human skillset.
A122: Revealed Cylon | B122: Hard to Satisfy: | C122: Exchange your supercrisis card at least twice.
A123: Revealed Cylon | B123: Sympathetic: | C123: The Humans win on your turn.
A124: Revealed Cylon | B124: Crisis? What Crisis?: | C124: Win the game, never having activated Caprica.
A125: Roslin | B125: Skills Be Damned: | C125: Activate a location on Galactica (not Colonial One) at least six times in a game.
A126: Roslin | B126: Physical Therapy: | C126: Activate a location three times in a single game.
A127: Roslin | B127: Bed Rest: | C127: As a Human, win the game without ever activating a location.
A128: Roslin | B128: Frakked If You Do...: | C128: Choose an Assault for Religious Visions.
A129: Starbuck | B129: Chewbacca Defense: | C129: Manage to stay out of the brig on an Admiral's Quarters activation while the value for a pass is 2 or less.
A130: Starbuck | B130: Clouded Destiny: | C130: Use the Secret Destiny ability to replace an assault with another assault.
A131: Support | B131: Cut the Blue Wire!: | C131: Play an Engineering card into the Bomb on Colonial One skill check, and pass it.
A132: Support | B132: All in a Day's Work: | C132: Repair all six Galactica locations in a single game.
A133: Support | B133: Snake Doctor: | C133: Repair eight Vipers in a single game.
A134: Support | B134: Spanner in the Works: | C134: Reveal as a Cylon with the Damage Galactica Loyalty Card, while not in the Brig.
A135: Team | B135: Never Look Back: | C135: Activate FTL Control at least four times in one game.
A136: Team | B136: Epidemic: | C136: All players, except revealed Cylons, are in Sickbay.
A137: Team | B137: Lockdown: | C137: All players, except revealed Cylons, are in the Brig.
A138: Team | B138: The Great Escape: | C138: At least three players leave the brig on consecutive turns.
A139: Team | B139: Four of a Kind: | C139: End the game with all resources at the same value.
A140: Team | B140: Doctor's Orders: | C140: Executive Order another player out of Sick Bay three times in a single game.
A141: Team | B141: All Hands on Deck: | C141: Have all players which are not revealed Cylons perform an action in a single turn.
A142: Team | B142: Police State: | C142: Issue both Arrest Orders in a single turn.
A143: Team | B143: Who's Flying This Thing?: | C143: No players are aboard Galactica.
A144: Team | B144: Silver Tongue: | C144: Successfully play all four Inspirational Speeches.
A145: Team | B145: Loaves and Fishes: | C145: Successfully play both Food Rationing Quorum cards.
A146: Team | B146: You're never going to believe it: | C146: The same crisis card is looked at three times before it's drawn.
A147: Tigh | B147: Magician: | C147: In a single turn, effectuate the switching of the titles of President and Admiral.
A148: Tigh | B148: Clean, Sober, and At Peace: | C148: Never lose cards due to Alcoholism, or use the Cylon Hatred ability.
A149: Tigh | B149: Self-Hatred: | C149: Use your Cylon Hatred to help throw yourself in the Brig.
A150: Zarek | B150: Pleasant Company: | C150: At least three times in a game, end your turn in the same location as another player while on Galactica and not in the Brig or Sickbay.
A151: Zarek | B151: Coup D'tat: | C151: Become the president after failing the Prisoner Revolt crisis card skill check
A152: Zarek | B152: Grab for Power: | C152: Become the president by executing the current President, or nominating yourself with Administration.
A153: Zarek | B153: No Regrets: | C153: Get executed by the admiral
A154: Zarek | B154: Resistance: | C154: Help the president escape the brig using your Friends in Low Places ability to decrease the difficulty
A155: Zarek | B155: The Circle: | C155: Successfully execute another player after activating the Airlock location yourself without playing cards into the skill check
A156: Zarek | B156: In Memory of '78: | C156: Use Consolidate Power to draw Piloting cards
A157: Zarek | B157: Expect the Unexpected: | C157: Use Preventative Policy to protect Population when activating your Unconventional Tactics ability
A158: Zarek | B158: Mysterious Tactics: | C158: Use the Unconventional Tactics skill to increase a resource which has decreased no more than two points from its initial value.
A159: Zarek | B159: Soylent Green: | C159: Use your Unconventional Tactics ability to increase Food

Sheet: ToDos
A1: Revelations ToDos
A2: Add GTTTD, Mission Brief to the interrupt tokens, maybe rework the way interrupt tokens are generated.
A3: Add an easy way to make colors positive after playing some in, accounting for Adama.
A4: Pull Stay and Fight out of the deck if not CFB? - Yep.
A5: Any board specials to add?
A6: Colony
A7: Cylon Civil War Rebel Basestar, Cylon Powers
A11: Daybreak ToDos
A12: Mutiny Cards in the Loyalty tab? Make a new tab?
A13: Earth Demetrius Locations, Mission deck, Rebel Basestar
A14: Miracle tokens
A15: Motives probably just hard-coded into the Loyalty module.
A16: New cards of all sorts.
A17: Fix Cylon Leader draws.
A18: Add board specials for new CACs (and old ones)
A20: General ToDos
A21: Ionian Nebula logging
A22: Add a way to handle the Baltar Ally/Strange Music Crossroads/etc.
A23: Add a way to handle the Doral Ally. - Change Quorum buttons to draw, then bury.
A24: Add option to output text files with player hands at the start of each turn/button press.
A25: Better Super Crisis Management
A26: Sort Quorum Hand when the President Title moves/at the start of each turn.
A27: Add Special for Lured Into a Trap. Any others?
A28: Cylon Pursuit variant?
A29: Make the link between the sheet and the image template more explicit have the user choose the actual file rather than depend on naming conventions.
A30: Fix the issue with a Destiny rebuild turning off the Play Destiny Into Skill Check that gets turned on with Trust Instincts.
A31: Detention should mark people as (2 max) instead of (1 max).
A32: Players in Sickbay when the Fleet reaches New Caprica do not get the Sickbay flag removed.
A33: Make sure the prompts post-Crisis make sense. Cylons don't do Activations, nor Jump Prep in Base. Don't prompt for Jumo Prep after Galactica Returns.
A34: Handle New Caprica Activations in the Posting Templates (only affects Scouting?)
A35: Turn off Sickbay/Brig Trauma after Crossroads.
A36: Implement official No-Sympathizer variant
A38: Known Bugs to fix.
A39: Trust Instincts from Destiny turns off the 'Play in Destiny' button.
A40: Breeder's Canyon isn't supported very well.
A41: Should probably not allow a Skill Check to be initialized before the previous one gets cleared.